idEla,tema,concepto,acuerdo,fundamento
3,1,bien_común_comunidad,A,"Construir las condiciones sociales , por ende, es base y pilar fundamental para la existencia de un estado."
8,1,bien_común_comunidad,A,"El bien común es aquel que va más allá de los valores individuales, y asegura que ningún grupo pueda estar por sobre otros. El aseguramiento del bien común permite una convivencia en la que se garantiza el respeto a todos.  Se sustenta en el sentido de pertenencia y corresponsabilidad"
12,1,bien_común_comunidad,A,"Estamos de acuerdo con este concepto, ya que vivimos en comunidad y se debe primar el sentir de todos las personas."
13,1,bien_común_comunidad,A,Posibilidad de decidir colectivamente los asuntos públicos para el bien de todos los miembros de la sociedad.
19,1,bien_común_comunidad,A,"Es un estado de bienestar, en teoría. Pera en la práctica no se realiza."
35,1,bien_común_comunidad,P,"Resguardo del interés colectivo, basado en la solidaridad y reconocimiento entre comunidades e individuos, necesario para la realización colectiva e individual. Existen distintas interpretaciones, encontramos que es difícil hacer una definición."
46,1,bien_común_comunidad,A,.
57,1,bien_común_comunidad,A,a través de este valor se puede mejorar el sistema ya que engloba el bienestar de todos.
58,1,bien_común_comunidad,A,y que hoy que cuidar los recursos naturales no renovables ya que son fundamentales para el bien de todas las personas
68,1,bien_común_comunidad,A,"El Estado  debe garantizar el bienestar del individuo y comunidad  en todos los ámbitos:  Salud, Educación, Vivienda, Empleo, Sistema Previsional(gratuito, libre y de calidad).Entorno, naturaleza y explotación y nacionalización  de recursos naturales estratégicos del país."
72,1,bien_común_comunidad,A,"Romper el individualismo, dos personas votan este principio. Avanzar a partir de este concepto en pensar en el bien de todos y no en privilegiados."
74,1,bien_común_comunidad,A,- Busca la mejora de la sociedad en su conjunto. - Limita la influencia de grupos de intereses particulares.
77,1,bien_común_comunidad,A,"Entendemos Bien Común como el fomento del bienestar de toda la comunidad, admitiendo la opción de favorecer a grupos específicos si y solo si beneficia al bien común, además, estableciendo un límite claro entre lo público y lo privado."
81,1,bien_común_comunidad,A,sin comentarios
91,1,bien_común_comunidad,A,respetar los acuerdos y que se practique en todas las esferas de la sociedad .-
101,1,bien_común_comunidad,A,"Engloba otros conceptos. La definición de comunidad implica democracia y el bien común implica respetar el medio ambiente, participación, plurinacionalismo, etc."
106,1,bien_común_comunidad,A,"Entendido como el fin último de la sociedad, en conjunto al principio de solidaridad. No es la unión de preferencias personales."
107,1,bien_común_comunidad,A,Que verdaderamente todos estemos enfocados en buscar y fortaleces el bien común y no privilegiar el bienestar de unos pocos desfavoreciendo a los más pobres.
108,1,bien_común_comunidad,P,"La constitución debe garantizar por medio de este principio los derechos colectivos de grupos con diferentes intereses, siendo ellos parte esencial del desarrollo de las comunidades que conforman el pueblo chileno"
114,1,bien_común_comunidad,A,Idea de que hay que velar por el bienestar de toda la comunidad y no solo de una parte.
125,1,bien_común_comunidad,A,"Uno de los principios más mencionados, que refuerza el sentido de organizarnos como país, como parte de un colectivos. Se destaca la responsabilidad individual en los efectos sobre la sociedad. Actuar desde lo individual para lo común."
126,1,bien_común_comunidad,A,EL ESTADO DEBE ORIENTAR SU ACCIÓN HACIA EL BIENESTAR DE TODOS Y NO EN BENEFICIO DE INTERESES PARTICULARES.
136,1,bien_común_comunidad,P,Es un valor fundamental porque es la razón de ser del Estado y permite la existencia de otros valores.
138,1,bien_común_comunidad,A,TODA PERSONA  TIENE DERECHO A UN BIEN COMUN
140,1,bien_común_comunidad,A,Que el Estado esté al servicio de la comunidad
141,1,bien_común_comunidad,A,El Estado debe velar para que las personas (toda la sociedad) puedan ser partícipe del desarrollo.
143,1,bien_común_comunidad,A,"Como consecuencia de una dictadura violenta, asesina, vivimos – menos que antes – una sociedad personalista, carente de ideales, convicciones y de creer que actuamos en torno a un bien común, sin anteponer el bien individual. ¿qué queremos definir como desarrollo? ¿qué entendemos como país moderno / desarrollado? (Teoría del decrecimiento). Tenemos la posibilidad de conversar ¿qué esperamos y cómo nos involucraremos en este desafío?"
148,1,bien_común_comunidad,A,EL NUEVO ESTADO DEBE ESTAR SUSTENTADO EN EL BIEN COMUN ES DECIUR LA RIQUEZA Y EL BIENESTAR DE TODOS.
154,1,bien_común_comunidad,A,"Es la meta de la constitución, que se garantiza a través del estado."
156,1,bien_común_comunidad,P,"El hombre es un animal social y por tanto debe vivir en comunidad, pero deberá respetar  la libertad y la autonomía de cada una de las personas. Para ello deberemos establecer las bases de lo que significa el bien común."
158,1,bien_común_comunidad,A,Ligar bien ambos conceptos porque la sociedad está muy individualista.
162,1,bien_común_comunidad,A,Buscar el bien común que sea producente con la sociedad en la que vivimos evitando que un bien privado y/o particular se sobreponga ante el bien de la comunidad.
166,1,bien_común_comunidad,A,"El estado debe garantizar derechos básicos de bien común y vida digna, como salud, educación, vivienda, pensiones y jubilación."
168,1,bien_común_comunidad,A,Consideramos que el bien común es un ente superior que debe estar por sobre el bien particular. Entendiendo el bien común como el bienestar de la mayoría.
170,1,bien_común_comunidad,A,"Para que todos se sientan parte de la sociedad. El sentido de pertenencia va relacionado a la dignidad, la equidad y la responsabilidad."
176,1,bien_común_comunidad,A,Que las decisiones del estado estén siempre focalizadas en el bienestar de la sociedad en su conjunto.
178,1,bien_común_comunidad,A,"Valor fundamental que inspira  al Estado a alcanzar el fin social para el cual se origina incrementando su participación como tal y NO solo, como ocurre  hoy, en  base al principio de subsidiariedad en lo económico, de tal modo que tenga un rol más activo frente a la comunidad en distintos ámbitos:"
194,1,bien_común_comunidad,A,porque debe ser el objetivo que este detras de cada desición.
197,1,bien_común_comunidad,A,Bienestar social para cada uno de los miembros de la sociedad con el fin de alcanzar plenamente la propia realización.
198,1,bien_común_comunidad,A,Es el fin del Estado y como tal debe estar en la Constitución.
202,1,bien_común_comunidad,A,Principio básico que debe animar la vida de toda comunidad.
213,1,bien_común_comunidad,A,"La norma debe tener un concepto fuerte de comunidad, que es la base de la sociedad. Se opone al indiviudalismo que nos afecta hoy. Desarrollo desde lo comunitario y no desde la individualidad."
220,1,bien_común_comunidad,A,Todos deben ser conscientes de las consecuencias de sus actos y omisiones. Todos deben procurar el bien común.
229,1,bien_común_comunidad,A,"Interés superior que orienta el actuar del Estado y la nación. Es la finalidad y motor del bienestar de la comunidad sin pasar a llevar la dignidad de personas individuales. No es la suma de los bienes individuales, es algo mucho mayor, es el bienestar de la comunidad."
233,1,bien_común_comunidad,A,.
236,1,bien_común_comunidad,A,"YA NO SE TRATA DEL CONCEPTO BASICO DE BIENESTAR PARA TODOS, SINO QUE CONFLUYEN PRINCIPIOS ASOCIADOS A LA VALORIZACION INTEGRAL DEL INDIVIDUO Y SU DESARROLLO EN UNA COMUNIDAD  DIVERSA Y RESPETUOSA DEL OTRO Y DEL MEDIO. EL ESTADO DEBE GARANTIZAR, RESPETAR, RECONOCER Y PROTEGER ESTE DERECHO DE TODOS."
239,1,bien_común_comunidad,P,Una comunidad es acotada a un determinado número de individuos; no es universal.
242,1,bien_común_comunidad,A,Mejoras sociales y mejor educación.
256,1,bien_común_comunidad,A,La vida será mejor cuando toda la comunidad este bien y no solo una parte de ella.
263,1,bien_común_comunidad,A,Todo gobierno debe promover el bien común.
270,1,bien_común_comunidad,A,"Es importante que nos proyectemos en conjunto, y para esto es necesario presindir del interes particular de los individuos o grupos qie componoen la comunidad, y asi lograr el bien para todos"
279,1,bien_común_comunidad,A,LO MEJOR PARA TODOS POR SOBRE LOS INTERESES DE UNOS POCOS
281,1,bien_común_comunidad,A,Es algo común que desean todos pero que es difícil de precisar. Se vincularía con un Estado que asegura un piso mínimo de bienestar.
287,1,bien_común_comunidad,A,Las políticas públicas tiene que considerar el bien común sobre el bien individual. Tenemos que reconocer que somos seres que vivimos en comunidad .
289,1,bien_común_comunidad,A,Hoy somos una comunidad y nuestras decisiones afectan a los demás.
293,1,bien_común_comunidad,A,Sentido inverso al modelo neoliberal que desarrolla y potencia el individualismo.
294,1,bien_común_comunidad,A,"Es importante volver a tejer vínculos a crear comunidad , volver a tener presente el bienestar de los demás"
295,1,bien_común_comunidad,A,"Condiciones sociales, políticas, ambientales, económicas, espirituales que permiten a todos y a cada uno su mayor realización"
311,1,bien_común_comunidad,A,Que el bienestar social prime por sobre el bienestar individual.
319,1,bien_común_comunidad,A,"Es necesaria la colaboración de todos, en comunidad, para la convivencia armónica de las personas."
320,1,bien_común_comunidad,A,"El estado debe velar por el bien de todos, sin dejarse llevar por partidismo.  El bien bien común tiene que facilitar la formación de comunidad."
328,1,bien_común_comunidad,A,"preocuparse de como están los otros, no ser tan individualistas, enfocarnos que muchos de los problemas se deben resolver de manera colectiva"
344,1,bien_común_comunidad,A,"Bien común lo entendemos como un beneficio país, descentralizado y garantizado."
346,1,bien_común_comunidad,A,Que el Estado asegure un bienestar social y económico respecto de cada ciudadano
356,1,bien_común_comunidad,A,"Es el sentido de unidad o fraternidad en un grupo, el reconocerse como pares."
358,1,bien_común_comunidad,A,"es necesario preocuparse por los mas vulnerables. pensar en la comunidad nos pone en igualdad. el aporte comunitario genera fuerza. Valor internacional, compartir riquezas para el futuro."
361,1,bien_común_comunidad,A,Estado de bienestar y calidad esencial para construir una sociedad humana.
362,1,bien_común_comunidad,A,"el fin de la sociedad es el fin común de todas las personas y de cada unas de ellas que les permita una vida digna ,alimento,vida digna  , salud ,educación ,trabajo ."
364,1,bien_común_comunidad,A,"Un principio que debe imperar en el marco de la constitución. Ninguna regulación debe perseguir fines de individuos o grupos particulares, sino el bien de la sociedad chilena en su conjunto"
368,1,bien_común_comunidad,A,"Es el fundamento principal de la Democracia y la base de la Constitución, es la regulación de la autonomía del ser humano y el respeto por el prójimo, se necesita eliminar la inmensa diferencia económica entre sectores sociales para lograr elevar la calidad de vida de todos."
375,1,bien_común_comunidad,A,"garantizar la paz social, la convivencia pacífica, la seguridad pública, la inclusión de todos, sin distinción de clases sociales, etnias, sexo, religión, nacionalidad. Una sociedad en actitud solidaria permanente y eficaz con los más vulnerables."
378,1,bien_común_comunidad,A,Considerado por todos como principio fundamental
382,1,bien_común_comunidad,A,Entendido como el espacio común de participación y desarrollo de la persona humana.  Valor 7.
383,1,bien_común_comunidad,A,"Entendido como bien común el bien de la comunidad, considerando mayorías y minorías. Comunidad significa respeto, unidad en la diversidad, familia, solidaridad.  Comunidad  es ser iguales en derechos y deberes."
387,1,bien_común_comunidad,A,El estado debe procurar el beneficio de todos y el bien de la sociedad.
389,1,bien_común_comunidad,A,"El Estado debe ser un agente corrector de las desigualdades, protegiendo a los ciudadanos mas vulnerables.  El Bien común debe reemplazar al actual principio de subsidiariedad del Estado."
392,1,bien_común_comunidad,A,"Es  responsabilidad del Estado resguardar y proteger el bien común para el desarrollo integral de la comunidad el cual se sustenta en el conjunto de libertades, bienes y servicios establecidos para favorecer a cada uno de los miembros de la sociedad. "
396,1,bien_común_comunidad,A,"debe ser el reflejo de nuestra sociedad en el futuro, ser un aporte al grupo social, comunidad con facultades de decisión y opinión"
404,1,bien_común_comunidad,A,"El Estado debe tener las herramientas legales que le permitan asegurar el acceso equitativo, y el resguardo apropiado a los bienes que pertenecen a la nación."
406,1,bien_común_comunidad,A,Bien común: es valor pues permite la paz social y tranquilidad para obtener desarrollo individual y comunitario.
407,1,bien_común_comunidad,A,El Estado debe garantizar que sus habitantes gocen de un nivel de bienestar digno de la condición humana.
409,1,bien_común_comunidad,A,"Que el bien común sea entendido como un bien social para la mayoría de las personas. Se propone el concepto de bien general (fraternidad). Entender el bien general como un antagonismo de la democracia liberal, la cual garantiza los derechos individuales de propiedad antes que el derecho social, el bien en la comunidad política y social"
411,1,bien_común_comunidad,A,El Estado debe procurar un bien común y la vida pacifica en comunidad.
412,1,bien_común_comunidad,A,"Valoramos el ser comunidad, velar por el bien de todos. La importancia de actuar y gobernar para el bienestar de todos, por sobre los intereses individuales."
413,1,bien_común_comunidad,A,Incluye a todos los otros valores.
414,1,bien_común_comunidad,A,Es necesario para hacer comunidad y abolir el individualismo. Se pretenden beneficios y recursos sin diferencias.
417,1,bien_común_comunidad,A,"Muchas de las cosas que suceden son arrastradas por el individualismo, muchos problemas territoriales se originan por no respetar este concepto. Se debiese tender a privilegiar las necesidades de todos en igualdad de condiciones."
418,1,bien_común_comunidad,A,"Implica comprender que un país se constituye como una unidad en la que el estado debe priorizar el bien colectivo y formar personas que reflejen esto. Hoy en día se evidencia un país atomizado, en que los individuos no se sienten parte de la realidad cotidiana."
423,1,bien_común_comunidad,A,"sociedad basada en progreso de todos. Entender bien común acotado a los derechos básicos de los ciudadanos: educación, salud, previsión."
428,1,bien_común_comunidad,A,"Comunicación entre los ciudadanos, chilenos e inmigrantes."
444,1,bien_común_comunidad,A,bienes superiores que son la base de nuestra comunidad. supone un diálogo y un acuerdo de cuales son
446,1,bien_común_comunidad,P,"Pensamos que ante la toma de decisiones en nuestra constitución debe primar el bien común, más que la conveniencia de algunos."
448,1,bien_común_comunidad,A,"1. Consideramos que la búsqueda del bien común es lo que subyace al resto de los valores, implica la solidaridad, la tolerancia y el respeto. Limita además el uso de las libertades individuales ya que deben estar supeditadas  al bien común."
452,1,bien_común_comunidad,A,Hubo acuerdo en la importancia de una constitución que se oriente realmente al bien común. Se coincidió en la necesidad de reconstruir el tejido social roto en este modelo de sociedad individualista y de regenerar la confianza y la solidaridad entre el pueblo.
463,1,bien_común_comunidad,A,"Sentido de un estado, relacionado a la naturaleza de nuestra convivencia"
468,1,bien_común_comunidad,A,"Debemos trabajar en pos de la sociedad, para poder beneficiarnos todos y no solo algunos. Pero debemos ser responsables de nuestros actos para que no afecten al otro."
483,1,bien_común_comunidad,A,"UN ESTADO QUE GARANTICE EL BIEN COMÚN, PARA UNA MEJOR CALIDAD DE VIDA DE TODOS."
484,1,bien_común_comunidad,A,acuerdo unanime
490,1,bien_común_comunidad,A,Prevalencia de este bien sobre los bienes individuales
494,1,bien_común_comunidad,A,"Entendido como la búsqueda del bienestar colectivo, donde priman los derechos sociales sobre los intereses personales, entendiendo que hay bienes comunes que sostienen la vida de las comunidades, como el aire, tierra, mar y biodiversidad los que hay que respetar y resguardar pues son patrimonio..."
495,1,bien_común_comunidad,A,Asociado a la equidad queremos que el quehacer humano siempre sea en beneficio de la comunidad
498,1,bien_común_comunidad,A,"Se ha perdido la noción sobre cómo vivir en comunidad, deteriorándose el tejido social, debiéndose recuperar el sentido social de los seres humanos por sobre los actos individuales"
509,1,bien_común_comunidad,A,"Agua; bosque, primer quebrada, Campos de Ahumada, reparación canal Ramírez. Bosques forestación Campos de Ahumada. Se tiene que preservar los bosques y el agua."
510,1,bien_común_comunidad,A,"Solidaridad, Inclusión, Estado Solidario, Integración, , terminar con el individualismo, respeto a las minorias"
513,1,bien_común_comunidad,A,"beneficio para todos sin distinciones, pensar en los otros"
526,1,bien_común_comunidad,A,Es un principio a alcanzar porque es la base o fin de la constitución del Estado para generar comunidad y construir la sociedad que queremos  y  como nos desarrollamos(.)
527,1,bien_común_comunidad,A,"La constitución debe facilitar el rescate de los bienes comunes, su valor de uso y su función social en materia de planificación, gestión y mejoramiento de los territorios para la satisfacción de las demandas y capacidades comunes fundamentales, en el espíritu de DESC velando por la calidad de vida"
531,1,bien_común_comunidad,A,"es prioritario que en nuestro pais se logre el bienestar de la gente y eso es deber de la gente , de las autoridades, que se logre"
534,1,bien_común_comunidad,A,Toda acción de los chilenos debe responder al beneficio de todos.
553,1,bien_común_comunidad,A,Es el objetivo de todo Estado u órgano político. Se constituye como algo más la suma de los bienes individuales.
557,1,bien_común_comunidad,A,Engloba otros. Que debe incluir la democracia.
559,1,bien_común_comunidad,A,Responsabilidad ante la comunidad de lo que uno plantea no dañe al otro. Que exista un respeto real donde termina mi derecho empieza la del otro.
562,1,bien_común_comunidad,A,Importancia de establecer condiciones favorables para el desarrollo de un grupo humano y poder tener derecho a su protección.
564,1,bien_común_comunidad,A,Es muy importante para la convivencia de las personas
568,1,bien_común_comunidad,A,Es un valor que es necesario reforzar considerando que en la actualidad pareciera que prima el bien individual por sobre el bien común.
579,1,bien_común_comunidad,A,lograr que la gente se empodere para generar cambios o reclamar sus derechos. lleva a respetar y promover igualdad
583,1,bien_común_comunidad,A,Conciencia de propender la comunidad. Que todos los integrantes puedan alcanzar su mayor realización material y espiritual posible.
586,1,bien_común_comunidad,A,el estado debe garantizar que todas las instituciones accedan a un bienestar dentro de la nación.
589,1,bien_común_comunidad,A,Es para todos los ciudadanos por igual no importando los intereses particulares de grupos ni de individuos.El bien comun permite una sociedad mas integrada menos Individualista
603,1,bien_común_comunidad,A,"Es fundamental, si  todos  actuáramos de acuerdo a este principio, las cosas serían más fáciles de resolver. Como sociedad, es necesario buscar siempre el bien de todos, en contraposición a la satisfacción de las necesidades individuales a cualquier precio."
608,1,bien_común_comunidad,P,"Gran parte de los participantes cree que toda persona debe realizarse material y espiritualmente en la comunidad nacional, promovido por el estado. otros no lo encuentran tan trascendente."
615,1,bien_común_comunidad,A,"Es un fin al cual las leyes , las personas deben buscar alcanzar pensando en el otro y no en el bien propio."
629,1,bien_común_comunidad,P,Prevalencia del bien común en la toma de decisiones.
632,1,bien_común_comunidad,A,"La constitución debe garantizar que ante cualquier que ante cualquier proyecto, cambio o avance, se priorice aquello que beneficie al conjunto de la ciudadanía y no solo a un grupo."
633,1,bien_común_comunidad,A,"Es necesario en la implementación del respecto y consideración de múltiples valores, tales como la inclusión, la dignidad, la diversidad, la solidaridad y otros."
634,1,bien_común_comunidad,A,Fundamenta el resto de valores y principios
636,1,bien_común_comunidad,A,"es sumamente importante potenciar la vida en comunidad, lo que beneficiara el bien común.  de esta forma se apunta que el bienestar sea para todos y todas, que lo que pide la mayoría como objetivo en común sea escuchado y atendido."
642,1,bien_común_comunidad,A,Consideramos que el Estado o el Gobierno debe velar por el bien común de todos sus habitantes sin distinciones y que la constitución debe establecer en su desarrollo y aprobación este principio claramente determinado.
644,1,bien_común_comunidad,A,En un mundo que tiende hacia el individualismo se requiere mayor conciencia de sociedad para que podamos convivir con más equidad y en paz. El bien común debe ser una guía para las políticas públicas.
652,1,bien_común_comunidad,P,Que haya bienestar y acceso a los recursos naturales para todos
653,1,bien_común_comunidad,A,"La organización del país, las actividades diversas desarrolladas por el Estado, deben inspirarse en el bien común de la lcomunidad."
663,1,bien_común_comunidad,A,Hay acuerdo en que el valor fundamental debe ser el Bien Común por sobre el interés propio
664,1,bien_común_comunidad,A,Es importante ser capaz de ver al otro cuando cada individuo toma una decisión. El bien común requiere de una mirada al otro y al entorno.
671,1,bien_común_comunidad,A,Los seres humanos tenemos la libertad con el objeto de responder al bien. Es importante que el bien común guíe el actuar de las personas para encauzar esa libertad.
675,1,bien_común_comunidad,A,"Todos participan para todos, sin individualismos, actores activos y no pasivos."
681,1,bien_común_comunidad,A,Bienestar de la mayoría de la sociedad
689,1,bien_común_comunidad,P,"S e debe basar en lo que la mayoría necesita, respetando la opinión de la minoría."
690,1,bien_común_comunidad,P,Fundamental para la sociedad
691,1,bien_común_comunidad,A,Importante valor que se relaciona con todas las personas. Para conseguir el bien común es importante la responsabilidad individual.
692,1,bien_común_comunidad,P,Es el bien de todos los hombres y pertenece a todas las personas. Busca el bien de toda la sociedad sin oponerse a los bienes individuales ni a los propios.
694,1,bien_común_comunidad,A,"El Estado está al servicio de la persona y su finalidad es promover el bien común. Debe contribuir a crear las condiciones que permitan a sus habitantes su realización, tanto espiritual como material, respetando derechos constitucionales"
695,1,bien_común_comunidad,A,en regimen democrático es básico el bien comun
698,1,bien_común_comunidad,A,Se requiere bien común para apoyarnos los unos a los otros y que se cumplan con los deberes que se demandan al vivir en comunida
701,1,bien_común_comunidad,A,Los actos del Estado deben ir en función del bienestar de toda la sociedad. Destacamos la importancia del respeto a la persona humana como sujeto de derecho y la familia como núcleo social.
702,1,bien_común_comunidad,A,Garantiza que no van a primar los intereses de grupos particulares por sobre las del colectivo social.
706,1,bien_común_comunidad,A,"Bien Común no sólo como bienestar si no que también como respeto de los recursos comunes (cultura, naturaleza, bienes nacionales, etcétera)."
714,1,bien_común_comunidad,A,"Este valor debe ser el norte para el desarrollo de toda actividad humana privada y pública, toda acción debe reconocer como limitación la existencia del otro y sus intereses. Pasar de la libertad de mercado acérrima y violenta a un Estado que busca el bienestar de sus ciudadanos."
719,1,bien_común_comunidad,P,"Que sea una retroalimentación, una vinculación empática."
720,1,bien_común_comunidad,P,"representa mas de un valor. ya que su busqueda involucra el bienestar de todos, asi podemos llegar a un Estado y Nacion mas representativo y solidario."
733,1,bien_común_comunidad,A,"que prime el bien común por sobre intereses individuales o de determinados grupos, para todo aspecto de la vida y la naturaleza. Pensar en las generaciones futuras."
746,1,bien_común_comunidad,A,Debe ser el gran paradigma que refugie las libertades individuales y las limitaciones que se les quiera imponer
756,1,bien_común_comunidad,A,apoyar las ideas de todos.
760,1,bien_común_comunidad,A,consenso en que es el valor y fin más importante de todo estado.
762,1,bien_común_comunidad,A,Porque debemos velar por el bien de los demás y no sólo del nuestro.
773,1,bien_común_comunidad,A,El estado debe garantizar el bien común de todos los miembros de la sociedad y por ende asegurar que los intereses de unos pocos se interpongan.
