idEla,tema,concepto,acuerdo,fundamento
8100,1,bien_común_comunidad,A,"Los sistemas sociales, instituciones y medios socio economicos deben funcionar de manera que beneficien a todas las personas. Beneficios para todos los miembros de la comunidad."
8101,1,bien_común_comunidad,A,"es lo que nos hace bien a todos, incluso cuando no nos damos cuenta,y, sobre todo bien comun es la idea de que la vida es mejor cuando toda la comunidad esta bien no solo una parte"
8123,1,bien_común_comunidad,A,"Este valor está entendido como servicialidad del Estado, es decir es el Estado el que está al servicio de la persona humana y no al revés."
8128,1,bien_común_comunidad,A,"El propósito de este principio es el respeto por el bien estar colectivo, y se espera que el Estado promueva el beneficio colectivo en los proyectos e inversiones,a largo como corto plazo."
8129,1,bien_común_comunidad,P,El bien común propicia el bienestar y la calidad de vida de los ciudadanos.
8134,1,bien_común_comunidad,A,"La constitución debe garantizar este valor, analizado desde lo ético, centrando la mirada en lo compartido, lo construido en conjunto y en la defensa de lo que es entendido como mejor para todos y todas."
8139,1,bien_común_comunidad,A,"El Estado no vela realmente por cuidar a la población, sino que a los poderosos. EJ: El Estado subsidiario. Sin embargo, debiese ser un Estado solidario . Los representantes políticos deben velar por el Bien Común. Existe la necesidad de buscar un bien para toda la comunidad."
8147,1,bien_común_comunidad,A,"bienestar colectivamente entendido, sin privilegio para nadie, ni aún para los poderosos. Engloba a la dignidad del ser y (del) sentido republicano."
8149,1,bien_común_comunidad,A,"Se señala que corresponde a un cambio de foco desde el individualismo, impuesto por la lógica de mercado a una mirada colectiva, reconociéndose la esencia del contrato social y de las relaciones que surgen de éste."
8152,1,bien_común_comunidad,A,"Que la comunidad tenga el derecho a participación, más intereses y pensar en el bien común. Fortalecer a la comunidad en todas sus instituciones."
8157,1,bien_común_comunidad,P,Busca garantizar condiciones básicas para el bienestar colectivo. Aquí se incluye el respeto a la naturaleza.
8159,1,bien_común_comunidad,A,Porque debe primar el bien general por sobre el particular
8167,1,bien_común_comunidad,A,Acuerdo general
8180,1,bien_común_comunidad,A,"sin privilegiados, derechos velar por todos"
8189,1,bien_común_comunidad,A,El principio de bien común/comunidad se contrapone a la propiedad privada.
8190,1,bien_común_comunidad,A,"el estado debe garantizar las condiciones mínimas de bienestar, estimulando el desarrollo de cada uno de los integrantes del país, priorizando el bien común por sobre el beneficio de grupos y personas particulares."
8191,1,bien_común_comunidad,A,"En una sociedad que ha elegido serlo, se debe resguardar el bien común en cada una de las decisiones que se tomen."
8200,1,bien_común_comunidad,A,"14 votos, como valor primordial faltante en nuestra sociedad en crisis, es fundamental la mirada comunitaria frente a la prevalencia de los individuales, para generar una mejor sociedad."
8214,1,bien_común_comunidad,A,Es un estado que pretende entregar a todos los ciudadanos que tengan los mismos derechos
8218,1,bien_común_comunidad,A,Accesible a todos.  Que las leyes consideren el beneficio de todas las personas involucradas.
8219,1,bien_común_comunidad,A,xxxxxxxxxxxxxxxxxxxxxxx
8226,1,bien_común_comunidad,A,Principio fundamental del Estado es propender al bien común. La comunidad y la familia como base social.
8227,1,bien_común_comunidad,A,"Debe ser, el actual y manterse"
8231,1,bien_común_comunidad,A,Procurar la mayor felicidad a la mayor cantidad de gente por la misma gente.
8249,1,bien_común_comunidad,A,"Ser menos individualistas, ser más solidarios con nuestro entorno, dado que si todos contribuimos, todos somos beneficiados. Se afecta positivamente a la comunidad."
8258,1,bien_común_comunidad,A,"Una sociedad que cuida el bien común, protege a todas las personas y fortalece toda la red de valores para cuidarlo."
8264,1,bien_común_comunidad,A,Los participantes de forma unánime consideran este valor como fundamental
8272,1,bien_común_comunidad,A,Concebimos el bien común como antagónico al individualismo entendiéndolo como un principio generador de una sociedad solidaria y respetuosa con el prójimo.
8277,1,bien_común_comunidad,P,La idea es que todos juntos nos encontremos y los que tienen más pongan eso en común para los que tienen menos. El problema es que la comunidad la forma la mayoría y a veces eso puede poner en riesgo a las minorías
8292,1,bien_común_comunidad,A,"Las organizaciones sociales y los ciudadanos deben aspirar al desarrollo de la sociedad. Formando comunidades inclusivas y justas, propendiendo al desarrollo local, social y nacional."
8296,1,bien_común_comunidad,A,Pensar en el bien de la comunidad antes que el bien particular
8302,1,bien_común_comunidad,A,.
8310,1,bien_común_comunidad,A,Los tres poderes del Estado deben garantizar el bien común por sobre el interés o bien privado.
8312,1,bien_común_comunidad,A,"Beneficiar a todos en lo social, en lo económico. Respetar a las personas en sus derechos básicos."
8314,1,bien_común_comunidad,A,"Este es un valor fundamental que debe garantizar el beneficio de todos y todas, ademas de garantizar  la libertad, paz,respeto y equidad etc."
8322,1,bien_común_comunidad,P,Resguardar acceso a bienes básicos universales y posibilidad de desarrollo comunitario dirigidos al bien común
8327,1,bien_común_comunidad,A,"El Estado debe velar por el bien común, entendido como el bienestar desde el punto de vista comunitario."
8331,1,bien_común_comunidad,A,EL BIEN DE LA MAYORÍA POR SOBRE LA MINORÍA
8337,1,bien_común_comunidad,A,ENGLOBA LA SOCIEDAD MODERNA EN ACUERDO A LO QUE POR DECISIÓN PARTICIPATIVA SEA EL BIEN PARA LA MAYORIA
8339,1,bien_común_comunidad,A,"Objetivo básico que debe perseguir el Estado para con sus ciudadanos asegurando el adecuado funcionamiento de las instituciones que entregan servicios básicos y acceso garantizado a la salud, educación, alimentación, vivienda, pensión social, transporte público, etc."
8348,1,bien_común_comunidad,A,"Garantizar el cumplimiento de todos los valores, destacando lo colectivo sobre lo individual."
8353,1,bien_común_comunidad,A,"Aquí acordamos no el bien común que favorece solo a una mayoría sino que queremos aquel que no deje ninguna minoría fuera. Buen común para todos. , nos quedamos con el concepto de una libertad en sentido amplio."
8356,1,bien_común_comunidad,A,para que sean para todos los derechos y deberes
8363,1,bien_común_comunidad,A,"La Constitución debe garantizar el bienestar de todos los seres, elementos y actores de la sociedad, considerando personas, naturaleza, animales y territorio. Además, que este bien común genere una justicia intergeneracional que se mantenga en el tiempo."
8365,1,bien_común_comunidad,A,El  organización del estado  debe estar regida por la convicción de hacer en pos del beneficio publico
8366,1,bien_común_comunidad,A,Que el bien común sea el valor superior en el que se enmarquen todas las leyes de la nación.
8370,1,bien_común_comunidad,A,Se debe garantizar la distribución de los bienes y servicios de acuerdo con las necesidades de las personas.
8387,1,bien_común_comunidad,P,"Parte del grupo grupo está en desacuerdo, ya que se ve como dar a las personas que luchan día a día."
8388,1,bien_común_comunidad,A,Debe pensar en el Bien Común y la Comunidad.
8392,1,bien_común_comunidad,A,Valor que incluye destinatario y origen de la creación artística.
8401,1,bien_común_comunidad,A,"Nos permite convivir y crecer respetándonos entre todos, es central para una constitución para todos. El bien común es aquello que es común a todos, independiente del individuo. Hoy el bien común no está garantizado; ejemplo, las AFP son obligatorias y no es claro que estas apunten al bien común."
8402,1,bien_común_comunidad,A,"Ampliar el concepto de núcleo social, desde familia, hacia la comunidad, donde las personas puedan colaborar entre sí en pos del bien común. Varias problemáticas sociales verían solución considerando este aspecto, abandono de los ancianos, maltrato infantil, marginalidad, pobreza, entre otros."
8403,1,bien_común_comunidad,P,teorizar el bien común ante el personal
8409,1,bien_común_comunidad,A,Todos los demás valores están destinados a contribuir a generar las condiciones necesarias para la realización.
8416,1,bien_común_comunidad,A,"El Estado debe garantizar el bien común, como base de la construcción de una sociedad equitativa y de derechos."
8425,1,bien_común_comunidad,A,"El Estado debe asegurar el Bienestar de todas personas, tanto en lo individual, social y cultural."
8438,1,bien_común_comunidad,A,"Engloba muchas cosas como respeto, responsabilidad, multiculturalidad, participación, tolerancia e inclusión. Las decisiones como país en beneficio de todos. Es un facilitador de la seguridad, el respeto."
8444,1,bien_común_comunidad,A,"El bien común debe estar consagrado como un bien superior  que debe regir por sobre cualquier otro interés particular, un  valor que debe ser primordial  que aportará al desarrollo  de toda la sociedad"
8445,1,bien_común_comunidad,A,"Vivir en sociedad obliga a la interdependencia, para lograrlo es necesario que el estado sea responsable, garante y solidario para el mas alto desarrollo del ser humano. Actuar con probidad y cautelando los bienes de la nación para su común disfrute."
8447,1,bien_común_comunidad,A,"que las decisiones que se tomen sean realmente pensando en el bien de todos (as), no solo en un grupo de personas"
8452,1,bien_común_comunidad,A,"El esmero colectivo de todos quienes viven en este país independientemente de su nacionalidad, edad, sexo, o condición social."
8463,1,bien_común_comunidad,A,"Es el rol primero del Estado y las personas, puesto que debe estructurar la convivencia nacional, teniendo a la base lo comunitario por sobre lo individual."
8466,1,bien_común_comunidad,A,"Es fundamental apuntar al bien común, independientemente de las posiciones particulares, en bien de la comunidad."
8476,1,bien_común_comunidad,A,"6 participantes votan por este valor. Se comprende que la Constitución Chilena debe proteger y velar por el bien común, entendiendo que somos una sociedad que debe vivir en armonía y paz."
8480,1,bien_común_comunidad,A,La  unión  hace  la  fuerza.  Dejemos  de  lado  el  individualismo  para  luchar  por  el  bienestar  de todos.
8482,1,bien_común_comunidad,A,Lo que nos sirve y hace bien a todos. Es la idea de que toda la comunidad está bien. Trabajar por el bien común es lo que deben hacer los países.
8483,1,bien_común_comunidad,A,porque la preocupación principal debe ser el bien común de todos sus habitantes
8486,1,bien_común_comunidad,A,"Debe ser un principio y una finalidad en base a acuerdos, siendo básico el respeto por los derechos humanos, equidad de género y el plurinacionalismo. El Estado y los ciudadanos deberían trabajar para todos."
8488,1,bien_común_comunidad,A,Es el compromiso de la sociedad y el Estado a ser responsable en su conjunto.
8494,1,bien_común_comunidad,A,"El Bien Común fue destacado, por unanimidad, como el valor esencial que queremos que mueva nuestro país, entendiendo éste como una gran Comunidad."
8495,1,bien_común_comunidad,A,"Todo nosotros debemos tener conciencia en los demás, fortalecer la convivencia en comunidad, lograr igualdad de derechos y ponerle fin al individualismo"
8537,1,bien_común_comunidad,A,existe pleno acuerdo. procurar que se beneficien todos los ciudadanos
8543,1,bien_común_comunidad,A,Complementario a solidaridad. Leit motiv.
8544,1,bien_común_comunidad,A,ver archivo adjunto
8547,1,bien_común_comunidad,P,Es un beneficio para todos de manera igual y asi optar por mejores condiciones. Diferencias en el caso de personas con pena de muerte.
8564,1,bien_común_comunidad,A,Elección democrática del bienestar a nivel de gobiernos locales
8570,1,bien_común_comunidad,A,"Que seamos comunidad en todo sentido, que compartamos y aportemos  junto con el estado al bien común, en estos tiempos las personas en diferentes aspectos están tendiendo a preocuparse solo por ellos mismos,  es imperante hacer un principio de bien común entre las personas."
8571,1,bien_común_comunidad,A,"La finalidad del Estado es garantizar el bien común de sus ciudadanos, y no solo promover este. El espíritu de nuestras leyes debiera ser propender a facilitar la vida en comunidad, se debería propender hacer valer en bien común sobre los bienes individuales, respetándolas y que de cómo resultado,"
8573,1,bien_común_comunidad,A,Como humanistas cristianos consideramos que el bien común debe constituirse como el principio orientador de la acción del Estado y ser un elemento inspirador del orden constitucional.
8575,1,bien_común_comunidad,A,Es un principio básico que debe estar presente en la constitución. Estado debe garantizar el bienestar de la sociedad
8577,1,bien_común_comunidad,A,El individualismo debilita nuestra cohesión.
8586,1,bien_común_comunidad,A,La Constitución debe obligar al Estado chileno a buscar y defender el bien común de los ciudadanos y la sociedad.
8594,1,bien_común_comunidad,P,buscar desarrollo de las personas
8597,1,bien_común_comunidad,A,"Se asociaron ambos conceptos, es decir el bien común debe ser visto desde lo comunitario y con sentido de comunidad."
8619,1,bien_común_comunidad,A,El Bien común es entendido como el respeto por parte del Estado y los particulares de los derechos sociales justiciables y el cuidado del medio ambiente.
8626,1,bien_común_comunidad,A,"El estado debe estar al servicio del pueblo y debe , hacer todo lo posible para conseguir el bien común y así lograr la plena autorealización material y espiritual"
8627,1,bien_común_comunidad,A,"Garantiza que el bien mayor se sobreponga al bien individual, actualmente esto no ocurre muy seguido. Acciones que se benefician a todos los ciudadanos a través de sistemas sociales, instituciones y medios socio económicos de los cuales todos dependemos"
8628,1,bien_común_comunidad,A,"Garantía de inclusión, justicia, dignidad y autonomía"
8630,1,bien_común_comunidad,A,Podemos crecer para que se beneficie toda la comunidad
8632,1,bien_común_comunidad,A,"En la nueva Constitución se debe resguardar el derecho del Bien común para todas las personas, que asegure condiciones básicas de una comunidad."
8634,1,bien_común_comunidad,A,LOS PARTICIPANTES RECALCAN LA IMPORTANCIA DE QUE CHILE SE ORGANICE PENSANDO EN TODAS LAS PERSONAS Y NO SÓLO EN LAS MÁS PRIVILEGIADAS.
8639,1,bien_común_comunidad,A,"EL BIEN COMUN DEBE ESTAR AL CENTRO DE LA CONSTITUCION, PERO NO DESE LO SUBSIDIARIO, SINO DESDE LA IGUALDAD Y LA UNIVERSIDAD."
8641,1,bien_común_comunidad,A,"No es mayoría gana y considerando a los sujeto Solidaridad, Convivencia"
8657,1,bien_común_comunidad,P,"Importante para nuestra sociedad.  Se reconoce su importancia, pero frente a la inclusión y el respeto a la diversidad se considera inferior en importancia"
8670,1,bien_común_comunidad,A,"No violencia, convivencia pacífica. Amabilidad. Paz. Participación. Equidad, colaboración y generosidad."
8679,1,bien_común_comunidad,A,"Valor primordial que el Estado debe asegurar. Respetar la visión de conjunto. Centrado en la solidaridad, la igualdad y el bienestar colectivo."
8685,1,bien_común_comunidad,A,"El bien común, busca el bien de toda la sociedad política, sin oponerse a los bienes individuales ni a los bienes propios de los distintos grupos."
8686,1,bien_común_comunidad,A,"Estado debe garantizarlo, no prevalecer el bien particular. Se trata de vivir en convivencia y mayor inclusión. Debe ir en contra de todo el sistema económico que conocemos hoy como Oligopolio.  Generar menos egoísmo en la gente, menos individualismo. Comunidad = Interés colectivo."
8708,1,bien_común_comunidad,A,Bien común debe permitir el desarrollo del colectivo nacional. Decisiones públicas deben realizarse por bien común y no propiedad individual (intereses particulares)
8710,1,bien_común_comunidad,D,"Cada persona puede lograr un bien a traves de los esfuerzos propios, pero es importante colaborar con los compatriotas que no pueden llegare a alcanzarlo."
8711,1,bien_común_comunidad,A,"rompe con el individualismo y hace retroceer al neoliberalismo concepto lo desarrolla sociedad porqué es una nueva forma de propiedad, ni estatal ni privada."
8716,1,bien_común_comunidad,P,creemos importante que todas las legislaciones estén mentadas al bien común y la ciudadanía.
8721,1,bien_común_comunidad,A,"Es el pilar fundamental que sostiene el valor y sentido de la nación y que comprende otros principios como respeto, igualdad, participación. El país como un bien de todas las personas y que lo debemos proteger y cuidar, por lo que es un principio transversal y colectivo en contraposición al individuo y los bienes privados. Debe ser la concepción de comunidad que queremos y guiar las leyes y políticas, donde lo colectivo este por sobre lo individual y lo privado."
8724,1,bien_común_comunidad,P,Es un valor que orienta la labor del estado en función de garantizar que todos los ciudadanos tengan acceso bienestar
8733,1,bien_común_comunidad,A,"Permitirá que los chilenos nos sintamos en una sociedad que nos respeta, cuida y protege ya que trasciende la singularidad y buscan un bien mayor Limita ciertos derechos individuales para garantizar el derecho colectivo"
8737,1,bien_común_comunidad,P,"La carta magna debe velar porque todos avancemos hacia un mismo objetivo, en el que se integren otros valores y principios como el respecto y la dignidad, de forma que todos nos comportemos en pos del bien común. Siempre teniendo presente que el bien común de sebe construir a partir de consensos"
8742,1,bien_común_comunidad,A,"PARA QUE UN PAIS AVANCE, SE DEBE RESPETAR EL BIEN COMUN POR SOBRE LO INDIVIDUAL"
8744,1,bien_común_comunidad,A,valor fundamental para todos
8750,1,bien_común_comunidad,A,Contribuir a crear las condiciones que permitan a todos y cada uno de los integrantes de la comunidad nacional su mayor realización espiritual y material posible.
8752,1,bien_común_comunidad,A,Prevalencia del interés general por sobre el particular.
8753,1,bien_común_comunidad,A,"Los bienes y servicios deben ser para todos, sin diferencias ni discriminación. Es una apuesta por vivir en una sociedad más igualitaria. Tener bienes comunes implica solidaridad y cooperatividad e incorporar a los otros en nuestras vidas."
8756,1,bien_común_comunidad,A,Con equidad e igualdad para todos.
8760,1,bien_común_comunidad,A,Toda Constitución debe nacer de un principio de comunidad.
8769,1,bien_común_comunidad,A,"• Las diferencias y desigualdades, tienen en común la ausencia de bienes comunes • El Estado está obligado a garantizar la igualdad y bien común. La actual Constitución no lo considera. • Hay que pensar en el bien común y la comunidad de ahí le siguen los otros."
8771,1,bien_común_comunidad,A,"El Estado debe promover y garantizar el Bien Común, por tanto le compete al Estado la velar por la repartición equitativa de los recursos de la nación. 14 votos."
8776,1,bien_común_comunidad,A,- Necesidad propia de todas las personas que viven en una comunidad o territorio. - Esto garantiza que los servicios aseguren el bien común y no particular.
8777,1,bien_común_comunidad,A,"Propende a lo mejor para todos y todas. Generar comunidad logra empoderamiento, lo que permite y obliga a definirse, a tomar decisiones, abanderizar por causas comunes y afines."
8780,1,bien_común_comunidad,A,"bien comun, comunidad y solidaria"
8781,1,bien_común_comunidad,P,Considerando que el estado no está garantizando los valores de igualdad de derecho.
8782,1,bien_común_comunidad,A,"Entre otras cosas, enfocado al bienestar y felicidad de las personas."
8789,1,bien_común_comunidad,A,"El Estado debe estar al servicio de la comunidad, fortalecer el entramado social de la ciudadanía a través de la realización personal y comunitaria de sus participantes. El bien común debe ser la columna central de la República."
8792,1,bien_común_comunidad,A,"Asegurar a la ciudadanía los elementos básicos para su desarrollo espiritual, cultural y material."
8806,1,bien_común_comunidad,A,Desarrollo desde las Bases
8808,1,bien_común_comunidad,A,"Como base de la sociedad, definiéndolo para que no sea tergiversado por quien gobierne."
8810,1,bien_común_comunidad,A,Se debe garantizar el acceso a bienes naturales y culturales. Cada persona tiene derecho a participar del bien común.
8821,1,bien_común_comunidad,A,Es importante velar por el bienestar de todos los ciudadanos
8822,1,bien_común_comunidad,A,"La constitución que dirija al país debería buscar el mejoramiento nacional, para poder crear el mejor país posible para todos sus habitantes"
8832,1,bien_común_comunidad,A,"Que la nueva constituciòn sea elaborada considerando la libertad que tenemos como ciudadanos, asegurando que no habrá intervención del gobierno de turno en el ejercicio de la libertad"
8846,1,bien_común_comunidad,A,Lo que prime debe ser el bien común
8847,1,bien_común_comunidad,P,"CREEMOS IMPORTANTE QUE SE NOS BENEFICIE A TODOS, PERO SABEMOS QUE LAS NECESIDADES SON MUCHAS ENTONCES NO SIEMPRE TODA LA COMUNIDAD QUEDA FAVORECIDA."
8848,1,bien_común_comunidad,A,Beneficio de los recursos de todo orden del Estado para el bienestar de la sociedad genera y no de unos pocos
8854,1,bien_común_comunidad,A,"Elegimos el bien común porque implica varios otros valores importantes como: Respeto, paz, igualdad (en el sentido de la equidad), igualdad ante la justicia. Creemos que la Constitución debe basarse en lo que es bueno para todos."
8855,1,bien_común_comunidad,A,Construcción colectiva de la sociedad por sobre el individuo.
8857,1,bien_común_comunidad,P,"El bien comun debe ser de todos, por encima de intereses particulares. La riqueza material, cultural y y social debe pertenecer a todos: ningun grupo puede (debe) adueñarse de ellas."
8858,1,bien_común_comunidad,A,QUE TODAS Y TODOS TENGAN ACCESO A MEJORES CONDICIONES DE VIDA
8870,1,bien_común_comunidad,A,Porque el estado está al servicio de la persona humana creando condiciones sociales que le permitan a todos desarrollarse en lo material y espiritual y respetando sus derechos.
8872,1,bien_común_comunidad,A,con este valor queremos el desarrollo integral de todas las personas.
8873,1,bien_común_comunidad,A,Como la palabra lo indica es el bien de todos o de las mayorías siendo estas siempre los sectores más modestos y carentes de oportunidades. Es encontrarse con el otro en un mismo proyecto en igualdad de condiciones.
8875,1,bien_común_comunidad,A,"Para una buena constitución, se debe trabajar por un bien común, no de manera individual."
8876,1,bien_común_comunidad,A,"Condiciones para el acceso de todos los habitantes de un país  a su desarrollo pleno, sin privilegio a determinados grupos"
8883,1,bien_común_comunidad,A,"Se considera para el cumplimiento y englobando otros valore como el respeto, la igualdad, la dignidad, la justicia, etc. el Bien común para todas las personas."
8888,1,bien_común_comunidad,A,Porque consideramos necesario orientarnos como sociedad hacia el bienestar general de todos y todas
8891,1,bien_común_comunidad,A,"Principio fundamental desde el cual debe levantarse una nueva constitución. El bien común reúne múltiples otros conceptos tales como inclusión, justicia, equidad, oportunidad, desarrollo, entre otros. El bien común debe ser definido por todos tras reflexiones ciudadanas y participativas que deben promoverse de manera constante y permanente para que sea efectivo."
8894,1,bien_común_comunidad,A,Que la vida sea mejor para toda la ciudadanía en su conjunto. No solo una parte. Igualdad para todos los ciudadanos.
8902,1,bien_común_comunidad,A,"La nueva Constitución debe promover el bien común, de toda la comunidad, por sobre el individualismo o privados."
8904,1,bien_común_comunidad,P,"garantizar que las acciones del estado sean para un bien común o de la comunidad, no para un grupo selecto."
8913,1,bien_común_comunidad,A,Este principio  debe ser un rol fundamental del estado y permitir a todos los entes que conforman una sociedad recibir los mismos derechos.
8917,1,bien_común_comunidad,A,Asegura la construcción del nosotros
8932,1,bien_común_comunidad,A,El estado debe establecer políticas que favorezcan a todo el pueblo.
8935,1,bien_común_comunidad,P,es deber del estado garantizar el bien común por sobre los derechos individuales.
8951,1,bien_común_comunidad,P,"Se percibe el bien común pero el problema es que es muy difuso en la actualidad, por ello debe definirse tomando en consideración la igualdad de condiciones y el respeto espiritual. ACUERDO PARCIAL: el término es demasiado amplio, por ellono todos están de acuerdo en que deba estar expresado."
8954,1,bien_común_comunidad,A,"se trata de vivir en comunidad , que la constitucion promueva este principio"
8959,1,bien_común_comunidad,A,No hay
8961,1,bien_común_comunidad,A,"Antes se trabajaba en comunidad, es fundamental mejorar nuestro modelo de relación social,  el estado debería enfatizar en el bienestar común de nuestras comunidades."
8963,1,bien_común_comunidad,A,"Este es un valor esencial que debe inspirar la acción del Estado, asegurando así que todos y todas las personas tengan una base mínima que les permita un estado de bienestar."
8965,1,bien_común_comunidad,A,LA CONSTITUCIÓN DEBE APUNTAR AL BIEN GENERAL.
