idEla,tema,concepto,acuerdo,fundamento
3994,1,bien_común_comunidad,P,El bien común es importante como base de nuestra sociedad para un buen desarrollo de esta por lo cual es importante preservarla.
4000,1,bien_común_comunidad,A,Es fundamental considerar a todas y todos a la hora de gobernar y legislar.
4002,1,bien_común_comunidad,A,El bien común como principio es el deber de velar por el respeto y el rescate de la diversidad en la construcción colectiva.
4003,1,bien_común_comunidad,A,"Bien común a fin de que todos los principios, derechos, valores y deberes, protejan y beneficien a todos y todas las chilenas."
4007,1,bien_común_comunidad,A,.
4010,1,bien_común_comunidad,A,"Sentido de comunidad; cuestión suprema, máxima propensión del Estado"
4014,1,bien_común_comunidad,P,"El bien común implica desarrollar políticas de equidad en oportunidades, independiente del género, condición social. Lleva implícito un desarrollo armónico y sustentable con el medio ambiente."
4020,1,bien_común_comunidad,A,El bien colectivo debe estar por sobre el bien privado o los intereses particulares. La constitución debe proteger al bien común como un principio fundamental.
4022,1,bien_común_comunidad,A,"Con este valor se recupera el sentido de comunidad, como una forma de superar el individualismo y/o la lucha de los intereses corporativos. El bien común promueve un auténtico compromiso de solidaridad con los y las otros/as."
4041,1,bien_común_comunidad,A,"El máximo desarrollo de los individuos y de las comunidades que estos forman, asegurándoles dignidad, respeto, seguridad y tolerancia."
4050,1,bien_común_comunidad,A,"Este concepto abarca otros: convivencia pacifica, libertad y autonomía. Finalmente el bien común es el enfoque que se le quiere dar a la creación de la nueva constitución."
4051,1,bien_común_comunidad,P,"La misión del estado es fomentar el bienestar de todos, asegurando derechos básicos"
4064,1,bien_común_comunidad,A,Necesidad de reconocer y respetar las necesidades de personas y comunidades.
4065,1,bien_común_comunidad,A,"Que se garantice el derecho a al agua a los campesinos. Que el subsuelo y el agua sean del estado que se garantice el acceso a la salud, educación y jubilación para todos los chilenos"
4070,1,bien_común_comunidad,A,CONJUNTO DE INTERESES PENSADO EN LAS GENERACIONES FUTURAS
4078,1,bien_común_comunidad,P,También se observó la vida Comunitaria
4079,1,bien_común_comunidad,A,"Se acuerda con la definición entregada por el gobierno, pero además se añade una definición de ciudadanía inclusiva según ONU y que dice relación con tener un equilibrio con los ecosistemas y la comunidad humana, esto es, obrar con respeto al medio ambiente y en armonía con la comunidad humana"
4082,1,bien_común_comunidad,P,"Es importante vivir en comunidad y desarrollar las organizaciones sociales, pero el grupo plantea que también es importante la autonomía de está."
4099,1,bien_común_comunidad,A,el bien comun debe estar por sobre el bien individual
4104,1,bien_común_comunidad,A,"Estos valores se entienden como la base mínima que permitirá la construcción de una sociedad igualitaria, respetuosa, justa, etc. Solamente en la medida en que los individuos puedan desarrollarse con libertad y autonomía será posible Ahora bien, por autonomía y libertad se entienden derechos intrínsecos al ser humano, no asociados a su expresión mercantil que otorga libertades de elección en el mercado (carácter que se les tiende a asignar estos valores)."
4106,1,bien_común_comunidad,P,Vivir en armonía. Velar por el bien de todos.
4109,1,bien_común_comunidad,A,"La Constitución debiera contemplar el bien común de los ciudadanos de nuestro país como un valor, inspirándose en generar condiciones favorables para todos y todas."
4112,1,bien_común_comunidad,A,"Todos somos diferentes, si embargo igual debemos ser respetados."
4119,1,bien_común_comunidad,A,"Reconoce que el otro (a) eres tú. La concreción de ese valor la hacemos generando espacios de conversación, usando nuestros valores en pos de la comunidad, expresando y siendo vida en la o el otro."
4131,1,bien_común_comunidad,A,Es la primicia que debe regir en todos los ámbitos de la constitución.
4135,1,bien_común_comunidad,A,"Se busca un modelo de desarrollo basado en el bien común y no en proyectos personales, que se respete el mejor destino para todos y no sólo para algunos."
4139,1,bien_común_comunidad,A,"creemos que es fundamental que se incorpore de maneras real, este principio para que podamos tener una sociedad más humana, y que vele por el bienestar de la comunidad"
4144,1,bien_común_comunidad,A,"Este concepto fue elegido como el nùmero 1, destaca la idea que de ponerlo en valor asegurando el bienestar general de la comunidad, dejando de lado las particularidades. Este concepto debe estar acompañado de un nuevo modelo econòmico en donde no prime la acumulaciòn de capital y el individualismo"
4161,1,bien_común_comunidad,A,"Se fundamenta en la prominencia del bien colectivo por encima del beneficio individual. (Pareciera obvio, pero a la luz de los últimos eventos que han ocurrido, y que nos hemos informado, observamos que algo que parecía higiénico, obvio, no lo es, entonces debemos legislar al respecto.)"
4163,1,bien_común_comunidad,P,Que se incorpore en la nueva constitucion
4177,1,bien_común_comunidad,A,BIEN MAYOR. BIEN SOCIAL
4181,1,bien_común_comunidad,A,Se acuerda que este concepto es fundamental para la constitución
4198,1,bien_común_comunidad,A,"En todas las sociedad y comunidades los miembros que la conforman van a tener en mayor o menor medida ideas diferentes de bienestar, pese a esto es imprescindible que como sociedad logremos llegar a un consenso acerca de cuál va a ser nuestro piso básico de calidad de vida, incluyendo nuestro desarrollo espiritual y material."
4201,1,bien_común_comunidad,A,preocupación por la ciudadanía primera opción del ser humano para poder interactuar en el otro
4204,1,bien_común_comunidad,A,es la finalidad básica de la vida en sociedad.
4206,1,bien_común_comunidad,A,Sociedad más justa.
4223,1,bien_común_comunidad,A,Por ser un valor base de los derechos humanos
4232,1,bien_común_comunidad,P,"Principio rector de la convivencia, consiste en la obligación de ciudadanos e instituciones, encabezados por el estado para proporcionar y asegurar condiciones de máximo desarrollo espiritual y material, en términos de dignidad, justicia, calidad de vida y oportunidades de participación para todos"
4236,1,bien_común_comunidad,A,"Debemos preocuparnos por el bien de toda nuestra  comunidad siendo más solidarios, justos  y equitativos  con las  políticas  publicas y leyes  pensando siempre  en la igualdad de oportunidad de todos los chilenos."
4241,1,bien_común_comunidad,A,Se debe asegurar el acceso al bien común a beneficio de los ciudadanos pues es un derecho beneficiarse de aquel.
4244,1,bien_común_comunidad,A,"La sociedad debe trabajar por el bien común, esto conlleva a otros valores como el respeto. Sobrepasar el individualismo."
4245,1,bien_común_comunidad,A,"El bien común es el bien de todos los individuos, organizaciones e instituciones que se encuentran organizados, como la familia, etc."
4249,1,bien_común_comunidad,A,.
4252,1,bien_común_comunidad,A,"Entendiendo que el bien común engloba otros conceptos tales como son la equidad, igualdad, diversidad, multiculturalidad, plurinacionalismo, y justicia. Estos conceptos anteriormente mencionados apuntan al bien común de todas y todos los ciudadanos de un país."
4260,1,bien_común_comunidad,A,La forma de como el Estado ha enfrentado la convivencia con el pueblo.  Ha alterado la forma y prácticas de bien común o trabajos en comunidad (ejemplo: limpieza de canales).
4261,1,bien_común_comunidad,A,"Buscar el bien de la de la comunidad identificando las particularidades de cada comunidad. Alcanzar el bien común a través de la construcción de comunidad Se discute sobre el concepto de “bien común” en contra de los conceptos de individualidad. Incorporar Probidad, Medio ambiente y Diversidad."
4267,1,bien_común_comunidad,A,"Formamos un colectivo ya que todos somos distintos. Además permite encontrarnos todos y crecer juntos. Somos seres sociales y diferentes, por lo que encontrarnos nos permite crecer. Permite que no prime el individualismo. No se toma como maximizar el beneficio social, se debe considerar lo privado."
4268,1,bien_común_comunidad,A,"Acto de conversar, deliberar, tomar acuerdos y respetar dichos acuerdos para que se lleven a cabo"
4272,1,bien_común_comunidad,A,"se asocia a calidad de vida, a propender como conjunto y personas individuales a que toda lo sociedad en su conjunto esté bien por sobre los intereses particulares. Acuerdo"
4275,1,bien_común_comunidad,A,"El estado debe velar por el principio de comunidad por sobre el principio de la individualidad del sujeto, promoviéndolo desde todos sus frentes. Esto entendiendo que vivimos, trabajamos y nos formamos en comunidad"
4279,1,bien_común_comunidad,A,"Esto integra otros valores. El bien común debe estar por sobre otros intereses particulares, especialmente de los grupos de poder. Como sociedad debemos aprender a compartir y escucharnos, desde los espacios más pequeños de construcción social."
4284,1,bien_común_comunidad,A,"- Que todas las políticas (decisiones), tengan como fin el bien común - Fortalecer todas las organizaciones de bases"
4296,1,bien_común_comunidad,A,Beneficios para la mayoría de las personas.
4300,1,bien_común_comunidad,A,"EL SISTEMA ACTUAL POLÍTICO, ECONÓMICO NO VELA POR LA SATISFACCIÓN Y CUMPLIMIENTO DE LAS NECESIDADES TRANSVERSALES  A LA SOCIEDAD, LO CUAL DAN BASE Y ORDENAMIENTO A LA SOCIEDAD."
4302,1,bien_común_comunidad,A,"TRABAJAR POR TODA LA COMUNIDAD, PARA QUE TODOS ESTEN BIEN."
4303,1,bien_común_comunidad,A,Se consideró unánimemente como un principio fundamental.
4310,1,bien_común_comunidad,A,"Se entiende sobre la base que las decisiones del estado, los privados y los individuos sean en base al bienestar de todos no primando lo individual y buscando contribuir a lo colectivo."
4311,1,bien_común_comunidad,A,La asamblea apuesta por el bien común y la solidaridad como principios que deben inspirar la futura constitución. También comprenden la cooperación mutua de la sociedad para lograr  un bienestar común
4322,1,bien_común_comunidad,A,"Es indispensable defender la justicia en todas las áreas de la sociedad. Necesidad de convivir en base a equidad e igualdad. Defender a todos los ciudadanos y no solo a una elite. Generar espacios de debate, participación e inclusión. Igualdad para todos en el acceso a los derechos sociales."
4338,1,bien_común_comunidad,A,Condiciones sociales que permiten a todos y cada unos de los integrantes de la comunidad nacional su mayor realización espiritual y material posible.
4371,1,bien_común_comunidad,A,La constitución debe propender al bien común de la sociedad.
4372,1,bien_común_comunidad,A,Nos juntamos con el fin de apoyarnos unos con otros.
4376,1,bien_común_comunidad,A,"Pensar en lo óptimo global, de comunidad y no en el óptimo individual/local"
4379,1,bien_común_comunidad,A,Porque todos somos iguales y tenemos los mismos derechos y debemos tener las mismas oportunidades
4383,1,bien_común_comunidad,P,8 personas manifiestan su acuerdo con este principio
4393,1,bien_común_comunidad,A,Es la base de la convivencia social y desarrollo de una comunidad y el país. Leyes que den garantía que todos podemos desarrollarnos y que estén en contraposición al individualismo.
4405,1,bien_común_comunidad,A,"Este debe ser el principio fundamental desde el cual debe nacer la nueva constitución. Bien común como sinónimo de inclusión, justicia, equidad, oportunidad, desarrollo, entre otros. El bien común debe ser definido de manera constante por todos así como reflexionarse y promoverse para su efectividad."
4409,1,bien_común_comunidad,A,Como fin del Estado y si no cumple no debe existir y los demás están incluidos
4410,1,bien_común_comunidad,P,- La constitución debe definir los criterios mínimos del bien común. Principio básico de convivencia que permite el desarrollo armónico de lo individual y lo social.
4418,1,bien_común_comunidad,A,Necesario que exista un beneficio real para toda la comunidad
4420,1,bien_común_comunidad,A,"Debe primar el bien colectivo por sobre lo individual. Las políticas de Estado deben apuntar al bien común por sobre lo privado,"
4422,1,bien_común_comunidad,A,- Desde la comunidad se construye sociedad. - Básico para el resto de los principios - La política comienza en la Comunidad.
4432,1,bien_común_comunidad,A,El bien común debe ir en función de velar por los derechos del buen vivir.
4434,1,bien_común_comunidad,A,EL BIEN COMUN DEBE IMPEERAR SOBRE INTERESES PARTICULARES PERO RESPETANDO LOS DERECHOS ESTABLECIDOS EN LA CONSTITUCION
4435,1,bien_común_comunidad,A,Sola una persona  está en desacuerdo por considerar que lo suyo es lejos lo más importante que lo de los demás.
4440,1,bien_común_comunidad,A,Idea de que la vida es mejor cuando se vive en comunidad respetando al entorno.
4441,1,bien_común_comunidad,A,Prioridad 7
4444,1,bien_común_comunidad,A,"Entendido como el bienestar de todos los miembros de la sociedad, velar por este principio debe ser tarea fundamental del estado pero también de todos los ciudadanos. Exige el desarrollo de políticas que permitan poner el bienestar colectivo, de las mayorías, sobre el beneficio de los particulares."
4447,1,bien_común_comunidad,A,"Primer valor fundamental de la constitución, debe incorporar la salud, vivienda, medio ambiente. Engloba también valores como la solidaridad y el respeto"
4450,1,bien_común_comunidad,A,Desarrollar políticas públicas que generen impacto positivo en el común denominador de las personas para un mejoramiento de la convivencia.
4454,1,bien_común_comunidad,P,"Más que bien común, proponemos “BIENESTAR COMÚN”, es decir, tener una vida buena y justa para todos, con oportunidad para desarrollar todos los potenciales y acceso garantizado a derechos esenciales."
4455,1,bien_común_comunidad,A,"Cuidar nuestros espacios comunes, tener acceso a proyectos para mejorar el entorno"
4460,1,bien_común_comunidad,A,"Se  entiende  que  el valor está  referido al  fortalecimiento del sentido  colectivo  en la  sociedad , distinto del  individualismo  imperante .Se hace  la diferencia  entre   búsqueda del  bien común ,y  búsqueda del  bien individual  exclusivamente."
4464,1,bien_común_comunidad,A,"Las políticas sean tomadas consecuentemente para que toda la población tenga mejoras sociales, culturales, ambientales, educacionales y no solamente algunos privilegiados."
4473,1,bien_común_comunidad,A,No hubo fundamento.
4475,1,bien_común_comunidad,A,"De suma importancia, ya que si todos estamos bue quiere que existe unión y la unión nos ayuda a crecer como país."
4476,1,bien_común_comunidad,A,"Que todos tengamos opción a una vida digna y de calidad y mejores sueldos para todos, no solo para un grupo."
4480,1,bien_común_comunidad,A,Definición de la actual constitución
4491,1,bien_común_comunidad,A,.
4496,1,bien_común_comunidad,A,Es el máximo “paraguas” que debe tener la Constitución para preocuparse de todos los habitantes
4501,1,bien_común_comunidad,A,tener acceso a la igualdad como todo chileno. ej: salud
4507,1,bien_común_comunidad,A,"Con el bien común nos podemos beneficiar todas las personas, sistemas sociales e instituciones, incluyendo también todo nuestro medio ambiente. Lo que permitirá un equilibrio biosicosocial."
4529,1,bien_común_comunidad,A,la razón de organizarse un Estado es también buscar el bien común.
4530,1,bien_común_comunidad,A,Es obligación del Estado el asegurar y garantizar la igualdad de condiciones para el desarrollo en plenitud de todas las personas que viven en el territorio. Resguardando que todas las instituciones que lo componen trabajen en pro de aquello.
4531,1,bien_común_comunidad,A,"Es necesario que existan condiciones sociales que beneficien al unisono de la comunidad y aseguren su integridad humana, asi como el libre desenvolvimiento."
4544,1,bien_común_comunidad,A,El Estado debe regirse por el principio de bien común de las personas por sobre las particularidades o sectores minoritarios
4556,1,bien_común_comunidad,A,Respeto a la persona humana.
4558,1,bien_común_comunidad,A,una comunidad organizada y apoyada por el estado siempre luchará por el bien común de todos los chilenos
4565,1,bien_común_comunidad,P,"fundamental rescatar la convivencia social como un valor, la relación con los otros como integrantes todos de una comunidad. Vivir en conjunto y respetarnos es fundamental para construir nuestra sociedad."
4582,1,bien_común_comunidad,P,Fin último del Estado. Se debe evitar un individualismo extremo. Comprende valores como comunidad y solidaridad. El Estado debe garantizar un mínimo de bienestar a sus ciudadanos.
4591,1,bien_común_comunidad,A,Es el valor que garantiza el desarrollo y el acceso a oportunidades para el desarrollo sustentable
4592,1,bien_común_comunidad,A,Todas las leyes tengan como finalidad el bien común de la comunidad.
4593,1,bien_común_comunidad,A,"EL ESTADO TIENE QUE GENERAR LAS CONDICIONES, PARA QUE LA SOCIEDAD EN SU CONJUNTO HABILITE AL SER HUMANO PARA ALCANZAR SU DESARROLLO."
4596,1,bien_común_comunidad,P,"Porque muchas personas sobre salen, pero se debe buscar el bien común."
4598,1,bien_común_comunidad,A,"Engloba a todo el resto de los valores, y es por esto que vivimos en sociedad."
4599,1,bien_común_comunidad,A,"Cada ciudadano debe privilegiar el bien común sobre los intereses individuales, creando así lazos fraternos que formen la comunidad."
4600,1,bien_común_comunidad,A,toda constitución debe estar sustentada en buscar el “bien común”  para todos los ciudadanos
4601,1,bien_común_comunidad,A,"El Estado es la obtención debe promover y crear  condiciones sociales que favorezcan en los seres humanos el desarrollo integral, tanto material como espiritual,  para todos los ciudadanos."
4609,1,bien_común_comunidad,A,"Si todos pensamos en que somos parte de una comunidad estaríamos dispuestos a buscar el bien común, el de todos los chilenos, así no existiría la corrupción y habría menos delincuencia."
4611,1,bien_común_comunidad,A,El Estado debe asegurar el bienestar de todos sus ciudadanos y la libertad de asociación en comunidades.
4612,1,bien_común_comunidad,A,Objetivo del estado es proveerlo y obligacion del los ciudadanos es cuidarlo
4614,1,bien_común_comunidad,A,"Todas las decisiones que se tomen tienen que ser conforme a las necesidades de la comunidad y deben apuntar al bien común. Esto quiere decir, tener en consideración a todas las personas respecto a su beneficio integro en la actualidad y en pos de las futuras generaciones."
4617,1,bien_común_comunidad,A,fortalecer los territorios lo que decide la mayoría  compartir las diferencias
4618,1,bien_común_comunidad,A,Para una sociedad sustentable y feliz
4619,1,bien_común_comunidad,A,porque presupone el respeto a la persona humana en su integridad y ordenado a su desarrollo.
4639,1,bien_común_comunidad,A,La institucionalidad del Estado y la sociedad en su conjunto  debe perseguirlo como finalidad última.
4640,1,bien_común_comunidad,A,"Es una búsqueda más allá de la individualidad, lo colectivo vitando egoísmo e individualismo."
4643,1,bien_común_comunidad,A,"RESPETO Y DIGNIDAD A LA PERSONA HUMANA EN TODAS SUS DIMENSIONES, DEL VIVIR EN SOCIEDAD"
4645,1,bien_común_comunidad,A,"Implica un sentido de pertenencia, que involucra el respeto y la dignidad de las personas."
4648,1,bien_común_comunidad,A,"trabajar por una identidad común de país, disminuir las barreras entre lo que corresponde a unos y otros, involucrarnos"
4659,1,bien_común_comunidad,A,Es el fin y el deber principal del Estado. No es absoluto sino que está sujeto al bien mayoritario y se logra concediendo herramientas básicas llamadas derechos.
4667,1,bien_común_comunidad,A,"El estado debe garantizar la posibilidad a los ciudadanos de desarrollarse, garantías de educación, salud, etc."
4684,1,bien_común_comunidad,A,Porque es el fin último del Estado; se ocuparía la definición de bien común que se plantea en el artículo 1 de la constitución actual.
4686,1,bien_común_comunidad,A,.
4694,1,bien_común_comunidad,A,Falta vocación por el servicio público. Se privilegia el interés particular y no el bienestar de toda la sociedad.
4712,1,bien_común_comunidad,A,para ser un país desarrollado debemos velar por el bien de todos
4718,1,bien_común_comunidad,A,Es el princiio basico de una costitucion velar por el bien comun de todos los ciudadanos.
4729,1,bien_común_comunidad,A,"Todas nuestras acciones deben apuntar a beneficiar a lo colectivo, mis acciones ayudan a la sociedad a un mejor vivir."
4735,1,bien_común_comunidad,A,"Se debe  asegurar el bien común y el interés colectivo, en el cual todas las personas puedan acceder a los beneficios del país, independientes si estos son público o privados."
4738,1,bien_común_comunidad,A,"Se debate en torno al concepto de bien común, diferenciándolo de una visión aristotélico-tomista, para reinterpretarlo en clave secular. En cuanto al concepto de comunidad, hay acuerdo pleno en cuanto a su desarrollo constitucional. Se propone la noción de interés general."
4742,1,bien_común_comunidad,A,"Principio fundamental a cual todos los gobiernos deben aspirar, es el bien que abarca a la gran mayoría de los participantes de una sociedad que se dan por mutuo acuerdo y permiten el desarrollo de nuestra sociedad, y que deben ser resguardados por el estado."
4743,1,bien_común_comunidad,A,"Entendiendo el bien comun como la matriz a la cual tributan otros valores, tales como, la amistad cívica."
4750,1,bien_común_comunidad,A,"Asegurar el bienestar de la comunidad, trabajo de bases, recoger la diversidad, asegurar la participación."
4756,1,bien_común_comunidad,A,"es importante para el beneficio de todas las personas, especialmente las personas más vulnerables."
4762,1,bien_común_comunidad,A,pensar en lo colectivo más allá de lo individual; implica que habiendo democracia los gobernantes y el estado deben pensar en un bien común que supera a la mitad más 1.
4764,1,bien_común_comunidad,A,Se debe primar el bien común por sobre los intereses personales. Esto es referido principalmente a que la constitución actual prima el interés individual de la propiedad privada. De esta manera se combate de manera trascendental la ideología neoliberal de la constitución del 80.
4769,1,bien_común_comunidad,A,"Considerar a los individuos como parte de un todo o de una comunidad, privilegiando el beneficio de la mayoría."
4775,1,bien_común_comunidad,A,"Queremos una sociedad más cercana, en la que los  vínculos entre los individuos pertenecientes o que tenga relación con  Chile sean la base que rija la creación de las instituciones y por consiguiente los derechos y deberes de los individuos ya sean personas naturales y jurídicas y porque creemos"
4778,1,bien_común_comunidad,A,Aspiramos a una convivencia en comunidad donde lo fundamental que no rige es lograr el bien común
4779,1,bien_común_comunidad,A,el trabajo conjunto promueve valores colectivos
4791,1,bien_común_comunidad,P,"Incluye  otros principios y valores, se debe velar siempre por el bien común, es transversal."
4792,1,bien_común_comunidad,A,Que el Estado garantice las bases fundamentales para el desarrollo de las personas.
4799,1,bien_común_comunidad,A,Asegurar el derecho a los espacios comunes. Debemos buscar el beneficio común de todas las personas que conforman nuestra sociedad.
4800,1,bien_común_comunidad,A,Porque es importante considerar el bienestar de todos y no sólo de unos pocos. La comunidad es importante para que se pueda dar una verdadera calidad de vida.
4805,1,bien_común_comunidad,A,El Estado debe administrar y ser dueño de todos los recursos naturales para el bien común.
4807,1,bien_común_comunidad,A,"El Estado debe garantizar, de manera justa, el bienestar colectivo (material, espiritual y medio ambiental) de todas las personas que habitan en el territorio de nuestro país."
4816,1,bien_común_comunidad,A,Todas de acuerdo en lo ecencial del sentido comunitario como valor principal de toda sociedad
4817,1,bien_común_comunidad,A,"El bien común es imprescindible, debido a que a partir de éste se construye una consciencia social y ciudadana que permita poner lo colectivo por sobre lo particular."
4827,1,bien_común_comunidad,A,NUEVO CONTRATO SOCIAL
4828,1,bien_común_comunidad,A,"Subordinación del bien individual al bien de la comunidad en su conjunto; supeditado a los valores y principios consagrados en esta constitución. Seleccionamos sólo ""Bien común""."
4831,1,bien_común_comunidad,A,Por el bienestar de todos.
4832,1,bien_común_comunidad,A,Garantizar el bien común de todos los ciudadanos ante todo
4833,1,bien_común_comunidad,A,"Recuperación del estado del agua y la energia eléctrica a la gran minería que esta en manos de privados para , financiar la salud ,la educación y las pensiones de jubilados poner términos a las isapres y  AFP y toda empresa estratégica que pase a manos del estado."
4840,1,bien_común_comunidad,A,Respetar el bien del vecino.
4857,1,bien_común_comunidad,A,"hubo acuerdo en este valor, en todos y todas las participantes, que la finalidad del Estado debe ser el bien común, y que para eso deben funcionar las instituciones, en Justicia y equidad, al servicio del Ser Humano de manera integral,"
