idEla,tema,concepto,acuerdo,fundamento
133,2,de_petición_ante_las_autoridades,A,hoy ante los hechos de corrupción se debe analizar las acciones de cada autoridad.
642,2,de_petición_ante_las_autoridades,A,La constitución debiera especificar claramente como las personas en forma individual o grupal tengan la posibilidad de algún tipo de petición que ayude a mejorar su bienestar social.
1075,2,de_petición_ante_las_autoridades,A,accceso directo hablar con la autoridad competente.
1274,2,de_petición_ante_las_autoridades,A,- Revocar autoridades electas - Referéndum revocatorio - Derogar una ley - Iniciativa Legal Ciudadana
1328,2,de_petición_ante_las_autoridades,A,Hacer llegar la información para que el gobierno desarrolle políticas públicas de acuerdo a las demandas y necesidades de los ciudadanos. Que exista una mayor cercanía entre la política y el ciudadano.
1575,2,de_petición_ante_las_autoridades,A,"Participación Ciudadana, Vinculante"
1618,2,de_petición_ante_las_autoridades,A,QUE SEAMOS ATENDIDOS CON RESPETO POR NUESTRAS AUTORIDADES Y SE PRIORICE A PROFESIONALES LOCALES PARA PUESTOS DE TRABAJOS LOCALES
1855,2,de_petición_ante_las_autoridades,A,"Cuando uno se dirija a sus autoridades, éstas sean accesibles y que estén en contacto con la realidad de su comunidad y sus vecinos."
2435,2,de_petición_ante_las_autoridades,A,Que se le pueda dar a conocer nuestras necesidades e inquietudes de manera más fluida y sin trámites tan engorrosos.
2759,2,de_petición_ante_las_autoridades,A,no muchas veces somos escuchados ho tomadas encuenta nuestras peticiones por nuestra condicion
2789,2,de_petición_ante_las_autoridades,A,sin burocracia
2894,2,de_petición_ante_las_autoridades,A,"Sin ley de lobby, no más burocracia, que tengamos un país más agilizador de trámites, sin tantas vueltas para lograr nuestros objetivos"
3204,2,de_petición_ante_las_autoridades,A,Que nos escuchen.
3444,2,de_petición_ante_las_autoridades,A,DERECHO A LA DEMOCRACIA DIRECTA Y VALIDAR LA OPINIÓN DEL ESTADO CIVIL
3637,2,de_petición_ante_las_autoridades,A,"Ser recibido, escuchado y considerado."
3753,2,de_petición_ante_las_autoridades,A,"que allá mas cercanía  a la ciudadanía donde sea escuchada ,con dignidad y respeto ante las situaciones adversas."
3782,2,de_petición_ante_las_autoridades,A,Se necesita mayor cercanía de las autoridades y que den respuesta con prontitud ante las peticiones.
3931,2,de_petición_ante_las_autoridades,A,Con amplitud y con obligación de pronunciamiento oportuna y rápida.
4104,2,de_petición_ante_las_autoridades,A,"Derecho de que cada ciudadano pueda relacionarse con las autoridades, promoviendo el desarrollo y ejecución de proyectos que para colectivos humano sean necesarios. Deberán existir conductos formales que logren que este vínculo efectivamente se lleve adelante."
4463,2,de_petición_ante_las_autoridades,A,Solicitar a la autoridad respuestas
4491,2,de_petición_ante_las_autoridades,A,.
4786,2,de_petición_ante_las_autoridades,A,1. Mas espacios y tiempos para dar respuesta a las necesidades de la gente.
5515,2,de_petición_ante_las_autoridades,A,Que las autoridades escuchen las peticiones de las comunidades y que tengan la obligación de responder a las peticiones estas sean a favor o en contra.
5797,2,de_petición_ante_las_autoridades,A,que las autoridades que representan a la ciudadanía cumplan sus deberes de escuchar y cumplir con las peticiones y necesidades de los ciudadanos.
6204,2,de_petición_ante_las_autoridades,A,Escuchar a las personas que realmente lo necesitan
6427,2,de_petición_ante_las_autoridades,A,Nadie puede imponer alguna autoridad.
6590,2,de_petición_ante_las_autoridades,A,"Es fundamental que se perfeccione diametralmente este derecho, para que no sea solo una norma programática, sino que se traduzca en una posibilidad concreta de hacer partícipe a las autoridades de nuestros problemas, señalando además el deber obligatorio de respuesta, con sanciones reales."
6660,2,de_petición_ante_las_autoridades,A,"Referendum, y plebiscitos"
7248,2,de_petición_ante_las_autoridades,A,"Las autoridades deben garantizarle a todas las personas el derecho a proporcionar información de interés, en especial sobre uso de recursos públicos"
7664,2,de_petición_ante_las_autoridades,A,"Lograr que las iniciativas populares, con ciertos requisitos, puedan ser iniciativa de ley, solucionar dudas o problemas a traves de una consulta o plebiscito"
8359,2,de_petición_ante_las_autoridades,A,Se entiende no solo como un derecho a la información a través de la transparencia de las autoridades sino a la interpelación y el reclamo respecto a la gestión.
8368,2,de_petición_ante_las_autoridades,A,Mayor incidencia de los ciudadanos. Menos burocracia estatal. Más facilidades a la participación. Falta más información.
8688,2,de_petición_ante_las_autoridades,A,"Mayor accesibilidad, facilitación de acceso. Que no sea tan burocrático."
8800,2,de_petición_ante_las_autoridades,A,"QUE LAS AUTORIDADES NO PASEN OCUPADOS POR LA AGENDA SI NO POR LOS CIUDADANOS, QUE LOS CIUDADANOS SAN MAS ESCUCHADOS Y ESTO COMO UN DERECHO NO COMO UN FAVOR. QUE LA CONSTITUCIÓN OBLIGUE LA REALIZACIÓN DE CABILDOS VINCULANTES CON ACTORES PERTINTES A SU CARTERA"
8847,2,de_petición_ante_las_autoridades,A,MUY IMPORTANTE YA QUE UNO PUEDE EXPONER SUS PROBLEMAS O HACER UNA CARTA A LA PRESIDENTA Y EXIGIR ALGUNA SOLUCION DIRECTA A LOS PROBLEMAS.
8855,2,de_petición_ante_las_autoridades,A,Mecanismo de participación ciudadana vinculante.
8862,2,de_petición_ante_las_autoridades,A,Corrección falta sentido común. Los grandes cambios mundiales han sido gracias a esto.
9096,2,de_petición_ante_las_autoridades,P,En este punto se incluyen peticiones particulares lo que es importante para que cada uno tenga el derecho de velar por lo que necesite ante autoridades que le brinden las herramientas para obtenerlo.
9579,2,de_petición_ante_las_autoridades,A,"Ley del fútbol amateur, subvenciones directas."
9630,2,de_petición_ante_las_autoridades,P,Esto es para que tomen en cuenta la opinión del pueblo de Chile.
9805,2,de_petición_ante_las_autoridades,A,evitar la burocracia ante la autoridad
9815,2,de_petición_ante_las_autoridades,A,Que haya un mecanismo donde la ciudadanía pueda pedir rendiciones de cuentas hacia organismos públicos y privados.
9928,2,de_petición_ante_las_autoridades,A,Derecho a requerir a la autoridad
10246,2,de_petición_ante_las_autoridades,A,"Dar respuesta al apoyo que tienen para sus representados y la responsabilidad de acceder cuando asì lo pida la gente, que consideren sus demandas."
10480,2,de_petición_ante_las_autoridades,A,es el pilar para la democracia
10482,2,de_petición_ante_las_autoridades,A,"Es importante poder tener acceso a las autoridades, hacer nuestros descargos y peticiones ser realmente escuchados."
10807,2,de_petición_ante_las_autoridades,A,"Creemos que los ciudadanos deben ejercer un rol activo en los asuntos públicos, por ejemplo controlando la gestión de autoridades y representantes."
11406,2,de_petición_ante_las_autoridades,P,Se necesita mayor disposición de las autoridades hacia la comunidad.
11519,2,de_petición_ante_las_autoridades,A,Solicitar información sobre sus acciones y deberes no solo en cuentas publicas sino como trabajador
11532,2,de_petición_ante_las_autoridades,A,"Los chilenos debemos tener derecho de acceder a las autoridades de gobierno para presentar solicitudes o propuestas que deban ser analizadas e impulsadas, si corresponde."
11888,2,de_petición_ante_las_autoridades,A,Derecho fundamental que permite romper barreras y comenzar a construir de abajo hacia arriba.
11976,2,de_petición_ante_las_autoridades,P,Todo ciudadano tiene derecho a realizar peticiones en todos los ámbitos del estado y privado.
11990,2,de_petición_ante_las_autoridades,A,"Ser escuchadas. Disponibilidad de atender , escuchar y solucionar en menos tiempo, sin tanta burocracia."
12113,2,de_petición_ante_las_autoridades,A,estuvimos todos de acuerdo
12286,2,de_petición_ante_las_autoridades,A,hasta ahora es muy dificil tener acceso a conversar con alguna autoridad
12305,2,de_petición_ante_las_autoridades,A,"Sobre la incidencia que tienen las personas en las políticas públicas, de tal forma que sus decisiones sean de carácter vinculante, para así darle voz a las personas."
12633,2,de_petición_ante_las_autoridades,A,"Toda persona tiene derecho de presentar peticiones respetuosas a las autoridades, en los términos señalados en este Código, por motivos de interés general o particular, y a obtener pronta resolución."
13322,2,de_petición_ante_las_autoridades,A,"Que nuestras demandas logren llegar y tener respuestas por las autoridades que corresponda. Que se consulte respecto de cesiones de tierra a otros países, como cuando se entrego tierras a argentina y perdimos un valioso territorio."
13551,2,de_petición_ante_las_autoridades,A,"Frente a las peticiones ciudadanas, debe existir la obligación de discutir los temas planteados por el pueblo. Se debe exigir transparencia e información."
13618,2,de_petición_ante_las_autoridades,A,poder como persona opinar y expresar a las autoridades sin complicaciones.
13633,2,de_petición_ante_las_autoridades,A,Poder acceder a audiencias con autoridades politicas nacionales  Que la Presidenta de la Republica visite las diferentes ciudades y dialogue con los ciudadanos
13880,2,de_petición_ante_las_autoridades,A,más información y regulación a esta institución poco conocida por la ciudadanía.
14355,2,de_petición_ante_las_autoridades,A,"Es necesario fortalecer este derecho, y obligar a las autoridadesa dar respuesta a las demandas sociales."
14596,2,de_petición_ante_las_autoridades,A,"Que se pueda la revocación de todas la autoridades ante la concurrencia de hechos cuestionables y que la ciudadanía, pueda promover iniciativas populares de Ley."
14708,2,de_petición_ante_las_autoridades,A,Las autoridades son elegidas por nosotros los ciudadanos y tienen el deber de escucharnos.
14977,2,de_petición_ante_las_autoridades,A,Todos debemos tener acceso a que las autoridades nos escuchen y reciban peticiones pues son nuestros representantes.
15045,2,de_petición_ante_las_autoridades,A,Que los trámites ante instituciones públicas sean más simples y ágiles en consideración a su calidad de adulto mayor (ejemplo: regularización de bienes raíces que hoy a demora 5 años en su tramitación)
15691,2,de_petición_ante_las_autoridades,A,El estado debería resguardar el derecho a que las inquietudes de la ciudadanía a ser agentes en la política nacional.
