idEla,tema,concepto,acuerdo,fundamento
11170,3,de_satisfacer_cargas_públicas,A,"Porque para garantizar una distribución equitativa de los beneficios de vivir en sociedad se debe honrar dicho compromiso con la comunidad a la que pertenecemos, de manera que no sólo sea en provecho de algunos de sus integrantes."
11216,3,de_satisfacer_cargas_públicas,A,"Prestación de carácter personal o patrimonial, que la ley le impone a la generalidad de las personas para el cumplimiento de determinados fines."
11217,3,de_satisfacer_cargas_públicas,A,Es importante asegurar la disposición de los ciudadanos a realizar acciones gratuitas que aporten a la sociedad.
11228,3,de_satisfacer_cargas_públicas,A,A través de los impuestos
11295,3,de_satisfacer_cargas_públicas,A,Deber de entregar financiamiento para poder llegar al bien común dentro de una situación justa
11348,3,de_satisfacer_cargas_públicas,A,"todo cargo publico que sea nombrado o elegido sean comprometidos, cumpliendo el respeto y la responsabilidad"
11389,3,de_satisfacer_cargas_públicas,A,"Todos tienen que hacerse cargo de sus deberes como ciudadanos (servicio militar, ir a votar, ser vocal)"
11399,3,de_satisfacer_cargas_públicas,P,"algunos consideran importante incluir como carga publica el deber de sufragar, asi comos er vocal de mesa. otros no pensaban lo mismo con el voto, pero en votacion la mayoria ganó y se incorporó este deber a la lista"
11445,3,de_satisfacer_cargas_públicas,A,Voto obligatorio (acuerdo parcial)
11477,3,de_satisfacer_cargas_públicas,A,"También relacionado con la pertenencia a la comunidad, de servir a través de las políticas implementadas por el Estado a causas comunes."
11486,3,de_satisfacer_cargas_públicas,A,"No exclusivamente mediante el pago de tributos, sino como deber eventual de participación o prestación activa, por ejemplo, trabajo eventual en el sector público."
11510,3,de_satisfacer_cargas_públicas,A,Que el estado pueda otorgar beneficios a los ciudadanos permitiendo una cirerta igualdad socia.  Poder otorgar subsidios  y pensiones de asistencialidad (por ejemplo)  es importante.
11591,3,de_satisfacer_cargas_públicas,P,ya que las personas que han elegido y no cumplen lo que prometen
11614,3,de_satisfacer_cargas_públicas,A,SE DEBE RESPETAR NUESTRO MEDIOAMBIENTE.
11655,3,de_satisfacer_cargas_públicas,A,La vida en comunidad obliga a que cada persona aporte a todos.
11689,3,de_satisfacer_cargas_públicas,A,"La satisfacción, sobre las cargas publicas, de parte de la constitución es fundamental para nosotros esto debido a que aquellos personas que no puedan desarrollarse por si mismo es deber de todos nosotros generar las herramientas y la ayuda para que genere sus propias opciones de vida y desarrollo."
11694,3,de_satisfacer_cargas_públicas,A,El que promete que cumpla y haga bien su labor de servicio público
11696,3,de_satisfacer_cargas_públicas,P,5 de 10 participantes esta de acuerdo.
11711,3,de_satisfacer_cargas_públicas,A,"Todo lo que sea impuestos, las obligaciones ciudadanas como el votar deben ser asumidas por las y los ciudadanos. para el cumplimiento de aquellas cargas públicas es necesario mejorar y ampliar la educación cívica no solo en la educación formal si no a través de las organizaciones sociales"
11726,3,de_satisfacer_cargas_públicas,A,Lo entendemos como el cumplimiento de obligaciones para con el estado
11759,3,de_satisfacer_cargas_públicas,P,"Las cargas públicas deben ser cumplidas, como correlato de los derechos ciudadanos. La minoría se manifiesta por excluír el voto obligatorio."
11853,3,de_satisfacer_cargas_públicas,A,Para una correcta convivencia en sociedad es importante que los ciudadanos cumplan con las obligaciones que el estado les impone porque así es posible desarrollar las políticas públicas que se proponen. Unanimidad
11890,3,de_satisfacer_cargas_públicas,A,Todos los que ostentan cargos públicos deben realizar su pega para eso se les pagan.
11893,3,de_satisfacer_cargas_públicas,A,designar personas adecuadas a cargos públicos
11927,3,de_satisfacer_cargas_públicas,A,garantizan los recursos para la proteccion de los derechos consagrados en la constitucion en especial los derechos sociales culturales
11982,3,de_satisfacer_cargas_públicas,A,concepto que debe motivar al respeto y a la negación del beneficio propio a base de cargos públicos
12023,3,de_satisfacer_cargas_públicas,A,las personas que sostienen cargos publicos debes ser idoneas al cargo y no estar en el cargo por tener algun pariente en el gobierno de turno
12029,3,de_satisfacer_cargas_públicas,P,debido a que todos tienen una responsabilidad dentro de la sociedad.
12042,3,de_satisfacer_cargas_públicas,A,Para financiar las politicas publicas
12155,3,de_satisfacer_cargas_públicas,A,protección y promocion y respetos de derechos humanos y fundamentales
12204,3,de_satisfacer_cargas_públicas,D,"No se entiende el concepto, pero de igual manera se da paso a la explicación, encontrando un ámbito general en el que en ciertos puntos genera una mirada positiva, pero que de igual forma va en desmedro de todos."
12239,3,de_satisfacer_cargas_públicas,A,"Contribuir y satisfacer cargas públicas. Especialmente por la propiedad privada, pero también de otros modos, los ciudadanos deben ponerse a disposición de las cargas que la comunidad determine para todos."
12247,3,de_satisfacer_cargas_públicas,P,"Opiniones diversas en el debate, algunos apelan por el derecho de libertad por sobre el satisfacer las cargas públicas."
12282,3,de_satisfacer_cargas_públicas,A,Corresponde hacerlo
12318,3,de_satisfacer_cargas_públicas,A,id
12381,3,de_satisfacer_cargas_públicas,A,"Exigir requisitos para cargos públicos, trayectoria ámbito público, pertenecer a la región, trayectoria intachable."
12467,3,de_satisfacer_cargas_públicas,P,Porque es un deber básico de un ciudadano
12562,3,de_satisfacer_cargas_públicas,P,"Hay acuerdo respecto de idea de cumplir cargas públicas, pero no de cuáles serían estas cargas públicas: por ej, hay oposición a servicio militar obligatorio, pero no a ser vocal de mesa. Habría que definir estas cargas públicas."
12573,3,de_satisfacer_cargas_públicas,A,"DE SATISFACER CARGAS PUBLICAS :ES UN DEBER DEL ESTADO EL TRABAJAR PARA SATISFACER NO TAN SOLO CARGAS PÚBLICA ,SI NO TAMBIEN CARGAS FAMILIARES"
12582,3,de_satisfacer_cargas_públicas,A,Cuando el Estado llama debemos acudir con orgullo a servirlo.
12589,3,de_satisfacer_cargas_públicas,A,Frente a un derecho siempre hay una obligación. El ejercicio de la democracia y la permanencia del estado requieren de la participación del pueblo soberano.
12599,3,de_satisfacer_cargas_públicas,P,"Principalmente considerar una canasta familiar que comprenda aspectos integrales al desarrollo social, cultural y económico de cada ciudadano."
12686,3,de_satisfacer_cargas_públicas,A,"Para protejer flores y fauna de Chile, para tener mas espacio."
12700,3,de_satisfacer_cargas_públicas,A,"las personas que ejercen cargos públicos los hagan por vocación y no por intereses económicos y personales , que no lucren ."
12709,3,de_satisfacer_cargas_públicas,P,"Obligación que impone el Estado por pertenecer a él. Es importante para mantener al país. Si queremos tener salud, educación, se necesita aportar dinero."
12751,3,de_satisfacer_cargas_públicas,A,Obligación de los ciudadanos
12764,3,de_satisfacer_cargas_públicas,A,Suministrar los elementos necesarios para el desarrollo de cada actividad y trabajo en estos sectores
12795,3,de_satisfacer_cargas_públicas,A,Deben ser asumidas por todos los ciudadanos en forma proporcional.
12841,3,de_satisfacer_cargas_públicas,A,Debe ser con Probidad y transparencia en el ejercicio de elección de cargos y  públicos.
12897,3,de_satisfacer_cargas_públicas,P,-Que cualquier persona tenga la posibilidad de acceder a un cargo público.
12950,3,de_satisfacer_cargas_públicas,A,"Como herramienta para la protección y conservación de la naturaleza y medio ambiente, así como del patrimonio histórico y cultural."
12972,3,de_satisfacer_cargas_públicas,A,Incluir también las cargas fiscales
12973,3,de_satisfacer_cargas_públicas,A,Es imperioso que el estado se haga cargo del íntegro desarrollo de cada uno de sus ciudadanos.
13010,3,de_satisfacer_cargas_públicas,A,Estado (instituciones) deben hacerse cargo de las necesidades de los habitantes de Chile y superarlas a la brevedad
13040,3,de_satisfacer_cargas_públicas,A,CONTRIBUCION EN RELATION A LAS CARGAS PUBLICAS
13045,3,de_satisfacer_cargas_públicas,A,"Cada cargo público tiene el deber de hacer cumplir su labor, ayudando en conjunto a conformar una mejor sociedad"
13049,3,de_satisfacer_cargas_públicas,A,Todos tienen el deber de pagar las cargas publicar de acuerdo a su ingreso
13092,3,de_satisfacer_cargas_públicas,A,Para que el estado disponga de los recursos necesarios para garantizar derechos todo ciudadano debe pagar oportunamente las cargas impositivas que les correspondan.
13203,3,de_satisfacer_cargas_públicas,A,Entendida como uno de los mecanismos a través del cual el Estado puede establecer contribuciones o gravar a las personas o a los patrimonios privados en beneficio colectivo. Es preciso hacer prevalecer el interés colectivo y mayoritario por sobre el interés individual o particular.
13228,3,de_satisfacer_cargas_públicas,A,Aportar lo necesario para el establecimiento de un sistema justo
13251,3,de_satisfacer_cargas_públicas,A,CARGAS PÚBLICAS OMPOSITIVAS QUE DEVEN SER MÁS EQUITATIVAS.
13324,3,de_satisfacer_cargas_públicas,A,.
13345,3,de_satisfacer_cargas_públicas,A,"Todos deben costear justamente el gasto social del Estado a través de tributos y otras cargas que se establezcan, existen derechos pero también responsabilidades sociales tributarias que cumplir."
13349,3,de_satisfacer_cargas_públicas,P,"Informar sobe el cuidado de la naturaleza, promoviendo su conservación y cuidado para el entorno."
13428,3,de_satisfacer_cargas_públicas,A,Se satisfarán a través de un sistema tributario redistributivo en el que las personas naturales y jurídicas contribuyan por separado y de la misma manera para el logro de la equidad.
13479,3,de_satisfacer_cargas_públicas,A,"Todos concordaron en la necesidad de establecer cargas públicas, como el pago de impuestos o el servicio militar, en éste último caso con objeción de consciencia."
13566,3,de_satisfacer_cargas_públicas,A,Responsabilidad y reconocimiento de pertenencia a una comunidad.
13583,3,de_satisfacer_cargas_públicas,P,El grupo asume como un deber el hacerse responsable por las cargas públicas asociando este concepto a la responsabilidad parental. De esta manera el grupo logra identificar derechos y deberes asociados al poder suplir necesidades básicas en torno al cuidado de los niños y niñas.
13656,3,de_satisfacer_cargas_públicas,A,"Equidad en entrega de recursos monetarios para los municipios. El presupuesto fiscal es ordinariamente desigual, lo que no se debe permitir."
13692,3,de_satisfacer_cargas_públicas,A,Exigir que los funcionarios publicos ejecuten sus labores.
13712,3,de_satisfacer_cargas_públicas,A,"Mediante la carga pública se compensan las desigualdades de oportunidades para los habitantes del país, en consecuencia se deben tomar medidas para sancionar la evasión debido al gran número de personas que son afectadas con ello."
13758,3,de_satisfacer_cargas_públicas,A,OBLIGACION A SER CARGA PUBLICA CUANDO SE SOLICITE
13759,3,de_satisfacer_cargas_públicas,A,"El pago de impuestos será proporcional a los ingresos y utilidades, debiendo tributarse territorialmente según sus operaciones e impacto medioambiental que éstas provoquen (empresas)"
13796,3,de_satisfacer_cargas_públicas,A,El Estado de distribuir y garantizar  con impuestos progresivos a  las personas.
13832,3,de_satisfacer_cargas_públicas,A,cargos públicos desempeñados con responsabilidad y probidad.
13846,3,de_satisfacer_cargas_públicas,A,Se debe cumplir con los deberes y derechos del ciudadano tanto como en expresar su voluntad a través del voto y trabajar para el estado cuando se estime conveniente.
13861,3,de_satisfacer_cargas_públicas,A,5. Considerar el no daño a los derechos de los seres humanos.
13874,3,de_satisfacer_cargas_públicas,A,"Apoyar la mantención y protección de los derechos ciudadanos a través de una correcta y equitativa legislación de las cargas públicas, a fin de resguardar y preservar los recursos naturales, patrimoniales, económicos y sociales."
13924,3,de_satisfacer_cargas_públicas,A,- Distribución igualitaria de costos y beneficios de políticas públicas
13942,3,de_satisfacer_cargas_públicas,A,Personas en privilegio tienen el deber de aportar. Responsabilidad de poner lo que tengo para ayudar al otro.
13950,3,de_satisfacer_cargas_públicas,A,Los que tienen más pagan más impuestos.
13965,3,de_satisfacer_cargas_públicas,A,.
13986,3,de_satisfacer_cargas_públicas,P,"contraprestación de la igualdad, se entiende como deber de los ciudadanos de responder frente al Estado"
14001,3,de_satisfacer_cargas_públicas,A,Todos debemos ser responsables con los impuestos.
14014,3,de_satisfacer_cargas_públicas,A,"Cumplimiento de los deberes fiscales, y el deber de participar en los procesos electorales (no voto obligatorio)."
14087,3,de_satisfacer_cargas_públicas,A,Compromiso ciudadano con el cumplimiento de las cargas públicas.
14096,3,de_satisfacer_cargas_públicas,P,por meritocracia
14116,3,de_satisfacer_cargas_públicas,A,Deber y responsabilidad de cumplir con los requerimientos que la vida democrática tiene para cada ciudadano.
14195,3,de_satisfacer_cargas_públicas,A,"Que se involucren en organismos comunitarios, para colaborar en la satisfacción o solución de cargas públicas."
14271,3,de_satisfacer_cargas_públicas,A,Comprendido esto como el deber de generar los recursos necesarios para las necesidades de los ciudadanos y el derecho de éstos a decidir su administración y gasto.
14276,3,de_satisfacer_cargas_públicas,A,reducir la tala exagerada en los bosques chilenos.
14308,3,de_satisfacer_cargas_públicas,A,"La implementación de derechos sociales tiene un costo, el cual debe ser distribuido entre todos, considerando criterios de progresión."
14344,3,de_satisfacer_cargas_públicas,A,DEMOCRACIA CON DERECHO Y OBLIGACIONES
14384,3,de_satisfacer_cargas_públicas,A,"si se quieren derechos, debemos tener deberes para solventar los primeros"
14387,3,de_satisfacer_cargas_públicas,A,"Pensamos que los ciudadanos deben estar obligados a ciertas cargas públicas, como lo es el votar."
14400,3,de_satisfacer_cargas_públicas,A,Igualdad ante la ley en los deberes.
14426,3,de_satisfacer_cargas_públicas,A,Pago de impuestos y otras cargas.
14466,3,de_satisfacer_cargas_públicas,A,Es tarea de todos conocer y determinar la forma en que se satisfacen estas cargas. Debe ser publicado y democrático
14570,3,de_satisfacer_cargas_públicas,A,"La satisfacción de cumplir las tareas propias del estado,la paz interna y de la libertad humana,es imposible sin algún grado de contribución por parte de los individuos."
14572,3,de_satisfacer_cargas_públicas,A,"Todos los ciudadanos, sin distinción deben cumplir con las cargas públicas impuestas por el Estado. Se hace necesario que las cargas públicas sean proporcionales, actualmente, por ejemplo, existen tributos que se aplican por igual a todas las personas independiente de su situación socioeconómica"
14636,3,de_satisfacer_cargas_públicas,A,Apoyo fundamental de la ciudadanía a la nación.
14653,3,de_satisfacer_cargas_públicas,A,"Creemos que el sujeto debe corresponder a la sociedad en la que está inserto. Ello debe ser con trabajo, que es la herramienta del hombre para satisfacer las necesidades materiales y sociales. Por ello debe ser deber ciudadano el satisfacer las cargas públicas con tal de cumplir esta máxima."
14780,3,de_satisfacer_cargas_públicas,P,"Cargas públicas, entendidas como toda obligación que impone el Estado: impuestos, obligaciones de paso, entrenamiento militar o servicio comunitario, el deber a votar."
14808,3,de_satisfacer_cargas_públicas,A,Voto obligatorio. Pagar impuestos. // Reponer 2% constitucional. 2 votos en contra.
14820,3,de_satisfacer_cargas_públicas,A,"Esto debe estar reflejado en los ingresos y no en las utilidades. Debe ser proporcional al ingreso de los ciudadanos, las cargas deberían ser diferenciadas."
14867,3,de_satisfacer_cargas_públicas,A,Cumplir con el trabajo para lo cual fueron contratados los funcionarios publicos.
14886,3,de_satisfacer_cargas_públicas,A,Acuerdo.
14925,3,de_satisfacer_cargas_públicas,A,que nos representen adecuadamente  Mal uso de las platas fiscales Muy alto suelto a políticos
14929,3,de_satisfacer_cargas_públicas,D,sin comentarios
14975,3,de_satisfacer_cargas_públicas,A,"es ser consistentes con el bien público, con el concepto de Nación."
14984,3,de_satisfacer_cargas_públicas,A,Cada ciudadano o persona jurídica debe aportar en forma proporcional y equitativa al desarrollo nacional.
14986,3,de_satisfacer_cargas_públicas,A,Se debe priorizar el bien común por parte de los funcionarios públicos
15003,3,de_satisfacer_cargas_públicas,A,"creemos que todos tenemos el deber de satisfacer las cargas públicas, teniendo presente nuestras posibilidades económicas, donde el que gane mas, aporta mas."
15056,3,de_satisfacer_cargas_públicas,A,x
15059,3,de_satisfacer_cargas_públicas,P,Cumplir los deberes que el Estado impone a cada ciudadano o persona.
15116,3,de_satisfacer_cargas_públicas,A,"entendemos que el estado debe hacerse cargo de las cargas públicas, la gestión administrativa de las personas ya que los ciudadanos aportan al estado a través de los impuestos."
15149,3,de_satisfacer_cargas_públicas,A,"Entendiéndose de quien puede ocupar estos cargos, se espera sean personas idóneas, proba y no por compromisos políticos."
15196,3,de_satisfacer_cargas_públicas,A,"satisfacer a las necesidades de los servicios públicos (salud, educación)"
15202,3,de_satisfacer_cargas_públicas,A,Se debe asumir que estas son indispensables para que cada miembro de la comunidad contribuya de acuerdo a su capacidad en los objetivos que se plantea la sociedad.
15207,3,de_satisfacer_cargas_públicas,A,"Pago equitativo de cargas públicas: de acuerdo a lo que cada uno puede, seg´n lo que establezca la ley, pagar impuestos y tributos para una mejor distribución de los recursos."
15239,3,de_satisfacer_cargas_públicas,A,"En caso de no cumplir con los deberes y responsabilidades, debe ser destituido."
15246,3,de_satisfacer_cargas_públicas,A,Sentirse responsable de nuestra institución pública.
15319,3,de_satisfacer_cargas_públicas,A,Es necesario que los cargos públicos sean usados transparentemente y que se las personas que los ejercen se limiten a cumplirlas funciones que se delimitan en las funciones.
15362,3,de_satisfacer_cargas_públicas,A,El tener derecho y beneficios implica asumir la responsabilidad de cumplir con los deberes que nos corresponden.
15374,3,de_satisfacer_cargas_públicas,A,"Hay que contribuir al desarrollo de la democracia y para eso, se debe participar activamente."
15396,3,de_satisfacer_cargas_públicas,A,RESPONSABILIDADES COMO CIUDADANOS EN NUESTRA SOCIEDAD.
15416,3,de_satisfacer_cargas_públicas,A,Entendemos que son  mecanismos a través de los cuales los Estados pueden establecer contribuciones o aportes que gravan a las personas o a los patrimonios privados en beneficio colectivo las cargas publicas deben ser proporcionales  Economía mixta
15427,3,de_satisfacer_cargas_públicas,A,Todos debemos contribuir en proporción a nuestras capacidades a las necesidades del Estado
15433,3,de_satisfacer_cargas_públicas,A,"Promover deberes de ciudadania hacia el estado porque vivir en comunidad da muchos beneficios y trae deberes y derechos, es obligación pagar tríbutos. Obligación del estado retribuir. Obligaciones compartidas e informadas por la sociedad. Justo para los ciudadanos. Proporcional a  ingresos de c/u."
15478,3,de_satisfacer_cargas_públicas,A,"El ciudadano, al ser parte de la comunidad, debe sostener las instituciones y el funcionamiento que la misma comunidad se ha dado."
15484,3,de_satisfacer_cargas_públicas,A,"deber de votar, deber de acceso de protección"
15494,3,de_satisfacer_cargas_públicas,D,.
15568,3,de_satisfacer_cargas_públicas,A,"Pagar los tributos Tributos progresivos Pena efectiva ante delitos Evitar fraude a la ley, incluida la evasión Distribución ética Responsabilidad en la generación de externalidades negativas"
15575,3,de_satisfacer_cargas_públicas,A,"Servicio a la comunidad, frente a desastres o necesidades colectivas, los ciudadanos deben aportar sus conocimientos y trabajo al bien común"
15601,3,de_satisfacer_cargas_públicas,A,Contraparte natural del listado de derechos.
15608,3,de_satisfacer_cargas_públicas,A,"Esta ligado con el servicio a la comunidad, vocales de mesa por ejemplo. y desempenar"
15635,3,de_satisfacer_cargas_públicas,A,revisar las garantías de los ciudadanos a las cargas publicas y sujetos a evaluación
15643,3,de_satisfacer_cargas_públicas,A,"Cargas legales en general, pagar impuestos, evitar y sancionar la evasión y/o elusión."
15676,3,de_satisfacer_cargas_públicas,A,"Es un deber de los ciudadanos satisfacer las cargas públicas, en beneficio de la sociedad en su conjunto. Esto debe ir a la par de los derechos que los ciudadanos reciben de la sociedad."
15683,3,de_satisfacer_cargas_públicas,A,igualdad ante las necesidades del estado
15736,3,de_satisfacer_cargas_públicas,A,"Para obtener igualdad y conseguir el bien común, es necesario que todos contribuyan al bien común."
15742,3,de_satisfacer_cargas_públicas,A,"Más fiscalización, transparencia. Exigencia y regularización de los contratos, asegurar la continuidad y bien común."
15777,3,de_satisfacer_cargas_públicas,A,"Derechos ciudadanos. Impuesto, vocal de mesa, etc"
15780,3,de_satisfacer_cargas_públicas,A,El estado tiene la obligación de satisfacerlas
15820,3,de_satisfacer_cargas_públicas,A,Es deber del Estado garantizar los derechos de las personas más vulnerables.
