idEla,tema,concepto,acuerdo,fundamento
11390,4,defensor_del_pueblo_ciudadano,A,Es necesario que exista una institución que defienda a los ciudadanos de abusos de instituciones o personas publcias y/o privadas
11398,4,defensor_del_pueblo_ciudadano,A,"Entendiendo una instancia que permita supervisar que empresas privadas e instituciones publicas , logre defender a ciudadanos de posibles abusos o utilicen el limite de la ley en perjuicio del pueblo."
11399,4,defensor_del_pueblo_ciudadano,A,Importante cuando a veces los polírticos están alejados o la sociedad cree que no los representan ni velan por sus intereses
11405,4,defensor_del_pueblo_ciudadano,A,Los ciudadanos debemos tener un órgano que nos defienda en forma gratuita.
11406,4,defensor_del_pueblo_ciudadano,A,Es un servicio necesario para las personas con bajos recursos económicos.
11413,4,defensor_del_pueblo_ciudadano,A,"Independiente, debe resguardar los derechos ciudadanos"
11422,4,defensor_del_pueblo_ciudadano,A,"Para que exista mayor justicia, para todos y no solo a las personas con dinero y poder."
11427,4,defensor_del_pueblo_ciudadano,A,"Una entidad que permita dar credibilidad a las Instituciones, que establezca claros límites y no permita los excesos de las personas que ostentan cargos importantes."
11429,4,defensor_del_pueblo_ciudadano,P,Es fundamental para la nueva constitución y el desarrollo del país.
11431,4,defensor_del_pueblo_ciudadano,A,Para que defienda los problemas menores del pueblo.
11432,4,defensor_del_pueblo_ciudadano,A,"Instancia jurídica obligatorias que garantice la más ecuánime aplicación de la ley, resguardando a ciudadanos que no cuenten con recursos evitando interferencia perniciosa e inequidad al momento de juzgar."
11439,4,defensor_del_pueblo_ciudadano,A,"el pueblo es más vulnerable, esta institución permitirá crear instancias de protección ciudadana y acceder a la justicia ."
11441,4,defensor_del_pueblo_ciudadano,A,Importante la existencia de éste para resguardar nuestros derechos
11444,4,defensor_del_pueblo_ciudadano,P,Para que se asegure de que las cosas o los recursos realmente se utilizan bien y para todos
11466,4,defensor_del_pueblo_ciudadano,A,"UN PUEBLO DEBE SER REPRESENTADO POR UN AGENTE NEUTRO, QUE LOS REPRESENTE ANTE  LOS CONSEJOS, LA VOZ REAL DEL PUEBLO. PARA QUE ASÍ SE CUMPLAN DERECHO."
11470,4,defensor_del_pueblo_ciudadano,A,en documento adjunto
11473,4,defensor_del_pueblo_ciudadano,A,"en caso de que se requiera, plebiscito revocatorio. Consultas ciudadanas."
11477,4,defensor_del_pueblo_ciudadano,A,Defensor del Pueblo: Organismo que vele por el respeto de los derechos del ciudadano común.
11480,4,defensor_del_pueblo_ciudadano,A,Órgano autónomo dotado de las herramientas legales y facultades que le permita promover los derechos humanos y presentar acciones judiciales en nombre de las personas o colectivos que han visto sus derechos vulnerados
11482,4,defensor_del_pueblo_ciudadano,A,Para representar la defensa de quienes no tenemos poder frente a la vulneración de nuestros derechos
11483,4,defensor_del_pueblo_ciudadano,A,Mecanismo eficaz y formal de protección de derechos ciudadanos y autónomo.
11495,4,defensor_del_pueblo_ciudadano,A,que se empoderen las entidades fiscalizadoras
11501,4,defensor_del_pueblo_ciudadano,A,"Debemos contar con una autoridad estatal para proteger y defender los derechos fundamentales de las personas frente al Estado, a fin de lograr un control constitucional."
11503,4,defensor_del_pueblo_ciudadano,A,Para garantizar equidad y eliminar los abusos e injusticias a la gente.
11506,4,defensor_del_pueblo_ciudadano,A,Para defender a quienes lo necesiten
11511,4,defensor_del_pueblo_ciudadano,A,El pueblo necesita un representante que defienda los intereses de los ciudadanos ante decisiones injustas del estado
11513,4,defensor_del_pueblo_ciudadano,A,"Necesitamos de una institución autónoma al servicios de la comunidad que defienda a los ciudadanos ante abusos del poder público, el atropello de sus derechos constitucionales y garantice la igual ante la ley."
11519,4,defensor_del_pueblo_ciudadano,A,Por elección libre y curriculum de trabajo con las bases de la ciudadania
11525,4,defensor_del_pueblo_ciudadano,A,Órgano autónomo encargado de velar por los derechos de las personas
11526,4,defensor_del_pueblo_ciudadano,P,Como representante de las demandas de las comunidades frente al atentado de los derechos fundamentales.
11528,4,defensor_del_pueblo_ciudadano,P,"institución conformada por ciudadanos elegidos de entre los electores desde los 16 años de edad , los cuales sean parte de la defensa de los derechos de                                                  todos frente a la justicia."
11532,4,defensor_del_pueblo_ciudadano,A,"Debe existir una figura que permita representar a los ciudadanos frente a la justicia cuando se sientan perjudicados por terceros, a costo del Estado."
11541,4,defensor_del_pueblo_ciudadano,A,"Es una autoridad que representa más directamente al pueblo, velando que no haya una violación de los derechos."
11543,4,defensor_del_pueblo_ciudadano,A,Porque creemos que debe existir una institución que defienda los derechos de las personas ante posibles abusos del Estado.
11548,4,defensor_del_pueblo_ciudadano,A,"Consideramos que como existe hoy una crisis de representación de la política en general, una buena acción sería fortalecer las defensorías del pueblo con el fin de canalizar las inquietudes de los ciudadanos y otorgar apoyo y orientación frente a distintas problemáticas."
11549,4,defensor_del_pueblo_ciudadano,A,Se hace necesario tener una Autoridad del estado que se encargue de garantizar los derechos del pueblo ante los abusos que pueda ejercer el poder político.
11550,4,defensor_del_pueblo_ciudadano,A,que se ejerza realmente a favor de los ciudadanos de los mas desposeídos.
11551,4,defensor_del_pueblo_ciudadano,A,Tener un ente defensor o fiscalizador en necesario para la politicas
11555,4,defensor_del_pueblo_ciudadano,A,Se considera que esta autoridad está relacionada con la profundización de lo democrático en la sociedad puesto que permite una participación real de las personas en la protección de sus propios derechos.
11556,4,defensor_del_pueblo_ciudadano,P,"Para defender nuestros derechos, con las autoridades."
11562,4,defensor_del_pueblo_ciudadano,A,"Unánime, por los derechos de los ciudadanos, también se necesita un representante."
11568,4,defensor_del_pueblo_ciudadano,A,Defensa frente a abusos de organismos públicos
11572,4,defensor_del_pueblo_ciudadano,A,Institución necesaria que sea garante de la justicia y que considere a los 3 poderes del Estado ser sometidos a juicio por el pueblo.
11577,4,defensor_del_pueblo_ciudadano,P,"No todos estimaron la necesidad de incorporarlo en la Constitución, pero por mayoría simple se estimó importante contar con un órgano que defienda y represente a los/as ciudadanas/os"
11582,4,defensor_del_pueblo_ciudadano,A,la ciudadanía debe tener una institución a quien recurrir ante la el abandono de deberes de alguna autoridad que actué con abuso o indolencia
11587,4,defensor_del_pueblo_ciudadano,A,"Que permita velar por el cumplimiento de los derechos constitucionales y legales, protegiendo a los ciudadanos ante las instituciones publicas/privadas."
11589,4,defensor_del_pueblo_ciudadano,A,Debe velar por los intereses del pueblo y resguardar nuestros derechos frente a la acción del Estado y los particulares.
11596,4,defensor_del_pueblo_ciudadano,A,"SE PROPONE UN ÓRGANO INDEPENDIENTE QUE PROTEJA Y DEFIENDA LOS DERECHOS FUNDAMENTALES DE LOS CIUDADANOS FRENTE A LOS PODERES ECONÓMICOS, POLÍTICOS E INSTITUCIONALES QUE LE AFECTA"
11598,4,defensor_del_pueblo_ciudadano,P,"Porque es necesario tener a quien represente al pueblo chileno, aunque se considera una solución parche."
11603,4,defensor_del_pueblo_ciudadano,A,Tener un representante oficial de los intereses del Pueblo con influencia en las discusiones políticas.
11606,4,defensor_del_pueblo_ciudadano,A,"defensoría del pueblo como servicio autónomo, solo el estado debe prever las condiciones económicas de la institución."
11615,4,defensor_del_pueblo_ciudadano,A,Debe haber alguien que nos defienda en forma imparcial del abuso.
11622,4,defensor_del_pueblo_ciudadano,A,"Novedoso en Chile. Sería una forma mas de atenuar el poder del Estado en beneficio de los ciudadanos, que en contra partida, los empodera. Sería un nexo entre ciudadanos y autoridades."
11626,4,defensor_del_pueblo_ciudadano,A,"Institución fundamental del Estado, considerando su autonomía respecto a cualquier gobierno, debe velar y resguardar que los derechos de las personas se vean garantizados."
11628,4,defensor_del_pueblo_ciudadano,A,Instancia asegurada constitucionalmente de defensoría de las personas (ombusdman)
11632,4,defensor_del_pueblo_ciudadano,A,"Velar por derechos colectivos, eficiente y con facultades, autónomo del gobierno, resolutivo, con autoridad, recursos y poder.  Ente exclusivamente técnico, no puede estar por sobre la ley.  Acuerdo parcial, electo por voto popular y poder sancionador."
11634,4,defensor_del_pueblo_ciudadano,A,Debiera ser autoridad independiente de carácter técnico que vele por el cumplimiento de las leyes vigentes. Debe investigar y dar respuesta a los ciudadanos. Acceso a la Información
11638,4,defensor_del_pueblo_ciudadano,A,"Activo, con presupuesto adecuado, con atribuciones para incidir y que sea reconocido por cada territorio al cual representa."
11647,4,defensor_del_pueblo_ciudadano,A,Porque es la instancia para acoger y dar respuesta a la ciudadanía frente al estado y los actores públicos y privados
11649,4,defensor_del_pueblo_ciudadano,A,una figura independiente de los poderes del estado que se constituya ante situaciones de contingencia
11650,4,defensor_del_pueblo_ciudadano,A,Garantizado y operacionalizado (el cómo) por parte de la nueva constitución.
11652,4,defensor_del_pueblo_ciudadano,A,Como entidad que defiende los derechos del colectivo
11655,4,defensor_del_pueblo_ciudadano,A,Garantiza la defensa de los derechos de los ciudadanos.
11659,4,defensor_del_pueblo_ciudadano,A,Una entidad que proteja a los grupos más vulnerables.
11662,4,defensor_del_pueblo_ciudadano,D,"Para el grupo es necesario una instancia así, mas no sabemos como representarlo."
11664,4,defensor_del_pueblo_ciudadano,P,fiscaliza que se controlen las decisiones. garantiza el cumplimiento de los acuerdos
11666,4,defensor_del_pueblo_ciudadano,A,institución que pueda defender a los ciudadanos.
11669,4,defensor_del_pueblo_ciudadano,A,Es importante velar por las personas mas vulnerables. Tener un mediador entre el pueblo y la autoridad.
11684,4,defensor_del_pueblo_ciudadano,A,Institución necesaria en la actualidad como representante de la ciudadanía y que debiese tener rango constitucional.
11687,4,defensor_del_pueblo_ciudadano,A,Que tenga autoridad y reconocimiento al más alto nivel.
11695,4,defensor_del_pueblo_ciudadano,P,"Debe existir un organismo autónomo, de raigamble constitucional, dotado de las herramientas legales y los recursos necesarios para proteger los intereses del ciudadano frente al Estado."
11702,4,defensor_del_pueblo_ciudadano,A,LOS CIUDADANOS TIENEN DERECHO A QUE UN DEFENSOR DE ALTO NIVEL PROTEJA SUS DERECHOS Y EVITE SU COHERSIÓN
11712,4,defensor_del_pueblo_ciudadano,A,Para generar un organismo que apoye las denuncias de los ciudadanos
11714,4,defensor_del_pueblo_ciudadano,P,"que se elija de manera democrática en el sistema judicial, es relevante en la medida que los ciudadanos y ciudadanas veamos vulnerados nuestros derechos, podamos contar con una figura del estado, ya que el Sernac solo nos defiende como consumidores, es importante contar con un defensor de nuestros derechos, ejercer los derechos. El defensor debería estar vinculado con las asambleas populares."
11721,4,defensor_del_pueblo_ciudadano,A,Debe existir un defensor ciudadano que garantice y proteja los derechos de los y las ciudadanos y ciudadanas
11722,4,defensor_del_pueblo_ciudadano,A,Hoy existe una sensación de desprotección muy grande
11723,4,defensor_del_pueblo_ciudadano,A,Asegurar y construir una institucionalidad que vele por los derechos individuales y colectivos e intereses de todas y todos los ciudadanos.
11730,4,defensor_del_pueblo_ciudadano,A,Esta institución es esencial para garantizar y defender los derechos de la ciudadania
11737,4,defensor_del_pueblo_ciudadano,A,"Debe ser una institución de carácter ciudadano, situada en la esfera de la sociedad civil"
11738,4,defensor_del_pueblo_ciudadano,A,creemos que es una figura a reforzar pues otorga garantías a la ciudadanía
11750,4,defensor_del_pueblo_ciudadano,A,- CON REALES ATRIBUCIONES.
11753,4,defensor_del_pueblo_ciudadano,A,Por ser el nexo entre las problemáticas del pueblo y las autoridades.
11759,4,defensor_del_pueblo_ciudadano,A,Figuras que permiten que los ciudadanos tengan un amparo efectivo frente a eventuales abusos del estado o sus funcionarios así como de organos privados.
11760,4,defensor_del_pueblo_ciudadano,A,Figura que debe estar en nuestro país. frente a posibles abusos del estado.
11762,4,defensor_del_pueblo_ciudadano,A,una instancia donde el pueblo pueda exponer sus problemáticas
11770,4,defensor_del_pueblo_ciudadano,A,El defensor del pueblo debe ser  incorporado como una Institución fundamental en el nuevo orden democrático facultandosele para ser el titular de la defensa de los derechos ciudadanos. Debe ser elegido democráticamente.
11773,4,defensor_del_pueblo_ciudadano,A,"Debe existir un ente autónomo del poder legislativo, judicial y ejecutivo que pueda actuar en casos de abusos de instituciones públicas o provadas."
11779,4,defensor_del_pueblo_ciudadano,P,"Se creará esta figura que reemplazará al Tribunal Constitucional y como requisitos deberá tener conocimientos en Derechos Humanos, ser atingente y transparente. Discrepancias: Métodos de elección (corte suprema/votación popular/parlamento) y tiempo de duración (4,5,6 años)."
11781,4,defensor_del_pueblo_ciudadano,A,necesitamos un defensor que nos defienda de los políticos corruptos.
11782,4,defensor_del_pueblo_ciudadano,A,.
11787,4,defensor_del_pueblo_ciudadano,A,Que proteja los intereses de la gente vulnerable.
11791,4,defensor_del_pueblo_ciudadano,A,NECESARIA PARA DEFENDERNOS CUANDO SOMOS ATROPELLADOS
11807,4,defensor_del_pueblo_ciudadano,A,"Al igual que un tribuno romano, un fiel representante de las legítimas demandas de los ciudadanos."
11810,4,defensor_del_pueblo_ciudadano,A,"Que sea una figura autónoma, independiente del poder político, constituido por miembros intachables y que procuren la difusión y defensa de los derechos de la ciudadanía, con un poder de acción real."
11813,4,defensor_del_pueblo_ciudadano,A,"Debe existir una organización, ya que así el pueblo tiene su defensa y respaldo."
11814,4,defensor_del_pueblo_ciudadano,A,Para hacer efectivos los derechos.
11815,4,defensor_del_pueblo_ciudadano,A,"La necesidad de contar con un organismo que fiscalice , proteja , oriente y desarrolle un trabajo de promoción a los derechos ciudadanos es imprescindible , especialmente para quienes no tienen recursos ni medios para demandar el respeto a sus derechos."
11825,4,defensor_del_pueblo_ciudadano,A,Contrapeso a la autoridad en ciertas instancias
11831,4,defensor_del_pueblo_ciudadano,A,Crear el rol para resguardar derechos ciudadanos.
11841,4,defensor_del_pueblo_ciudadano,A,"Que se instale el defensor del pueblo para fomentar el bienestar ciudadano, los derechos y libertades tanto individuales como colectivas. Que exista un defensor rural que se ocupe de representar y sensibilizar las necesidades del campo"
11845,4,defensor_del_pueblo_ciudadano,A,Institución que nos permita tener la posibilidad de acceder a un equidad en la aplicación de la justicia
11862,4,defensor_del_pueblo_ciudadano,A,Órgano independiente que fiscalice al Estado y proteja a la ciudadanía
11871,4,defensor_del_pueblo_ciudadano,A,"Un mediador validado por la ciudadanía, el cuál pueda tener injerencia en la toma de decisiones a nivel estructural."
11873,4,defensor_del_pueblo_ciudadano,A,Velar por los derechos ciudadanos
11874,4,defensor_del_pueblo_ciudadano,A,elegido por votación popular fiscalizando los derechos ciudadanos
11876,4,defensor_del_pueblo_ciudadano,A,Que el grupo ya definido acuda al lugar de los hechos
11880,4,defensor_del_pueblo_ciudadano,A,"Queremos que se instaure esta figura en chile, en la que un líder vela por los derechos de los ciudadanos. Este debería ser elegido mediante elección popular cada 5 años."
11887,4,defensor_del_pueblo_ciudadano,A,"Que asegure que se cumplan realmente los derechos para todos y que las decisiones nacionales no sean limitadas a un grupo exclusivo, como es el Tribunal Constitucional, que puede modificar la voluntad de la ciudadanía expresada en el apoyo electoral que se ha dado a proyectos como reforma laboral."
11891,4,defensor_del_pueblo_ciudadano,A,INCLUIRLA ES UN AVANCE A FAVOR DE GARANTIZAR CON INDEPENDENCIA LOS DERECHOS INDIVIDUALES Y COLECTIVOS.
11892,4,defensor_del_pueblo_ciudadano,A,DEBIESE EXISTIR UNA INSTITUCIÓN QUE DEFIENDA AL PUEBLO Y SUS DERECHOS
11896,4,defensor_del_pueblo_ciudadano,A,Se necesita que una entidad o ministerio que defienda a la gente.
11902,4,defensor_del_pueblo_ciudadano,A,Dadas las condiciones históricas gana fuerza la necesidad de que exista una estricta supervisión de la ética de la clase política chilena.
11906,4,defensor_del_pueblo_ciudadano,A,ORGANISMO DEL ESTADO QUE DEFIENDA A LOS CIUDADANOS DE ABUSOS DEL SISTEMA POLITICO
11909,4,defensor_del_pueblo_ciudadano,A,"representante de las necesidades de la comunidad, con una mirada desde la propia realidad"
11917,4,defensor_del_pueblo_ciudadano,A,"Elegido democráticamente para defender, en materia ambiental, de injusticias cometidas por empresas, ya sean privadas o no."
11918,4,defensor_del_pueblo_ciudadano,A,Debe ser contemplado en terminos de implementar esta institución para defender los derechos y libertades fundamentales de las personas frente al poder del estado y ante cualquier vulneración.
11919,4,defensor_del_pueblo_ciudadano,A,ES IMPORTANTE TENER UN REPRESENTANTE A NIVEL JURÍDICO U OTRO FRENTE AL ESTADO U OTRO PODER.
11921,4,defensor_del_pueblo_ciudadano,A,Para Garantizar que no se vulneren los derechos de las personas.
11924,4,defensor_del_pueblo_ciudadano,A,Permite defender a las personas frente a las injusticias que provoca el Estado.
11926,4,defensor_del_pueblo_ciudadano,A,crear institución para resguardar a la ciudadanía.
11928,4,defensor_del_pueblo_ciudadano,A,"Entidad que debe ser conocida, pública y de acceso sin dificultad en los casos determinados."
11929,4,defensor_del_pueblo_ciudadano,A,Consideramos necesario crear una figura legal y servicio de acceso universal dedicado a la protección de los derechos de las personas frente a cualquier infracción o negligencia por parte del Estado.
11932,4,defensor_del_pueblo_ciudadano,A,Absolutamente necesario para la defensa de los desprotegidos ( una especie de SERNAC ciudadano).
11935,4,defensor_del_pueblo_ciudadano,A,"AUTORIDAD ENCARGADA DE GARANTIZAR LLOS DERECHOS DE LOS CIUDADANOS, ANTE ABUSOS DE LOS PODERES POLÍTICOS O LEGISLATIVO DEL ESTADO"
11946,4,defensor_del_pueblo_ciudadano,A,Que se exista la figura de defensor público y que este tenga las atribuciones y poder suficiente para defender al ciudadano común.
11947,4,defensor_del_pueblo_ciudadano,A,"se llego a acuerdo al recibir 19 de 19 votos por parte de los asistentes al encuentro, unanime"
11948,4,defensor_del_pueblo_ciudadano,A,El ciudadano común debiera ser representado por una institución que alegue sus derechos “ya que el estado no los asegura”.
11973,4,defensor_del_pueblo_ciudadano,A,Que haya una constitución que defienda los derechos de los ciudadanos cuando sean vulnerados.
11975,4,defensor_del_pueblo_ciudadano,A,necesitamos a alguien que vele por los derechos de los miembros de la sociedad.
11980,4,defensor_del_pueblo_ciudadano,A,Consagra la tutela de los derechos de los ciudadanos frente al Estado y empresas de servicios públicos.
11982,4,defensor_del_pueblo_ciudadano,A,búsqueda del líder que sea defensor de los derechos humanos
11990,4,defensor_del_pueblo_ciudadano,A,Que el defensor del Pueblo defienda los derechos del ciudadano en las distintas esferas del poder.
11995,4,defensor_del_pueblo_ciudadano,A,"Debe crearse esta institución para que vele por los derechos de las personas de manera institucional, como parte del sistema de equilibrio de poderes."
11997,4,defensor_del_pueblo_ciudadano,A,Ministerio competente para observar causas que actualmente quitan tiempo en el tradicional sistema judicial existente
12002,4,defensor_del_pueblo_ciudadano,A,La Constitución debe proteger los derechos de los ciudadanos
12003,4,defensor_del_pueblo_ciudadano,A,UNANIMIDAD. 14 ACUERDOS.
12007,4,defensor_del_pueblo_ciudadano,A,Apoyo para la protección de derechos ciudadanos.
12008,4,defensor_del_pueblo_ciudadano,A,encargado de defender los derechos humanos y fundamentales de las personas
12010,4,defensor_del_pueblo_ciudadano,P,Como agente neutro que transmita las necesidades e inquietudes locales hacia las entidades legislativas y administrativas de la nación.
12013,4,defensor_del_pueblo_ciudadano,A,Intitución que permita resguardar los derechos del pueblo.
12014,4,defensor_del_pueblo_ciudadano,A,Institución encargada de defender a los ciudadanos frente a las actuaciones del estado.
12017,4,defensor_del_pueblo_ciudadano,A,resguardar el derecho y tener derecho de cualquier ciudadano a ser defendido
12021,4,defensor_del_pueblo_ciudadano,A,"Que se consideren temas prácticos de la vida diaria, donde se vean vulnerados los derechos ciudadanos, por ejemplo pagos abusivos de bienes y servicios."
12024,4,defensor_del_pueblo_ciudadano,A,Asegurar una defensa profesional y calificada a toda persona que sea acusada de cometer delito.
12029,4,defensor_del_pueblo_ciudadano,A,"la justicia debería ser igual para todos, pues es un derecho."
12033,4,defensor_del_pueblo_ciudadano,A,persona que manifiesta su acuerdo o desacuerdo a traves de las huelgas y el voto
12035,4,defensor_del_pueblo_ciudadano,A,Estimamos conveniente en nuestra nueva constitución generar esta figura la cual se dedique a regularizar la creación de las leyes que afecten directamente al pueblo.
12040,4,defensor_del_pueblo_ciudadano,A,"Debe ser una institución autónoma e independiente, que se encargue de garantizar los derechos de los ciudadanos ante los abusos que puedan cometer los poderes políticos y administrativos y debe supervisar el pleno cumplimiento de los Derechos Humanos y Fundamentales."
12041,4,defensor_del_pueblo_ciudadano,A,"Una institución independiente de todos los poderes del Estado, elegido de manera popular. Ajeno a grupos de poder, a intervenciones, transparente, eficiente- moderno, idoneidad técnica, probidad."
12048,4,defensor_del_pueblo_ciudadano,A,"IGNORAMOS LA FUNCIONALIDAD D ESTA INSTITUCION, CREEMOS Q DEBIERA TENER LAS SGTES CARACTERISTICAS: - REPRESENTANTE ELEGIDO POR LA CIUDADANIA - INTERMEDIARIO DIRECTO ENTRE LA PRESIDENCIA Y LA PROVINCIA CON EL FIN DE RESOLVER O MEDIAR EN RELACION A LAS NECESIDADES DE LAS PERSONAS EN SITUACION D DISCAP"
12051,4,defensor_del_pueblo_ciudadano,A,Para que haya alguien que vele por nuestros derechos y su cumplimiento
12057,4,defensor_del_pueblo_ciudadano,A,"Como una manera de ecualizar la diferencia de poder entre el estado y la ciudadanía, es que se considera necesaria la existencia de esta institución independiente que se dedique exclusivamente a defender al ciudadano frente al estado."
12067,4,defensor_del_pueblo_ciudadano,A,DEBE SER UN CIUDADANO ELECTO POR TODOS LOS CIUDADANOS
12087,4,defensor_del_pueblo_ciudadano,A,"SIEMPRE DEBE HABER ALGUIEN QUE ABOGUE POR EL PUEBLO Y POR CADA UNO DE SUS CIUDADANOS,"
12094,4,defensor_del_pueblo_ciudadano,A,"Transparencia, equidad que garantice una defensa del ciudadano en general"
12100,4,defensor_del_pueblo_ciudadano,A,"Proponemos la figura de Defensor del pueblo que vele efectivamente  por la protección de los derechos y garantías públicas de las personas y grupos frente a actuaciones u omisiones abusivas, discriminatorias o negligentes, o la inacción, de las autoridades y servicios de la Administración del Estado, o de empresas que atienden necesidades públicas. Incluye el velar y propiciar el interés colectivo o bien común."
12103,4,defensor_del_pueblo_ciudadano,A,CREAR INSTITUCIONES QUE PROTEJAN A LOS CIUDADANOS. DEFENDER SUS DERECHOS FUNDAMENTALES FRENTE A LA ADMINISTRACIÓN.
12106,4,defensor_del_pueblo_ciudadano,A,Contar con un representante del pueblo.
12112,4,defensor_del_pueblo_ciudadano,A,.
12113,4,defensor_del_pueblo_ciudadano,A,"creación de unan corporación que vele por los derechos antes el estado, que sea independiente y autonoma"
12117,4,defensor_del_pueblo_ciudadano,A,Debería existir como institucionalidad para que garantice los derechos y deberes establecidos en la constitución y las leyes.
12118,4,defensor_del_pueblo_ciudadano,A,Consideramos que debe ser una autoridad de rango constitucional que represente y defienda a los ciudadanos frente al estado de manera independiente del gobierno en curso o anteriores.
12119,4,defensor_del_pueblo_ciudadano,A,Necesitamos a alguien que que defienda al pueblo para sacar adelante nuestras necesidades.
12120,4,defensor_del_pueblo_ciudadano,A,acercar la figura de un representante de los ciudadanos en el poder ejecutivo que tenga facultades y atribuciones que permita la defensa de las personas
12126,4,defensor_del_pueblo_ciudadano,A,Existe la necesidad de que tengamos una institución que nos respalde ante temas legales que conozca de la cultura y además la lengua.
