idEla,tema,concepto,acuerdo,fundamento
7965,4,defensor_del_pueblo_ciudadano,A,Porque debe haber una ayuda hacia las personas que no tienen quién las defienda.
7973,4,defensor_del_pueblo_ciudadano,A,acuerdo total
7980,4,defensor_del_pueblo_ciudadano,A,Hasta ahora las demandas ciudadanas solo las atiende el Sernac. Necesitamos una representación colectiva como el Consejo de Defensa del Estado
7987,4,defensor_del_pueblo_ciudadano,A,QUE DEFIENDA A LA GENTE DE LOS ABUSOS DE LA AUTORIDAD
7988,4,defensor_del_pueblo_ciudadano,A,Que como en otros países en Chile exista un defensor del pueblo.
7989,4,defensor_del_pueblo_ciudadano,A,"Se debe garantizar a la Ciudadanía la Institucionalidad del “Defensor del Pueblo”, como un órgano autónomo independiente del Estado y que proteja legítimamente los intereses de forma efectiva de cada ciudadano."
7990,4,defensor_del_pueblo_ciudadano,A,"Creemos que debe existir alguna institución que proteja a los ciudadanos adecuadamente frente al estado y sus instituciones, cuando son afectados por sus decisiones, o por la falta de servicio de la administración."
7991,4,defensor_del_pueblo_ciudadano,A,"Debe existir un ciudadano elegido democráticamente que busca garantizar y defender al pueblo de los abusos de poder, en términos tanto políticos, sociales o económicos."
7997,4,defensor_del_pueblo_ciudadano,A,Que exista una instacia donde gobierne o sea compuesta por personas de la misma ciudadanía que viven con o el común de las personas
7998,4,defensor_del_pueblo_ciudadano,A,"En análisis comparado con países de la región y tomando además como ejemplo el caso de España, se hace necesaria la figura de un órgano facultado para representar a los desamparados en casos de eventuales litigios frente al aparato estatal."
8000,4,defensor_del_pueblo_ciudadano,A,Electo democráticamente Empoderado y con herramientas
8002,4,defensor_del_pueblo_ciudadano,A,"ministerio de derechos ciudadanos, que vele por la integridad física, psicológica, social de la ciudadanía"
8005,4,defensor_del_pueblo_ciudadano,A,se hace necesario que el Estado garantice la defensa efectiva de los derechos fundamentales de sus ciudadanos.
8008,4,defensor_del_pueblo_ciudadano,A,Establecer el rol del ciudadano y defensor del pueblo como encargado de defender los derechos fundamentales y las libertades públicas de los ciudadanos mediante la supervisión de la actividad de las administraciones públicas.
8011,4,defensor_del_pueblo_ciudadano,A,En una sociedad donde los mas poderosos abusan del sistema  es fundamental la figura del defensor del pueblo que no dependa de nadie y por tanto no sea influenciable.
8017,4,defensor_del_pueblo_ciudadano,A,"Defender a los ciudadanos, en especial a los más pobres. No discriminar. Las personas deberíamos tener las mismas posibilidades, pero por ser de calle, ser pobres, no somos tomados en cuenta."
8018,4,defensor_del_pueblo_ciudadano,A,Exista una persona o institución que represente los intereses de esta frente a las instituciones.
8025,4,defensor_del_pueblo_ciudadano,A,el pueblo unido jamas sera vencido!!!.
8036,4,defensor_del_pueblo_ciudadano,A,"La gente común y corriente deben tener presencia en la aplicación de la justicia, además la gente común y corriente debe ser defendida en igualdad de condiciones que los poderosos"
8040,4,defensor_del_pueblo_ciudadano,A,Se prioriza en segundo lugar.
8042,4,defensor_del_pueblo_ciudadano,A,Que exista una entidad que ayude a dar la opinión a cada pueblo.
8043,4,defensor_del_pueblo_ciudadano,A,Proponemos la existencia de este.
8051,4,defensor_del_pueblo_ciudadano,A,Se debe crear para que una institución se haga cargo del respeto de los derechos de los ciudadanos.
8057,4,defensor_del_pueblo_ciudadano,A,Institución que no existe y que llena un vacío en cuanto al acceso a la justicia de las minorías.
8058,4,defensor_del_pueblo_ciudadano,P,-Debe ser autónoma.
8061,4,defensor_del_pueblo_ciudadano,A,"Que haya más igualdad frente a la justicia, sin distinciones entre clases sociales."
8062,4,defensor_del_pueblo_ciudadano,A,Velar y defender los intereses de la comunidad.
8080,4,defensor_del_pueblo_ciudadano,A,Que este sea acuerdo a la defensoría de un pueblo y no de un carácter político.
8084,4,defensor_del_pueblo_ciudadano,A,Institución que representara los intereses ciudadanos ante el Estado y privados
8085,4,defensor_del_pueblo_ciudadano,A,Institución autónoma destinada a representar y defender los derechos de las personas frente a las demás instituciones del Estado.
8089,4,defensor_del_pueblo_ciudadano,A,"Mientras más instancias independientes resguarden a los ciudadanos, se promueve mayor transparencia y acceso a la justicia."
8093,4,defensor_del_pueblo_ciudadano,A,Se expresa el deseo de contar con una entidad autonoma objetiva que supervigile el actuar del Estado en cuanto al cumplimiento de la Constitucion.
8098,4,defensor_del_pueblo_ciudadano,A,debe existir un defensor gratuito para todos porque tenemos derecho a defensoria legal y oportuna
8099,4,defensor_del_pueblo_ciudadano,A,COINCIDIMOS CON DEFINICIÓN DEL GLOSARIO. DEBERÍA CREARSE ESTA INSTANCIA
8101,4,defensor_del_pueblo_ciudadano,A,"que la defensa sea travez de un abogado, pa todos tenemos derecho a ser defendidos, no habrá justicia jamas sin el derecho a la defensa."
8114,4,defensor_del_pueblo_ciudadano,P,.
8118,4,defensor_del_pueblo_ciudadano,A,se debe crear la defensoria del pueblo para que todos nos sintamos protegidos a cualquier problema con la autoridad.
8125,4,defensor_del_pueblo_ciudadano,A,Debe ser elegido por elección popular universal
8128,4,defensor_del_pueblo_ciudadano,A,Se espera que Estado cree una institución que pretenda defender a los ciudadanos frente a abusos y otras vulneraciones de derechos que se comenten desde las instituciones públicas.
8139,4,defensor_del_pueblo_ciudadano,A,.
8142,4,defensor_del_pueblo_ciudadano,A,Que se cree la figura legal como una institución autónoma y surgida desde la misma ciudadanía para defender los intereses y derechos de los ciudadanos frente al poder que tienen los organismos del Estado e instituciones privadas de manera de asegurar la igualdad y protección de los menos poderosos.
8146,4,defensor_del_pueblo_ciudadano,A,Que exista una institución que defienda los derechos del pueblo y de la ciudadanía efectivamente y de forma igualitaria y que les proteja tanto del estado como de las otras personas.
8147,4,defensor_del_pueblo_ciudadano,A,"hacia el Estado y hacia privados, (respecto de) labor de fiscalización y defensa jurídica de los derechos de las personas."
8149,4,defensor_del_pueblo_ciudadano,A,Un representante que no esté vinculado a ningún poder y tenga la facultad de garantizar el cumplimiento de todos los derechos ciudadanos
8150,4,defensor_del_pueblo_ciudadano,A,"Debe existir un organismo que resguarde los derechos ciudadanos de forma real, que sea intermediario entre las personas y los poderes del estado, que se cumplan de verdad los derechos ciudadanos que existen en nuestra constitución."
8151,4,defensor_del_pueblo_ciudadano,A,Necesitamos de alguien que vele por nuestros derechos
8152,4,defensor_del_pueblo_ciudadano,A,sin fundamentos
8153,4,defensor_del_pueblo_ciudadano,A,"Debe existir una entidad que nazca en las regiones para llevar las inquietudes de la gente, sus necesidades, derechos etc."
8163,4,defensor_del_pueblo_ciudadano,A,Los dirigentes deben ser incentivados con bonos o beneficios.
8166,4,defensor_del_pueblo_ciudadano,A,Representa y defiende a las personas e instituciones cuyos derechos han sido atropellados.
8169,4,defensor_del_pueblo_ciudadano,A,Sin fundamentación
8173,4,defensor_del_pueblo_ciudadano,A,Es un contrapeso contra el abuso o la desidia de los funcionarios públicos.
8180,4,defensor_del_pueblo_ciudadano,A,ya que actualmente si una persona es conculcada en ciertos derechos queda en la total indefension
8189,4,defensor_del_pueblo_ciudadano,A,Institución fundamental para la existencia y garantías de los derechos ciudadanos.
8190,4,defensor_del_pueblo_ciudadano,A,"Es necesario que esta institución se desarrolle en Chile, ya que garantiza que todas las personas no estemos en indefensión frente al Estado. Debe ser autónomo, definir explícitamente sus atribuciones y garantizar los recursos humanos, materiales y económicos para su funcionamiento."
8191,4,defensor_del_pueblo_ciudadano,A,Lo elegimos porque hoy en día hay muchas personas que ven sus derechos vulnerados a pesar de que existen leyes. Esas personas deberían recibir apoyo de un organismo neutral.
8200,4,defensor_del_pueblo_ciudadano,A,14 votos
8202,4,defensor_del_pueblo_ciudadano,A,.
8203,4,defensor_del_pueblo_ciudadano,A,"representativo, preventivo a los gobiernos locales, con mayor participación ciudadanas."
8206,4,defensor_del_pueblo_ciudadano,A,abogado para defender la injusticia del ciudadano común y corriente
8208,4,defensor_del_pueblo_ciudadano,A,Que el pueblo se sienta representado en su integridad.
8210,4,defensor_del_pueblo_ciudadano,A,"Debería existir una institución y/o persona que vele por los derechos en todo ámbito, pero que no sea un político. Derecho a que nos defiendan como ciudadanos, que nos informen de lo que pasa en nuestro país. Falta espacio de representatividad de ciudadanos comunes, no políticos que velan por su in"
8215,4,defensor_del_pueblo_ciudadano,A,"Organismo que debe tener un rol más protagónio y resolutivo frente a la ciudadanía, mediando en diversos conflictos, ya sea con el Estado, con los privados o entre la misma comunidad organizada."
8220,4,defensor_del_pueblo_ciudadano,A,"No conocemos que exista esta figura en Chile, pero dado su importancia para asegurar los derechos del pueblo y evitar los abusos del poder político"
8226,4,defensor_del_pueblo_ciudadano,D,Ya existen en las normativas y leyes instituciones suficientes que representan al ciudadano.
8231,4,defensor_del_pueblo_ciudadano,A,Velar por los intereses de las personas cuando se ven afectadas por otros poderes.
8245,4,defensor_del_pueblo_ciudadano,A,"Debe ser una entidad representativa , autónoma e independiente de los poderes del Estado que nos defienda."
8254,4,defensor_del_pueblo_ciudadano,A,Crear un sistema de contraloria social y ciudadana a nivel local que proteja a la gente de los abusos e ilegalidades de los agentes públicos y del E stado
8256,4,defensor_del_pueblo_ciudadano,A,DEBE EXISTIR PARA ASESORAR AL CIUDADANO QUE NO POSEE CONOCIMIENTOS EN PRESENTACIONES BASICAS
8258,4,defensor_del_pueblo_ciudadano,A,Es importante para defender a las personas de los excesos o abusos de poder de las instituciones.
8261,4,defensor_del_pueblo_ciudadano,A,Que las autoridades defiendan al ciudadano
8267,4,defensor_del_pueblo_ciudadano,P,"En qué consiste el defensor ciudadano, en que vamos a tener un representante, vocero del pueblo recolectando el interés del pueblo para defender derecho y apoyarlo? si es así, debiese existir sólo los elegidos como reperesentantes de estos, como el Alcalde, pero uno de verdad, no que sólo beneficie"
8269,4,defensor_del_pueblo_ciudadano,A,porque el puedo tiene que tener una representación directa
8272,4,defensor_del_pueblo_ciudadano,A,El rol de la institución del defensor del pueblo representa un avance en la igualdad de derechos jurídicos entre los ciudadanos y debe ser un ente autónomo.
8284,4,defensor_del_pueblo_ciudadano,P,"Autoridad del estado que representa a los ciudadanos en el debate de la constitución. Debe ser autónomo, independiente e imparcial, y garantizar los derechos de los ciudadanos ante los abusos que pudieran cometer los poderes políticos."
8288,4,defensor_del_pueblo_ciudadano,A,Debe haber una institución que por oficio actúe ante cualquier injusticia.
8291,4,defensor_del_pueblo_ciudadano,A,"La protección judicial de los nuevos derechos constitucionales debe salvaguardarse por intermedio del defensor del pueblo, especialmente de los sectores en situación de desmedro social.   Debe ser de alta calidad."
8292,4,defensor_del_pueblo_ciudadano,A,"Implementar la institución del defensor del pueblos, quien tendrá el deber de acoger y defender los derechos e intereses de la ciudadanía."
8298,4,defensor_del_pueblo_ciudadano,A,Unión comunal tenga voto legal Instaurar mesas de dialogos Vocero por cada densidad de habitantes
8302,4,defensor_del_pueblo_ciudadano,A,.
8305,4,defensor_del_pueblo_ciudadano,A,"Es necesario un representante directo de la población, que cuide de evitar cualquier acto discriminatorio que se pueda cometer contra los que no tienen una voz constante en el Estado."
8314,4,defensor_del_pueblo_ciudadano,A,"institución que se encargue de fiscalizar  garante de los derechos del pueblo, siendo un aporte a la democracia de nuestro país,"
8315,4,defensor_del_pueblo_ciudadano,A,"Se requiere una institucionalidad que sea capaz de garantizar  el acceso a la justicia en igualdad de condiciones, en especial para aquellos que sufren algún tipo de discriminación de clase, etnia, genero u otro."
8328,4,defensor_del_pueblo_ciudadano,A,institución que vele por el respeto del estado y de los grandes compromisos por los derechos de los ciudadanos.
8330,4,defensor_del_pueblo_ciudadano,A,-
8337,4,defensor_del_pueblo_ciudadano,A,Entidad importante ya que busca garantizar el derecho a defensas a las personas con falta de recursos
8346,4,defensor_del_pueblo_ciudadano,A,o Garantizar la transparencia y legitimización de las consultas
8351,4,defensor_del_pueblo_ciudadano,A,Institución  que defienda a la gente de los abusos del estado y las empresas.
8353,4,defensor_del_pueblo_ciudadano,A,Desde hace mucho tiempo que Chile esta al debe con esta institución. Queremos que exista y tenga un carácter vinculante y no meramente un emisor de opiniones.
8359,4,defensor_del_pueblo_ciudadano,A,Este debe ser de carácter independiente y orientado a las necesidades y demandas de las personas como colectivo.
8360,4,defensor_del_pueblo_ciudadano,A,"defender a la gente, defender al pueblo."
8365,4,defensor_del_pueblo_ciudadano,A,"esta figura puede socorrer sobre todo a aquellos con menos educación, accesibilidad y conocimientos."
8366,4,defensor_del_pueblo_ciudadano,A,"Un organismo fiscalizador de instituciones públicas y privadas, que impida el abuso de estas hacia los ciudadanos."
8371,4,defensor_del_pueblo_ciudadano,A,que exista la defensa sobre todo a los desposeídos.
8378,4,defensor_del_pueblo_ciudadano,P,"Incluir una autoridad  cuyo mandato sea velar por el interés público frente a algún acto del Estado que vulnere los derechos públicos. Es un ente autónomo, independiente del Gobierno."
8388,4,defensor_del_pueblo_ciudadano,A,Es una Entidad muy importante en la defensa del Pueblo.
8395,4,defensor_del_pueblo_ciudadano,A,Anhelo deseable
8402,4,defensor_del_pueblo_ciudadano,A,"Un ente que pueda presentar las ideas, inquietudes y preocupaciones de la ciudadanía, transmitiendo de manera adecuada, esto es fundamental. Lamentablemente muchas personas no cuentan con el lenguaje suficiente para poder acercarse a instituciones formales, incluso el miedo es un factor."
8403,4,defensor_del_pueblo_ciudadano,A,que se escuche realmente un representante de verdad.
8406,4,defensor_del_pueblo_ciudadano,A,Persona o entidad designada por las cortes para defender y proteger los derechos fundamentales de los ciudadanos.
8411,4,defensor_del_pueblo_ciudadano,A,Exista una figura indepediente del poder politico que permita que cualquier ciudadano tenga derecho a interponer demanda.
8416,4,defensor_del_pueblo_ciudadano,A,Establecer un Defensor del pueblo/ciudadano con independencia y representación del pueblo  frente a la estructura del Estado.
8420,4,defensor_del_pueblo_ciudadano,A,Considera la institucionalidad que garantiza los Derechos de los habitantes del país frente a las Instituciones Públicas y aquellas Privadas que cumplen una función social o se trata de bienes y servicios considerados básicos.
8425,4,defensor_del_pueblo_ciudadano,A,La Constitución debe garantizar a cada ciudadano el derecho a defensa y que esta sea realiza a través de un organismo autónomo y que esté al servicio de la ciudadanía.
8427,4,defensor_del_pueblo_ciudadano,A,importante que exista un representante elegido por le pueblo que participe de las instancias decisivas ante abusos de poderes políticos o legislativos  por cada región
8434,4,defensor_del_pueblo_ciudadano,A,Para garantizar los derechos de los habitantes ante abusos que puedan hacer los poderes políticos
8442,4,defensor_del_pueblo_ciudadano,A,Debe haber una institución que defiendan los intereses del pueblo.
8447,4,defensor_del_pueblo_ciudadano,A,un encargado que vele por los derechos de todos (as)
8448,4,defensor_del_pueblo_ciudadano,A,"Necesidad urgente de creación de una figura que defienda y vele por los intereses de la ciudadanía, ante los poderes tanto estatales como privados."
8452,4,defensor_del_pueblo_ciudadano,A,"Una institución que asegure independencia, transparencia y una calidad mayor de la democracia y la justicia."
8458,4,defensor_del_pueblo_ciudadano,A,es necesario tener un defensor porque no tienen para pagar.
8459,4,defensor_del_pueblo_ciudadano,A,Defensor del pueblo una figura judicial institucionalizada que se preocupe y tenga como misión la defensa colectiva de los derechos naturales sociales y educativos de grupos carentes De defensoría. Debe ser un puente de conectividad entre el pueblo y la justicia institucional.
8460,4,defensor_del_pueblo_ciudadano,A,Entendimos esto como una instancia de resguardo de los derechos de las personas frente a las acciones del Estado que nos puedan perjudicar. Cualquier instancia que promueva la defensa de las personas es importante.
8463,4,defensor_del_pueblo_ciudadano,A,"Como contrapeso en el Estado, reconociendo la soberanía del pueblo."
8466,4,defensor_del_pueblo_ciudadano,A,Porque es una adecuada protección de los derechos de los ciudadanos frente a las acciones del Estado y otros organismos.
8471,4,defensor_del_pueblo_ciudadano,A,La Constitución debe establecer la institución de un Defensor del Pueblo.
8482,4,defensor_del_pueblo_ciudadano,A,Es indispensable proteger los derechos de los ciudadanos frente a la administración. Se deben garantizar los derechos de los ciudadanos ante abusos de los poderes del Estado.
8485,4,defensor_del_pueblo_ciudadano,P,LA SOCIEDAD MISMA PUEDE ENCARGARSE DE ESTE ROL: EJEMPLO; LOS COSOC Y LOS    LÍDERES SOCIALES
8488,4,defensor_del_pueblo_ciudadano,A,"Este es un cargo dentro de la Contraloría General de la Republica, que es y al igual que esta, autonomo del ejecutivo. Promociona, defiende y vigila los derechos y garantias de los ciudadanos."
8495,4,defensor_del_pueblo_ciudadano,A,Tener una institución que vele por la legitima defensa de los derechos ciudadanos.
8502,4,defensor_del_pueblo_ciudadano,A,"Se debe crear una Contraloría Ciudadana que proteja a la gente de los abusos, el  trato indigno, la corrupción y las ilegalidades de los agentes públicos y electos y que vele por el derecho a la planificación participativa, el cumplimiento de los acuerdos y  el buen uso de los recursos del Estado."
8508,4,defensor_del_pueblo_ciudadano,A,"que efectivamente exista la figura de defensor del pueblo y que esta cumpla con la función de defender ante los cobros abusivos, las colusiones, alzas arbitrarias en salud y las afp"
8516,4,defensor_del_pueblo_ciudadano,A,Se debe garantizar el derecho de la defensa de todas las personas con igualdad ante la ley.
8524,4,defensor_del_pueblo_ciudadano,A,Se explica por sí solo.
8527,4,defensor_del_pueblo_ciudadano,A,Aspiración para más agilidad y más transparencia a la aplicación de la justicia.
8537,4,defensor_del_pueblo_ciudadano,A,con defensa real
8542,4,defensor_del_pueblo_ciudadano,A,Necesidad de defender derechos que no están protegidos
8543,4,defensor_del_pueblo_ciudadano,A,No existe un ente autonomo para velar por los intereses ciudadanos
8544,4,defensor_del_pueblo_ciudadano,A,ver archivo adjunto
8549,4,defensor_del_pueblo_ciudadano,A,"QUE EXISTA REALMENTE. LA CORPORACIÓN JUDICIAL DEJA LOS CASOS BOTADOS Y NO HAY RESOLUCIONES PARA LOS CASOS. OTRA FALENCIA PARA EL QUE NO PUEDE PAGAR ABOGADO, EL ESTADO SE HAGA CARGO, YA QUE GRANDES Y CIERTAS INSTITUCIONES ABUSAN DE LA CIUDADANIA."
8556,4,defensor_del_pueblo_ciudadano,A,- Para generar una mayor representación ciudadana.
8562,4,defensor_del_pueblo_ciudadano,A,sin fundamento
8564,4,defensor_del_pueblo_ciudadano,P,"Debe ser la instancia para defender al pueblo, cuando la administración no funcione. Puede ser paralelo o al final de un proceso judicial"
8566,4,defensor_del_pueblo_ciudadano,A,"Con autonomía que otorgue un mecanismo de control ciudadano y de defensa de los derechos universales, desde la ciudadanía."
8570,4,defensor_del_pueblo_ciudadano,P,Porque nos representa y nos defiende.
8572,4,defensor_del_pueblo_ciudadano,A,SE DEBERIA ELEGIR UN DEFENSOR DEL PUEBLO QUE DENUNCIE LOS ABUSOS HACIA EL PUEBLO
8573,4,defensor_del_pueblo_ciudadano,P,Debe incorporarse un órgano autónomo constitucional que cumpla el rol de defensoría del pueblo. Un integrante del grupo fue contrario a esta idea por tratarse de un órgano contramayoritario.
8577,4,defensor_del_pueblo_ciudadano,P,Protección al ciudadano común.
8582,4,defensor_del_pueblo_ciudadano,A,"Institución que debiese proteger a la ciudadanía de los abusos de poder, tanto de las instituciones del Estado, como de otras instituciones de la sociedad chilena."
8586,4,defensor_del_pueblo_ciudadano,A,El Estado debe velar por los intereses de las mayorías populares.
8594,4,defensor_del_pueblo_ciudadano,A,garantizar derechos de las personas que no tengan recursos
8597,4,defensor_del_pueblo_ciudadano,A,Imprescindible que la constitución contemple Defensor del Pueblo.
8603,4,defensor_del_pueblo_ciudadano,A,Debería haber alguien que defienda al pueblo.
8605,4,defensor_del_pueblo_ciudadano,A,para que el estado no abuse del poder del ciudadano a pie
8607,4,defensor_del_pueblo_ciudadano,A,"El pueblo es el cuerpo del pais, se necesita de quien nos defienda y haga valor los derechos"
8617,4,defensor_del_pueblo_ciudadano,A,"SERIA INTERESANTE HUBIERA ESTA FIGURA LEGAL, DONDE SE ESTABLECIERA UNA DEFENSORIA DEL PUEBLO MAS CERCANA DE LA CIUDADANÍA QUE VELEN POR SUS NECESIDADES"
8621,4,defensor_del_pueblo_ciudadano,P,"La creación de esta entidad que representa al pueblo ante las instituciones públicas ayudaría a renovar la confianza de las personas en la política,. pues contarían con una institución capaz de defender sus intereses en todos los niveles políticos."
8622,4,defensor_del_pueblo_ciudadano,A,"Ley integral de derechos, porque es garante de derechos Equiparar el poder del estado con el popular"
8633,4,defensor_del_pueblo_ciudadano,A,Falta representatividad cívica y respeto por parte de quienes la ejercen.
8635,4,defensor_del_pueblo_ciudadano,A,"Debe cautelar que el gobierno en sus diversas instancias y niveles, ejecute con equidad y justicia las decisiones las tomadas y hacerlas presentes a quien corresponda para eliminar los error."
8637,4,defensor_del_pueblo_ciudadano,A,todos debemos tener a alguien que nos defienda en el país.
8641,4,defensor_del_pueblo_ciudadano,A,"Entidad que orienta, asesora y acompaña legalmente a pesonas o grupos de personas en la defensa de sus derechos"
8647,4,defensor_del_pueblo_ciudadano,A,"Como entidad que regula la cancha, al relacionarnos los ciudadanos con el Estado."
8658,4,defensor_del_pueblo_ciudadano,A,Poder llevar a juicio a los políticos y dirigentes  corruptos
8666,4,defensor_del_pueblo_ciudadano,A,Que exista Institucionalidad que garantice los Derechos Ciudadanos. Institución garante de los Derechos del Pueblo.
8672,4,defensor_del_pueblo_ciudadano,A,Que exista un ente del estado que ayude a los ciudadanos.
8675,4,defensor_del_pueblo_ciudadano,A,"Propiciar los cabildos como una forma de participación ciudadana permanente. Estipular los estamentos que serán considerados para establecer  el defensor del pueblo. Que sean comunidades  abiertas, libres,  conocidas por todos, sin fines de lucro."
8680,4,defensor_del_pueblo_ciudadano,A,Es una instancia que puede servir a los ciudadanos para defender nuestros derechos y tratar de ejercer igualdad.
8685,4,defensor_del_pueblo_ciudadano,A,"debe a nuestro juicio ser incorporada en la nueva Carta Fundamental, ya que representara a las personas ante cualquier tipo de autoridad política o administrativa"
8688,4,defensor_del_pueblo_ciudadano,A,"Debe ser elegido por democracia, velar por los derechos del pueblo."
8689,4,defensor_del_pueblo_ciudadano,A,que los ciudadanos en su conjunto tenga acceso a la defensa frente a los abusos y nepotismos de sus lideres y entes privados que atente contra los derechos
8699,4,defensor_del_pueblo_ciudadano,A,Institución sueca que permite defender de mejor manera a los ciudadanos frente a los eventuales atropellos e ineficiencias del aparataje estatal.
8708,4,defensor_del_pueblo_ciudadano,A,Necesidad de contar con figura legal que tome a su cargo intereses ciudadanos. Fijar problemas de derechos humanos.
8711,4,defensor_del_pueblo_ciudadano,A,reconocimiento de una defensoria popular
8712,4,defensor_del_pueblo_ciudadano,A,Una institución que vele y defienda el cumplimiento de la constitución y los derechos del pueblo
8721,4,defensor_del_pueblo_ciudadano,A,"Debe ser un órgano autónomo, pero que forme parte de la estructura del Estado, con recursos propios y suficientes para el diseño y desarrollo de sus funciones, con facultades de promoción y defensa de los DDHH, donde además pueda presentar y seguir acciones judiciales en personas y colectivos. Sus autoridades deberán electas a través de una asamblea de representantes."
