idEla,tema,concepto,acuerdo,fundamento
4302,4,defensor_del_pueblo_ciudadano,A,ES LA ORGANIZACION QUE DEBE CUMPLIR LA PROTECCION O GARANTIAS PARA TODO CIUDADANO EN LO PUBLICO COMO EN LO PRIVADO.
4310,4,defensor_del_pueblo_ciudadano,A,El grupo está de acuerdo en integrar esta figura autónoma constitucional que asuma el rol de ser la voz defensora de derechos de la ciudadanía contra los otros órganos del estado.
4322,4,defensor_del_pueblo_ciudadano,A,"Con la finalidad de garantizar la justicia civil, esta defensoría será un organismo al que podrá recurrir cualquier ciudadano para solicitar protección ante una vulneración parcial o total de cada uno o la totalidad de sus derechos."
4336,4,defensor_del_pueblo_ciudadano,A,El pueblo debe tener un organismo que lo defiende de las arbitrariedades del Estado.
4337,4,defensor_del_pueblo_ciudadano,A,Entendemos que son las instituciones sobre las cuales debemos debatir. Institución que debe tener rango constitucional y vinculante y su rol es clave para garantizar los derechos del pueblo.
4343,4,defensor_del_pueblo_ciudadano,A,Elegido por democracia
4349,4,defensor_del_pueblo_ciudadano,P,Institución con iniciativa legislativa que permite la instalación de temas prioritarios para la sociedad organizada en la agenda pública.
4353,4,defensor_del_pueblo_ciudadano,A,"Sería bueno que una persona sin ningún cargo político, influencia política ni religiosa (idealmente) pudiera representar y comunicar las ideas de las personas."
4354,4,defensor_del_pueblo_ciudadano,A,De acuerdo.
4355,4,defensor_del_pueblo_ciudadano,A,Para defender y proteger los derechos esenciales de los seres humanos frente a la acción del Estado.
4361,4,defensor_del_pueblo_ciudadano,A,"Autoridad que garantiza los derechos del ciudadano ante abuso de los poderes políticos o legislativos. Debiera ser elegido por voto popular, para fiscalizar al gobierno."
4362,4,defensor_del_pueblo_ciudadano,A,Creemos de suma importancia que en la nueva constitución se incorpore la figura del Defensor del Pueblo como un ente independiente a los otros tres poderes del Estado.
4365,4,defensor_del_pueblo_ciudadano,A,Una institución que defienda nuestra realidad local que se preocupe de todos los ciudadanos y ciudadanas que vele integralmente por el pueblo.
4373,4,defensor_del_pueblo_ciudadano,A,ES NECESARIO YA QUE SE REQUIERE UN PODER INDEPENDIENTE QUE FISCALICE Y VELE POR LOS DERECHOS DE LOS CHILENOS Y CHILENAS YA SEA EN EL ÁMBITO PUBLICO COMO PRIVADO
4376,4,defensor_del_pueblo_ciudadano,A,Tomar el ejemplo de un buen número de países en donde existe esta figura y el bien que le hace a la democracia
4380,4,defensor_del_pueblo_ciudadano,A,DEBIESE IMPULSARSE CON MAYOR FUERZA ESTA FIGURA
4383,4,defensor_del_pueblo_ciudadano,A,Defensor efectivo de derechos de la gente
4387,4,defensor_del_pueblo_ciudadano,A,Que exista un nexo entre la ciudadanía y el gobierno que este defiende mayormente al pueblo frente a las injusticias.
4393,4,defensor_del_pueblo_ciudadano,A,"Se requiere una instancia que defienda nuestros derechos ciudadanos  sin necesidad de abogados. Defensa de derechos ciudadanos más allá del consumo, un SERNAC de derechos ciudadanos."
4396,4,defensor_del_pueblo_ciudadano,P,"El grupo acuerda que debería existir esta institucion en Chile, no existe claridad sobre su dimensión, pero se estima que debería ser un vinculo que pueda relacionar con mayor fluidez a la ciudadanía con los poderes del Estado. Falta representatividad de la gente."
4405,4,defensor_del_pueblo_ciudadano,A,Promoverlo como autoridad del Estado con el fin de garantizar los derechos de los ciudadanos  ante cualquier tipo de abuso que puedan hacer los poderes políticos (legislativo) del Estado.
4408,4,defensor_del_pueblo_ciudadano,A,Que asegure nuestros derechos ante el estado.
4410,4,defensor_del_pueblo_ciudadano,A,"- Consejo de elección popular con criterio de funcionamiento colegiado y descentralizado. Con reelecciones limitadas. Acceso equitativo, gratuito e informatizado."
4421,4,defensor_del_pueblo_ciudadano,A,"Definir sus funciones, limitaciones y forma de elección."
4422,4,defensor_del_pueblo_ciudadano,A,"- Falta esta figura, para una defensa real y eficaz de todos los ciudadanos"
4424,4,defensor_del_pueblo_ciudadano,A,sin fundamento
4426,4,defensor_del_pueblo_ciudadano,A,Mayor difusión de este derecho instrucción de los derechos ciudadanos.
4430,4,defensor_del_pueblo_ciudadano,A,"CON PARTICIPACIÓN DE LA SOCIEDAD CIVIL, EN SU ORGANIGRAMA,CON POSIBILIDAD DE CARÁCTER VINCULANTE DE SUS SUGERENCIAS, RECOMENDACIONES AL PASAR POR PLEBISCITO, QUE SE ACTIVA DE INMEDIATO AL NO SER TOMADAS EN CUENTA ESTAS SUGERENCIAS POR PARTE DE LOS PODERES DEL ESTADO."
4432,4,defensor_del_pueblo_ciudadano,A,Institución encargada de ser la defensoría de los y las ciudadanas comunes
4434,4,defensor_del_pueblo_ciudadano,A,IMPORTANTE QUE EXISTA ESTA FIGURA PERO QUE TENGA MÁS ATRIBUCIONES COMO EN OTROS PAISES.
4436,4,defensor_del_pueblo_ciudadano,A,Se necesita una entidad en donde el ciudadano puedo recurrir para buscar ayuda para defender sus derechos.
4440,4,defensor_del_pueblo_ciudadano,A,"Electo por el pueblo, entregando informaciones periódicas de su gestión"
4444,4,defensor_del_pueblo_ciudadano,A,Se necesita de una figura o institución que equilibre la relación asimétrica que hoy existe entre los civiles y las instituciones. El defensor del pueblo debe ser garante de los derechos de la ciudadanía frente a cualquier tipo de abuso.
4445,4,defensor_del_pueblo_ciudadano,A,"Crear una Defensoría del Pueblo, ante posibles abusos del Estado. Debe también reforzarse la Defensa del Consumidor (ante las empresas)"
4447,4,defensor_del_pueblo_ciudadano,A,Mecanismo de equidad jurídico social
4451,4,defensor_del_pueblo_ciudadano,A,Representante o líder de una comunidad u organización social que transmita el pensamiento de un grupo determinado.
4454,4,defensor_del_pueblo_ciudadano,P,"Debe contar con recursos financieros y facultades legales suficientes para que su labor sea eficaz; con requisitos claros para garantizar su idoneidad. Proponemos que su designación sea por votación popular directa, o bien de una terna propuesta por el Presidente y que elija la Corte Suprema."
4456,4,defensor_del_pueblo_ciudadano,A,El estado debera garantizar los derechos ciudadanos y proteger a la ciudadania de decisiones arbitrarias por organismos del estado que vulneren dichos derechos. Para ello se debe crear un organismo de defensoria del pueblo cuyas decisiones sean vinculantes y obligatorias.
4457,4,defensor_del_pueblo_ciudadano,A,"Crear una institución que se asegure de fiscalizar y regular en beneficio del pueblo, a instituciones publicas y privadas."
4460,4,defensor_del_pueblo_ciudadano,A,"Por razones de tiempo  , no  se  alcanza a debatir sobre las características  que deberían tener  las instituciones consideradas más  importantes  por los participantes"
4465,4,defensor_del_pueblo_ciudadano,P,"Creemos acertada la figura pero algunos opinaban que aumentar el aparataje estatal no es necesario, más de lo que ya es actualmente. Además se puede prestar para conveniencias políticas del momento."
4469,4,defensor_del_pueblo_ciudadano,A,"las personas que están a cargo del país deberían defendernos, ya que somos personas y deben tratarnos con el respeto que merecemos."
4475,4,defensor_del_pueblo_ciudadano,A,"Este es de gran necesidad para fiscalizar tanto a las instituciones públicas, como a sus funciones, con relación a las acciones u omisiones que le sean imputables y que puedan perjudicar o afectar los derechos fundamentales."
4478,4,defensor_del_pueblo_ciudadano,A,La Constitución debe resguardar la existencia de una institución independiente del Estado que permita defender y proteger al ciudadano ante los actos que afecten en bien común
4490,4,defensor_del_pueblo_ciudadano,A,para una efectiva representación
4491,4,defensor_del_pueblo_ciudadano,A,.
4494,4,defensor_del_pueblo_ciudadano,A,"Que exista y se potencie un defensor de los ciudadanos, alguien que sea la voz del pueblo ante los poderes (un interlocutor)."
4496,4,defensor_del_pueblo_ciudadano,A,Que exista una entidad democrática y transparente que defienda a los ciudadanos.
4497,4,defensor_del_pueblo_ciudadano,A,que medie diferencias vecinales y responda conflictos locales
4504,4,defensor_del_pueblo_ciudadano,A,Debe existir una institución que proteja a los ciudadanos de eventuales abusos u arbitrariedades de parte de los órganos públicos.
4506,4,defensor_del_pueblo_ciudadano,A,"instituciones que protejan al ciudadano en aspectos económico, sociales y politicos"
4507,4,defensor_del_pueblo_ciudadano,A,"que sea una persona cercana de fácil acceso, sin restricciones de a quien pueda defender, persona equitativa."
4519,4,defensor_del_pueblo_ciudadano,A,"Garantizar la no vulneración de los derechos del ciudadano respecto a las políticas estatales, además, que promueva los derechos y políticas públicas."
4531,4,defensor_del_pueblo_ciudadano,A,"Que esta asesoría nazca de y por el pueblo, asegurando mayor compromiso, vocación e interés del profesional."
4538,4,defensor_del_pueblo_ciudadano,P,"Se discute hacerla de forma regulada y clara con los ciudadanos, con el fin de qe no se vuelva un vicio o problema."
4542,4,defensor_del_pueblo_ciudadano,A,PARA VELAR POR LOS DERECHOS DEL PUEBLO
4547,4,defensor_del_pueblo_ciudadano,A,"se debe crear un defensor de ciudadanos colegiado dentro de la administración del estado, que se preocupe de velar por los derechos y libertades de las personas y su dignidad."
4548,4,defensor_del_pueblo_ciudadano,A,Hacer contrapeso a los abusos de los poderes del estado..
4556,4,defensor_del_pueblo_ciudadano,A,Velar por los derechos y libertades de las personas.
4570,4,defensor_del_pueblo_ciudadano,A,"Necesitamos fiscalización independiente, efectiva y honesta de nuestras instituciones"
4572,4,defensor_del_pueblo_ciudadano,A,"Organismo que garantice justicia ante la inquietud ciudadana, acoja y de soluciones ante demandas colectivas."
4574,4,defensor_del_pueblo_ciudadano,A,"Debe existir un órgano que goce de poder y autonomía, que permita la escucha ciudadana de la visión de país."
4576,4,defensor_del_pueblo_ciudadano,P,"se requiere dicho organismos para velar por los derechos ciudadanos y humanos en caso de violación de estos, recibir orientación adecuada (se violan derechos sin saberlo)."
4583,4,defensor_del_pueblo_ciudadano,A,La mejor forma de tomar en cuenta las necesidades de los chilenos como personas.
4584,4,defensor_del_pueblo_ciudadano,A,Una figura nueva y positiva pues necesitamos alguien que los intereses de la mayoría su
4585,4,defensor_del_pueblo_ciudadano,A,Institución que tiene por fin último la defensa de las personas ante las instituciones públicas y privadas que con su actuar afecten los intereses de particulares
4592,4,defensor_del_pueblo_ciudadano,A,"Las colusiones están muy de moda, con esta institución, juntamos nuestra fuerzas y tal vez estas grandes empresas dejen de reírse de nosotros."
4595,4,defensor_del_pueblo_ciudadano,A,"Institución integrada por la ciudanía vinculante y revocable, participativa en común. Tener representación por distintos ente de la ciudanía.   Revisar el poder de los concejales. Exigir al consejo Municipal tener más participación.  Fiscalizar y sancionar en acorde a la falta. Vinculante con el programa de gobierno."
4598,4,defensor_del_pueblo_ciudadano,A,Debe ir en la Constitución.
4600,4,defensor_del_pueblo_ciudadano,P,Los ciudadanos están completamente desprotegidos en muchas materias. Por eso debe establecer la figura de un defensor del pueblo al servicio de los ciudadanos.
4601,4,defensor_del_pueblo_ciudadano,A,"Establecer una autoridad autónoma y descentralizada funcional y territorialmente, para defender los derechos humanos fundamentales y libertades, de los ciudadanos."
4607,4,defensor_del_pueblo_ciudadano,A,Debe existir una organización autónoma que garantice nuestra defensa.
4611,4,defensor_del_pueblo_ciudadano,A,DEbe velar por el respeto por parte del Estado de los derechos y libertades de los ciudadanos y por la implementación de políticas públicas que propicien el desarrollo de las personas.
4612,4,defensor_del_pueblo_ciudadano,A,vela por los derechos de los ciudadanos ante abusos del funcionarios del estado
4617,4,defensor_del_pueblo_ciudadano,A,En los casos que los ciudadanos no tengan los recursos necesarios para defenderse.
4618,4,defensor_del_pueblo_ciudadano,A,Es en sí una institución porque cuida y promueve nuestras tradiciones.
4619,4,defensor_del_pueblo_ciudadano,A,"porque sin él, el Estado pierde sentido de ser"
4622,4,defensor_del_pueblo_ciudadano,A,Como contrapeso al poder.
4625,4,defensor_del_pueblo_ciudadano,A,"Organismo Colegiado a través de Elección popular que cautele los derechos ciudadanos, ejemplo: fijar dieta de  parlamentarios."
4626,4,defensor_del_pueblo_ciudadano,A,Que se institucionalice ya que muchas veces el pueblo no tiene quien los defienda.
4644,4,defensor_del_pueblo_ciudadano,A,debemos tener una institución que garantice resguardo y protección a los ciudadanos . Derecho a ser defendidos con responsabilidad .
4648,4,defensor_del_pueblo_ciudadano,A,Es importante crear esta institución que permite representar a los ciudadanos frente a la administración del estado abordando amplias tematicas
4650,4,defensor_del_pueblo_ciudadano,A,"PARA QUE REPRESENTEN A GRUPOS LOCALES, COMITES Y COORDINADORAS"
4653,4,defensor_del_pueblo_ciudadano,A,LÍDER QUE TENGA EL DERECHO DE EXPRESIÓN Y SEA ESCUCHADO.
4655,4,defensor_del_pueblo_ciudadano,A,"""La voz del pueblo"". Se deben garantizar los derechos de los ciudadanos."
4657,4,defensor_del_pueblo_ciudadano,P,"Órgano independiente, apolítico, elegido representativamente para defender a los ciudadanos  de arbitrariedades  de la administración de turno."
4662,4,defensor_del_pueblo_ciudadano,A,porque genera un equilibrio en la relación entre los ciudadanos y el Estado.
4667,4,defensor_del_pueblo_ciudadano,A,Autoridad que proteja y defienda derechos de los habitantes.
4668,4,defensor_del_pueblo_ciudadano,A,"La consideramos una INSTITUCIÓN que debe estar considerada en la Constitución, pues ofrecen la posibilidad de que la sociedad participe o de que las mismas instituciones sean reguladas de modo especial."
4673,4,defensor_del_pueblo_ciudadano,P,No se tiene claridad del concepto.
4681,4,defensor_del_pueblo_ciudadano,A,Para profundización de la democracia y defensa de derechos ciudadanos frente al estado. Rango constitucional garantiza su fuerza.
4685,4,defensor_del_pueblo_ciudadano,A,Es necesario contar con ciudadanos comunes y corrientes en las decisiones judiciales y en el cumplimiento constitucional.
4686,4,defensor_del_pueblo_ciudadano,A,.
4689,4,defensor_del_pueblo_ciudadano,A,Es necesario que exista frente a los abusos de instituciones públicas y privadas.
4694,4,defensor_del_pueblo_ciudadano,A,Institución paralela al gobierno que fiscalice y verifique la real aplicación del proceso.
4699,4,defensor_del_pueblo_ciudadano,A,Un órgano independiente encargado de velar por el respeto de los derechos de las personas representándolas frente a los órganos del Estado
4703,4,defensor_del_pueblo_ciudadano,A,"Debe existir una institución que represente de forma autónoma al pueblo, vigilando y apoyando la gestión del Estado"
4705,4,defensor_del_pueblo_ciudadano,A,Institución para defender y proteger los derechos fundamentales de los ciudadanos frente a la administración.
4706,4,defensor_del_pueblo_ciudadano,A,SIN FUNDAMENTO
4709,4,defensor_del_pueblo_ciudadano,A,contrapeso a las instituciones judiciales en defensa y acompañamiento
4712,4,defensor_del_pueblo_ciudadano,P,se necesita que las instituciones defiendan mas los derechos del pueblo que los intereses de las empresas
4719,4,defensor_del_pueblo_ciudadano,A,----------------------------
4724,4,defensor_del_pueblo_ciudadano,A,A
4729,4,defensor_del_pueblo_ciudadano,A,Organismo que defienda a la ciudadanía y al pueblo del Estado y que persiga judicialmente irregularidades que la Contraloría detecte.
4730,4,defensor_del_pueblo_ciudadano,A,Instancia que proteja a los ciudadanos de la accion publica o privada.
4734,4,defensor_del_pueblo_ciudadano,P,Una persona lo cree importante pero ya existe.
4735,4,defensor_del_pueblo_ciudadano,A,es una autoridad estatal que tiene como objetivo proteger y defender los derechos fundamentales de las personas frente al Estado.
4742,4,defensor_del_pueblo_ciudadano,A,Es necesario para cautelar la democracia y los derechos de los ciudadanos
4748,4,defensor_del_pueblo_ciudadano,A,"Como el principal organismo encargado de defender a los ciudadanos, sus derechos frente a la administración pública"
4750,4,defensor_del_pueblo_ciudadano,A,Replicar el ejemplo de países. Defensa de los derechos humanos en la figura del defensor del pueblo para agilizar el proceso.
4758,4,defensor_del_pueblo_ciudadano,P,"Si, porque cualquiera puede serlo y además es una figura necesaria."
4768,4,defensor_del_pueblo_ciudadano,A,el pueblo
4773,4,defensor_del_pueblo_ciudadano,A,"Si bien hay instituciones que entregan defensa a personas, sería bueno una oficina del Defensor del Pueblo integral."
4774,4,defensor_del_pueblo_ciudadano,A,.
4775,4,defensor_del_pueblo_ciudadano,A,"Es fundamental que exista un organismo autónomo que sea capaz de fiscalizar que los poderes del estado velen por los derechos humanos e intereses colectivos, ya sea desde el accionar o desde la omisión por parte de estos mismos."
4777,4,defensor_del_pueblo_ciudadano,A,Defensor del pueblo contra los abusos de instituciones del Estado.
4778,4,defensor_del_pueblo_ciudadano,A,Fortalecer este tipo de defensoría
4779,4,defensor_del_pueblo_ciudadano,A,entidad independiente del estado protege y garantiza los derechos de la ciudadanía
4798,4,defensor_del_pueblo_ciudadano,A,Acuerdo unánime y que esta figura se institucionalice.
4810,4,defensor_del_pueblo_ciudadano,A,para la defensa de los desamparados ante los abusos del estado y los poderosos
4816,4,defensor_del_pueblo_ciudadano,A,La sensación de inseguridad debe desaparecer. uno mismo debe proteger al progimo también.
4820,4,defensor_del_pueblo_ciudadano,A,Crear una defensoría más cercana al pueblo
4821,4,defensor_del_pueblo_ciudadano,A,"Debe reforzarse esta figura de gran importancia práctica, generando información para los ciudadanos."
4823,4,defensor_del_pueblo_ciudadano,A,Se sugiere crear la institución del defensor de los derechos de las personas frente al Estado.
4831,4,defensor_del_pueblo_ciudadano,A,Todos necesitamos alguien que nos defienda
4832,4,defensor_del_pueblo_ciudadano,A,Crear el espacio para esto.
4837,4,defensor_del_pueblo_ciudadano,P,Sin fundamento
4839,4,defensor_del_pueblo_ciudadano,A,Importante por ser un actor de protección de la gente teniendo un respaldo potente e institucional para conseguirlo.
4840,4,defensor_del_pueblo_ciudadano,A,Debe haber un defensor que pueda resguardar la integridad de los ciudadanos y protegernos de los abusos.
4844,4,defensor_del_pueblo_ciudadano,A,Por que es una institución que protege al ciudadano frente al estado o a otros poderes
4857,4,defensor_del_pueblo_ciudadano,A,"Esto es necesario para que la ciudanía se sienta mas partes, sobre todos los que se sienten menos integrados y vulnerados"
4860,4,defensor_del_pueblo_ciudadano,A,tener una institución autónoma y financiada por el estado para la defensa de los derechos del ciudadano
4888,4,defensor_del_pueblo_ciudadano,A,Debe existir una instancia para asegurar la participación y el resguardo de la ciudadanía para garantizar la fiscalización
4900,4,defensor_del_pueblo_ciudadano,P,"Se selecciona como una Institución importante y que actualmente no se encuentra presente, en tanto debe existir una instancia donde la ciudadanía pueda denunciar cuando el Estado no esté respetando efectivamente los Derechos planteados en la Constitución."
4902,4,defensor_del_pueblo_ciudadano,A,Necesidad de una última instancia para cuando nuestros derechos son vulnerados. Ente independiente del juicio de un solo juez.
4905,4,defensor_del_pueblo_ciudadano,A,Estamentos por el pueblo
4908,4,defensor_del_pueblo_ciudadano,A,"PERSONA QUE REPRESENTA LA VOZ DEL PUEBLO Y SEA ESCUCHADA, LO IDEAL SERIA QUE LA CIUDADANA LO ESCOJA."
4909,4,defensor_del_pueblo_ciudadano,A,Debe crearse para proteger a la ciudadanía más que como consumidores
4926,4,defensor_del_pueblo_ciudadano,A,para que no exista discriminación; Porque el pueblo debe estar seguro.
4929,4,defensor_del_pueblo_ciudadano,A,para defender y proteger los derechos fundamentales de los ciudadanos y ciudadanas
4930,4,defensor_del_pueblo_ciudadano,A,Se debe instituir
4935,4,defensor_del_pueblo_ciudadano,A,"Crear un Defensor del Pueblo y del Ciudadano, colegiado y dentro de la administración del Estado, que vele por el respeto por parte de los organismos del Estado de los derechos y libertades de las personas, su dignidad, así como establecer políticas públicas asociadas a los derechos sociales."
4936,4,defensor_del_pueblo_ciudadano,A,no hay
4945,4,defensor_del_pueblo_ciudadano,A,concepto ombudsman que garantice los derechos de los habitantes ante cualquier tipo de abuso y creación de un concejo económico y social que de mayor espacio de participación a la sociedad civil
4946,4,defensor_del_pueblo_ciudadano,A,"Ser defendidos por una institución seria, es garantía real de derechos."
4948,4,defensor_del_pueblo_ciudadano,A,Tener un representante de los derechos del pueblo con recursos para cumplir su rol
4950,4,defensor_del_pueblo_ciudadano,A,Como una institución necesaria para apoyar el trabajo del pueblo en su defensa.
4951,4,defensor_del_pueblo_ciudadano,A,Por el grado de indefensión del ciudadano.
4960,4,defensor_del_pueblo_ciudadano,A,Participar en pro de las necesidades de la ciudadanía.
4962,4,defensor_del_pueblo_ciudadano,A,Necesidad de los representados en nuestros derechos.
4963,4,defensor_del_pueblo_ciudadano,A,Similar al de naciones europeas
4978,4,defensor_del_pueblo_ciudadano,A,"una autoridad que al igual que la contraloría vela por el buen uso de los recursos, vele por el respeto a los ciudadanos en la gestación y ejecución de las políticas públicas."
4979,4,defensor_del_pueblo_ciudadano,A,Como primera elección.
4981,4,defensor_del_pueblo_ciudadano,A,El Estado debe asegurar que las personas sin diferencia puedan acceder a instancias de defensa de sus derechos fundamentales
4983,4,defensor_del_pueblo_ciudadano,A,En blanco
4992,4,defensor_del_pueblo_ciudadano,A,Persecución legal a quienes cometen delitos contra las personas.
4999,4,defensor_del_pueblo_ciudadano,A,La voz de los ciudadanos es importante y debe ser consultada y escuchada.
5001,4,defensor_del_pueblo_ciudadano,A,Es necesario que se incorpore instituciones que velen por los DDHH.
5008,4,defensor_del_pueblo_ciudadano,A,Ente encargado de velar por los derechos y garantías del pueblo.
5010,4,defensor_del_pueblo_ciudadano,A,A LA SOCIEDAD LE FALTA UN DEFENSOR DEL PUEBLO O DEL CIUDADANO.
5012,4,defensor_del_pueblo_ciudadano,A,Que exista un ministerio de los ciudadanos que nos defiendan como ley 20.500.
5015,4,defensor_del_pueblo_ciudadano,A,nos parece importante que exista un ciudadano/institución que resguarde derechos no resguardados que vayan emergiendo a propósito de los cambios sociales.
5027,4,defensor_del_pueblo_ciudadano,A,Este funcionario tendría la facultad de supervisar efectivamente la labor del gobierno.
5028,4,defensor_del_pueblo_ciudadano,A,Hay que fortalecer y darle protagonismo al Defensor del Pueblo
5029,4,defensor_del_pueblo_ciudadano,A,"Institucion que asume la defensa del ciudadano ante el estado, cuando se vulneran sus garantias ciudadanas"
5030,4,defensor_del_pueblo_ciudadano,A,oportunidad para velar oir el respeto y cumplimiento de los derechos de los ciudadanos.
5034,4,defensor_del_pueblo_ciudadano,P,ingresa a lista por tener más de una selección en primera ronda.
5042,4,defensor_del_pueblo_ciudadano,A,"Una institución necesaria. La fiscalía cuida los intereses de la nación toda, la defensoría protege a los delincuentes, PERO NADIE PROTEGE A LAS VÍCTIMAS. Por esto es importante que exista el defensor del ciudadano o del pueblo.  No puede ser mostar a las victimas en TV, y a delincuentes los tapen."
5046,4,defensor_del_pueblo_ciudadano,A,Que esté esta persona en el gobierno para que vele por los derechos de los ciudadanos
5048,4,defensor_del_pueblo_ciudadano,P,Hay acuerdo para que exista esta figura más no al tipo de competencias que tenga o si solo debe atender a los ciudadanos más vulnerables
5052,4,defensor_del_pueblo_ciudadano,P,"La figura del defensor del pueblo reconocida con rango constitucional, independiente y con la fuerza real para proteger al pueblo."
5054,4,defensor_del_pueblo_ciudadano,A,que alguien defienda al pueblo de las injusticias
5061,4,defensor_del_pueblo_ciudadano,A,Otorga defensa a los ciudadanos ante el abuso de las leyes en situación de injusticia
5063,4,defensor_del_pueblo_ciudadano,A,"Fundamental para ejercer una democracia participativa, desde lo local, especialmente al momento de respetar y proteger los derechos fundamentales de los ciudadanos, respecto de las actuaciones de las autoridades que afecten los derechos ciudadanos."
5065,4,defensor_del_pueblo_ciudadano,A,NO SABEMOS SI ACTUALMENTE EXISTE PERO DEBIERAMOS DE TENER ESTA INSTITUCION
5067,4,defensor_del_pueblo_ciudadano,A,.
5074,4,defensor_del_pueblo_ciudadano,A,Defensoría autónoma del estado/solo apoyo fiscal para recursos.
5075,4,defensor_del_pueblo_ciudadano,P,Existe la necesidad de un defensor del pueblo que vele por la defensa de nuestros derechos constitucionales.
