idEla,tema,concepto,acuerdo,fundamento
5547,2,igualdad_de_género,A,"El Estado debe eliminar toda práctica que implique una discriminación arbitraria basada en el género. Principalmente las que se relacionan con la disparidad de salarios y costos en los planes de salud públicos y privados. Es deber del Estado impulsar políticas públicas que incentiven la equidad de género, haciéndose cargo de las diferencias propias que caracterizan a hombres y mujeres."
5548,2,igualdad_de_género,P,"Se está de acuerdo con la importancia de este derecho. Pero se considera igualmente importante el Derecho a la no discriminación por sexo, género, clase social, y pertenencia a un pueblo indígena."
5551,2,igualdad_de_género,P,"Derechos básicos y no disasociables, constituyen un todo con los mas abajo mencionados"
5555,2,igualdad_de_género,A,Porque es un derecho de todos y todas ser tratados igualmente ante la ley y que no existan diferencias valóricas hacia hombres y mujeres.
5557,2,igualdad_de_género,A,Que sea un derecho constitucional en la política y en lo salarial
5563,2,igualdad_de_género,A,Todos somos iguales y distintos a la vez
5589,2,igualdad_de_género,A,_Salario equitativo _No discriminación _Igualdad de carga laboral
5591,2,igualdad_de_género,A,Para que la constitución resguarde la igualdad y el respeto. Para romper con el paradigma del sistema patriarcal en la sociedad.
5628,2,igualdad_de_género,A,Porque se debe respetar la individualidad de cada ser humano
5634,2,igualdad_de_género,A,"Que el estado garantice que hombres y mujer tengamos la misma posibilidad de desarrollo.  Es obligatorio asumir políticas públicas que alivien la carga que significan los hijos, hoy sólo en las espaldas de las mujeres.  Además de fomentar participación en puestos de poder e igualdad de salarios."
5673,2,igualdad_de_género,A,que seamos tratados en todos los ambitos de igual a igual Hombre Mujer
5685,2,igualdad_de_género,A,"La igualdad de género logrará construir una sociedad más justa y equitativa, fortaleciendo nuestra democracia comprendiendo nuestras diferencias."
5711,2,igualdad_de_género,A,Garantizar igualdad y equidad de géneros.
5718,2,igualdad_de_género,A,Es deber del Estado resguardar los D° de la mujer y deberia ser equidad en vez de igualdad
5734,2,igualdad_de_género,A,"Creación de políticas públicas que garantices la igualdad de género, la erradicación del patriarcado y mirada machista."
5748,2,igualdad_de_género,A,No diferenciar en los trabajos los cargos. Sueldos justos e iguales.
5751,2,igualdad_de_género,A,La Constitución garantice la equidad de género en todo ámbito.
5771,2,igualdad_de_género,A,A
5774,2,igualdad_de_género,A,"nos basaremos en que TODOS SOMOS IGUALES, por ende debe de ser que las personas que eligen relacionarse con personas de su mismo sexo (homosexuales), tienen los mismos derechos que los (heterosexuales). Por ende deben de ser juzgado como tal"
5779,2,igualdad_de_género,A,pluralidad
5801,2,igualdad_de_género,A,"DEBE ESTAR GARANTIZADO COMO BASE SOCIAL Y CULTURAL.  OPORTUNIDADES EQUITATIVAS  PARA DESARROLLARSE COMO PERSONAS IGUALES EN UNA SOCIEDAD CONSCIENTE SUS ATRIBUCIONES, APTITUDES, Y CARACTERÍSTICAS PARTICULARES , SIN DISCRIMINACIÓN POR SEXO."
5804,2,igualdad_de_género,A,Porque hombres y mujeres son seres humanos y deben tener los mismos derechos; ninguno es más que el otro.
5806,2,igualdad_de_género,A,"El hombre y la mujer son iguales ante la ley , por lo cual basta ya que la mujer , sea humillada , con bajos sueldos y de bajos poderes administrativos."
5824,2,igualdad_de_género,A,"tanto hombres como mujeres deberían tener los mismos derechos, deberes y oportunidades. También se debiera contemplar salarios equitativos entre hombres y mujeres al igual que las pensiones."
5843,2,igualdad_de_género,A,"derecho fundamental basado en e respeto, no discriminacion y la igualdad entre hombres y mujeres."
5877,2,igualdad_de_género,P,Los hombres adultos del grupo consideran que no necesariamente somos iguales. Sin embargo las mujeres establecen que es necesario que se reconozca que todos somos igualmente capaces y meremos ser tratados como iguales.
5886,2,igualdad_de_género,A,"LAS MUJERES Y HOMBRES NOS REGIMOS BAJO LAS  MISMAS LEYES, PERO LAS LEYES NO SON IGUALES PARA LOS DOS SEXOS. EJEMPLO, DIFERENCIA EN EL SUELDO, PARA UN MISMO TRABAJO."
5895,2,igualdad_de_género,A,"-Se acoge como d° que debe designarse tanto en los derechos (salario y postnatal), responsabilidades y educación entre hombres y mujeres. -Va relacionado con un cambio cultural -Que se garantice de forma material. -Debe derogarse figuras legales obsoletas"
5919,2,igualdad_de_género,A,que se acepten las condiciones sexuales  de las personas
5921,2,igualdad_de_género,A,"Se reconocen las diferentes identidades en el marco de la igualdad de género. Promover políticas públicas para mejorar el acceso a salud, protección social.  Derecho a políticas igualitarias para el posnatal, igualdad en remuneraciones, libre de discriminación y acoso sexual callejero y aborto libre"
5942,2,igualdad_de_género,A,Mayor respeto para las mujeres y más oportunidades
5959,2,igualdad_de_género,P,"Implica el reconocimiento como ser humano sin diferencias por género, es también entendido como libertad de género, diversidad y trato igualitario"
5960,2,igualdad_de_género,A,Hombres y mujeres aportamos por iguales al desarrollo del país y de la sociedad
5961,2,igualdad_de_género,A,Porque las mujeres y los hombres tenemos los mismos derechos.
5962,2,igualdad_de_género,A,Las mujeres deben tener los mismos derechos que los hombres para todo asunto.
5975,2,igualdad_de_género,A,En nuestra sociedad actual se debe aceptar las opciones sexuales tanto de hombres y mujeres
5984,2,igualdad_de_género,A,Debe resguardad la igualdad de género entre quienes se identifiquen con un género más allá de lo Heteronormativo
5993,2,igualdad_de_género,A,"Por visión de que el hombre es maltratador y hace daño, y eso no siempre es así."
6008,2,igualdad_de_género,A,"La nueva constitución debiera garantizar la igualdad en derechos, deberes y oportunidades de desarrollo para todos los habitantes independientemente de su sexo e identidad de genero."
6021,2,igualdad_de_género,A,es muy relavantes que las mujeres y los hombres tengan las mismas oportunidades
6030,2,igualdad_de_género,A,Todos somos iguales. En Chile no hay igualdad entre hombres y mujeres
6032,2,igualdad_de_género,P,aceptarnos en todos los lugares.
6046,2,igualdad_de_género,A,"- Incluir y respetar diferencias de sexo, género e identidad sexual."
6074,2,igualdad_de_género,A,mujeres y hombres deben gozar de los mismos derechos siempre.
6085,2,igualdad_de_género,A,"Igualdad en deberes, derechos, salario, cargos en trabajo y en la familia"
6123,2,igualdad_de_género,A,"Que todas las personas sean iguales y además, tengas la misma oportunidad de acceso en la salud, trabajo, salario, etc. Ya que se ve una diferencia notoria en los salarios entre hombres y mujeres, etc."
6142,2,igualdad_de_género,A,"Romper con los roles de género de antaño. Debemos establecer que todos somos iguales. Hay que incluir el tercer sexo (homosexualidad). No existe una representación para las minorías sexuales. La homosexualidad es un fenómeno natural, por tanto objeto de derecho y eso debe estar en la constitución."
6157,2,igualdad_de_género,A,Obligaría a la ley a abandonrar sus posturas machistas
6181,2,igualdad_de_género,A,"Igualdad laboral; No discriminación en ningún ámbito; Reconocimiento de las distintas identidades de género; Enfoque de género en el sistema educacional; Antipatriarcal, antimachista y no sexista."
6192,2,igualdad_de_género,A,"La constitución hablara de equidad de genero. Se debe reconocer a la mujer como eje fundamental de la sociedad, igualar su condición social, laboral , etc. La constitución velara y protegerá toda diversidad de genero."
6199,2,igualdad_de_género,D,"Se debe considerar debido a que no hay conciencia en algunas personas respecto de su valor e importancia. que ambos sexos tengan iguales derechos laborales,igual trato.Considerarla como derechos igualitarios y no como una forma de  promocionar los derechos de las mujeres(tenencias de hijos) sueldo"
6220,2,igualdad_de_género,A,"Acción afirmativa (cuotas), inclusión de todas las formas de género y conciliación para la vida familiar de hombres y mujeres."
6224,2,igualdad_de_género,A,que no exista diferencia por genero y se establezca igualdad de derechos para los generos.
6230,2,igualdad_de_género,A,"El género no sea jerarquizable. Aumentar los múltiples expresiones de género sin excepción. No realizar diferencias en términos de género, ya sea un acceso a derechos laborales, de salud o educación"
6238,2,igualdad_de_género,P,"Reconocer, promover y valorar la diversidad. La diversidad de género es bidireccional, co responsabilidad entre hombres y mujeres. No puede la ley en ningun caso atentar contra dicha igualdad, reconociendo y valorando sus diferencias."
6262,2,igualdad_de_género,A,el estado deberia garantizar oportunidades trato y derechos de todos los ciudadanos
6265,2,igualdad_de_género,A,Mujeres y hombres deben tener igualdad de derechos y deberes.
6273,2,igualdad_de_género,A,Hombres y mujeres iguales en todas las actividades que desarrollemos
6275,1,igualdad_de_género,P,"No es equidad, no es una política pública, debe estar en la base de nuestra institucionalidad"
6297,2,igualdad_de_género,A,"iguales derechos a hombres y mujeres, sin discriminacion, en trabajo, estudio, salud, valorando las diferencias"
6300,2,igualdad_de_género,A,"Cada uno de estos derechos es inherente al ser humano, por el sòlo hecho de serlo, no es posible excluir ninguno, por lo tanto, el enunciar solo 7 debe ser sòlo un ejercicio y bajo ningún punto de vista excluyente los restantes."
6316,2,igualdad_de_género,A,Los hombres y mujeres somos iguales en derechos y deberes
6338,2,igualdad_de_género,P,"Respeto mutuo No discriminación por edad, sexo condición, salario."
6339,2,igualdad_de_género,A,asegurar las oportunidades independiente del genero y orientación sexual de las personas.
6349,2,igualdad_de_género,A,Creemos que se debe garantizar un buen trato y respeto a las minorías sexuales. No es justo que se respete después de una tragedia.
6360,2,igualdad_de_género,A,A
6369,2,igualdad_de_género,A,Igualdad de sueldos y acceso al trabajo. Iguales beneficios
6410,2,igualdad_de_género,A,"Todos los seres humanos somos iguales, por lo que debemos tener los mismos derechos y oportunidades. Proteger y defender especialmente los derechos de aquellos géneros que se encuentran en desventaja actualmente, es un paso fundamental para tener una sociedad más igualitaria."
6430,2,igualdad_de_género,P,No debe existir discrimación por género sea cual sea éste.
6447,2,igualdad_de_género,A,discriminación por ser transexual o algo similar
6480,2,igualdad_de_género,A,"A IGUAL TRABAJO,  IGUAL SALARIO"
6493,2,igualdad_de_género,A,"la constitución debe ser explícita en declarar que garantiza este derecho, tanto en lo productivo, en lo reproductivo, en lo político y en lo social."
6507,2,igualdad_de_género,A,El genero de cada ser humano no puede ser un condicionante de su trato
6515,2,igualdad_de_género,P,El Estado debe tener un rol activo en combatir la desigualdad de género
6518,2,igualdad_de_género,A,NO MÁS VIOLENCIA CONTRA LA MUJER. que el ministerio proteja verdaderamente los derechos de la mujer.
6535,2,igualdad_de_género,A,Demandamos una sociedad consciente de la dominación del patriarcado a nivel social e individual. Salarios y oportunidades laborales equivalentes para ambos géneros. La condición femenina  debe dejar de significar un menoscabo en la atención de salud.
6538,2,igualdad_de_género,P,"Superar todos los aspectos que ven a la mujer en un nivel inferior y respetar aquello que dice “a igual trabajo, igual salario”"
6549,2,igualdad_de_género,A,Que el acceso a todo tipo de cargos sea equitativo.
6552,2,igualdad_de_género,A,Que las mujeres tengan derecho a un salario igualitario  al de los hombres y no ser discriminadas  ante funciones laborales.
6567,2,igualdad_de_género,A,"Históricamente vulnerado y omitido en su particularidad bajo el argumento de estar contenido en otros Derechos generales, ha llevado a su vulneración trayendo como consecuencia una profunda inequidad."
6580,2,igualdad_de_género,A,Se les da muy poco espacio a la mujer para que se desarrolle libremente en la sociedad ya que este es una pais machista. El cual se dedica a cerrarle las puertas a las mujeres.
6586,2,igualdad_de_género,A,Hombres y mujeres deben estar en igualdad de condiciones
6605,2,igualdad_de_género,A,Que las mujeres tengan los mismos derechos.
6607,2,igualdad_de_género,A,"Laboral, social, que nos respeten"
6661,2,igualdad_de_género,A,Que tanto hombres y mujeres tengan igualdad en todo ámbito.
6688,2,igualdad_de_género,A,La Constitución debe abogar por equilibrar las relaciones (en términos de condiciones) entre hombres y mujeres.
6708,2,igualdad_de_género,A,"Que exista igualdad, no sólo se enfoque en la mujer. Que no se hagan distinciones, ni siquiera ante la ley."
6735,2,igualdad_de_género,A,"Derecho al mismo trato, al mismo salario (según oficio o profesión), al reconocimiento social, de acceso a los cargos públicos o en instituciones y empresas. Sin discriminaciones de ningún tipo, ni positivas ni negativas.  Donde la condición de mujer no sea obstáculo ni impedimento, ni motivo de tr"
6754,2,igualdad_de_género,A,"La discusión no solo debe abordarse en el ámbito económico cuando se hable de igualdad de género y es por esto que este derecho debe abarcar todo lo relacionado con los hombre y mujeres, su convivencia social, su educación, su crianza, entre otras cosas, es por esto que se deben brindar las mismas"
6779,2,igualdad_de_género,A,"Se debe consagrar la igualdad a la salud, a salario, al acceso al trabajo, a las oportunidades de desarrollo personal, entre otros muchos temas."
6786,2,igualdad_de_género,A,"igualdad de condiciones, mas oportunidades para mujeres."
6798,2,igualdad_de_género,A,Que en la constitución se hable de hombres y mujeres. Igualdad salarial entre hombres y mujeres.
6816,2,igualdad_de_género,A,"Integridad y tolerancia, respeto. Diversidad cultural."
6849,2,igualdad_de_género,A,Derechos y deberes de género e identidad de género deben ser igualitarios para todos.
6882,2,igualdad_de_género,A,Mayor valoración de la mujer en igualdad con el hombre.
6885,2,igualdad_de_género,A,Todos.tenemos.los.mismos.derechos.y.deberes.
6903,2,igualdad_de_género,A,ASEGURAR IGUALDAD EN EL ACCESO A SERVICIOS E INSTITUCIONES. PROMOVER LA IGUALDAD EN CUANTO A REMUNERACIONES POR IGUAL TRABAJO Y PROFESIONES
6923,2,igualdad_de_género,P,tanto hombres como mujeres debemos tener los mismos beneficios y derechos
6932,2,igualdad_de_género,A,"- AQUELLO QUE ES EXIGIDO POR LA SOCIEDAD, ESTADO Y CIUDADANOS - HAY QUE PROMOVER EL RESPETO DE LOS DERECHOS HUMANOS"
6970,2,igualdad_de_género,A,Tener igualdad de genero entre hombres y mujeres para cargos públicos.
6975,2,igualdad_de_género,A,Todos tenemos las mismas capacidades
7026,2,igualdad_de_género,A,Mismos derechos a expresarse y oportunidades sociales sin discriminación.
7045,2,igualdad_de_género,A,Trato igualitario entre hombres y mujeres.
7059,2,igualdad_de_género,A,que el genero ni la identidad sexual sean factores de discriminacion
7068,2,igualdad_de_género,A,"Dar oportunidad reales y efectivas a hombres y mujeres, gozar de los mismos derechos y libertades, poder acceder a cargos Públicos y Privados por Capacidades"
7072,2,igualdad_de_género,A,"Es necesario terminar con los abusos, el Estado debe garantizar la igualdad de género, hoy podemos afirmar con gran determinación que no existen diferencias entre  distintos géneros."
7137,2,igualdad_de_género,A,"Igualdad de género debe ser un derecho constitucional, igualdad entre los sujetos, igualdad ante cualquier derecho y obligación."
7147,2,igualdad_de_género,A,Punto recalcado como importante durante toda la discusión.
7202,2,igualdad_de_género,A,"Las personas tienen los mismo derechos independiente de su sexo, las oportunidades existentes deben  repartirse de manera justa entre hombres y mujeres."
7210,2,igualdad_de_género,A,"El principio de igualdad supone la no discriminación. La igualdad de género contribuiría a que otros grupos tengan un mayor bienestar. Se piensa desde una perspectiva relacional, inclusiva porque es importante reconocer la identidad de género no sólo involucra a las mujeres, sino con la sociedad"
7212,2,igualdad_de_género,A,TODOS MERECEMOS TENER LAS MISMAS OPORTUNIDADES Y EN LAS MISMAS CONDICIONES
7214,2,igualdad_de_género,P,"La mayoría señala que es un valor que debería estar consagrada en la Carta Fundamental, pero otros integrantes señalan que no es necesario."
7217,2,igualdad_de_género,A,legislar para que en ejercicio de un mismo cargo haya igualdad de remuneraciones . que las isapres no discriminen a las mujeres haciendo mayores descuentos cuando estan en edad fertil
7226,2,igualdad_de_género,A,"La constitución debe ser una herramienta que sirva a la tarea de lograr la igualdad de genero, que las mujeres se sientan protegidas, que se termine con la brecha salarial, con la baja participación e inclusión en la política, el respeto a sus derechos sexuales y reproductivos."
7231,2,igualdad_de_género,A,"Porque es necesario que la igualdad de género se concrete por medio de políticas de Estado en todos los ámbitos: salud, educación, ingreso, derechos, etc."
7267,2,igualdad_de_género,A,Mejores Garantías.
7287,2,igualdad_de_género,A,Equidad para todos/as Respeto a la dicersidad Autonomia en decisiones valoricas No discriminacion
7292,2,igualdad_de_género,A,Derecho a la no discriminación e igualdad ante la ley
7297,2,igualdad_de_género,A,Alcanzó 8 votos de 13 participantes. Cada participante votó por 7 Derechos que consideró más importantes de tener presencia en la Constitución.
7300,2,igualdad_de_género,D,"Trato igualitario y sin discriminación de todas las personas independiente de su género o sexo. No se trata de desdibujar roles natural, como por ejemplo la maternidad, pero es fundamental para que tengamos trato igualitario en todos los derechos."
7310,2,igualdad_de_género,A,Priorizado
7348,2,igualdad_de_género,A,"El Estado debe asegurar a todas las personas los mismos derechos y ademas adoptar medidas especiales para que los que están en situación de desventaja puedan gozar plenamente de sus derecho.Lo anterior no va contra la igualdad de genero, sino que lo refuerza."
7357,2,igualdad_de_género,A,En Chile en este momento es un gran tema
7391,2,igualdad_de_género,A,Existe mucha desigualdad de genero y el estado debe generar los mecanismos para revertir esta situación.
7393,2,igualdad_de_género,A,En concordancia con equidad de género como principio.
7427,2,igualdad_de_género,A,"Lo mismo que un principio, quisiéramos que se reivindique la figura de la mujer en toda su dimension"
7429,2,igualdad_de_género,A,Salario equitativo Igualdad en las leyes
7462,2,igualdad_de_género,A,"La mujer debe tener los mismos derechos que el hombre ante la ley, igualdad de oportunidades, igualdad de remuneraciones"
7471,2,igualdad_de_género,A,"Debe existir un trato igualitario en el trabajo, en la familia, en las instituciones."
7485,2,igualdad_de_género,A,solucionar un problema cultural
7492,2,igualdad_de_género,A,HOMBRES Y MUJERES DEBEN TENER LAS MISMAS  OPORTUNIDADES Y DERECHOS
7503,2,igualdad_de_género,A,"Reconocer y promover los mismos derechos a hombres y mujeres en la familia, el trabajo, la justicia, la sociedad en general."
7509,2,igualdad_de_género,A,"Que no haya diferencias entre hombres y mujeres , que sean mirados de la misma manera , ya que tienen las mismas capacidades"
7515,1,igualdad_de_género,A,"Todos los seres humanos son iguales en derechos y oportunidades. La discriminación de género, raza, social es la negación de la democracia."
7585,2,igualdad_de_género,A,"Igualdad, equidad, identidad de genero... reconocer y valorar la multiplicidad de los géneros"
7587,2,igualdad_de_género,A,"No más segregación de la mujer con respecto del hombre (salarios, etapa fértil, labores domésticas). A igual educación igualdad de salarios y puestos laborales."
7591,2,igualdad_de_género,A,vea documento adjunto
7606,2,igualdad_de_género,A,"que los sueldos sean igualitarios en el género e igual en la sociedad, justicia educación."
7615,2,igualdad_de_género,A,En el sector cooperativo este es  un derecho que está consagrado desde sus orígenes.
7620,2,igualdad_de_género,A,"igualdad en las oportunidades y acceso en todo ámbito. Respeto, tolerancia y educación en torno a la equidad de género"
7621,2,igualdad_de_género,A,Se debe asegurar la diversidad de género y que todos estos deben tener los mismos derechos y deberes. Significa un cambio en el sistema cultural y económico que no haga diferencias ni discriminación según el género. Debe ser asegurado y promovido desde el Estado.
7626,2,igualdad_de_género,A,Que se promueva la igualdad y la equidad de género.
7648,2,igualdad_de_género,A,"La inclusión e integración de todas las formas de vida existentes, sin diferenciaciones de clase, religión, sexo u otras, potencia el desarrollo de nuevas culturas y formas de pensar. Y justamente esa diversidad es la que nos hace evolucionar."
7674,2,igualdad_de_género,A,No se debe discriminar a nadie.
7675,2,igualdad_de_género,A,"Es necesaria la no discriminación por género, como también garantizar los derechos individuales de la mujer, como ejemplo los derechos reproductivos."
7715,2,igualdad_de_género,A,"Justicia e igualdad social entre hombres y mujeres, dejando de lado la discriminación y promover la igualdad de oportunidades. Roles deben ser compartidos y también considerar el rol paterno igual de importante que el de la madre."
7733,2,igualdad_de_género,A,se requiere asegurar la equidad constitucionalmente
7750,2,igualdad_de_género,A,"Igualdad para todos, oportunidades, laboral, educación."
7763,2,igualdad_de_género,A,Chile necesita avanzar en esta materia para saldar una deuda histórica con sus mujeres
7764,2,igualdad_de_género,P,"mismos derechos para hombres y para mujeres, igualdad salarial y un sistema de educación basado en el feminismo."
7797,2,igualdad_de_género,A,"Aspiramos que en el siglo XXI efectivamente las mujeres podamos concretar igualdad en el trabajo, suelos y oportunidades, sin que el embarazo sea un antecedente para que seamos menos consideradas que los varones."
7801,2,igualdad_de_género,A,Igualdad de derechos sin importar naturaleza sexual y/o género
7826,2,igualdad_de_género,A,"El Estado debe garantizar la igualdad entre mujeres y hombres y establecer los mecanismos necesarios para el logro de la misma, a través de acciones afirmativas, medidas de corresponsabilidad."
7832,2,igualdad_de_género,A,Tener las mismas oportunidades
7875,2,igualdad_de_género,A,"en la comunicación, en el trato, el respeto, el trabajo y sueldo, existe mayor valoración del hombre"
7885,2,igualdad_de_género,A,"IGUALDAD EN EL TRATO DE LAS PERSONAS, INDISTINTAMENTE"
7892,2,igualdad_de_género,A,la igualdad de genero es basica para que todas y todos tengamos las mismas oportunidades para desarrollarnos en plenitud.
7927,2,igualdad_de_género,A,Apuntamos a la EQUIDAD de género como concepto más preciso.
7979,2,igualdad_de_género,A,HOMBRES Y MUJERES TENGAN LAS MISMAS OPORTUNIDADES
7987,2,igualdad_de_género,A,SIN DIFERENCIAS
7994,2,igualdad_de_género,A,Pertenecer a un género no puede significar la asignación de un rol o un trato diferente.
8013,2,igualdad_de_género,A,debe haber igualdad de genero entre hombre  mujer esta sociedad la formamos los dos seres.
8042,2,igualdad_de_género,P,Se deben estregar las mismas oportunidades a hombre y mujeres-
8068,2,igualdad_de_género,A,Porque todas las personas tienen derecho a elegir  su propia condición sexual
8103,2,igualdad_de_género,A,IGUALDAD EN EL SUELDO ENTRE HOMBRES Y MUJERES TODOS SOMOS IGUALES HOMBRES Y MUJERES
8118,2,igualdad_de_género,A,"se deben crear todos los mecanismos posibles y organismo, para que se respeto la igualdad de genero en su totalidad."
8125,2,igualdad_de_género,A,Entre hombres y mujeres y otros géneros posibles
8128,2,igualdad_de_género,A,"El Estado debe resguardar el derecho a la no violencia de género, no discriminación por género, como por ejemplo resguardando la equidad en salarios y garantizando la representatividad en instituciones públicas. Además generar políticas para su prevención"
8150,2,igualdad_de_género,A,"Que se garantice la igualdad de genero en todos los ámbitos y se penalice el no respeto a la igualdad de genero ademas que se establezca por Ley la equidad numérica en cargos públicos, sueldos y en beneficios generales, como por ejemplo fuero Paternal."
8218,2,igualdad_de_género,A,Tanto en los roles sociales como en el trabajo.
8250,2,igualdad_de_género,A,"Tanto hombre como mujer tienen las mismas capacidades para realizar cualquier tipo de actos, igualdad de derecho, expresión y sanción."
8254,2,igualdad_de_género,A,A la equidad de genero.que s erespeten y garanticen tratados internacionales del derecho a vivir sin violencias
8261,2,igualdad_de_género,A,Que seamos tratados todos iguales
8273,2,igualdad_de_género,A,El Estado debe garantizar que hombres y mujeres tengan los mismos derechos y accesos de oportunidades.
8276,2,igualdad_de_género,A,Terminar con las diferencias salariales entre hombres y mujeres y con la discriminación en todas sus formas.
