idEla,tema,concepto,acuerdo,fundamento
2556,2,igualdad_de_género,A,"Desde pequeños se debe inculcar la igualdad de género, en todos los ámbitos y áreas, rechazando la violencia, discriminación y maltrato."
2586,2,igualdad_de_género,A,.
2588,2,igualdad_de_género,A,Hombres y mujeres deben ser tratados de la misma manera sin existir diferencias económicas y de trato ante el mismo puesto de trabajo
2626,2,igualdad_de_género,A,"Permite garantizar políticas pública, legislaciones y normas de convivencia en pos de la reivindicación de los derechos de género."
2665,2,igualdad_de_género,A,-Porque hay desigualdades que aún no se superan y desprotección por parte del estado a los grupos que sufren estas desigualdades.
2666,2,igualdad_de_género,A,Respeto entre hombres y mujeres
2691,2,igualdad_de_género,A,debemos seguir avanzando en la igualdad de genero m si bien hemos avanzado nos falta mucho para seguir trabajando hombres y mujeres debemos tener las mismas oportunidades
2725,2,igualdad_de_género,A,"En la práctica todavía persisten muchas desgiualdades entre hombres y mujeres, productos de siglos de dominación patriarcal. El Estado debe hacer todo su esfuerzo, a través de medidas afirmativas o de discriminación positiva, para combatir las desigualdades de una manera rápida y efectiva."
2743,2,igualdad_de_género,A,Hombres y mujeres debemos recibir el mismo trato
2747,2,igualdad_de_género,A,"representación de cargos de elección popular, gobierno y otras materias."
2754,2,igualdad_de_género,A,Queremos visibilizar este tema ya que estamos en una situación crítica de violencia de género hoy en día. Queremos igualdad de condiciones del desarrollo de la vida entre los géneros. Inclusión de la diversidad de género.
2758,2,igualdad_de_género,A,PARA QUE NO HAYA DISCRIMINACION ENTRE HOMBRES Y MUJERES
2759,2,igualdad_de_género,A,se toma mas en cuenta a la mujer en cumplir funciones al higual que un hombre como lo es hoy en dia madadana una mujer en el pais
2768,2,igualdad_de_género,A,Por Unanimidad.
2794,2,igualdad_de_género,A,todos somos iguales y tenemos derechos.
2811,2,igualdad_de_género,A,Es una equidad para una mejor sociedad.
2823,2,igualdad_de_género,A,Porque el género de los individuos no debe definir las posibilidades y derechos de estos.
2825,2,igualdad_de_género,A,LOS MISMOS SUELDOS PARA HOMBRES Y MUJERES
2828,2,igualdad_de_género,P,"Es necesario que el Estado protega y fomente la igualdad de las personas,  eliminando las brechas entre hombres y mujeres"
2834,2,igualdad_de_género,A,"El Estado debe segurar el termino de la discriminación laboral, social, política, etc, asegurando la equidad de género."
2836,2,igualdad_de_género,A,Debemos avanzar en construir una sociedad en que todos tengamos los mismos derechos y oportunidades
2840,2,igualdad_de_género,A,"Todas las personas, sin importar su genero tienen derecho a ser tratados de igual forma que todos"
2846,2,igualdad_de_género,P,"aquí se obtiene acuerdo parcial puesto que algunas participantes creen que chile es un país donde prima el matriarcado. De igual forma se señala que debe haber una actualización en la política de igualdad de género, la cual debe ser inclusiva."
2863,2,igualdad_de_género,A,"Igualdad para ambos hombre y mujer, en todo porque a la mujer durante mucho tiempo se le ha menos preciado y bajado de rango en comparación al hombre."
2896,2,igualdad_de_género,A,"Entendido como un derecho que debe ser igual entre hombre y mujeres, y que en esta busqueda no se agrande la brecha de diferencias. Igualdad de genero es pre y post natal paralelo para hombres y mujeres, es asumir que un golpe venga de donde venga es violencia que no corresponde etc."
2911,2,igualdad_de_género,A,Los mismos derechos y responsabilidades para hombres y mujeres.
2940,2,igualdad_de_género,A,igualdad en todos los niveles para hombres y mujeres
2948,2,igualdad_de_género,A,Debería haber derechos y deberes tanto como hombres y mujeres mientras la mujer pueda realizar esto.
2974,2,igualdad_de_género,A,Acuerdo de la asamblea
3006,2,igualdad_de_género,A,"Entendiendo género como un concepto abierto. Los derechos y deberes no deben diferenciarse si eres hombre, mujer, transgénero u otro"
3026,2,igualdad_de_género,A,A acceder a cargos máximos no importando el género Cuidado y educación de los hijos Derecho de cirugía para corrección de guatita delantal para madres con tres o mas hijos
3066,2,igualdad_de_género,A,Permitir la igualdad entre distintos géneros
3070,2,igualdad_de_género,A,"- Todo ciudadano, independiente de su genero, debe tener los mismo deberes y derechos."
3076,2,igualdad_de_género,A,"""BASTA DE ABUSOS, ES NECESARIO QUE EL ESTADO GARANTICE IGUALDAD ENTRE EL HOMBRE Y LA MUJER"" ""IGUALDAD DE SALARIO"""
3134,2,igualdad_de_género,A,"Garantizar que independientemente del género, todas las personas tenemos los mismos derechos. Al mismo tiempo garantizar el respeto a la identidad de género."
3136,2,igualdad_de_género,A,Creemos que el género no debe ser una limitante para las oportunidades integrales de desarrollarnos como personas.
3166,2,igualdad_de_género,A,"Hombres y mujeres dignos, iguales en cuanto a su capacidad física e intelectual. Igualdad en el trabajo, igualdad de oportunidades. Igualdad de remuneraciones."
3193,2,igualdad_de_género,P,"El debate se centro y fue amplio en este tema. Se esta de acuerdo en la igualkdad de genero en cuanto a las mujeres, pero con el ""tercer genero"" no, esto quiere decir que no deberian ser iguales en derechos de  adopcion, educacion y matrimonio la poblacion homosexual o transexual."
3207,2,igualdad_de_género,A,igualdad sustantiva entre hombres y mujeres. La desigualdad es violencia. Es necesario eliminar lo estereotipos en la educación y en los medios de comunicación.
3215,2,igualdad_de_género,A,que las leyes sean igual para hombres y mujeres y que a la mujer se le proteja del maltrato
3229,2,igualdad_de_género,P,"Igual trabajo, igual paga, beneficios y derechos."
3264,2,igualdad_de_género,A,"""Democracia en el país, y democracia en la casa"" simetría de derechos dentro de la familia erradicación de la violencia de género  es responsabilidad de hombres y mujeres"
3275,2,igualdad_de_género,A,Se debe reconocer la igualdad de todas las personas en cuanto a su identidad de género.
3278,2,igualdad_de_género,A,El respeto del hombre y la mujer sin diferencias. Porque hoy en día influye  la diferencia.
3296,2,igualdad_de_género,A,"Por el ser mujer no debe determinar ni discriminar ,en temas tan relevantes  como cuanto pago por un plan de salud, ni el sueldo que voy a recibir y tampoco perder oportunidades laborales."
3323,2,igualdad_de_género,A,"hombres, mujeres y diversidades tenemos los mismos derechos."
3328,2,igualdad_de_género,A,que sea parejo para ambos sexos
3334,2,igualdad_de_género,A,"concuerdan en que todos y todas tenemos los mismos derechos, aunque comentan que es poco considerado actualmente y solicitan que se hable y difunda mas sobre el tema"
3366,2,igualdad_de_género,A,todos de acuerdo.
3393,2,igualdad_de_género,A,sin discriminatorio
3409,2,igualdad_de_género,A,"Clave para construir un Estado Moderno, acorde con las necesidades actuales y con el deficit histórico."
3423,2,igualdad_de_género,A,hoy en día debemos respetar las distintas opciones sexuales y de familia que constituyen nuestra sociedad
3455,2,igualdad_de_género,A,"Tenemos que incluir en la Constitución los Derechos Sexuales y Reproductivos, Derecho a una Vida Libre y sin Violencia,<Derecho a la Participación Social y Política de las la Mujeres, Derechos sociales, etc."
3458,2,igualdad_de_género,A,Igualdad de oportunidades sin distinción de género.
3461,2,igualdad_de_género,P,LAS PERSONAS DEBEN SER TRATADAS DIGNAMENTE SEGUN SEAN SUS                OPCIONES LAS CUALES SON PERSONALÍSIMAS.
3485,2,igualdad_de_género,A,El Estado debe impulsar medidas positivas que eliminen la discriminación por género en todas sus formas.
3487,2,igualdad_de_género,A,que seamos tratados con la misma dignidad y los mismos derechos
3523,2,igualdad_de_género,P,Porque existe mucha discriminación a las mujeres en el plano de trabajo y salud Existen diferencias notables en el área de trabajo entre hombres y mujeres.
3527,2,igualdad_de_género,P,una sociedad educada en sexualidad y afectividad
3528,2,igualdad_de_género,A,Sin igualdad de Género no hay verdadera democracia. La nueva constitución debe contemplarla
3542,2,igualdad_de_género,A,Tanto derechos y deberes deben ser iguales para hombres y mujeres.
3546,2,igualdad_de_género,A,Es una de las mayores brechas que existe en la sociedad chilena y debiera estar garantizada por la constitución
3573,2,igualdad_de_género,A,Igualdad en el trato y condiciones para ambos sexos.
3577,2,igualdad_de_género,A,Más allá de una moda.
3583,2,igualdad_de_género,A,Como el reconocimiento y equivalencia en materia social y legal respecto de los derechos entre diversos géneros.
3593,2,igualdad_de_género,A,Dada la constitución de la sociedad chilena es que la igualdad de género es fundamental. Igualdad para hombres y mujeres. Abarca también la equidad de salario. Protección física y psicológica. protección real y total mujer que sufre violencia intrafamiliar.
3598,2,igualdad_de_género,A,Igualdad entre hombres y mujeres en la REMUNERACIÓN.
3599,2,igualdad_de_género,A,Ambos generos tengan las mismas oportunidades en todo orden de cosas
3608,2,igualdad_de_género,A,Los mismos derechos para hombres y mujeres.
3671,2,igualdad_de_género,A,"4º Derecho. Todos, mujeres y hombres somos iguales en deberes y derechos"
3673,2,igualdad_de_género,A,Salarios equitativos. Basta de machismo y violencia hacia la mujer.
3686,2,igualdad_de_género,A,"que se cumpla el valor desde la base, legislando en relación a ello."
3702,2,igualdad_de_género,A,"Referido a la igualdad de oportunidades, trato y acceso entre hombres y mujeres."
3723,2,igualdad_de_género,A,"Salarios igualitarios.  Igualdad de condiciones para postular a cargos públicos.  Ejes culturales no sexistas (en la educación). Regulación en el trabajo. Maternidad compartida. Jubilación y Previsión igualitaria. >lenguaje inclusivo, eliminación de la publicidad sexista. Igualdad de derechos para comunidades minoritarias, lesbianas, gay y transexuales."
3725,2,igualdad_de_género,A,En todas las actividades y cargos.
3728,2,igualdad_de_género,A,"Es importante igualar condiciones, acceso y oportunidades entre todas las identidades de genero. Promoviendo la no violencia de genero y respetando todas las expresiones de éste."
3732,2,igualdad_de_género,A,Se debe asegurar que no existan brechas de ningún tipo que perjudiquen a uno u otro genero
3740,2,igualdad_de_género,A,Juzgar de la misma manera legalmente y no discriminar respecto al trabajo (sueldo y tipo de labor)
3766,2,igualdad_de_género,A,Un estado que se preocupe de la igualdad de genero.
3769,2,igualdad_de_género,A,"Que ambos géneros tengan las mismas oportunidades en todo ámbito, sin diferencias ni conflictos, ya que todos somos ciudadanos de la misma nación."
3817,2,igualdad_de_género,A,"No queremos más diferencias en sueldos, sistemas de salud, de previsión, no más abusos ni desmedros para mujeres. Un Eº que contemple la igualdad de género es un Eº que asegura un país más igualitario y menos discriminatorio."
3892,2,igualdad_de_género,A,"Sea posible que tanto la mujer como el hombre se les respete como tal, sin condicionar su genero."
3893,2,igualdad_de_género,A,"aspiración colectiva en la construcción, un país mejor"
3910,2,igualdad_de_género,A,Siendo todos iguales el estado debe garantizar el bienestar superior. Salir del patriarcado.
3944,2,igualdad_de_género,A,SÉPTIMA MÁS VOTADA
3947,2,igualdad_de_género,A,Que tanto hombres como mujeres tengan los mismos salarios.
3960,2,igualdad_de_género,A,"La palabra lo dice, igualdad de condiciones para todos y todas y cualquier condición sexual. Dº al respeto entre interespecies."
3977,2,igualdad_de_género,A,Especialmente en relacion al mercado laboral y el uso del tiempo.
3980,2,igualdad_de_género,A,"No existe entre mujeres y hombres acceso equitativo, ni ejercicio de derechos y oportunidades."
3991,2,igualdad_de_género,A,"Es un derecho que las mujeres y los hombres deben recibir los mismos beneficios, los mismos tratos, el mismo respeto, las mismas oportunidades, etc. esto nos hace ser iguales ante las leyes."
4025,2,igualdad_de_género,A,"Hombres y mujeres deben tener igual acceso a los mismos niveles  de poder en la econmìa, en la polìtica, cultura, y cualquier otro espacio de desarrollo.  El estado debe garantizar esta igualdad."
4042,2,igualdad_de_género,A,y no discriminacion
4061,2,igualdad_de_género,A,Todos somos iguales y tenemos derechos
4108,2,igualdad_de_género,A,Respeto a las personas como quieran vivir
4111,2,igualdad_de_género,A,.
4125,2,igualdad_de_género,A,"DEBE SER EN TODO SENTIDO, TRABAJO, SALUD, OPORTUNIDADES , IGUALDAD EN SUELDOS, EDUCACION, Y ENJ UNION CIVIL."
4146,2,igualdad_de_género,A,"Protección, respeto y dignificación de la mujer chilena. Igualdad en el trabajo. Igualdad en los salarios. Igualdad en el Senado, en la Cámara de Diputados y en toda representación popular."
4169,2,igualdad_de_género,A,TRATO IGUAL SIN IMPORTAR LAS OPCIONES SEXUALES
4197,2,igualdad_de_género,A,"hombres y mujeres deben estar en igualdad de condiciones bajo todo los aspecto. debemos contar con el mismo salario, debemos igualdad en todas las condiciones."
4199,2,igualdad_de_género,A,"La sociedad la hacen todos los géneros, por lo cual cada uno debe ser reconocido, respetado y no debe haber diferencias de trato, de derechos, ni discriminación para cada uno de ellos. Esto es clave para una coexistencia justa y pacífica."
4213,2,igualdad_de_género,A,"mismos derechos, mismas obligaciones, mismas oportunidades."
4231,2,igualdad_de_género,A,Garantizar los derechos a igualdad entre hombres y mujeres y otros géneros (otras diversidades)
4241,2,igualdad_de_género,A,"Somos todos iguales , por ende necesitamos trato igualitario."
4266,2,igualdad_de_género,A,"Hombres y mujeres respetados por igual, es de la esencia del respeto a la dignidad humana de cada uno, generando una visión en la cual cada miembro de la sociedad respeta a los demás y desempeña un papel que le permite aprovechar su potencial al máximo."
4267,2,igualdad_de_género,A,"Muy enmarcado en el contexto nacional, se le da importancia a este derecho por injusticias y discriminación que se están dando actualmente en el país. Va muy de la mano con el fundamento del valor de la igualdad."
4272,2,igualdad_de_género,D,mujeres no deben ser discriminadas. Desacuerdo Discrepancias indican que la nueva constitución debe ofrecer los mismos derechos sin discriminación de género
4275,2,igualdad_de_género,A,Es importante poder considerar la igualdad de género como un derecho fundamental de los ciudadanos y ciudadanas de nuestro país. Se enfatiza en la necesidad de la igualdad de derechos y condiciones tanto para el hombre pero por sobre todo a la mujer por su condición de madre.
4283,2,igualdad_de_género,A,"TODOS, HOMBRES Y MUJERES DEBEMOS TENER LAS MISMAS OPORTUNIDADES."
4294,2,igualdad_de_género,A,LAS MUJERES MERECEN EL MISMO TRATO QUE LOS HOMBRES
4297,2,igualdad_de_género,A,tanto hombres como mujeres deben tener los mismos derechos y no debe haber discriminacion
4373,1,igualdad_de_género,A,Equidad de género en derechos y deberes
4373,2,igualdad_de_género,A,POR QUE LOS HOMBRES Y MUJERES SOMOS IGUALES EN SOCIEDAD
4383,2,igualdad_de_género,A,10 integrantes manifiestan su acuerdo en este derecho
4396,2,igualdad_de_género,P,Algunos participantes plantean que éste derecho debe estar incluido en el derecho a la no discriminacion. Pero la mayoría opina que es importante y que debe ser considerado como reconocimiento a los derechos de las mujeres y equidad de genero como esencial en esta época.
4440,2,igualdad_de_género,A,No a la discriminación. Todos y todas pueden acceder a los mismos cargos sin distinción de sexo.
4460,2,igualdad_de_género,A,"Se  consensuó la  necesidad de instalar especialmente en el aparato público la equidad de género para que no exista tanta discriminación en sueldos, cargos y responsabilidades.  Se mencionó la responsabilidad de los partidos políticos en la designación de los candidatos en general."
4494,2,igualdad_de_género,A,"Todos somos iguales en derechos, deberes y responsabilidades ante la ley."
4497,2,igualdad_de_género,A,que promueva la protección
4501,2,igualdad_de_género,A,"que tengamos igual participación, oportunidades, deberes o derechos sin que se condicione el género"
4506,2,igualdad_de_género,A,"basta de discriminación y abuso de genero en los diversos ámbitos, laborales, educativos, hogar, etc."
4523,2,igualdad_de_género,A,Es poder vernos a los ojos y saber que tenemos los mismos derechos.
4538,2,igualdad_de_género,P,Se destaca la desigualdad entre los salarios y problemas de seguridad que se dan por violencia de género.
4542,2,igualdad_de_género,A,MISMAS POSIBILIDADES DE DESARROLLO PARA EL HOMBRE Y LA MUJER
4561,2,igualdad_de_género,A,como forma de ejercer la igualdad de derechos entre  los géneros y como forma de ejercer la paridad de representación.
4566,2,igualdad_de_género,A,"Derecho que permite realizar la igualdad genérica, la equidad y la justicia; garantizando una plena integración de los ciudadanos y ciudadanas."
4572,2,igualdad_de_género,A,"Equidad en el trato, remuneración, acceso."
4595,2,igualdad_de_género,A,"lograra la igualdad a través de la equidad cumpliendo  los tratados internacionales, y garantizando el derecho a vivir sin violencias"
4618,2,igualdad_de_género,A,Porque somos todos iguales
4626,2,igualdad_de_género,A,"Que el hombre y la mujer gocen de los mismos derechos. Que el estado promueva  e impulse la eliminación de las desventajas existentes, en todo orden normativo e institucional."
4645,2,igualdad_de_género,A,Derecho a no ser discriminado por tu género y acceso a los mismos derechos sin importar el género.
4650,2,igualdad_de_género,A,NO DISCRIMINAR POR GENERO
4654,2,igualdad_de_género,A,"MISMOS DERECHOS PARA TODOS, NO DESCRINAR POR SER MUJERES."
4659,2,igualdad_de_género,A,"Entendiendo género fuera de la lógica binaria, este derecho es necesario porque reivindica la convicción de que las personas merecemos un trato digno y las mismas oportunidades (educacionales, salariales, etc) sin importar nuestra identidad de género."
4671,2,igualdad_de_género,A,Que exista la misma oportunidad hombres y mujeres.(sueldos-oportunidades)
4703,2,igualdad_de_género,A,"Es necesario asegurar la equidad en las remuneraciones (ganar lo mismo), concebir géneros como sujetos de derecho. Esto implica limitar la cosificación."
4709,2,igualdad_de_género,A,no discriminación
4721,2,igualdad_de_género,A,Ambos géneros deben tener los mismos derechos y deberes
4742,2,igualdad_de_género,A,"Todos somos iguales ante la ley, es un deber garantizar la no discriminación de género de ningún tipo."
4768,2,igualdad_de_género,A,en todo tanto hombre como mujeres .
4798,2,igualdad_de_género,A,Fortalecer la institucionalidad estatal para equilibrar la participación de los ciudadanos y ciudadanas en la sociedad.
4799,2,igualdad_de_género,A,Tanto hombres como mujeres deben tener los mismos derechos para ser una sociedad igualitaria.
4810,2,igualdad_de_género,A,"Es importante que el trato y las reglas sea igual ante las mismas responsabilidades, (sentido amplio)."
4827,2,igualdad_de_género,A,"El Estado debe garantizar igualdad de derechos y oportunidades de desarrollo entre hombres y mujeres, eliminando la brecha salarial que hoy existe, entre otras situaciones similares"
4832,2,igualdad_de_género,A,Mismas oportunidades para todos
4857,2,igualdad_de_género,P,"creemos que mejor es el concepto es el derecho a la equidad de genero, y para aquello el estado debe disminuir las brechas de acceso al trabajo, la educación y  a la toma de decisiones de las mujeres, porque en este momento solo las poca que están son excepcionales, pero no es generalidad"
4858,2,igualdad_de_género,A,"es necesario que exista en todo ámbito trabajo, sueldo, educación, etc."
4873,2,igualdad_de_género,P,"todos tienen beneficios: vivienda, alimentación, educación, salud, y todos tienen derechos y obligaciones, acuerdo parcial de los asistentes"
4881,2,igualdad_de_género,A,Fundamentos en acta adjunta
4894,2,igualdad_de_género,A,"Se considera que a pesar de los esfuerzos y logros que se han adquirido, hay que continuar avanzando con la eliminación del  modelo patriarcal."
4909,2,igualdad_de_género,A,se debe garantizar este derecho
4924,2,igualdad_de_género,A,"Tanto hombres como mujeres tengan igualdad en el trabajo, en derechos."
4941,2,igualdad_de_género,A,Siendo personas todos somos sujetos de derecho  para la equidad de oportunidades y retribuciones.
4942,2,igualdad_de_género,A,-
4957,2,igualdad_de_género,A,Porque es esencial para el desarrollo de una sociedad humanitaria
4982,2,igualdad_de_género,A,"La Nueva Constitución debe establece, proteger y promover la igualdad a toda persona sin importarle su condición de sexo."
5003,2,igualdad_de_género,A,"La mujer no esta en igualdad con relación al hombre, ya que esta sociedad nos pagan menos por nuestro trabajo. Además cobran más por salud y pensiones."
5017,2,igualdad_de_género,A,La mujer y el hombre tienen los mismos derechos acorde a sus deberes.
5063,2,igualdad_de_género,A,"En necesario que no haya discriminación para una democracia sana y participativa, por ello, no deben existir diferencias de derechos entre ambos géneros (como la disminución de la mujer en el plano laboral), como tampoco privilegios (como las mujeres cuando tratan el tema de los hijos, discriminando a los hombres-padres) simplemente basados en el sexo de cada persona."
5084,2,igualdad_de_género,A,Control y el uso de los bienes y servicios de la sociedad que no allá discriminación entre  ambos sexos y que no se privilegie al hombre en ningún aspecto de la vida social.
5092,2,igualdad_de_género,P,"Sí porque todavía existen diferencias entre los derechos y deberes entre hombres y mujeres, diferencias de sueldo y condiciones de trabajo."
5125,2,igualdad_de_género,A,Que hombres y mujeres deben tener los mismos beneficios
5156,2,igualdad_de_género,A,Derecho unido al valor.
5177,2,igualdad_de_género,A,hombres y mujeres somos iguales no debe existir diferencias solo por ser hombre o mujer.
5179,2,igualdad_de_género,A,"se debe garantizar las condiciones que permitan la equidad de género, tal como la igualdad salarial, la no discriminación de la mujer y la igualdad de oportunidades para la mujer."
5205,2,igualdad_de_género,A,No por ser hombre o mujer tenemos más o menos capacidades.
5240,2,igualdad_de_género,A,Garantizar el trato en igualdad de condiciones para el hombre y la mujer.
5276,2,igualdad_de_género,A,"Mismos derechos para hombres y mujeres,"
5304,2,igualdad_de_género,A,y a la vida sin violencia.Mayor protección a las mujeres. Castigar adecuadamente la violencia de genero
5313,2,igualdad_de_género,A,Que el estado reconosca de manera equitativa condicion de la mujer en situacion contractual y laboral.
5336,2,igualdad_de_género,A,"es avanzar en sociedad, pues todos somos iguales, es avanzar a una sociedad mas equitativa"
5342,2,igualdad_de_género,A,este posibilitara la equidad en derechos para hombre y mujeres.
5350,2,igualdad_de_género,P,"Si bien las mujeres tienen mayor privilegio ante la ley, debiese ser igual para ambos sexos"
5354,2,igualdad_de_género,A,Velar por la igualdad de género es velar por la igualdad de derechos para una buena convivencia entre los seres humanos
5365,2,igualdad_de_género,A,Derecho debe ser garantizado constitucionalmente
5370,2,igualdad_de_género,A,se entienda en su sentido amplio que incluya derechos sexuales y reproductivos y bajo no concepcion binaria de género-
5405,2,igualdad_de_género,A,.
5416,2,igualdad_de_género,A,Fomentar la integración y el respeto de los derechos de la mujer y de las minorías sexuales. Reconocimiento legal de la Transexualidad.
5424,2,igualdad_de_género,A,"Tener que pedir la igualdad de género es algo que marca el retraso en que vive  la sociedad chilena.  La mujer no es considerada en igualdad de condiciones con el hombre. No se le da trabajo, reciben menos sueldos y no se considera su doble condición de madre y trabajadora; hasta la hacen sentir culpable por dejar los niños por ir a trabajar."
5438,2,igualdad_de_género,A,"Mismo trabajo, mismo sueldo."
5463,2,igualdad_de_género,A,Que las mujeres tengan las mismas oportunidades y que exista paridad de genero en el parlamento y servicios publicvos
5481,2,igualdad_de_género,A,DERECHO ALTAMENTE VALORADO POR LOS PARTICIPANTES
5493,2,igualdad_de_género,A,"Asamblea constituyente, ahora estamos solo en los discursos y no hay igualdad de genero, hombres y mujeres debieran estar en igualdad, ninguno por sobre el otro."
5504,2,igualdad_de_género,A,Es una forma de corregir la discriminación existente y el no cumplimiento de la igualdad ante la ley.
5528,2,igualdad_de_género,P,"En este punto hubo acuerdo parcial, algunos opinaron que el matrimonio debe ser entre un hombre y una mujer, otros, opinaron distinto."
5539,2,igualdad_de_género,A,Requisito básico para una sociedad igualitaria. La mitad de la población no puede ser tratada en forma distinta a la otra mitad
