idEla,tema,concepto,acuerdo,fundamento
14800,4,jefatura_de_gobierno,A,Escogimos esta institución ya que una jefatura de gobierno es totalmente importante que exista en un país para que pueda ser gobernado de una manera estructurada y bien organizada.
14843,4,jefatura_de_gobierno,A,"de acuerdo todos, es importante esta entidad que siga siendo república unitaria"
14863,4,jefatura_de_gobierno,A,Democrático y consensuado
14876,4,jefatura_de_gobierno,P,Poner en discusión régimen y migrar hacia uno menos presidencial.
14900,4,jefatura_de_gobierno,A,Que la ciudadanía pueda elegir libremente a su presidente
14943,4,jefatura_de_gobierno,P,para que el gobierno tenga un jefe y pueda mandar todo. respetar las leyes y a las personas.
14950,4,jefatura_de_gobierno,A,DIRECCION EJECUTIVA DEL ESTADO
15100,4,jefatura_de_gobierno,A,Autoridad que debe ceñirse a los controles de los ciudadanos
15233,4,jefatura_de_gobierno,A,"Creemos que es necesario que haya alguien que se haga responsable de la gestión diaria del Estado, que este a cargo de la parte interna y ejecute políticas con las leyes que se tienen que aplicar para dar equilibrio a las funciones a las distintas funciones dentro de la entidad."
15322,4,jefatura_de_gobierno,A,Todos los participantes concuerdan en la importancia de este concepto.
15368,4,jefatura_de_gobierno,A,Inevitablemente es una estructura fundacional
15435,4,jefatura_de_gobierno,A,Es importante y debe realizare bien su trabajo.
15491,4,jefatura_de_gobierno,A,"Una Presidencia, una República"
15519,4,jefatura_de_gobierno,A,Para el buen funcionamiento del país y de cada una de las carteras/instituciones/organizaciones.
15562,4,jefatura_de_gobierno,A,Hubo consenso en que esta institución debe estar presente en el debate al redactar la nueva constitución.
15657,4,jefatura_de_gobierno,A,.
15677,4,jefatura_de_gobierno,A,Los tres poderes deben estar definidos
15717,4,jefatura_de_gobierno,A,Creemos que todo gobierno debe tener un conductor que oriente sus pasos
15805,4,jefatura_de_gobierno,P,es quien nos representa como pais
15820,4,jefatura_de_gobierno,A,La Debe llevar el Presidente de la República.
15825,4,jefatura_de_gobierno,A,Se debe mantener el sistema o régimen de gobierno actual.
