idEla,tema,concepto,acuerdo,fundamento
5048,4,justicia_constitucional,A,Hay acuerdo en que debe existir pero debe asegurarse con que los jueces no tengan una marcada tendencia política que influya en sus fallos
5054,4,justicia_constitucional,A,para quien no cumpla la constitucion
5075,4,justicia_constitucional,A,El Tribunal Constitucional debería ser reemplazado por una institución más democrática con participación ciudadana. Evaluación cada 3 o cuatro años de la gestión de los integrantes del Tribunal Constitucional.
5086,4,justicia_constitucional,A,"Organismo técnico, descentralizado y autónomo, compuesto por expertos provenientes de la sociedad civil y/o academia, al servicio del legislativo, para adecuar las normas y leyes a la Constitución vigente."
5087,4,justicia_constitucional,A,sí
5092,4,justicia_constitucional,P,"QUE LOS ACUERDOS DEL PARLAMENTO , EN ESPECIAL LO LEGISLADO NO TENGA QUE PASAR POR EL TRIBUNAL CONSTITUCIONAL COMO ARBITRO DE LOS INTERESES DE LA DERECHA PINOCHETISTA."
5096,4,justicia_constitucional,P,"1. Siempre y cuando se modifique la esencia de la constitución, acogiendo el sentir ciudadano 2. Que la función del tribunal sea defender esa esencia."
5106,4,justicia_constitucional,A,"La constitución no debe discriminar, favoreciendo a determinados sectores sociales, ni en elecciones, ni en la economía, etc."
5107,4,justicia_constitucional,A,"Tener elementos claros para los que fueron elegidos por voto popular, puedan ser eliminados del cargo político."
5114,4,justicia_constitucional,A,"No debe haber nada que viole o pase a llevar la constitución, Es para todos."
5136,4,justicia_constitucional,A,Restringir el poder del Tribunal Constitucional a un organismo informante y no a un cuarto poder como en la actualidad
5190,4,justicia_constitucional,A,Es necesaria para el país.
5194,4,justicia_constitucional,A,Todos los cuidadanos deben ser jusgados por igual.
5212,4,justicia_constitucional,P,"Control, garantía, pero se debe revisar nombramiento e integración."
5261,4,justicia_constitucional,A,"El TC es necesario, pero hay que estudiar sus funciones y su integración. Puede ser  entendida como una cámara política y por ello, falto de legitimidad democrática. Lo más importante es que no puede intervenir en el proceso legislativo"
5305,4,justicia_constitucional,A,que exista realmente justicia igualitaria
5307,4,justicia_constitucional,A,"Porque alguien debe velar para que la constitución se lleve a cabo y se respete en su totalidad, es por eso que la tenemos."
5310,4,justicia_constitucional,A,SE DEBE PROTEGER SOBERANÍA POPULAR EXPRESADA EN CONSTITUCIÓN
5311,4,justicia_constitucional,A,"El Tribunal Constitucional, como parte de la justicia constitucional, es anti-democrático. Se propone como moción eliminarlo.  En su función actual, tiene un poder pre-legislativo.  Debe haber una fundamentación democrática a la justicia constitucional."
5316,4,justicia_constitucional,P,su participacion es fundamental por su acabado conocimiento de las leyes de la constitucion
5330,4,justicia_constitucional,A,Para hacer valer la constitución.
5351,4,justicia_constitucional,A,A cargo de una corte constitucional encargada de reconocer los recursos relacionados con los derechos consagrados y reconocidos por la Constitución.
5362,4,justicia_constitucional,D,hacer cumplir los derechos y deberes de nuestra constitución
5387,4,justicia_constitucional,A,"Se debe hacer cumplir la constitución, cueste lo que cueste. Porque al leer la constitución política de nuestro país, vemos un idealismo y utopía, que nunca ha podido llevarse a cabo."
5390,4,justicia_constitucional,A,"La constituciòn dbe ser justa con la mayoría, sobre todo con los trabajadores y trabajadoras. Con los pobres del campo y las ciudades."
5396,4,justicia_constitucional,P,No se entendio el concepto.
5416,4,justicia_constitucional,A,"Tribunal Constitucional con jueces de carrera, elegidos con independencia del poder político."
5433,4,justicia_constitucional,A,"Justicia electoral entrando como un valor de derecho y protección de las personas, pero debe ser para todos iguales, garantizar que efectivamente sea justicia."
5435,4,justicia_constitucional,A,"Debe haber un organismo, como el actual tribunal constitucional, pero mejorado (importante revisar como son electos los miembros de este tribunal), que vele por el cumplimiento de la Constitución. Es necesario para que la política no se cargue a ningún extremo."
5439,4,justicia_constitucional,A,Pleno acuerdo
5461,4,justicia_constitucional,A,Que resguarde la interpretacion y puesta en marcha de los principios constitucionales
5491,4,justicia_constitucional,P,Es necesario revisar la función.
5499,4,justicia_constitucional,A,Correcta interpretación de la constitución y las leyes
5522,4,justicia_constitucional,D,"En este punto no hubo acuerdo, ya que algunos asistentes sostuvieron que este tribunal entorpece la labor del país, duplicando su competencia jurídica con la del poder judicial, además de que en estos últimos años se ha politizado la elección de sus integrantes, lo que resta imparcialidad a sus decisiones, por lo que estimaron eliminar su existencia. Por otra parte, algunos creen que se debe objetivizar el proceso de elección de sus integrantes, pero que su función permanezca."
5536,4,justicia_constitucional,A,PARA HACER PREVALECER LEYES Y HAYA IGUALDAD PARA TGODOS
5553,4,justicia_constitucional,A,Votacion
5554,4,justicia_constitucional,D,Se propone la eliminacion del Tribunal Constitucional ; el control de la constitucionalidad lo ejercera la Corte Suprema
5563,4,justicia_constitucional,P,"Modificar el Tribunal Constitucional, que sean miembros elegidos por elección popular ""No puede ser que unas pocas personas tomen decisiones tan relevantes, sin representatividad"""
5567,4,justicia_constitucional,A,El Tribunal Constitucional tiene que ser el garante  final de que tanto el Congreso Nacional como la Presidencia de la República respeten la  Constitución. Sólo así se protegen los derechos de las personas.
5568,4,justicia_constitucional,A,Importante que siga existiendo como Tribunal Constitucional.
5570,4,justicia_constitucional,P,para que la justicia sea igual para todos
5591,4,justicia_constitucional,A,"En coherencia con el punto anterior, se entiende que la justicia constitucional implica el respeto de las normas y principios que regulan la convivencia cuidadana y el comportamiento de las instituciones."
5619,4,justicia_constitucional,A,Para que se haga valer la nueva constitución y que la justicia sea más equitativa
5622,4,justicia_constitucional,A,en absoluto acuerdo
5631,4,justicia_constitucional,A,Se necesita que alguien ejecute y haga que se cumpla lo que dicta la constitucion
5634,4,justicia_constitucional,P,Poner fin al Tribunal Constitucional que hoy opera como una tercera cámara.  Para la coordinación constitucional se puede dejar a la Corte Suprema o en el mismo congreso un equipo técnico (no político) que lo vigile.
5652,4,justicia_constitucional,P,"Sera quien mantenga en pie el cumplimiento lo que indique la constitución, de tal forma de que otras leyes no pasen por encima de ella."
5656,4,justicia_constitucional,A,Ella debe estar integrada por todos los magistrados de la corte suprema.
5659,4,justicia_constitucional,A,Limitar las facultades del tribunal constitucional a determinados temas.
5675,4,justicia_constitucional,A,Consenso
5711,4,justicia_constitucional,A,Que la constitución sea garante de justicia en todo ámbito.
5718,4,justicia_constitucional,A,Que la justicia sea respetada por todos sin excepción
5728,4,justicia_constitucional,A,Acuerdo General.
5735,4,justicia_constitucional,A,"Que se juzgue de acuerdo a la nueva constitución, igualdad para todos sin preferencia, Todos somos ciudadanos del mismo país."
5736,4,justicia_constitucional,A,Justicia constitucional: Asegurar procesos transparentes de creación y aplicación de leyes
5753,4,justicia_constitucional,A,"Los 7 puntos fueron seleccionados de la votación de todos, fueron los que sacaron mas votos"
5769,4,justicia_constitucional,A,"No parece mantener el actual tribunal Constitucional. debe regularse su composición, forma de designación (no política) de sus integrantes y los límites a sus funciones (no integradora del proceso de formación de la ley)."
5775,4,justicia_constitucional,D,"Creemos que la justicia constitucional, no permite generar legislaciones fuera de su rango, por lo que aceptamos que las discuciones no dependan de la constitución."
5792,4,justicia_constitucional,P,Se debe limitar las facultades reglamentarias del tribunal constitucional.
5795,4,justicia_constitucional,A,Queremos que nuestra constitución contemple y garantice justicia equitativa para todos.
5801,4,justicia_constitucional,P,"un organizamos que haga cumplir la constitución, debe ser un documento de fácil de  comprensión y ejes estratégicos claros."
5803,4,justicia_constitucional,A,"Justicia con penas y derechos incluidos en la constitución, restablecer la pena de muerte."
5804,4,justicia_constitucional,A,Es necesaria una entidad que asegure que las leyes emanadas de todos los poderes del estado sean acordes a los valores y principios consagrados en esta nueva constitución.
5813,4,justicia_constitucional,A,"La constitución nos garantice que el tribunal constitucional, la controlaría de la república y los tribunales superiores de justicia deben existir para cumplir su rol de fiscalizadores"
5833,4,justicia_constitucional,A,"Esta institución debe ser parte del poder judicial. Sus miembros se eligen con un procedimiento similar al de la corte suprema. El tribunal será integrado solo por méritos. Para todos los efectos se supedita a la Corte Suprema, ante quien se puede recurrir los fallos de éste."
5837,4,justicia_constitucional,A,"El respeto de las leyes, y no sólo estas, sino otras normas de inferior jerarquía, debe ser sometido a conocimiento de este tribunal especializado."
5845,4,justicia_constitucional,P,"Al hacer eso, ser parte de este proceso, muchos del grupo creen que es importante tener justicia constitucional, una vez que la constitución se haya re hecho por los ciudadanos."
5857,4,justicia_constitucional,A,4º PRIORIDAD
5875,4,justicia_constitucional,A,Sus miembros deberían ser designados democráticamente.
5890,4,justicia_constitucional,A,Es importante para proteger los principios de la nueva Constitución.
5919,4,justicia_constitucional,A,que se cumplan las leyes en igualdad para todos
5925,4,justicia_constitucional,P,"Para que la norma jurídica sea concebida desde la constitución, desde sud derechos, valores y pirncipios."
5942,4,justicia_constitucional,P,Que establezca de manera democrática lo que está dentro de la Constitución o no
5951,4,justicia_constitucional,A,DERECHOS Y DEBERES
5975,4,justicia_constitucional,A,Que se cumplan las leyes igualdad para todos
5978,4,justicia_constitucional,A,"QUE EL TRIBUNAL CONSTITUCIONAL ESTE COMPUESTO POR 7 MIEMBROS, QUE SEA DE ELECCION DEMOCRATICA Y NO ELECTA POR EL PODER JUDICIAL"
5985,4,justicia_constitucional,A,"Igualdad para todos, independiente de su cargo, raza o forma de pensar."
5988,4,justicia_constitucional,A,que se cumpla lo que esta escrito en ella
5991,4,justicia_constitucional,P,"Se deben hacer cumplir las leyes de la constitución, para cada ciudadano por igual, sin tratos especiales."
6011,4,justicia_constitucional,P,Reestudiar para darle mejor representatividad y determinar mejor sus funciones. Alguien que dirima adecuadamente controversias de poderes.
6023,4,justicia_constitucional,A,"Revocabilidad de sentencias, que conlleve a un plebiscito de reforma constitucional en el percepto en cuestión."
6032,4,justicia_constitucional,A,justicia para todos por igual.
6035,4,justicia_constitucional,A,"Que nuestra constitución sea justa, equitativa y participativa."
6050,4,justicia_constitucional,D,"Se debería eliminar o modificar su integración y facultades. lo anterior, debido a que son capaces de rechazar leyes redactadas por las personas que nosotros elegimos."
6068,4,justicia_constitucional,A,TRIBUNAL CONSTITUCIONAL.  Estamos totalmente de acuerdo con el órgano jurisdiccional ya existente en nuestro país.
6080,4,justicia_constitucional,A,"Eliminar el tribunal constitucional, no puede ser que un grupo de 10 personas decidan casi los destinos cuando se apela a ellos, desde sus propios valores y creencias."
6084,4,justicia_constitucional,P,Alguien (Institución) debe velar por funcionamiento de la Constitución.
6112,4,justicia_constitucional,A,"Consideramos que debe existir un organismo como este pero que no debe existir con las características de una tercera cámara, tal como existe hoy."
6115,4,justicia_constitucional,A,Nada ni nadie puede ir por sobre la Constitución
6133,4,justicia_constitucional,A,VELAR POR EL CUMPLIMIENTO DE LA CONSTITUCIÓN
6142,4,justicia_constitucional,A,"el TC debe ser únicamente para dirimir cuando hayan procesos anticonstitucionales en el desarrollo de una ley, no cuando una esté próxima a ser ley o se haya aprobado ya. El TC debe resolver en función del espíritu de la ley. Debe resguardar el curso del proceso legislativo"
6144,4,justicia_constitucional,A,Replantearse la existencia del tribunal constitucional y su funcion como practicamente una tercera camara legislativa
6179,4,justicia_constitucional,A,que se respeten las normas impuestas por la constitución
6181,4,justicia_constitucional,A,Dependencia del parlamento (responsabilidad política); Determina el verdadero sentido y alcance de la constitución; Fiscalización; Juicio Político.
6187,4,justicia_constitucional,A,Revisar la conformación y la organización del tribunal constitucional.
6191,4,justicia_constitucional,P,Se señala que debe haber mayor eficacia  y  transparencia  en la justicia constitucional
6193,4,justicia_constitucional,A,"Entre muchos problemas con el actual tribunal constitucional estimamos que deben modificarse principalmente: El número de miembros que lo conforman, que debe ser impar y evitar que el presidente del tribunal sea así quien decida y además debe eliminarse el control preventivo de constitucionalidad."
6200,4,justicia_constitucional,A,Necesario para el buen funcionamiento de las leyes
6201,4,justicia_constitucional,A,Todas las leyes supeditadas a la constitución.
6202,4,justicia_constitucional,P,"Hay concenso en que debe existir un control de constitucionalidad de las leyes. Sin embargo, no se llega a un acuerdo a cómo debe organizarse este control: algunos optan por abolir el Tribunal Constitucional, otros lo hacen recaer en la Corte Suprema, entre otras ideas."
6206,4,justicia_constitucional,A,Debe ser independiente y autónomo
6207,4,justicia_constitucional,A,Que incluya justicia para los animales; imposición de penas aflictivas para los culpables de maltrato animal.  Asegurar la calidad o condición de los animales como seres sintientes
6217,4,justicia_constitucional,A,Que la constitución sea igualitaria y en relación al grado del delito
6218,4,justicia_constitucional,A,Discutir las atribuciones y el sistema de nombramiento de los ministros del Tribunal Constitucional. Ampliar el concepto de justicia constitucional.  Evaluar la posibilidad de establecer nuevos mecanismos u órganos que velen por el respeto de la constitución
6219,4,justicia_constitucional,A,Velar por el respeto a la constitución.
6220,4,justicia_constitucional,A,Reformar totalmente. Es inconcebible que el Tribunal Constitucional sea una tercera cámara.
6228,4,justicia_constitucional,A,"Entendido como el TRIBUNAL CONSTITUCIONAL, garante final que tanto el Congreso como la Presidencia respeten la Constitución."
6252,4,justicia_constitucional,A,"Número impar de integrantes. Dos representantes por cada poder del Estado, y tres  representantes de organizaciones de la sociedad civil, profesionales del derecho (defensor del pueblo ,abogados de derechos humanos ). Organismo más técnico que político. Duran 6 años, a contraciclo presidencial."
6253,4,justicia_constitucional,A,Que se haga justicia al pasar a llevar una ley
6259,4,justicia_constitucional,A,Que en la proxima consitucion pueda crear un organo democratico que se electo bajo eleccion popular de 16 mienbros para interpretar la constitucion y defender sus leyes . eliminar el tribunal constitucional ya que es por dedocracia y no por representacion popular.
6261,4,justicia_constitucional,A,"Creemos  que se debe mejorar, este es un tema que claramente se encuentra en deuda."
6265,4,justicia_constitucional,A,Democratización de las controversias entre los poderes del estado.
6270,4,justicia_constitucional,A,Tribunal constitucional. Que sea capaz de velar por el resguardo de nuestras normas y principios fundamentales. Debe ser capaz de contrapesar a los poderes del estado.
6273,4,justicia_constitucional,A,La justicia constitucional pilar fundamental paraonrespetas nuestra constitucin
6276,4,justicia_constitucional,P,Que implique sancionar a todos sin excepción
6285,4,justicia_constitucional,A,Termino del tribunal constitucional
6291,4,justicia_constitucional,A,Argumento: Necesario resguardar el cumplimiento de la constitución.
6307,4,justicia_constitucional,A,QUE EXISTAN UN CONJUNTO DE NORMAS Y LEYES
6314,4,justicia_constitucional,A,Que todas las Instituciones del estado se rigan según la Constitución.
6330,4,justicia_constitucional,A,ES NECESARIO EL CUMPLIMIENTO DE LAS LEYES Y LA CONSTITUCION
6334,4,justicia_constitucional,A,porque tiene que existir una institución que vele que se cumpla todo lo escrito en la constitución
6338,4,justicia_constitucional,A,"Igualdad de leyes y sanciones para todos y todas, en iguales condiciones."
6365,4,justicia_constitucional,A,"Discutir composición del Tribunal Constitucional, funciones y atribuciones"
6377,4,justicia_constitucional,A,Con objeto de defender la constitución de mayorías circunstanciales.
6409,4,justicia_constitucional,A,Organismo encargado de velar por el cumplimiento de la constitución.
6410,4,justicia_constitucional,A,"Suponiendo que la Constitución respeta y garantiza los derechos y deberes de todas las personas, es necesario que existan mecanismos que aseguren que las normas de la Constitución sean respetadas."
6422,4,justicia_constitucional,A,"Que se converse respecto del funcionamiento, composición, designación del tribunal constitucional."
6449,4,justicia_constitucional,A,APEGO IR-RESTRICTO A LA CONSTITUCIÒN
6453,4,justicia_constitucional,A,"Que la constitucion se imparta o actúe con justicia, para todos iguales, que sea parejo para todos  y sean cumplidos sus preceptos  y obligaciones  en todo su ámbito como ley.-"
6464,4,justicia_constitucional,A,brindar valores normativos a los derechos y principios consagrados en el texto de la constitución.
6470,4,justicia_constitucional,A,NECESARIA LA INSTITUCIONALIDAD DE UN TRIBUNAL QUE ESTE DENTRO DEL PODER JUDICIAL SIN LA DESIGNACIÓN POLÍTICA ACTUAL DE SUS INTEGRANTES
6475,4,justicia_constitucional,A,"• Que contenga muy claramente los derechos, deberes y obligaciones"
6483,4,justicia_constitucional,A,Garantizar que normas y leyes cumplan espíritu del bien común que inspira la constitución.
6502,4,justicia_constitucional,A,Derechos y deberes de igualdad de hombres y mujeres.
6515,4,justicia_constitucional,A,Hay que cambiar atribuciones y funciones para velar por una Constitución legítima y efectiva. Deben aumentar los miembros del Tribunal Constitucional y revisar su poder (actual) como una tercera Cámara.
6532,4,justicia_constitucional,A,A cargo de una corte constitucional que conozca recursos relacionados con Derechos consagrados y reconocidos por la constitución.
6577,4,justicia_constitucional,A,"Que sean denunciados los ministros del Estado, Senadores, Diputados y otros cargos públicos que discriminen la Iglesia por cualquier forma de comunicación."
6583,4,justicia_constitucional,A,Es importante ya que de esta forma se pueden controlar los poderes del estado.
6617,4,justicia_constitucional,A,Es dar a cada uno lo que le corresponde con la garantía de la constitución.
6621,4,justicia_constitucional,A,"para velar por la constitucionalidad de las leyes ( a priori o a posteriori), ya sea por un Tribunal Constitucional o por la Corte Suprema de Justicia."
6628,4,justicia_constitucional,A,"Tribunal Constitucional con facultades acotadas, elegidos popularmente y respetuoso de la democracia y de los poderes del estado"
6643,4,justicia_constitucional,P,"Revisar mecanismos de control de constitucionalidad de la ley, porque lesiona principio democrático. Liitar su función a resolver litigios judiciales. Revisar forma de selección de los jueces."
6653,4,justicia_constitucional,A,"Se debe debatir la existencia del Tribunal constitucional, sus atribuciones y estructura y participantes."
6667,4,justicia_constitucional,A,ES EL TERCER PODER DE JUSTICIA CONSTITUCIONAL Y QUE DEBE SEGUIR SIENDO INDEPENDIENTE EN SUS DECISIONES
6670,4,justicia_constitucional,A,Tribunal constitucional. Para evitar una distorsión de las decisiones tomadas por los representantes de la soberanía popular se requiere que actúe ex post. Se sugiere elección popular de sus integrantes
6672,4,justicia_constitucional,A,Por que se necesita que se haga valer la nueva constitución.
6680,4,justicia_constitucional,A,SE DEBE O TIENE QUE EXISTIR UN ÓRGANO QUE SEA CAPAZ DE EJERCER UN CONTROL CONSTITUCIONAL Y VELAR POR QUE SE ADAPTEN A LA CONSTITUCIÓN.
6694,4,justicia_constitucional,D,"Similar con lo mencionado en el punto Acusación Constitucional , creemos útil la existencia de una institución o herramienta que vele por el cumplimiento de una nueva constitución mas el uso que se ha dado al tribunal constitucional no ha sido del más apropiado."
6732,4,justicia_constitucional,A,"Los métodos de designación de los jueces del tribunal deben ser más representativos y más democráticos, deben garantizarse los derechos con contenido social."
6748,4,justicia_constitucional,A,Justicia constitucional
6749,4,justicia_constitucional,P,"Para que los parlamentarios hagan bien su trabajo y cumplan con nosotros, para eso los elegimos."
6754,4,justicia_constitucional,A,se debe respetar la constitución
6756,4,justicia_constitucional,A,Hacer respetar las leyes constitucionales.
6758,4,justicia_constitucional,A,"Es lógico que exista justicia constitucional que vele por el respeto a la Constitución establecido como deber, pero se realiza observaciones como que la conformación del Tribunal Constitucional tenga una integración de número impar de Ministros electos democráticamente."
6787,4,justicia_constitucional,A,Que sea verdadero el papel de justicia
6843,4,justicia_constitucional,A,"Eliminar el tribunal Constitucional pues, vulnera todas las instancias de democracia y participación previas"
6856,4,justicia_constitucional,A,"Se propone eliminar el Tribunal Constitucional, y entregar el control (represivo) de constitucionalidad de las leyes a la Corte Suprema. En cambio, mantener el TC, sólo eliminando su control preventivo no pareció suficiente para asegurar la democracia de mayorías."
6884,4,justicia_constitucional,A,"Debe existir y ejercer un Tribunal Constitucional, en donde deben establecerse su composición y atribuciones."
6890,4,justicia_constitucional,A,Que cumplan las bases de nuestra constitución.
6904,4,justicia_constitucional,A,Que sean respetadas las leyes.
6925,4,justicia_constitucional,A,"Garante y defensora de la Constitución. No solo controla al Estado, si no que garantiza la libertad, igualdad y el respeto de las reglas de un régimen democrático."
6936,4,justicia_constitucional,A,Eliminar el tribunal constitucional
6943,4,justicia_constitucional,A,Que lo que está en la constitución se aplique
7003,4,justicia_constitucional,A,.
7018,4,justicia_constitucional,P,"No al Tribunal Constiucional. Se plantea la alternativa de que cuando no hay consenso a nivel parlamentario, se realice plebiscito para que dirima, que reemplazaría al  tribunal constitucional."
7026,4,justicia_constitucional,A,Garantizar el no cuoteo político y se propone una fórmula de elección aleatoria sobre la base del mérito que garantice idoneidad.
7027,4,justicia_constitucional,A,"Tribunal constitucional, para resguardar los principios e interpretaciones propios de una discusión tal como la que hemos tenido en este ejercicio."
7046,4,justicia_constitucional,A,Porque debe existir un ente superior que resguarde el cumplimiento del orden jurídico del país
7048,4,justicia_constitucional,A,Porque todos deberíamos estar protegidos por la ley y constitución
7078,4,justicia_constitucional,A,"Esta debe resguardar los intereses sociales, reafirmando en el carácter soberano de la república y no anteponer visiones particulares por sobre generales"
7137,4,justicia_constitucional,A,La justicia constitucional debe pasar a manos de la Excelentísima Corte Suprema.
7140,3,justicia_constitucional,A,"QUE LA CONSTITUCIÓN SEA EL  GARANTE DE LOS DERECHOS DE LAS PERSONAS, QUE CONTEMPLE LA EDUCACIÓN, SALUD Y VIVIENDA."
7140,4,justicia_constitucional,A,"QUE LA CONSTITUCIÓN SEA EL  GARANTE DE LOS DERECHOS DE LAS PERSONAS, QUE CONTEMPLE LA EDUCACIÓN, SALUD Y VIVIENDA"
7146,4,justicia_constitucional,A,Es necesario tener una institución que evalué e interprete la actual institucionalidad.
7155,4,justicia_constitucional,A,"La actual justicia constitucional opera como una tercera cámara negativa, además, es integrada por muchos ministros con baja calificación, que son elegidos binominalmente, respondiendo a intereses partidistas, el quórum es solo por mayoría en temas de vital importancia, entre otras razones."
7174,4,justicia_constitucional,A,"El tribunal constitucional debe ser garante de que el congreso y la presidencia respeten la constitución, dando garantías de proteger los derechos."
