idEla,tema,concepto,acuerdo,fundamento
15722,1,paz_convivencia_pacífica,A,"Porque Jesucristo es Dios de Paz, Él quiere que vivamos en paz"
15723,1,paz_convivencia_pacífica,A,Debemos convivir en paz y garantizando por la Constitución.
15768,1,paz_convivencia_pacífica,A,Libre expresión de marchas pacíficas para impedir actos violentos.
15803,1,paz_convivencia_pacífica,A,"El grupo determina que es un principio básico para el funcionamiento democrático del estado, puesto que asegura de esta manera una plena participación en un ambiente de plena tranquilidad y sin que ningún grupo de la sociedad se sienta violentado en sus derechos ciudadanos"
15821,1,paz_convivencia_pacífica,A,Llamado de paz para que la sociedad aprenda a respetar.
15825,1,paz_convivencia_pacífica,A,El estado debe resguardar la paz diplomáticamente.
15849,1,paz_convivencia_pacífica,A,LOS JÓVENES NECESITAN ESPACIOS DE PAZ QUE SE CULTIVE Y QUE TODAS LAS PERSONAS LO LLEVEN  A CABO
