idEla,tema,concepto,acuerdo,fundamento
10953,1,paz_convivencia_pacífica,A,"deberiamos saber vivir en convivencia comunitaria, convivencia familiar"
10960,1,paz_convivencia_pacífica,A,"DEBEMOS RESPETARNOS Y VIVIR EN PAZ, QUE NO HAY GUERRAS NI VIOLENCIA."
10980,1,paz_convivencia_pacífica,A,"Desarrollar convivencia pacifica con otros paises hermanos, y por sobre todo entre ciudadanos, de forma  tolerante y respetuosa entre las partes."
11027,1,paz_convivencia_pacífica,A,"Si no podemos ejercer la auto defensa el Estado resguardar la seguridad individual, la unidad nacional y la paz social"
11070,1,paz_convivencia_pacífica,A,Todos deseamos vivir en paz.
11096,1,paz_convivencia_pacífica,A,para concientizar sobre las buena convivencia y el buen trato.
11105,1,paz_convivencia_pacífica,A,"Debemos como sociedad vivir en un ambiente social de empatía, tolerancia, solidaridad y respeto por los demás"
11143,1,paz_convivencia_pacífica,A,lo importante de una buena convivencia y tranquilidad
11264,1,paz_convivencia_pacífica,A,"Políticas de Estado, que éste entregue herramientas para que se inserten niños y adolescentes al deporte y ala sociedad. Que cada organismo cumpla y fiscalice que se cumplan los derechos y deberes de  la comunidad."
11270,1,paz_convivencia_pacífica,A,"SE establece la relación entre vivir en paz, y tener una mejor calidad de vida, al estar asociado al bien estar de las personas como un factor clave de la sociedad, y que aporta al desarrollo del país.-"
11273,1,paz_convivencia_pacífica,A,Valor fundamental para solidificar los otros valores previamente enumerados.
11275,1,paz_convivencia_pacífica,A,"Todo ser humano busca paz y buena convivencia, es un principio fundamental para el entendimiento de las personas, de los pueblos y de las naciones."
11284,1,paz_convivencia_pacífica,A,"Es deber central del Estado resguardar la seguridad individual, la unidad nacional y la paz social. Si no podemos ejercer la auto defensa, es precisamente por el hecho que el Estado asume ese deber."
11293,1,paz_convivencia_pacífica,A,"Nos lleva a vivir en fraternidad y justicia. Algo que nos falta a diario en varios ámbitos de nuestra vida. La idea es apelar a que cada persona es  responsable crecer en dialogo y capacidad de resolver sus conflictos, evitando llegar a otras instancias."
11294,1,paz_convivencia_pacífica,A,"La paz debe ser trascendental plasmarlo en la  constitución. No se debe enfocar en una carrera  armamentista como se ha hecho hasta ahora, si no más bien a la fraternidad latinoamericana y dentro de Chile, principalmente con los mapuches y todo pueblo originario."
11305,1,paz_convivencia_pacífica,A,"Para poder vivir en armonía es necesario una convivencia sana y pacifica como principio fundamental. Esto engloba el respeto, la tolerancia y la empatía entre todos los ciudadanos de una nación"
11372,1,paz_convivencia_pacífica,A,"Estado pacifista que promueva la cultura y el derecho a la paz, así como la cooperación entre los pueblos de la región y del mundo."
11403,1,paz_convivencia_pacífica,A,"EL ESTADO DEBE VELAR Y GARANTIZAR LA PAZ Y CONVIVENCIA PACIFICA, QUE ES EL SUSTENTO DE LOS DEMAS VALORES Y PRINCIPIOS."
11444,1,paz_convivencia_pacífica,A,Mantener paz y prosperidad en el país.
11544,1,paz_convivencia_pacífica,A,Importante para la vida tranquila y en paz donde todos podamos expresarnos.
11578,1,paz_convivencia_pacífica,A,que todos participen comunitariamente.
11582,1,paz_convivencia_pacífica,A,"la Paz, sobre todo la Paz Social, es imprescindible para tener un país que crezca en desarrollo económico y humano"
11589,1,paz_convivencia_pacífica,A,Que el Estado entregue las herramientas necesarias para que las comunidades trabajen en equipo y fortalezcan la paz y convivencia entre ellos.
11615,1,paz_convivencia_pacífica,A,El estado debe asegurarnos vivir en tranquilidad y paz
11630,1,paz_convivencia_pacífica,A,"Es prioridad del Estado resguardar la seguridad de las personas, la unidad nacional y la paz. El estado debe asumir el deber de la defensa."
11633,1,paz_convivencia_pacífica,A,"Es deber del Estado resguardar la seguridad de los ciudadanos tanto individual, como nacional y garantizar la paz social sin desmedro de la legitima defensa"
11645,1,paz_convivencia_pacífica,A,Necesario para una convivencia social segura.
11750,1,paz_convivencia_pacífica,A,PARA RESOLVER LOS CONFLICTOS
11759,1,paz_convivencia_pacífica,P,Mayoritariamente los asistentes plantearon un cambio de foco de las fuerzas armadas asociado a una desmilitarización y reducción armamentista.  Minoritariamente se plantea la transformación paulatina hacia fuerzas de paz.
11790,1,paz_convivencia_pacífica,A,la gente vive con miedo de la delincuencia ya que los carabineros tardar en llegar.
11932,1,paz_convivencia_pacífica,A,": Incluye la tolerancia, el respeto y la participación, evita conflictos mayores"
12000,1,paz_convivencia_pacífica,A,"El Estado de debe resguardar la seguridad de las personas, del país y la paz social."
12023,1,paz_convivencia_pacífica,A,"la paz debe ser el  equilibrio y estabilidad l. También debe ser  la tranquilidad mental de una persona o sociedad; es decir  la ausencia de inquietud, violencia o guerra."
12037,1,paz_convivencia_pacífica,P,La convivencia es un desafío hoy para la construcción del Chile del futuro. Otros quisieron sumar el respeto.
12058,1,paz_convivencia_pacífica,P,"Frente a la actual crisis individual, es necesario asegurar una convivencia pácifica entre los ciudadanos y sus vecinos"
12077,1,paz_convivencia_pacífica,A,"Es deber central del Estado resguardar la seguridad individual, unidad nacional y la paz social.  Hay que evitar la autodefensa"
12106,1,paz_convivencia_pacífica,A,Para evitar daños colaterales  a personas que no se involucran en protestas o huelgas.
12126,1,paz_convivencia_pacífica,A,La importancia que cada pueblo puede habitar su territorio en paz y en equilibrio con la naturaleza.
12133,1,paz_convivencia_pacífica,A,"LA PAZ ES SINÓNIMO DE RESPETO A LA DIGNIDAD HUMANA, LOS DERECHOS HUMANOS Y LA LIBRE DETERMINACIÓN DE LOS PUEBLOS."
12165,1,paz_convivencia_pacífica,A,Derecho a vivir en paz.
12240,1,paz_convivencia_pacífica,P,"vivir en paz, armonía y tranquilidad, resolver conflictos en paz."
12315,1,paz_convivencia_pacífica,A,ASEGURAR UN ENTORNO PACÍFICO PARA TODOS LOS CIUDADANOS.
12395,1,paz_convivencia_pacífica,A,El desarrollo normal de una comunidad debe estar dentro de un marco de paz y tranquilidad.
12422,1,paz_convivencia_pacífica,A,"Es deber central del Estado resguardar la seguridad individual, la unidad nacional y la paz social. Si no podemos ejercer la auto defensa, es precisamente por el hecho que el Estado asume ese deber."
12426,1,paz_convivencia_pacífica,A,"Para lograr un desarrollo social como país, básicamente necesitamos una paz y una armonía como población, que nos permita mirarnos y respetarnos como hermanos e hijos de una misma Patria, sin odios, desconfianzas ni prejuicios. La Carta Fundamental debería proporcionar garantías reales para el diál"
12453,1,paz_convivencia_pacífica,P,"Privilegiar la paz como medio de resolución de problemas, camino de solución ante cualquier conflicto o controversias internas y con respecto a otros países."
12459,1,paz_convivencia_pacífica,A,En todo el pais
12498,1,paz_convivencia_pacífica,A,"Se debe procurar que todos los ciudadanos puedan convivir pacíficamente,  el estado debe custodiar la seguridad y el orden público."
12612,1,paz_convivencia_pacífica,A,La transparencia y el conocimiento de los hechos ayuda a fortalecerla. Importancia de los medios de información.
12629,1,paz_convivencia_pacífica,A,un pais con mas respeto y tolerancia hará que sea un país mas pacifico y con esto se mejorara la convivencia
12666,1,paz_convivencia_pacífica,A,"Paz y amor: La convivencia en armonía y de forma pacífica permite que las personas se desenvuelvan en orden.  Entendemos el valor de la paz y el amor desde lo individual para que luego se refleje en lo colectivo, como un estado de tranquilidad, además desde la proximidad y la solidaridad."
12686,1,paz_convivencia_pacífica,P,"Deberia estar sobre las discuciones sean tranquilas sin guerras, no deberia estar porque otros paises intentaran atacar y uno como país tiene que estar preparado."
12700,1,paz_convivencia_pacífica,A,-debemos cuidarnos y respetarnos.  -tener un dialogo permanente  -tener claridad en cuanto a deberes y derechos que tenemos .
12717,1,paz_convivencia_pacífica,P,"Debemos convivir pacíficamente entre vecinos, un pueblo en paz refleja cómo queremos vivir a fututo."
12767,1,paz_convivencia_pacífica,A,Que nuestra constitución incorpore como un valor y bien mayor la paz. Somos un pueblo pacífico que se relaciona al interior y el exterior como una sociedad que busca resolver sus conflictos de manera pacífica.
12807,1,paz_convivencia_pacífica,A,"Mantener la paz significa el pleno respeto a la dignidad de cada persona, grupo o nación. La paz es fruto de la justicia. Dicha carencia es lo que ha originado los conflictos en la Araucanía."
12814,1,paz_convivencia_pacífica,A,"Debemos relacionarnos con seguridad, siempre y cuando tengamos un pais que garantice la paz, debemos procurar que no exista maltratos y podamos vivir plenamente."
12826,1,paz_convivencia_pacífica,A,COMO PERSONAS TENEMOS QUE VIVIR EN PAZ E IGUALDAD CON RESPETO PARA TODOS
12941,1,paz_convivencia_pacífica,A,La Constitución debe inspirarse y propender a una convivencia pacífica en medio de la diversidad de personas y pensamientos.
12960,1,paz_convivencia_pacífica,A,"Es deber central del estado resguardar la seguridad individual, la unidad nacional y la paz social. Si no podemos ejercer la autodefensa, es precisamente por el hecho que el estado asume ese deber"
12962,1,paz_convivencia_pacífica,A,"El estado debe asegurar las condiciones de convivencia entre grupos sociales (etnias, trabajadores, identidades sexuales, grupos religiosos, distintos grupos etareos, etc.) Condiciones; igualdad de derechos, deberes  y oportunidades"
12986,1,paz_convivencia_pacífica,D,No es posible pensar los otros valores si no se asegura este. Es el resultado final. Tolerancia y respeto.
13001,1,paz_convivencia_pacífica,A,"que se garantice la tranquilidad, tolerancia y fraternidad en la sociedad"
13014,1,paz_convivencia_pacífica,A,"Es deber central del Estado resguardar la seguridad individual, la unidad nacional y la paz social. Si no podemos ejercer la auto defensa, es precisamente por el hecho que el Estado asume ese deber."
13027,1,paz_convivencia_pacífica,A,"LA SEGURIDAD Y ARMONÍA EN EL CONVIVIR DEBEN SER PRINCIPIOS BÁSICOS PARA GARANTIZAR EL BIEN COMÚN Y EL SENTIDO DE COMUNIDAD, MUCHAS VECES PERDIDO DEBIDO A LA DESCONFIANZA EN EL  OTRO."
13052,1,paz_convivencia_pacífica,A,El gobierno debe garantizar la paz y correcta convivencia entre ciudadanos.
13058,1,paz_convivencia_pacífica,A,da la principal  armonía para desenvolverse  y desarrollarse
13089,1,paz_convivencia_pacífica,A,"que los problemas se solucionen en forma pacifica, sin violencia no disturbios o represión excesiva  que haya una buena convivencia entre todos los ciudadanos"
13131,1,paz_convivencia_pacífica,A,"Para mejorar nuestra calidad de vida sin violencia sin miedo,revisar las leyes la puesta giratoria."
13142,1,paz_convivencia_pacífica,A,"La paz es un principio básico, no se impone, sino que se alza como una máxima y una bandera, es un ideal que se debe tener a la vista cada vez que se dialoga y se buscan consensos, el escuchar a las distintas posiciones es el camino"
13153,1,paz_convivencia_pacífica,A,"La paz, no solamente por problemas externos, la paz interna en el pais, sin violencias, ni institucionales ni del estado."
13172,1,paz_convivencia_pacífica,A,El Estado debe ser garante de la paz como forma de asegurar la convivencia pacífica en todas sus dimensiones. Es el principio de la resolución de los conflictos.
13177,1,paz_convivencia_pacífica,A,Debe estar resguardada y favorecida
13182,1,paz_convivencia_pacífica,P,Ser mas drástico la posición del país frente a aspectos limítrofes.
13189,1,paz_convivencia_pacífica,P,LA PAZ PERMITE AL CIUDADANO Y AL PAÍS PODER LOGRAR UN PLENO DESARROLLO Y ALCANZAR SUS MÁXIMAS POTENCiALIDADES
13202,1,paz_convivencia_pacífica,A,Generar instancias que disminuya el estrés y el colapso de las personas . Tener mejor trato con países aledaños
13257,1,paz_convivencia_pacífica,A,"Cultura de Paz: Concebimos a Chile como un país que promueve la cultura de la paz y el derecho a la paz, con pleno respeto por la soberanía de todas las naciones que conviven en su territorio."
13267,1,paz_convivencia_pacífica,A,para tener una mejor calidad de vida  * entendiendo que la tolerancia lleva a la paz.
13298,1,paz_convivencia_pacífica,A,"Es deber central del Estado resguardar la seguridad individual, la unidad nacional y la paz social y derecho a la legitima defensa"
13373,1,paz_convivencia_pacífica,P,"vivir como hermanos. olvidar las diferencias del pasado, para avanzar"
13391,1,paz_convivencia_pacífica,A,"Es deber del estado garantizar la seguridad individual, colectiva y paz social."
13398,1,paz_convivencia_pacífica,A,SIN PAZ Y CONVIVENCIA PACIFICA NINGUNO DE LOS OTROS VALORES ES POSIBLE
13409,1,paz_convivencia_pacífica,A,Respeto garantizado para cada integrante de la sociedad.
13419,1,paz_convivencia_pacífica,A,"Es deber central del Estado resguardar la paz social, la seguridad individual y la unidad nacional, si no actuamos en autodefensa, es porque el Estado debe asumir ese deber"
13423,1,paz_convivencia_pacífica,A,No validar la violencia.
13433,1,paz_convivencia_pacífica,A,"Es deber central del Estado resguardar la seguridad individual, la unidad nacional y la paz social. Si no podemos ejercer la auto defensa, es precisamente por el hecho que el Estado asume ese deber"
13441,1,paz_convivencia_pacífica,A,No a la violencia en todos sus sentidos.
13446,1,paz_convivencia_pacífica,A,La paz es fundamental
13477,1,paz_convivencia_pacífica,A,"Hay que encontrar la solución a los problemas mediante el diálogo y no esperar que llegue la solución después de hacer huelgas, protestas con accidentes y muertes. También se debe mantener la paz y armonía con los países vecinos a través del diálogo."
13524,1,paz_convivencia_pacífica,A,A
13591,1,paz_convivencia_pacífica,A,"Tener una convivencia  tranquila  con nuestros vecinos, en general un entorno agradable vecinal y comunal."
13598,1,paz_convivencia_pacífica,A,Aprender a vivir en sociedad y sin violencia.
13618,1,paz_convivencia_pacífica,A,Mejorar la educación civil.
13648,1,paz_convivencia_pacífica,A,"Se debe asegurar la paz para poder desarrollarse como persona, familia y comunidad, y hoy hay mucho miedo en muchos sectores de la sociedad."
13668,1,paz_convivencia_pacífica,A,"derecho al dialogo sin conflictos armados, al interior y al exterior del país."
13684,1,paz_convivencia_pacífica,A,"Necesario para que exista justicia, Respeto, Igualdad para que sea un mejor país."
13704,1,paz_convivencia_pacífica,A,Urge sentir que podemos vivir tranquilos. Está la sensación de que las autoridades han perdido el poder preventivo y controlador y  su autoridad
13712,1,paz_convivencia_pacífica,A,"El Estado debe participar imparcialmente como un agente activo para promover la  convivencia pacífica entre los habitantes, grupos sociales, culturales y de intereses."
13786,1,paz_convivencia_pacífica,A,"habría mas tranquilidad mental, todo seria mas pacifico"
13800,1,paz_convivencia_pacífica,A,"Es deber central del Estado resguardar la seguridad individual, la unidad nacional y la paz social. Si no podemos ejercer la auto defensa, es precisamente por el hecho que el Estado asume ese deber."
13809,1,paz_convivencia_pacífica,A,Vivir y caminar por calles tranquilas sin el miedo que te vaya a suceder algo
13817,1,paz_convivencia_pacífica,A,Vivir tranquilos
13951,1,paz_convivencia_pacífica,A,Ponerle fin a la violencia y estimular la convivencia pacifica entre todos los que conformamos esta sociedad.
13960,1,paz_convivencia_pacífica,A,necesitamos paz social. Porque no hay respeto en la sociedad. Es decir violencia y miedo a controlar nuestras vidas y no salimos adelante.
14005,1,paz_convivencia_pacífica,A,"La paz se logra con inclusión, solidaridad, dando cabida a los instintos básicos que impulsan la generación de vínculos entre seres humanos. Tener la paz como proposito de vida terminaria con los ejércitos, la violencia, etc. y dejaría recursos libres para otras cosas."
14050,1,paz_convivencia_pacífica,A,Que todos vivan en paz.
14054,1,paz_convivencia_pacífica,A,Estado o nivel de conciencia y convivencia en armonía. Condición básica para que se desarrollen los otros valores y para que nos relacionemos los seres humanos.
14066,1,paz_convivencia_pacífica,A,"Que nos asegure vivir en paz tanto en Chile como la convivencia pacifica con otros países, ser un país que siempre abogue por la paz."
14080,1,paz_convivencia_pacífica,A,"Es deber central del Estado resguardar la seguridad individual, la unidad nacional y la paz social.Hay que evitar la autodefensa"
14103,1,paz_convivencia_pacífica,A,Debe estar garantizada como escenario natural y justo. En estos momentos la sociedad no ofrece tranquilidad a sus ciudadanos
14157,1,paz_convivencia_pacífica,A,saber tolerar las opiniones del resto
14179,1,paz_convivencia_pacífica,A,TODOS LOS PUTOS FUERON SOMETIDOS A VOTACIÓN Y ESTOS SON LOS QUE OBTUVIERON LA MAYORÍA
14249,1,paz_convivencia_pacífica,P,es necesario la confianza para tener una sana convivencia
14291,1,paz_convivencia_pacífica,A,Que actúe como base  para poder establecer ambiente sano y de poder funcionar como cuidadano
14307,1,paz_convivencia_pacífica,A,Unánime
14344,1,paz_convivencia_pacífica,A,A
14386,1,paz_convivencia_pacífica,A,Respeto entre cada ciudadano.
14411,1,paz_convivencia_pacífica,A,El respeto por los demas nos permitira una convivencia pacifica.
14471,1,paz_convivencia_pacífica,P,Generar políticas que eviten las diferencias que producen los conflictos entre las personas de la población.
14482,1,paz_convivencia_pacífica,P,Respeto por otros y generación de confianzas. Donde se reconozca y valore a los demás ciudadanos.
14499,1,paz_convivencia_pacífica,A,- Tranquilidad de los ciudadanos - Merecemos vivir en un ambiente tranquilo
14546,1,paz_convivencia_pacífica,P,Convivencia pacífica entre personas. Paz social.
14547,1,paz_convivencia_pacífica,A,Corresponsabilidad ciudadana.
14562,1,paz_convivencia_pacífica,A,"la paz debe existir siempre, no podemos sentirnos vulnerables"
14575,1,paz_convivencia_pacífica,P,"Sin paz, nada es posible.  Sin paz, no se puede ejercer la democracia."
14585,1,paz_convivencia_pacífica,P,El derecho al acceso a la justicia que nos brinde una constitución politica.
14604,1,paz_convivencia_pacífica,A,Velar por el bien común
14636,1,paz_convivencia_pacífica,A,"El estado debe garantizar la seguridad y proteger a sus  ciudadanos en todo el territorio nacional  frente al terrorismo, violencia social, delincuencia, narcotráfico, etc."
14647,1,paz_convivencia_pacífica,A,Es la mejor condición para que un país progrese y tenga el mejor bienestar para su población.
14694,1,paz_convivencia_pacífica,A,Debe ser la obligación de un estado proveer y  velar por la paz de la nación.
14701,1,paz_convivencia_pacífica,A,Debe existir igualdad de dignidad tanto en hombres como mujeres
14708,1,paz_convivencia_pacífica,A,Chile es un país pacífico y todos debemos cuidar de eso.
14724,1,paz_convivencia_pacífica,A,Siempre se debe optar por convivir pacíficamente. Privilegiar el diálogo. Resolver los conflictos entre compatriotas mediante mecanismos de mediación.
14761,1,paz_convivencia_pacífica,P,"El grupo estima que el valor se eligió como consecuencia de la coyuntura social y política, pues la paz es la consecuencia (objetivo) de la consagración de otros valores/principios constitucionales, tales como: IGUALDAD, JUSTICIA Y OTROS."
14850,1,paz_convivencia_pacífica,A,"Deseamos la paz para nuestra nación en el entendido que es el estado natural del ser humano, donde prive la alegría, la tranquilidad tanto dentro del país como en sus relaciones internacionales."
14872,1,paz_convivencia_pacífica,A,"Erradicar la violencia,  Proponer espacios de amistad civica"
14887,1,paz_convivencia_pacífica,A,"Todos deciden, para vivir en una sociedad en paz."
14910,1,paz_convivencia_pacífica,A,Que todo ciudadano desde su nacimiento sea formado con valores y principios de paz y convivencia.
14927,1,paz_convivencia_pacífica,A,"Todo ser humano busca paz y buena convivencia, es un principio fundamental para el entendimiento de las personas, de los pueblos y de las Naciones."
14943,1,paz_convivencia_pacífica,A,porque todos tenemos derecho a vivir en paz sin que nos molesten.
14986,1,paz_convivencia_pacífica,A,Generar tranquilidad para cada ciudadano
14996,1,paz_convivencia_pacífica,P,EL ESTADO NO POTENCIA LA PAZ Y LA CONVIVENCIA CIUDADANA.
15016,1,paz_convivencia_pacífica,A,todos aspiramos a caminar por las calles tranquilos
15032,1,paz_convivencia_pacífica,A,QUE HAYA CONVIVENCIA PACIFICA ENTRE TODOS LOS CIUDADANOS
15067,1,paz_convivencia_pacífica,A,Seguridad y Convivencia Pacífica.
15108,1,paz_convivencia_pacífica,A,"Entendiendo la paz como la resolución de conflictos de manera no violenta, se vota por este concepto por el deseo de contar con un Estado que fundacionalmente sea no bélico y que respete la diversidad y la convivencia."
15147,1,paz_convivencia_pacífica,A,"Una constitución que nos permita enfrentar la creciente violencia que existe en contra la mujer, los niños y las minorías."
15161,1,paz_convivencia_pacífica,P,Como comienzo del acuerdo social y como compromiso del ejercicio de la libertad Disenso: Algunas circunstancias deben permitir la defensa o en el contexto
15191,1,paz_convivencia_pacífica,A,El Estado tiene que entender la cultura de la paz como la entiende y define las Naciones Unidas.
15199,1,paz_convivencia_pacífica,A,"Debemos ser un país que promueva la paz entre los chilenos, y con los países vecinos"
15233,1,paz_convivencia_pacífica,A,"Debe haber tranquilidad en la comunidad, si nuestra constitución tiene que tener  la paz como un valor indispensable ya que entonces tendrá que haber entendimiento entre grupos y en especial no habrá violencia y guerras."
15257,1,paz_convivencia_pacífica,A,A vivir en una comunidad en tranquilidad.
15282,1,paz_convivencia_pacífica,A,"Que promueva acciones que permitan retornar a la vida de barrio, amable, solidario y seguro."
15285,1,paz_convivencia_pacífica,P,Es sinónimo de respeto a la dignidad humana. Entendimiento a todos los niveles de la sociedad y entre naciones.
15287,1,paz_convivencia_pacífica,P,Vivir en paz es fundamental. Si no nos sentimos seguros no podemos preocuparnos por cosas más elevadas.
15324,1,paz_convivencia_pacífica,A,La
15328,1,paz_convivencia_pacífica,A,"educación cívica, como ramo obligatorio en los colegios."
15407,1,paz_convivencia_pacífica,A,No ir a la guerra si la soberanía del Estado no está siendo amenazada
15432,1,paz_convivencia_pacífica,A,El Estado debe ser proactivo en la resolución de las fuentes del descontento social que atenten contra la convivencia pacífica de la sociedad.
15437,1,paz_convivencia_pacífica,A,"Vivir en Paz, solucionar el conflicto en la Araucanía reconociendo que somos una región con particularidades unicas."
15479,1,paz_convivencia_pacífica,A,Si se dialoga más habrá más paz y se podrá fomentar e respeto y la justicia.
15503,1,paz_convivencia_pacífica,A,"Es deber fundamental del Estado mantener y preocuparse por la seguridad, unidad y paz nacional"
15515,1,paz_convivencia_pacífica,A,"Base de una buena democracia la convivencia buena  de los ciudadanos genera confianza ayuda mutua,  cooperativismo entre otras muchas soluciones para alcanzar la paz."
15521,1,paz_convivencia_pacífica,A,"Es deber central del Estado resguardar la seguridad individual, la unidad nacional y la paz social."
15564,1,paz_convivencia_pacífica,A,no queremos violencia ni guerras
15569,1,paz_convivencia_pacífica,A,"La paz y la convivencia cada vez es menos, debemos vovler a encontrarnos. Es parte del Bien Común. Desacuerdo: Se genera por uso político que puede mal interpretar a ""su manera"" el concepto."
15587,1,paz_convivencia_pacífica,A,"Mayor seguridad, mejorar la convivencia, vivir en comunidad. es esperable que sea regulada por el estado"
15588,1,paz_convivencia_pacífica,A,"respeto mutuo genera armonía en las comunidades locales, deberían haber sanciones de trabajos comunitarios para quienes reciban denuncia de su comunidad por mala convivencia."
15609,1,paz_convivencia_pacífica,A,necesidad fundamental para la vida en comunidad
15617,1,paz_convivencia_pacífica,A,Vivir en paz en el País y con los demás países
15623,1,paz_convivencia_pacífica,A,asegura el cuidado del medio ambiente y tranquilidad
15641,1,paz_convivencia_pacífica,A,"son las autoridades cuando no permiten movilizaciones convivencia pacifica las que provocan la convivencia entre los vecinos debe aumentar, menos provocacion"
15649,1,paz_convivencia_pacífica,A,"vivir en paz, sin miedo de caminar por las calles, de asistir al estadio, de pasear por el barrio"
15668,1,paz_convivencia_pacífica,A,VIVIR EN ARMONÍA RESPETAR CADA UNA DE LAS PERSONAS
15683,1,paz_convivencia_pacífica,A,la paz como principio básico y fundamental para la vida en sociedad.
15692,1,paz_convivencia_pacífica,P,"Debemos establecer nueastro derecho a vivir en una cultura de la paz, en donde las personas y el Estado acepten a los individuos más que solamente tolerarlos, al igual con la naturaleza y los seres vivos."
15715,1,paz_convivencia_pacífica,A,Respeto mutuo
