idEla,tema,concepto,acuerdo,fundamento
5046,1,paz_convivencia_pacífica,A,"Con nuestros pueblos originarios, naciones unidas fin a la violencia y paz social"
5050,1,paz_convivencia_pacífica,A,VALORIZACION DE LA PERSONA MENOS MUERTES SIN CAUSA NI MOTIVOS
5092,1,paz_convivencia_pacífica,P,Tiene que ver con el respeto e igualdad que tienen las personas para vivir de una forma armoniosa y sana. Así podemos sentirnos más seguros y libres.
5099,1,paz_convivencia_pacífica,P,"Respeto, tolerancia, equilibrio, buen trato, no violencia."
5103,1,paz_convivencia_pacífica,P,"se pide de parte de los políticos que no se descalifiquen unos a otros , esto genera intranquilidad al ciudadano común, La Paz y convivencia pacífica empieza por nuestras autoridades."
5142,1,paz_convivencia_pacífica,A,"Respeto a las creencias de las personas en forma pacífica, protegiendo a los ciudadanos, representantes, lugares de reunión, según cada creencia."
5157,1,paz_convivencia_pacífica,A,Asegurar la Paz y Seguridad para vivir en uns Sociedad con respeto integral.
5168,1,paz_convivencia_pacífica,A,El Estado debe promover y construir una cultura que propicie la resolución pacífica de los conflictos.
5241,1,paz_convivencia_pacífica,A,"Sin paz no se logra bienestar, desarrollo. Se debe ser tolerante para convivir."
5276,1,paz_convivencia_pacífica,A,"No violencia, comprensión empatia, seguridad estabilidad, unión, no rivalidad, escuchar la opinión de todos respeto y comunicación."
5284,1,paz_convivencia_pacífica,A,EVITAR QUE LAS INSTITUCIONES Y LOS GOBERNANTES PROVOQUEN VIOLENCIA.
5285,1,paz_convivencia_pacífica,P,Generar una cultura de la no violencia. Vida sana
5306,1,paz_convivencia_pacífica,P,Convivir en armonía dentro de una comunidad.
5418,1,paz_convivencia_pacífica,A,"Definirse como un estado no violento (como actitud activa), agotar todas las instancias reflexivas como compromiso de estado para garantizar los derechos constitucionales, tanto para situaciones internas como externas. Rechazar formas violentas como instancias primarias de resolución de conflictos."
5447,1,paz_convivencia_pacífica,A,La paz debe existir dentro del país y con los vecinos. Se debe superar el vandalismo presente en cualquier manifestación masiva.
5493,1,paz_convivencia_pacífica,A,"Asamblea constituyente, como estamos no es justo que se persiga a los pueblos originarios, queremos paz."
5515,1,paz_convivencia_pacífica,A,"Prevención de la delincuencia, mejoramiento de las leyes actuales, sanciones duras y efectivas, programas reales de integración a la sociedad de personas que hay cumplido con condenas."
5525,1,paz_convivencia_pacífica,A,"principio fundamental para desarrollarse como persona, familia y comunidad, con actitudes para resolver de manera óptima los conflictos para el bien común."
5570,1,paz_convivencia_pacífica,A,todos pueden compartir
5585,1,paz_convivencia_pacífica,A,LA RESOLUCIÓN PACÍFICA DE LOS CONFLICTOS A TRAVÉS DE LA NO VIOLENCIA
5758,1,paz_convivencia_pacífica,A,Necesario para vivir tranquilo
5902,1,paz_convivencia_pacífica,A,Se debe garantizar la convivencia pacífica dotando de mayores facultades a las policías.
5919,1,paz_convivencia_pacífica,A,la vida en violencia no es sana
5942,1,paz_convivencia_pacífica,A,"Basado en el respeto, tolerancia"
5975,1,paz_convivencia_pacífica,A,La vida con violencia no es sana
5993,1,paz_convivencia_pacífica,A,"Tratarse a nivel país, leyes más dráticas, menos permisividad."
6009,1,paz_convivencia_pacífica,A,Se debe asegurar la paz pública. El respeto por protestas pacificas. Establecer la Educación Cívica.
6246,1,paz_convivencia_pacífica,A,Acuerdo completo
6277,1,paz_convivencia_pacífica,A,"Es deber central del Estado resguardar la seguridad individual, la unidad nacional y la paz social."
6292,1,paz_convivencia_pacífica,P,En la actualidad se violenta la convivencia. Necesitamos tolerancia por el otro.
6328,1,paz_convivencia_pacífica,A,"Valor y principio fundamental, cimentado en la convicción de que somos personas inteligentes y con voluntad para tomar decisiones dirigidas a propiciar el bien común"
6389,1,paz_convivencia_pacífica,A,"Porque tenemos que vivir en paz con nuestros pares,aprender a respetarnos para mejorar nuestra calidad de vida, tenemos que aprender la tolerancia y no discriminación."
6397,1,paz_convivencia_pacífica,P,La paz y convivenci es un resultado sobre la congujación de otros valores
6406,1,paz_convivencia_pacífica,A,"Vivimos en un Chile violento que no queremos para nuestros hijos. falta de valores, falta de respeto a las autoridades, nos debilito como sociedad. necesitamos que carabinros tenga mas facultades para trabajar y vivir tranquilos."
6428,1,paz_convivencia_pacífica,A,.
6478,1,paz_convivencia_pacífica,A,a
6571,1,paz_convivencia_pacífica,A,Condición necesaria para alcanzar el bien común y la convicción de proceder por mecanismos no violentos tanto en el plano individual como colectivo.
6641,1,paz_convivencia_pacífica,A,"Es deber del Estado resguardar la seguridad individual, la unidad nacional y la paz social. Si no podemos ejercer la auto defensa, es precisamente por el hecho que el Estado debe hacerlo"
6658,1,paz_convivencia_pacífica,P,"para llegar a esta opción se hizo por segunda ronda. Entre los que estaban Respeto y Soberanía, siendo soberanía un item muy defendido entre los presentes. se descartó por asociarse a problemas limitrofes más que a soberanía regional."
6670,1,paz_convivencia_pacífica,A,Fundamento del respeto mutuo entre las personas y las naciones.
6701,1,paz_convivencia_pacífica,A,Seguridad en la forma de educar mas concurrencia policial andar libremente por las calles
6706,1,paz_convivencia_pacífica,A,Para que exista un buen desarrollo de las comunidades donde vivimos
6767,1,paz_convivencia_pacífica,A,.
6769,1,paz_convivencia_pacífica,A,Es condición básica para la vida en sociedad
6791,1,paz_convivencia_pacífica,P,Todos tenemos derecho a vivir tranquilos en nuestro territorio.
6828,1,paz_convivencia_pacífica,A,"Es fundamental para resolver problemas y/o diferencias, con la finalidad de buscar un bien común."
6910,1,paz_convivencia_pacífica,A,Convivencia y tolerancia hacia los demás con respeto.
6974,1,paz_convivencia_pacífica,A,"Garantía de vivir y convivir en un ambiente de paz, las relaciones y convivencia entre los ciudadanos debe ser en paz, respeto y armonía."
6975,1,paz_convivencia_pacífica,A,Para que haya una armonía mas grata y sin problemas
7022,1,paz_convivencia_pacífica,A,Entendimiento para mantener buena relación entre los individuos.
7023,1,paz_convivencia_pacífica,A,"Es deber central del Estado resguardar la seguridad individual, la unidad nacional y la paz social. Si no podemos ejercer la auto defensa, es precisamente por el hecho que el Estado asume ese deber."
7037,1,paz_convivencia_pacífica,A,"Es deber central del Estado resguardar la seguridad individual, la unidad nacional y la paz social. Si no podemos ejercer la auto defensa, es precisamente por el hecho que el Estado asume ese deber."
7126,1,paz_convivencia_pacífica,A,Debemos tener una democracia que garantice y no vulnere los derechos de todos los ciudadanos. Sólo así podemos formar una sociedad sana
7131,1,paz_convivencia_pacífica,A,"La convivencia pacífica de la población sea inclusiva, recíproca, con respeto mutuo, complementario y solidario."
7177,1,paz_convivencia_pacífica,A,Que nunca más vuelva a haber un golpe militar y violentan los derechos humanos
7263,1,paz_convivencia_pacífica,A,"Porque en sí, el país necesita paz, estar tranquilos."
7275,1,paz_convivencia_pacífica,A,"Principio que favorece, inspira y prioriza una convivencia pacífica entre nosotros y los países vecinos"
7301,1,paz_convivencia_pacífica,A,Acuerdo unanime
7304,1,paz_convivencia_pacífica,A,"Un mundo sin violencia, sin maldad, un mundo tranquilo."
7339,1,paz_convivencia_pacífica,A,Es fundamental la paz social para ejercer la mayoría de los otros derechos y sentar las bases de un desarrollo social y cultural.
7352,1,paz_convivencia_pacífica,A,"Para vivir dignamente, tranquilos y unidos como sociedad."
7396,1,paz_convivencia_pacífica,A,"Es deber central del Estado resguardar la seguridad individual, la unidad nacional y la paz social, si no podemos ejercer el autodefensa, es precisamente por el hecho que el Estado asume su deber"
7416,1,paz_convivencia_pacífica,A,"Es importante porque la gente vive alterada, atropella y empuja y sólo le importa su propia integridad."
7472,1,paz_convivencia_pacífica,A,las relaciones humanas deben desarrollarse en un ambiente de paz.
7480,1,paz_convivencia_pacífica,A,"El deber central del Estado resguardar la seguridad individual, la unidad nacional y la paz social"
7484,1,paz_convivencia_pacífica,A,"bajo los actuales indices de inseguridad en los vivimos, es necesario bajar la tensión y encontrar la paz necesaria para promover un buen vivir."
7503,1,paz_convivencia_pacífica,A,Es la base de otros valores que nos llevan a comportarnos como seres humanos para convivir en armonía.
7542,1,paz_convivencia_pacífica,A,Es necesario convivir pacíficamente y resolver los problemas
7620,1,paz_convivencia_pacífica,A,asegurar que se fomente la convivencia sana en los diversos espacios públicos y privados
7686,1,paz_convivencia_pacífica,A,Fundamento de una sociedad civilizada
7748,1,paz_convivencia_pacífica,A,Son necesarias para una vida mejor
7806,1,paz_convivencia_pacífica,A,"Sustentar constitucionalmente la construcción de una      cultura de Paz, que facilite el equilibrio personal y social,     para una convivencia de buen vivir entre personas,      comunidades, etnias,  países y continentes."
7807,1,paz_convivencia_pacífica,A,Una convivencia pacífica cimentada sobre la Justicia.
7854,1,paz_convivencia_pacífica,A,buscar y propiciar la paz y la convivencia pacífica
7891,1,paz_convivencia_pacífica,A,"Es deber central del Estado resguardar la seguridad individual, la unidad nacional y la paz social. Si no podemos ejercer la auto defensa, es precisamente por el hecho que el Estado asume ese deber."
7945,1,paz_convivencia_pacífica,A,MANTENER UN PAIS SIN CONFLICTOS INTERNOS COMO EXTERNOS.
7960,1,paz_convivencia_pacífica,A,"Encuentran muy importante el mantener un ambiente de paz y convivencia, este valor es muy necesario y se debe considerar como base principal para una nueva constitución."
7979,1,paz_convivencia_pacífica,A,"PARA QUE HAYA MAS RESPETO, SEGURIDAD Y MEJOR CONVIVENCIA"
8040,1,paz_convivencia_pacífica,A,Se acuerda entre la penúltima prioridad por unanimidad
8138,1,paz_convivencia_pacífica,A,Educar.
8148,1,paz_convivencia_pacífica,P,Es acuerdo parcial ya que hemos analizado que es muy importante la soberanía más aún estando en lugar fronterizo
8151,1,paz_convivencia_pacífica,A,hay muy poca tolerancia y seguridad
8169,1,paz_convivencia_pacífica,A,Sin fundamentación
8172,1,paz_convivencia_pacífica,A,Manteniendo leyes y rigidendonos por ellas mantenemos una sociedad pacifica. Porque una buena relación nos lleva a una convivencia buena de ciudadanos.
8180,1,paz_convivencia_pacífica,A,evitar la violencia y respetar los derechos
8201,1,paz_convivencia_pacífica,A,"A través de la comunicación , el conocimiento y la tolerancia."
8223,1,paz_convivencia_pacífica,A,"El Estado debe resguardar la seguridad individual, la unidad nacional y la paz social. No se debe generar  la auto defensa"
8238,1,paz_convivencia_pacífica,A,"Es deber central del Estado resguardar la seguridad individual, la unidad nacional y la paz social."
8261,1,paz_convivencia_pacífica,A,NO a la violencia
8269,1,paz_convivencia_pacífica,A,porque La vida debe dejar de ser una competencia
8276,1,paz_convivencia_pacífica,A,Queremos una sociedad basada en el respeto tolerancia y sin abusos de poder.
8360,1,paz_convivencia_pacífica,A,si hay paz todo está bien.
8371,1,paz_convivencia_pacífica,A,"todos los ciudadanos necesitamos vivir en armonía y en una sana convivencia, respetando las diferencias y llegar acuerdos beneficiosos para todos"
8387,1,paz_convivencia_pacífica,A,Por agresividad de los ciudadanos. Por falta de tiempo de cada persona.
8459,1,paz_convivencia_pacífica,A,"Todo comienza con la Paz, que la constitución garantice paz nacional e internacional; Que este concepto de paz y convivencia pacifica sea enseñado desde los primeros años de Estudio que este derecho se resguarde constitucionalmente, y que resguardar también se Entienda como sanciones judiciales y sociales a todo grupo, sexta o proselitismo que Promulguen  la falta de convivencia el respeto y distorsión en la paz como primer derecho de una sociedad libre."
8509,1,paz_convivencia_pacífica,A,Suma Qamaña (vivir bien).
8549,1,paz_convivencia_pacífica,A,"VIVIR EN FORMA PACIFICA EN NUESTRO ENTORNO, ABURRIDAS DE LAS PROTESTAS, ESCANDALOS Y VIOLENCIA"
8561,1,paz_convivencia_pacífica,A,"Es indispensable que se generen condiciones de vida adecuada a las necesidades de todos los ciudadanos, que permita la autor realización de cada una de ellos."
8589,1,paz_convivencia_pacífica,A,"Este valor se asocia fundamentalmente a la vida interna del país, no tanto como la relación con nuestros vecinos."
8605,1,paz_convivencia_pacífica,A,comunicarnos de forma no violenta.
8634,1,paz_convivencia_pacífica,A,QUE CHILE NO VAYA A LAS GUERRAS NI GASTE TANTO EN ARMAS.
8636,1,paz_convivencia_pacífica,A,7 participantes toma acuerdo el resto se abstiene
8777,1,paz_convivencia_pacífica,A,"Se relaciona con otros principios y valores como el respeto, bien común, por ejemplo. Es transversal para el desarrollo de un país."
8822,1,paz_convivencia_pacífica,A,"La idea de que podamos vivir en paz, sin miedo a que se nos vulneren nuestros derechos, logrando una felicidad en comunidad."
8876,1,paz_convivencia_pacífica,A,"La constitución  y el Estado deben consagrar valores que garanticen la seguridad de su población, así como impulsar políticas preventivas de la delincuencia y de los conflictos armados."
8877,1,paz_convivencia_pacífica,A,"Se debe asegurar la seguridad individual, comunitaria, social. Convivencia Pacifica"
8882,1,paz_convivencia_pacífica,A,Queremos vivir tranquilos
8883,1,paz_convivencia_pacífica,A,"Se cree que para que todos los valores y principios se puedan cumplir en armonía, debe existir la Paz y la convivencia pacifica, esto engloba la tolerancia, la solidaridad, la justicia y la inclusión."
8944,1,paz_convivencia_pacífica,A,"El estado debe garantizar la seguridad individual, colectiva y paz social. Nosotros no estamos autorizados para ello"
9012,1,paz_convivencia_pacífica,A,"El Estado debe  resguardar y asegurar la seguridad individual y la paz social, con el fin de evitar la auto tutela y auto defensa"
9017,1,paz_convivencia_pacífica,P,"Necesaria y que se construye con la verdadera justicia, respeto a toda persona y ser viviente. Esto se logra satisfaciendo las necesidades básicas."
9024,1,paz_convivencia_pacífica,A,Seguridad
9110,1,paz_convivencia_pacífica,A,Todos quieren vivir en paz sin problemas
9116,1,paz_convivencia_pacífica,A,"Falta de Paz,  entendimiento entre iguales, educación"
9129,1,paz_convivencia_pacífica,A,"Es deber central del Estado resguardar la seguridad individual, la unidad nacional y la paz social. Si no podemos ejercer la auto defensa, es precisamente por el hecho que el Estado asume ese deber."
9140,1,paz_convivencia_pacífica,A,Ayuda a vivir tranquilos y mejora la calidad de vida
9151,1,paz_convivencia_pacífica,A,"Para el desarrollo de cualquier país se debe tener paz, por tanto el Estado debe dar las garantías para que todos los habitantes se le entregue las condiciones para asegurar la paz y la convivencia pacífica."
9157,1,paz_convivencia_pacífica,A,La paz y la convivencia pacífica entre los países e internamente es y debe ser un objetivo de toda la sociedad.
9176,1,paz_convivencia_pacífica,A,para poder emprender libremente y poder trabajar
9202,1,paz_convivencia_pacífica,A,"Palabra tan manoseada, pero hacemos tan poco por cuidarla, sentimos la necesidad que la constitución haga hincapié en este punto."
9215,1,paz_convivencia_pacífica,A,El Estado debe resguardar la paz social
9251,1,paz_convivencia_pacífica,A,"Un valor fundamental para el núcleo de nuestro país, para la familia"
9324,1,paz_convivencia_pacífica,A,"Derecho a manifestar las ideas de forma respetuosa, para exponer ideas."
9329,1,paz_convivencia_pacífica,A,"Para vivir en un país con convivencia pacifica y en paz, primero debe asegurarse la seguridad de las personas"
9331,1,paz_convivencia_pacífica,A,para que exista un ambiente social y paz ciudadana
9334,1,paz_convivencia_pacífica,A,que los violentistas no tienen ningún asidero en nuestro país y respeto por la persona humana
9342,1,paz_convivencia_pacífica,A,"Toda persona tiene derecho a vivir en paz, con libertad y resguardo para desenvolverse día a día."
9353,1,paz_convivencia_pacífica,A,Vivir en armonía.
9354,1,paz_convivencia_pacífica,A,x
9399,1,paz_convivencia_pacífica,P,Concepto clave que permite el desarrollo del país y las personas. Búsqueda de este desarrollo a través de la gestión no violenta de los conflictos.
9444,1,paz_convivencia_pacífica,A,"Permite y se relaciona con; la diversidad, el respeto, tolerancia, pluralismo, convivencia, solidaridad, inclusión."
9475,1,paz_convivencia_pacífica,A,"la paz es un principio básico, debemos entender que la paz no se impone"
9487,1,paz_convivencia_pacífica,A,"Que exista armonía y convivencia pacífica entre todas las partes de la sociedad. Que los conflictos se solucionen con dialogo, respeto y tolerancia."
9504,1,paz_convivencia_pacífica,A,Ningún fin justifica la violencia. Una sociedad más justa (que de seguridades) facilita la convivencia pacífica Es un concepto muy relacionado con el respeto mutuo Promover la negociación como mecanismo de resolución de conflictos para evitar la violencia. También hay que extender el concepto de convivencia pacífica a relaciones armoniosas y de respeto al medio ambiente.
9526,1,paz_convivencia_pacífica,A,"centrada en la importancia de vivir en una sociedad sin violencia , y resaltando el rol de la familia incluyendo a todo tipos de familias."
9548,1,paz_convivencia_pacífica,A,GARANTIZAR SEGURIDAD Y TRANQUILIDAD DE TODOS LOS CIUDADANOS.
9671,1,paz_convivencia_pacífica,A,Con la paz existe dialogo u acuerdo.
9787,1,paz_convivencia_pacífica,A,Un valor que para nosotros y en este momento es de importancia primordial
9801,1,paz_convivencia_pacífica,A,ENTENDIENDOSE COMO AUSENCIA DE CONFLICTOS ARMADOS Y TAMBIEN AUSENCIA DE LA VIOLENCIA ORIGINADA POR LA NEGACION DE DERECHOS Y LIBERTADES.
9819,1,paz_convivencia_pacífica,A,"sociedad en  crisis, asegurar la dignidad de las personas."
9845,1,paz_convivencia_pacífica,A,"Cada persona tiene derecho a expresar lo que piensa , sin que  esto dañe la integridad del otro"
9858,1,paz_convivencia_pacífica,A,"El Estado debe resguardar la paz social, la seguridad individual y la unidad nacional"
9929,1,paz_convivencia_pacífica,A,Porque en una guerra se pierde más de lo que se gana y porque queremos una comunidad pacífica.
9976,1,paz_convivencia_pacífica,A,tranquilidad de todos los ciudadanos. respeto a los distintos pensamientos. Unidad entre todos en base a la tolerancia.
9992,1,paz_convivencia_pacífica,P,Son las bases en una sociedad para vivir en equidad y justicia
9994,1,paz_convivencia_pacífica,P,"Estamos de acuerdo, ya que todo chileno debe poder vivir sin temor y no sentirse agredido, también se debe respetar esto con los extranjeros y pueblos indígenas que habitan en nuestro país."
9995,1,paz_convivencia_pacífica,A,este valor debe respetarse valorarlo y ser una constante en nuestro sistema
10006,1,paz_convivencia_pacífica,A,"garantía que se da si logramos la seguridad, paz social englobada en la seguridad, que no se impida mi derecho a estar en desacuerdo, se generan instancias de solución de conflictos, que se atiendan las garantías sociales"
10026,1,paz_convivencia_pacífica,A,"Que el gobierno se preocupe de la paz de los habitantes, mejorando leyes sobre marcha y protestas. Esto se logrará por medio de una A.C."
10028,1,paz_convivencia_pacífica,A,"Este valor debería estar muy presente, y hacer hincapié en ello para tener una mejor calidad de vida y considerar la igualdad de condiciones."
10029,1,paz_convivencia_pacífica,A,Basado en el bien común por sobre intereses particulares.
10037,1,paz_convivencia_pacífica,A,"QUE APRENDAMOS A RESPETAR TODOS Y A TODAS SEGÚN GENERO, CLASES SOCIALES Y DEL LUGAR QUE VIVIMOS"
10056,1,paz_convivencia_pacífica,A,"la paz es un principio básico muy importante, se debe guardar y cuidar"
10070,1,paz_convivencia_pacífica,A,paz
10112,1,paz_convivencia_pacífica,A,Esto redunda en la calidad de vida. Se requiere reforzar los valores.
10131,1,paz_convivencia_pacífica,A,Para relaciones igualitarias entre las personas de un mismo territorio y comunidad. para una relación entre países.
10167,1,paz_convivencia_pacífica,A,"Que el estado garantice la paz, tanto con los países vecinos como en nuestro país. (guerras civiles)"
10174,1,paz_convivencia_pacífica,A,"debe destacarse este concepto en alguna parte de la constitución, atendiendo al creciente síntoma de violencia que ha alcanzado nuestro país, ya sea en protestas, trato personal, etc. Es de suma urgencia cambiar la forma en la cual estamos relacionándonos."
10237,1,paz_convivencia_pacífica,A,La constitución debe promover el bien común para alcanzar la máxima realización espiritual y material de las chilenas y chilenos.
10246,1,paz_convivencia_pacífica,A,Como una forma de vida donde se considere que las personas pueden tener paz y por ende tranquilidad en su diario vivir
10273,1,paz_convivencia_pacífica,A,vivir tranquilos sin enfrentamientos
10282,1,paz_convivencia_pacífica,A,"Solución no es subir rejas, pasa por el autocuidado; el conocerse con sus vecinos. No seamos egoístas.  Carabineros no da abasto.  El delincuente ""se educa"" en el delito y va conociendo el comportamiento de la gente.  ¿nos seguiremos encarcelando? Derecho a la paz."
10283,1,paz_convivencia_pacífica,A,vivir seguro sin delincuencia  que no existan traficantes en los lugares donde vivimos
10298,1,paz_convivencia_pacífica,A,todas las personas queremos vivir en un entorno pacifico y en paz
10313,1,paz_convivencia_pacífica,A,Consideramos necesario e imprescindible el respeto y valoración de la diversidad humana.
10319,1,paz_convivencia_pacífica,A,Todos queremos vivir tranquilos sin temer por lo que alguna vez fuimos. Sacar la mirada de la sospecha sobre uno.
10321,1,paz_convivencia_pacífica,P,Respetar normas de convivencia y vivir en paz.
10389,1,paz_convivencia_pacífica,A,Es la base para el dialogo
10404,1,paz_convivencia_pacífica,A,"Es deber central del Estado resguardar la seguridad individual, la unidad nacional y la paz social. Si no podemos ejercer la auto defensa, es precisamente por el hecho que el Estado asume ese deber."
10446,1,paz_convivencia_pacífica,A,"Es deber central del Estado resguardar la seguridad individual, la unidad nacional y la paz social."
10481,1,paz_convivencia_pacífica,A,"PODER ASEGURAR LA VIVENCIA TRANQUILA, PERO RESPETANDO AL OTRO"
10500,1,paz_convivencia_pacífica,A,por que es la única manera en que los humanos podemos coexistir
10504,1,paz_convivencia_pacífica,A,Que se garantize la paz interna y externa para desarrollarnos libremente.
10529,1,paz_convivencia_pacífica,A,"confianza en la justicia, respeto por el entorno y vecionos."
10551,1,paz_convivencia_pacífica,A,Es importante que la sociedad aprenda a resolver sus conflictos de forma respetuosa y pacífica.
10554,1,paz_convivencia_pacífica,A,SER MAS DRÁSTICO CON LAS POSICIONES MILITROFES
10641,1,paz_convivencia_pacífica,A,Crear las condiciones básicas para que todos puedan vivir de una manera tranquila y sana.
10713,1,paz_convivencia_pacífica,A,Es deber principal del Estado resguardar la seguridad individual y la paz social y así no incurrimos en la autodefensa.
10748,1,paz_convivencia_pacífica,A,Que se establescan leyes y se fomenten la paz y la buena convivencia entre los ciudadanos.
10750,1,paz_convivencia_pacífica,A,"para que las personas se lleven bien entre si, no haya mas violencia y mejor vivir."
10814,1,paz_convivencia_pacífica,A,"Que todos podamos vivir en paz, sin temor"
10818,1,paz_convivencia_pacífica,A,"Propender y promocionar la vida individual y familiar en un clima de armonía con sólidos valores, inculcados de s la misma familia escuela y sociedad."
10821,1,paz_convivencia_pacífica,A,"Como garantía de un cumplimiento de derechos sociales, a través de la participación ciudadana, ejercida como eje de resolución de conflictos v/s criminalización de movimientos sociales."
10824,1,paz_convivencia_pacífica,A,"Es deber central del Estado resguardar la seguridad individual, la unidad nacional y la paz social. Si no podemos ejercer la auto defensa, es precisamente por el hecho que el Estado asume ese deber"
10862,1,paz_convivencia_pacífica,A,"Somos una sociedad que progresa unida, que necesitamos de la cooperación y la relación entre seres humanos, por lo que dice relación desde la convivencia entre integrantes de la sociedad, y desde la relación Estado-individuo. Agregamos también la convivencia pacífica internacional."
10870,1,paz_convivencia_pacífica,A,"Es sinónimo de respeto a la dignidad humana, los DDHH y a la libre autodeterminación de los pueblos."
10874,1,paz_convivencia_pacífica,A,Los participantes opinan que la sociedad y el Pueblo debe primar la conducta de escuchar y aceptar la opinión de los demás.
10908,1,paz_convivencia_pacífica,A,Vemos la transgresión permanente de la paz y sin esta no hay desarrollo comunitario.
