idEla,tema,concepto,acuerdo,fundamento
48,2,proteccion_judicial_de_los_derechos,P,"Que no sea una declaracion de principios, sino que se materialice en instituciones y mecanismos. Que sea una protección igualitaria y no segregada."
54,2,proteccion_judicial_de_los_derechos,A,Que si no se respetan los derechos individuales o de una comunidad la justicia pueda garantizar su respeto y protección para todos.
105,2,proteccion_judicial_de_los_derechos,A,igualdad en pobres y ricos
111,2,proteccion_judicial_de_los_derechos,A,"Tener el derecho a ejercer ante los tribunales, todas las acciones destinadas a proteger los derechos consagrados en la Constitución y los Tratados Internacionales vigentes. Es fundamental terminar con la desigualdad derivada de los recursos económicos para acceder a la justicia."
136,2,proteccion_judicial_de_los_derechos,A,Evita la vulneración de los derechos por parte de individuos e instituciones.
207,2,proteccion_judicial_de_los_derechos,A,Es la herramienta más elemental para garantizar los derechos reconocidos por la constitución
213,2,proteccion_judicial_de_los_derechos,A,Que todos tengan la posibilidad de tener un abogado para defender sus derechos.
263,2,proteccion_judicial_de_los_derechos,A,"El gobierno debe velar para que se cumplan y respeten todos nuestros derechos, otorgando las herramientas necesarias para que ello se cumpla."
279,2,proteccion_judicial_de_los_derechos,A,ASEGURARSE QUE MIS DERECHOS SON LOS MISMOS PARA TODOS Y RESPETARLOS
289,2,proteccion_judicial_de_los_derechos,A,La declaración formal de los derechos debe contar con medios de protección legal efectiva.
291,2,proteccion_judicial_de_los_derechos,A,Se debe reforzar el derecho a un acceso a igualitario y pronto a la justicia. Los juicios prolongados constituyen en sí mismos una forma de injusticia.
296,2,proteccion_judicial_de_los_derechos,A,al bien público y los derechos de los trabajadores
297,2,proteccion_judicial_de_los_derechos,A,"Toda persona tiene el derecho a que sus garantías y derechos individuales (derecho a la vida, a la propiedad, a la libertad, etc) sean amparados y protegidos por las leyes y los estamentos judiciales."
317,2,proteccion_judicial_de_los_derechos,A,Para asegurar los Derechos
387,2,proteccion_judicial_de_los_derechos,A,"Garantizar los derechos (por ejemplo) salud; poder denunciar cuando algo no funciona (cuando no se está cumpliendo con un derecho). A su vez activar otros sistemas, ya que alguien debe hacerse cargo (para garantizar el ejercicio de los derechos)."
396,2,proteccion_judicial_de_los_derechos,A,es la garantia de cada ciudadano (a) de la protección de sus derechos y de ejercer libremente sus necesidades
418,2,proteccion_judicial_de_los_derechos,A,Esencial para hacer efectivo el ejercicio de derechos
482,2,proteccion_judicial_de_los_derechos,A,para que las personas se encuentren protegidas en todos sus derechos
507,2,proteccion_judicial_de_los_derechos,A,como una forma de abolir el abuso de poder.
527,2,proteccion_judicial_de_los_derechos,A,"Garantía legal y vinculante con legislación y normativa referidas a suelo, territorio y ciudades con la institucionalidad para garantizar y proteger los derechos urbanos, habitacionales, territoriales y al uso sostenible de los recursos naturales. Garantía legal y vinculante de reparación."
553,2,proteccion_judicial_de_los_derechos,A,Se deben proteger judicialmente todos los derechos.
644,2,proteccion_judicial_de_los_derechos,A,Para el ejercicio efectivo de los derechos se requieren mecanismos judiciales de protección al alcance de todos.
653,2,proteccion_judicial_de_los_derechos,A,"Con información transparente, educación cívica e integral tendríamos una ciudadanía informada y consiente de sus derechos."
669,2,proteccion_judicial_de_los_derechos,A,Todas las personas deben sentir el resguardo de sus derechos y que las personas que vulneren esto deben recibir su sanción.
714,2,proteccion_judicial_de_los_derechos,A,Garantía de que todos los derechos sean exigibles.
717,2,proteccion_judicial_de_los_derechos,A,Todos estos derechos no tendrían sentido si no podemos exigirlos. Por eso es necesario poder pedirle a un juez que haga valer mis derechos.
732,2,proteccion_judicial_de_los_derechos,A,"Es necesario considerar el DERECHO A RECLAMO, consideramos que es necesaria la correcta protección judicial para que los derechos garantizados en la Constitución y las leyes no se transformen o sean en el peor de los casos sólo ""aspiraciones sociales""."
733,2,proteccion_judicial_de_los_derechos,A,"garantizar el cumplimiento de los derechos de los ciudadanos, que exista una real justicia para con ellos."
745,2,proteccion_judicial_de_los_derechos,A,A
778,2,proteccion_judicial_de_los_derechos,A,"Respaldo legal de los derechos, que sean garantizados y puedan ser exigidos por todos los ciudadanos, protección del estado."
799,2,proteccion_judicial_de_los_derechos,A,"Si no hay garantías por parte del Estado del respeto de los derechos, debe existir un garante, que debe ser el poder judicial."
851,2,proteccion_judicial_de_los_derechos,A,Los derechos de las personas deben ser avalados por un marco legal.
868,2,proteccion_judicial_de_los_derechos,A,Hubo acuerdo total entre los participantes.
876,2,proteccion_judicial_de_los_derechos,A,"Derechos Sociales y humanos garantizados Educación de excelencia, gratuita, sin lucro, no sexista y holística. Salud de excelencia, resolutiva, oportuna y universal. Vivienda social de calidad y con materialidad acorde al clima, políticas descentralizadas.Se debe generar la institucionalidad y contraloría necesaria para que las personas que ocupen cargos electos o dirigenciales a nivel público o privado sean probadamente probas"
897,2,proteccion_judicial_de_los_derechos,P,Herramienta que obliga el resguardo y cumplimiento de nuestros Derechos Sociales
932,2,proteccion_judicial_de_los_derechos,A,Asegurar que se cumplen los derechos.
956,2,proteccion_judicial_de_los_derechos,A,ES NECESARIO QUE LOS DERECHOS Y GARANTÍAS TENGAN UNA PROTECCIÓN REAL POR PARTE DEL ESTADO.
959,2,proteccion_judicial_de_los_derechos,A,Tanto público como privado
963,2,proteccion_judicial_de_los_derechos,A,Hoy no existe real proteccion de los derechos ciudadanos.
1036,2,proteccion_judicial_de_los_derechos,A,"En los casos de derechos fundamentales, El Estado debiera hacerse cargo de los juicios que se generen en pos del bien común."
1051,2,proteccion_judicial_de_los_derechos,A,.
1055,2,proteccion_judicial_de_los_derechos,A,"La justicia debe resguardar nuestros derechos, hay que modificarlos para estar respaldados en todo ámbito."
1057,2,proteccion_judicial_de_los_derechos,A,ya que sin eso no se pueden ejercer los derechos
1072,2,proteccion_judicial_de_los_derechos,P,derechos
1127,2,proteccion_judicial_de_los_derechos,A,Los ciudadanos deben contar con herramientas que hagan exigibles los derechos garantizados en la Constitución.
1144,2,proteccion_judicial_de_los_derechos,A,Se requiere un mecanismo real de protección  judicial de los derechos  garantizados.
1146,2,proteccion_judicial_de_los_derechos,A,QUE LA JUSTICIA NO DESCONOZCA LOS DERECHOS A UN TRIBUNAL JUSTO EN CONTRA DE LOS AGRESORES AUN SEAN POLÍTICOS
1221,2,proteccion_judicial_de_los_derechos,A,Asistencia fiscal garantizada en querellas en caso de presunta violación del derecho.
1241,2,proteccion_judicial_de_los_derechos,A,"ofrecer garantías eficaces que hagan que dicho reconocimiento no sea una mera declaración de buenas intenciones vacía de eficacia, que ofrezcan mecanismos jurídicos que permitan la rápida corrección de los derechos conculcados se manifiesta en la creación de instrumentos procesales concretos."
1255,2,proteccion_judicial_de_los_derechos,A,"Protección de nuestros pueblos originarios, respeto a los convenios internacional del trabajo y su decreto 169."
1265,2,proteccion_judicial_de_los_derechos,A,Sin Observaciones.
1266,2,proteccion_judicial_de_los_derechos,A,Derecho a decidir qué hacer con los dineros propios y recibir protección en cuanto a la salud.
1327,2,proteccion_judicial_de_los_derechos,A,Cada ciudadano y ciudadana debe tener derecho a una adecuada y debida protección judicial de sus derechos.
1379,2,proteccion_judicial_de_los_derechos,A,A
1415,2,proteccion_judicial_de_los_derechos,A,Apuntamos aquí a la existencia - cautelada por el estado- de una o varias entidades que velen por la protección judicial de los derechos individuales y colectivos de los ciudadanos.
1425,2,proteccion_judicial_de_los_derechos,A,"Universal e igualitaria, mediante organismos estatales que velen por su correcto funcionamiento"
1500,2,proteccion_judicial_de_los_derechos,A,PORQUE ES FUNDAMENTAL CONTAR CON UN PODER JUDICIAL QUE PERMITA EXIGIR EL CUMPLIMIENTO DE LAS OBLIGACIONES Y VELAR POR EL RESPETO DE NUESTRO DERECHOS
1524,2,proteccion_judicial_de_los_derechos,A,"el estado debe ser garante de la proteccion, debe defender los derechos"
1525,2,proteccion_judicial_de_los_derechos,A,"se debe reforzar el derecho a un acceso igualitario y pronto a la justicia, los jucios prolongados constituyen en si mismo una forma de injusticia"
1529,2,proteccion_judicial_de_los_derechos,A,"es la forma de resguardar, los aspectos d elibertad, igualdad y dignidad de las personas."
1567,2,proteccion_judicial_de_los_derechos,A,"Se debe garantizar el cumplimiento de los derechos por ley . En caso contrario, las personas deben tener acceso equitativo a la protección judicial de sus derechos."
1568,2,proteccion_judicial_de_los_derechos,A,Esto entendido como una forma de garantizar el cumplimiento y respecto de los demás derechos.
1594,2,proteccion_judicial_de_los_derechos,A,derecho a que todo ciudadano pueda recurrir a la justicia en caso de necesidad de reclamar por sus derechos y que estos sean atendidos y protegidos
1596,2,proteccion_judicial_de_los_derechos,A,"Es necesario que la justicia cautele los derechos de las personas, así como las leyes."
1615,2,proteccion_judicial_de_los_derechos,A,Para que la justicia pueda resguardar los derechos consagrados en la Constitución.
1631,2,proteccion_judicial_de_los_derechos,A,La falta de políticas sociales que respaldan a los ciudadanos.
1657,2,proteccion_judicial_de_los_derechos,A,Cada ciudadano chileno debe ser amparado por la ley.
1711,2,proteccion_judicial_de_los_derechos,A,"Junto con el acceso a la justicia y las garantías del debido proceso, este derecho es esencial para que los derechos garantizados sean efectivamente cumplidos y respetados por el Estado y por la sociedad. Sin esta protección, no tienen contenido"
1721,2,proteccion_judicial_de_los_derechos,A,"No hay cultura de respetar los derechos de las personas , urgencia de ocuparse de los niños vulnerados, es necesario salvar la vida de ni;os y ni;as."
1733,2,proteccion_judicial_de_los_derechos,A,"A este derecho se le debe integrar ""de las personas y los animales"", así expresa la disposición real de ejercer el valor del respeto."
1752,2,proteccion_judicial_de_los_derechos,A,Garantizar su ejercicio.
1768,2,proteccion_judicial_de_los_derechos,A,Recurso de protección con mecanismos efectivos de reclamación para todos los derechos fundamentales.
1771,2,proteccion_judicial_de_los_derechos,A,"tutela efectiva, incluye exigibilidad de derechos restablecimiento del daño infligido reparación del afectado"
1864,2,proteccion_judicial_de_los_derechos,A,•Se debe reforzar el derecho a un acceso a igualitario y pronto a la justicia. Los juicios prolongados constituyen en sí mismos una forma de injusticia.
1908,2,proteccion_judicial_de_los_derechos,A,"defiendan mis derechos, poder demandar"
1937,2,proteccion_judicial_de_los_derechos,A,ok
1944,2,proteccion_judicial_de_los_derechos,A,"Ante la vulneración de los derechos, que los ciudadanos tengan acceso a la defensa real, oportuna y efectiva, para restituir el ejercicio pleno de los derechos vulnerados."
1978,2,proteccion_judicial_de_los_derechos,A,"Se considera relevante poder incorporar una figura que resguarde el cumplimiento cabal de los derechos, que exista protección judicial cada vez que estos derechos sean vulnerados.-"
1990,2,proteccion_judicial_de_los_derechos,A,Demandar individual y colectivamente al Estado y a los particulares.
2045,2,proteccion_judicial_de_los_derechos,A,la ultima ratio la constituye la posibilidad efectiva de recomponer el ejercicio  de un derecho con la intervención de un tercero imparcial
2066,2,proteccion_judicial_de_los_derechos,A,Hacer de los derechos humanos sobre todo de los vinculados con la vida algo de real relevancia no como los que se muestran hoy en día y demostrar todo esto en la ley que ejecuta.
2096,2,proteccion_judicial_de_los_derechos,A,"nadie debe quedar desamparado, el poder judicial debe ser ágil decentralizado y con profesionales conocedores de dibersos estatus sociales."
2099,2,proteccion_judicial_de_los_derechos,A,Es un derecho que garantiza el resguardo de otros derechos y su debida protección.
2102,2,proteccion_judicial_de_los_derechos,A,Este derecho debe considerar la generación de mecanismos que permitan cumplir de manera garantizada los derechos.
2236,2,proteccion_judicial_de_los_derechos,A,Para todos los derechos garantizados en la constitución. Con protección al derecho ajeno y promoción de la exigibilidad de los derechos ante Tribunales ordinarios
2242,2,proteccion_judicial_de_los_derechos,A,- Es un mecanismo para ejercer efectivamente los derechos. - Recursos de protección gratuitos al alcance de todos.
2243,2,proteccion_judicial_de_los_derechos,A,"Implementar tribunales de ejecución de pena para salvaguardar la correcta ejecución de las condenas, en especial aquellas que conllevan restricción de libertad."
2303,2,proteccion_judicial_de_los_derechos,A,"Todo derecho, sin excepción alguna, debe tener protección mediante recurso de protección y otras acciones que procedan (amparo en su caso específico). Dicho protección debe ser mediante un proceso rápido que sirva para su propósito."
2316,2,proteccion_judicial_de_los_derechos,A,"Poderes resguardado, desde el Estado como garante de los mismos."
2327,2,proteccion_judicial_de_los_derechos,A,no bastan los derechos sin su protección efectiva.
2333,2,proteccion_judicial_de_los_derechos,A,Que los ciudadanos sean protegidos cuando no se cumplen sus derechos garantizados constitucionalmente.
2405,2,proteccion_judicial_de_los_derechos,A,..
2459,2,proteccion_judicial_de_los_derechos,A,"Los derechos no están del todo asegurados en la práctica. Es necesario que se garantice a través de un mecanismo judicial de protección, los derechos presentes en los tratados de derechos humanos internacionales y en las leyes nacionales, de manera práctica y eficaz."
2470,2,proteccion_judicial_de_los_derechos,A,Que el estado garantice la protección judicial de los derechos.
2486,2,proteccion_judicial_de_los_derechos,A,que la justicia sea la entidad que resguarde la protección de los derechos
2495,2,proteccion_judicial_de_los_derechos,A,ES FUNDAMENTAL QUE LOS DERECHOS QUE BUSCAMOS PROTEGER CUENTEN CON UN MARCO JUDICIAL QUE PERMITA HACERLOS VALER.
2527,2,proteccion_judicial_de_los_derechos,A,Para que no se pasen por alto los derechos a la hora de tener un juicio o en cualquier momento de la vida.
2538,2,proteccion_judicial_de_los_derechos,A,El estado tiene que garantizar el cumplimiento de los derechos.
2580,2,proteccion_judicial_de_los_derechos,A,nn
2596,2,proteccion_judicial_de_los_derechos,A,que se respete a nivel institucional los derechos de las personas
2665,2,proteccion_judicial_de_los_derechos,A,-Ya que existe una débil protección ante los derechos humanos con respecto a acontecimientos inconclusos de la dictadura.
2690,2,proteccion_judicial_de_los_derechos,A,Los derechos contemplados en esta Constitución deben contar con las herramientas jurídicas necesarias para su exigibilidad
2712,2,proteccion_judicial_de_los_derechos,A,Por este concepto se establece el compromiso del estado de defender judicialmente todos los derechos reconocidos en la constitución.
2725,2,proteccion_judicial_de_los_derechos,A,"Los derechos que sólo están reconocidos en un texto, pero que no se pueden ejercer en la práctica o no tienen tutela jurisdiccional, son sólo meras expectativas y no derechos reales. Debe existir un acceso igualitario y expedito a la justicia."
2794,2,proteccion_judicial_de_los_derechos,A,Porque en algunos ámbitos no se respetan los derechos judiciales.
2797,2,proteccion_judicial_de_los_derechos,A,"Los derechos solo existen, con una eficaz protección judecial"
2800,2,proteccion_judicial_de_los_derechos,A,El estado debe proveer los medios para que todos aquellos que vean sus derechos fundamentales vulnerados puedan defenderlos en el poder judicial.
2808,2,proteccion_judicial_de_los_derechos,A,Priorización estadística según las preferencias del diálogo ciudadano.
2827,2,proteccion_judicial_de_los_derechos,A,"Necesitamos ejercer nuestros derechos y que el gobierno garantice su protección, hoy existen muchos vacíos legales que nos vulneran."
2864,2,proteccion_judicial_de_los_derechos,A,"Es necesario dado que actualmente las garantías constitucionales y legales no son suficientes para proteger a los derechos en general. Deben existir acciones legales efectivas, para que los jueces tengan herramientas para hacer cumplir la ley."
2918,2,proteccion_judicial_de_los_derechos,A,Garantizar que la justicia se imparta de forma justa e igualitaria. Recordando los derechos humanos.
2962,2,proteccion_judicial_de_los_derechos,A,que los derechos estén garantizados ante una vulneración y que existan las instituciones y mecanismos donde reclamarlos.
2984,2,proteccion_judicial_de_los_derechos,A,"Es un deber de cada ciudadano exigir el cumplimiento de sus derechos, pero es deber del Estado hacer que esto se lleve a cabo judicialmente para que nuestros derechos fundamentales se hagan respetar y se cumplan."
3003,2,proteccion_judicial_de_los_derechos,A,Debe existir una protección judicial a la vulneracion de algún tipo de derecho. Deben existir garantías.
3052,2,proteccion_judicial_de_los_derechos,P,"Que todos nuestros derechos estén protegidos judicialmente, es decir, que las autoridades respectivas velen por el cumplimiento y respeto de todos los derechos de cada ciudadano. Que no se vulnere ningún derecho."
3055,2,proteccion_judicial_de_los_derechos,A,el estado debe velar por los derechos de todos los ciudadanos sin importar situación económica
3061,2,proteccion_judicial_de_los_derechos,A,"Toda persona tiene el derecho a que sus garantías y derechos individuales (derecho a la vida, derecho a la propiedad, a la libertad, etc.) sean amparados y protegidos por las leyes y los estamentos judiciales."
3136,2,proteccion_judicial_de_los_derechos,A,Se debe garantizar el cumplimiento de la justicia y el derecho de las personas.
3139,2,proteccion_judicial_de_los_derechos,A,"Todos los derechos reconocidos en la constitución deben contar con recursos tanto judiciales como administrativos que permitan su reclamación para hacerlos exigibles, única manera de hacerlos efectivos."
3153,2,proteccion_judicial_de_los_derechos,A,Como garantía de cumplimiento y exigibilidad de los demás derechos reseñados.
3167,2,proteccion_judicial_de_los_derechos,P,"Herramienta fundamental para poder llevar a cabo la protección de estos derechos, es decir, se necesita herramientas para poder protegerlos en caso de ser vulnerados"
3178,2,proteccion_judicial_de_los_derechos,A,"en la medida que tenemos derechos, necesitan ser potegidos  y garantizados previniendo la vulneración de aquellos."
3193,2,proteccion_judicial_de_los_derechos,A,"Esta nueva constitucion debe constinuar velando por la proteccion de los derechos judiciales, especialmente para los que cumplen condena, velando por el respeto a derechos humano, a la no tortura, el derecho a no ser maltratado por el hecho de expresar nuestra opinión."
3253,2,proteccion_judicial_de_los_derechos,A,El poder judicial debe garantizar  el cumplimiento  de los derechos y deberes de la ciudadanía  con igualdad frente a la ley  tanto en su defensa como en su castigo.
3273,2,proteccion_judicial_de_los_derechos,A,Procurar que exista instancia  judicial especializada en las materias contenciosas administrativas.
3278,2,proteccion_judicial_de_los_derechos,A,Habría un  mecanismo legal para asegurar el ejercicio de todos los derechos.
3285,2,proteccion_judicial_de_los_derechos,A,"derecho que ampare contra actos que vulneren los derechos fundamentales, donde se terminen las prácticas abusivas"
3290,2,proteccion_judicial_de_los_derechos,A,x
3349,2,proteccion_judicial_de_los_derechos,A,Debe haber fiscalización para que no se pasen a llevar los derechos.
3368,2,proteccion_judicial_de_los_derechos,A,Es estado debe garantizar que los derechos que se encuentren en la constitucion tengan proteccion judicial para ser defendidos frente a aquellos que los vulneran y pasan allevar
3386,2,proteccion_judicial_de_los_derechos,A,"• Cumplimiento con el resguardo y que el derecho sea respetado por la ley • Protección judicial de los derechos, y reflexión sobre ¿cómo educar? y respetar • Si algo no es ley no se respeta. • Respetar el derecho a protestar"
3387,2,proteccion_judicial_de_los_derechos,A,SOBRE TODO LOS DERECHOS DE LOS MAS VULNERABLES: NIÑOS(AS) Y ADULTOS MAYORES
3410,2,proteccion_judicial_de_los_derechos,A,Es el estado quién debe entregar la protección judicial de los derechos a todos los ciudadanos.
3534,2,proteccion_judicial_de_los_derechos,A,Cuidado y respeto a las normas que garanticen los derechos de todos
3556,2,proteccion_judicial_de_los_derechos,P,"No existió un acuerdo, pero todos manifestamos el interés de que debe existir una protección del ejercicio de los derechos de parte de los ciudadanos."
3563,2,proteccion_judicial_de_los_derechos,A,Todos tenemos derecho a ser representados judicialmente y de forma expedita.
3572,2,proteccion_judicial_de_los_derechos,A,"Las leyes deben proteger a todos por igual, se debe eliminar la injerencia de grupos de interés particulares en la confección de leyes.  Se debe asegurar el  derecho efectivo de  acceso a la justicia eliminando las  trabas que existen actualmente."
3581,2,proteccion_judicial_de_los_derechos,A,El Estado está obligado a fortalecer el ordenamiento jurídico al servicio de los derechos del ser humano.
3639,2,proteccion_judicial_de_los_derechos,A,"Debe de asegurarse la acción ante los tribunales para proteger todos los derechos consagrados en la constitución, en especial, la protección de los derechos humanos respecto de los actos y omisiones del Estado, como garante de ellos."
3656,2,proteccion_judicial_de_los_derechos,A,Entendida como una garantía de todos los derechos
3721,2,proteccion_judicial_de_los_derechos,A,Los derechos deben ser respetados
3749,2,proteccion_judicial_de_los_derechos,A,Para no dejar a las personas desamparadas.
3755,2,proteccion_judicial_de_los_derechos,P,que la justicia proteja todos los derechos de los chilenos.
3852,2,proteccion_judicial_de_los_derechos,A,Derechos  a la libertad de expresión y  salarios.
3875,2,proteccion_judicial_de_los_derechos,A,PORQUE EL ESTADO DEBE RESPONSABILIZARSE DE PROTEGER Y ASEGURAR LOS DERECHOS DE LOS CIUDADANOS
3877,2,proteccion_judicial_de_los_derechos,P,Es necesario por cuanto propugnan la equidad e igualdad
3915,2,proteccion_judicial_de_los_derechos,A,Como garantía del cumplimiento de todos los derechos. Posibilidad de exigir el cumplimiento.
3968,2,proteccion_judicial_de_los_derechos,A,Si es necesario los derechos de las personas se debe proteger judicialmente.
3983,2,proteccion_judicial_de_los_derechos,A,Derecho a que el estado garantice a través de leyes el cumplimiento de los derechos y un mecanismo de protección judicial gratuito cuanto estos se vulneren.
4006,2,proteccion_judicial_de_los_derechos,A,"Consideramos a este como el más importante de los Derechos, pues nos permite una herramienta legal y efectiva para garantizar todos los demás derechos."
4041,2,proteccion_judicial_de_los_derechos,A,"De nada sirven los derechos sin la debida y oportuna protección judicial de los mismos, por ello debemos contar con mecanismos eficientes y eficaces que los cautelen."
4104,2,proteccion_judicial_de_los_derechos,A,"El estado debe velar por que todos los ciudadanos tengan acceso a una educación, salud, vivienda y trabajo de calidad, a que estos se puedan asociar y participar sin restricciones, al aire  y al agua. En caso de que el Estado no cumpla con estos derechos, será posible enfrentarlo judicialmente por su falta."
4115,2,proteccion_judicial_de_los_derechos,A,"La Constitución debe garantizar la protección judicial de todas las personas que viven en nuestro país, asegurando acceso igualdad a los derechos."
4119,2,proteccion_judicial_de_los_derechos,A,Garantizar la protección judicial de todos los derechos que sean reconocidos por el Estado.
4146,2,proteccion_judicial_de_los_derechos,P,El Estado no hace mucho en relación a la protección del derecho de las personas.
4168,2,proteccion_judicial_de_los_derechos,A,"Es fundamental para que los derechos fundamentales sean protegidos por el Estado, y a su vez de manera directa."
4174,2,proteccion_judicial_de_los_derechos,A,ES ESTADO NO DEBE REPRIMIR LOS DERECHOS QUE LA MISMA CONSTITUCIÓN CONSAGRA. DEBE EXISTIR TUTELAJE DE ELLOS.
4259,2,proteccion_judicial_de_los_derechos,A,Que se considere esa protección constitucional de los derechos y pueda existir un ente que los defienda.
4283,2,proteccion_judicial_de_los_derechos,A,DEBER PARA CON LOS DERECHOS DE CADA UNO.
4300,2,proteccion_judicial_de_los_derechos,P,"QUE LAS PERSONAS AL SER VULNERADAS SEAN PROTEGIDAS, ASÍ COMO ES APLICADA A PERSONAS PRIVILEGIADAS EN RIQUEZA O ESTATUS POLÍTICO, QUE LAS ÓRDENES DE ALEJAMIENTO SEAN CUMPLIDAS Y CON SANCIONES OPORTUNAS Y EFECTIVAS."
