idEla,tema,concepto,acuerdo,fundamento
4319,2,proteccion_judicial_de_los_derechos,A,porque tener un mecanismo de exigir al Estado el cumplimiento de los derechos resulta capital para darles efectividad.
4451,2,proteccion_judicial_de_los_derechos,A,Que exista una mayor protección y sanción de cada uno de los derechos cuando estos no son respetados.
4463,2,proteccion_judicial_de_los_derechos,A,Garantizar recursos para defender derechos
4531,2,proteccion_judicial_de_los_derechos,A,Que cada uno de los derechos que consideramos fundamentales sean amparados jurídicamente para corroborar su ejecución real.
4546,2,proteccion_judicial_de_los_derechos,A,"SE debe establecer como derecho , ya que hay derechos que se vulneran fácilmente y una herramienta eficaz es la protección judicial para la reclamación de ellos."
4561,2,proteccion_judicial_de_los_derechos,A,"ejercicio pleno de los derechos , y que los que no los respetan sean sancionados judicialmente."
4592,2,proteccion_judicial_de_los_derechos,A,"Si nuestros derechos son violados, necesitados tener una garantía real, de que se solucionara y no quedar desprotegidos."
4599,2,proteccion_judicial_de_los_derechos,A,"Fiscalización a la realización de estos derechos fundamentales, tener la convicción de que se cumplirán y respetaran por ley."
4659,2,proteccion_judicial_de_los_derechos,A,"Los derechos deben tener una garantía efectiva de defensa por parte del Estado, para evitar transgresiones y/o violaciones a éstos. Existen instancias en la que algunos de estos derechos pueden privarse, por ejemplo, al cometer un delito y estar en la cárcel (libertad)"
4684,2,proteccion_judicial_de_los_derechos,A,Porque es fundamental que se coloque en la Constitución para ser llevado a la práctica.
4699,2,proteccion_judicial_de_los_derechos,A,el Estado debe crear las instancias para que sean debidamente protegidos para las personas que posean los derechos que la Constitución y la ley cautelan. De esta manera también es responsabilidad de las personas de hacer cumplir sus derechos y hacer uso de la protección judicial como derecho y como
4733,2,proteccion_judicial_de_los_derechos,A,(10/10) QUE EL ESTADO PROTEJA Y GENERE UN MECANISMO PARA EL FACIL ACCESO A RECLAMAR POR EL CUMLIMIENTO DE SUS DERECHOS Y GARANTIAS.
4742,2,proteccion_judicial_de_los_derechos,A,La justicia imparcial e independiente debe actuar cuando los derechos de los ciudadanos sean vulnerados.
4750,2,proteccion_judicial_de_los_derechos,A,Que los tribunales de justicia reconozcan los derechos a través de mecanismos efectivos de los derechos reconocidos en la nueva constitución y las convenciones internacionales de derechos humanos
4758,2,proteccion_judicial_de_los_derechos,A,Que el estado proteja los derechos de las personas independiente de la condición en que se encuentre.
4777,2,proteccion_judicial_de_los_derechos,A,Garantizar el ejercicio de los derechos
4800,2,proteccion_judicial_de_los_derechos,A,"De nada nos sirve tener derechos si no los podemos proteger. Esto, siguiendo los tratados internacionales debería ser sin lugar a dudas."
4821,2,proteccion_judicial_de_los_derechos,A,"Todos somos iguales ante la ley, sin importar su condición económica, género, raza u origen. Por lo tanto tenemos derecho a la protección que el Poder Judicial imparte."
4839,2,proteccion_judicial_de_los_derechos,A,Contar con un sistema de resolución de conflictos y sus respectivas leyes es fundamental para que consagre la protección de los derechos
4857,2,proteccion_judicial_de_los_derechos,A,"Se requiere que no solo exista una lista como meras declaración de derechos, sino que el recurso de protección venga a accionar jurídicamente la protección efectiva de estos derechos si son vulnerados"
4872,2,proteccion_judicial_de_los_derechos,A,"LA PROTECCIÓN JUDICIAL DE LOS DERECHOS COMPRENDE EL DERECHO A PROCEDIMIENTOS JUSTOS, IMPARCIALES Y RÁPIDOS, QUE BRINDEN, LA POSIBILIDAD, PERO NUNCA LA GARANTÍA DE UN RESULTADO FAVORABLE."
4888,2,proteccion_judicial_de_los_derechos,A,Garantizar los derechos de protección en todo el proceso de juicio y evaluación de garantías.
4900,2,proteccion_judicial_de_los_derechos,P,"Se cree fundamental que exista una instancia que regule el cumplimiento efectivo de los Derechos de cada ciudadano, donde sea posible denunciar al estado cuando corresponda."
4902,2,proteccion_judicial_de_los_derechos,A,Para que los derechos no sean vulnerados debe existir un resguardo jurídico.
4927,2,proteccion_judicial_de_los_derechos,A,proteger mejor a las victimas
4935,2,proteccion_judicial_de_los_derechos,A,justicia oportuna: Se debe reforzar el derecho a un acceso igualitario y pronto a la justicia. Los juicios prolongados constituyen en sí mismos una forma de injusticia.
4952,2,proteccion_judicial_de_los_derechos,A,ellos deben ciudar de nosotros
4997,2,proteccion_judicial_de_los_derechos,A,"TODOS LOS DERECHOS DEBEN PODER EXIGIRSE A TRAVÉS DE LA JUSTICIA, ASÍ SE ASEGURA SU CUMPLIMIENTO A CABALIDAD Y NO QUEDA COMO LETRA MUERTA."
5030,2,proteccion_judicial_de_los_derechos,P,"Niños, mujeres, adultos mayores, hombres, deben tener derecho a la protección judicial en especial cuando pasan por situaciones de vulneración."
5063,2,proteccion_judicial_de_los_derechos,A,Son necesarios para ejercer y respetar los derechos básicos garantizados.
5085,2,proteccion_judicial_de_los_derechos,A,Como personas y habitantes de un país necesitamos ser protegidos ante la ley.
5106,2,proteccion_judicial_de_los_derechos,A,Para ello la justicia debe ser gratis y eficiente. Nadie debe ser pasado a llevar.
5111,2,proteccion_judicial_de_los_derechos,A,"ante un órgano judicial que sea realmente independiente, al que todas la personas, puedan acudir gratuitamente."
5141,2,proteccion_judicial_de_los_derechos,A,Los derechos tienen que ser exigibles.
5163,2,proteccion_judicial_de_los_derechos,A,DEBE INCLUIR LOS DERECHOS HUMANOS. La mejor forma de garantizar el resguardo y promoción estatal de los derechos de las personas es mediante la protección judicial de TODOS ellos. Esto comprende la justiciabilidad de los Derechos Humanos de manera directa en el sistema de derecho interno.
5241,2,proteccion_judicial_de_los_derechos,A,Poder proteger mis derechos
5306,2,proteccion_judicial_de_los_derechos,P,QUE EL GOBIERNO PROTEJA LOS DERECHOS HUMANOS.
5319,2,proteccion_judicial_de_los_derechos,A,"Que la ley actúe realmente garantizando que nuestros derechos no sean violados por los que tienen poder, principalmente económico y político, a saber; colusión, corrupción política-empresarial, monopolios, etc.."
5324,2,proteccion_judicial_de_los_derechos,A,"ste derecho debe estar garantizado por el Estado, ya que no tendría aplicabilidad establecer una serie de derechos que no tengan protección judicial. Todo lo estipulado en la Constitución y las leyes que emanen de ella, deben tener la protección judicial en caso de ser violadas."
5326,2,proteccion_judicial_de_los_derechos,P,quiero que todos los derechos sean protegidos por el poder judicial
5360,2,proteccion_judicial_de_los_derechos,A,"este concepto no es menor y debe ser considerado, pues la ley no puede defender aquello que por ley No esta escrito, así mismo, cuando se incumplen los derechos debe existir un mecanismo que garantice que se podrá proteger los derechos vulnerados."
5362,2,proteccion_judicial_de_los_derechos,A,porque se tienen que hacer valer los derechos
5370,2,proteccion_judicial_de_los_derechos,P,"Misma logica que la igualdad ante la ley,"
5390,2,proteccion_judicial_de_los_derechos,A,"Los derechos deben ser protegidos por la justicia, que sea ágil y expedita. También objetiva y ecuánime. Debe ser gratis"
5454,2,proteccion_judicial_de_los_derechos,A,la Ley debe velar por el resguardo de todos los derechos humanos
5491,2,proteccion_judicial_de_los_derechos,A,Que se sancionen judicialmente las vulneraciones de derechos.
5504,2,proteccion_judicial_de_los_derechos,A,Como una reafirmación del concepto actual agregando la propiedad sobre los fondos de pensiones.
5518,2,proteccion_judicial_de_los_derechos,A,"los derechos deben ser obligatoriamente preservados por el poder judicial,y de este modo que impida que se sobrepasen."
5532,2,proteccion_judicial_de_los_derechos,P,"La justicia debe aplicarse en Chile a todo nivel, con igualdad respecto de gobernantes y gobernados."
5567,2,proteccion_judicial_de_los_derechos,A,Se debe reforzar el derecho  a un acceso a igualitario y pronto a la justicia. Los juicios prolongados constituyen en sí  mismos una forma de injusticia.
5618,2,proteccion_judicial_de_los_derechos,P,Es la forma de ejercer todos los derechos consagrados en la Constitución y las leyes.
5627,2,proteccion_judicial_de_los_derechos,A,"Garantizar la protección de los derechos fundamentales de cada ciudadano/a y a estar afectos a un proceso judicial con un trato justo, digno e igualitario."
5633,2,proteccion_judicial_de_los_derechos,A,Consideramos que es un derecho clave para la sana convivencia democrática.
5642,2,proteccion_judicial_de_los_derechos,A,Que haya garantía efectiva de derechos
5707,2,proteccion_judicial_de_los_derechos,A,"- Resguardo de nuestros derechos, hacerlos exigibles."
5716,2,proteccion_judicial_de_los_derechos,A,Protección y cargos judicialmente los derechos.
5745,2,proteccion_judicial_de_los_derechos,A,"Asegurar que el ente estatal cumpla como garante de derechos, es decir, que exista un marco jurídico para proteger y resguardar los derechos."
5794,2,proteccion_judicial_de_los_derechos,A,que nuestros derechos no sean letra muerta sino que cada chileno pueda sentirse protegido en sus derechos por el ESTADO
5804,2,proteccion_judicial_de_los_derechos,A,Para garantizar efectivamente todos los derechos mencionados.
5813,2,proteccion_judicial_de_los_derechos,A,"La constitución nos garantice que los ciudadanos que ocupen los cargos públicos o privados será aplicable contra conductas activas como omisivas cometidas por el estado, como por particulares"
5817,2,proteccion_judicial_de_los_derechos,A,"Derecho importante para evitar la vulneración de derechos de los individuos de la sociedad. Necesidad de la existencia de una justicia única, exclusión de la justicia militar."
5833,2,proteccion_judicial_de_los_derechos,A,Se garantiza el acceso a la Justicia . y a la representación Civil y Penal. Este derecho será gratuito y de calidad para los sectores más vulnerables de la sociedad. El Sistema Público no será incompatible con sistemas privados. Las Fiscalías deberán representar al estado y victimas
5865,2,proteccion_judicial_de_los_derechos,A,Que se respete la Constitución.
5882,2,proteccion_judicial_de_los_derechos,A,Nadie debe transgredir nuestros derechos y tenemos derecho a sentirnos seguros.
5904,2,proteccion_judicial_de_los_derechos,P,Que los Derechos y las libertades puedan ser protegidos por la justicia.
5905,2,proteccion_judicial_de_los_derechos,A,Porque asegura  la protección de todos los demás derechos.
5951,2,proteccion_judicial_de_los_derechos,A,GARANTIZADA.
5966,2,proteccion_judicial_de_los_derechos,A,"Tenemos el Recurso de amparo y el Recurso de protección, para determinadas situaciones, queremos que exista algo similar cuando se trate del daño al Patrimonio Cultural."
5991,2,proteccion_judicial_de_los_derechos,A,Se debe garantizar judicialmente que todos los derechos fundamentales de las personas sean respetados.
5993,2,proteccion_judicial_de_los_derechos,A,Estar protegidos si estos derechos son vulnerados. Para que el Estado garantice que lo que  exijo como derecho sea respetado
6042,2,proteccion_judicial_de_los_derechos,A,"Entendido como una herramienta legal que permita asegurar estos derechos, incluyendo el derecho a la sindicalización, la huelga y también la libre competencia. Igualmente, el derecho de acceso a la información pública, que creemos de suma importancia para el desarrollo del Estado y sus políticas."
6068,2,proteccion_judicial_de_los_derechos,A,Sin una adecuada proteccion judicial de los derechos y libertades estos no se entienden y pierden eficacia.
6082,2,proteccion_judicial_de_los_derechos,A,Capacidad de cualquiera de acudir a los tribunales de justicia en caso de ver vulnerado alguno de sus derechos.
6098,2,proteccion_judicial_de_los_derechos,P,El estado debe garantizar la protección ante cualquier vulneración a los derechos humanos.
6112,2,proteccion_judicial_de_los_derechos,A,Consideramos muy importante que exista una garantía de que se podrá exigir la protección efectiva de todos los derechos consagrados en la constitución.
6118,2,proteccion_judicial_de_los_derechos,A,Es esencial proteger los derechos y dar un marco jurídico que garantice el respeto a los derechos y asigne responsabilidad en los deberes. Es proteger la base de la exigencia y legalidad.
6123,2,proteccion_judicial_de_los_derechos,A,Protección por la integridad física de cada una de las personas. (Derechos que cada persona tiene por pertenecer a la sociedad)
6151,2,proteccion_judicial_de_los_derechos,A,•Se debe reforzar el derecho a un acceso a igualitario y pronto a la justicia. Los juicios prolongados constituyen en sí mismos una forma de injusticia
6163,2,proteccion_judicial_de_los_derechos,A,Proteger efectivamente una acción cautelar que garantice y protega todos los derechos  garantizados por la constitución.-
6166,2,proteccion_judicial_de_los_derechos,A,"Que no existan derechos que no puedan ser reclamados a través de recursos. Que sea posible exigirle a la autoridad todos los derechos garantizados por la Constitución, y que si ésta no los respeta, tener posibilidad de recurrir ante los tribunales de Justicia para que se pronuncie al respecto."
6192,2,proteccion_judicial_de_los_derechos,A,Deberán ser respaldados por constitución todos los derechos de protección judicial .
6218,2,proteccion_judicial_de_los_derechos,A,"En tanto las políticas publicas del Estado no promuevan y protejan los derechos constitucionales de las personas, los tribunales tienen que ejercer la función publica de las cuales están investidos, esto es, ampararlos a nivel jurisdiccional (vía recurso de protección)."
6230,2,proteccion_judicial_de_los_derechos,A,La posibilidad de exigir el cumplimiento eficaz de los derechos consagrados en la Constitución.
6252,2,proteccion_judicial_de_los_derechos,A,"Consiste en el resguardo, por parte del Estado, de todos los derechos de primera, segunda y tercera generación."
6256,2,proteccion_judicial_de_los_derechos,A,Es el mecanismo que permite que se hagan valer los derechos de las personas.
6258,2,proteccion_judicial_de_los_derechos,A,El poder judicial debe hacerse cargo de las diferencias actuales en los procesos penales de los sectores más vulnerables respecto de aquellos con mayor poder adquisitivo.
6365,2,proteccion_judicial_de_los_derechos,A,No hay fundamento
6406,2,proteccion_judicial_de_los_derechos,A,"Todo ciudadano debe ser protegido en igualdad, no a ciudadanos de 1 y 2 clase. asesoría para victimas o ciudadanos que requieran defensa de sus intereses."
6422,2,proteccion_judicial_de_los_derechos,A,tribunales son la instancia final para resguardar los derechos.
6441,2,proteccion_judicial_de_los_derechos,A,"Mecanismo que garantiza la demanda judicial de la ciudadanía frente a la vulneración de los derechos. Una nueva constitución debe garantizar los derechos de las personas, los derechos sociales, culturales y económicos."
6449,2,proteccion_judicial_de_los_derechos,A,EL PODER JUDICIAL DEBE PROTEGER LOS DERECHOS DE TODOS Y TODAS Y DEBE HACER EXPEDITO SU ACCESO.
6457,2,proteccion_judicial_de_los_derechos,A,Guarda relación con la defensa a través de los Tribunales de Justicia de los derechos que tienen los ciudadanos y que se encuentren vulnerados.
6466,2,proteccion_judicial_de_los_derechos,A,necesitamos que se incline a obrara y juzgar respetando la verdad y dando a cada uno lo que le corresponde (igualdad)
6481,2,proteccion_judicial_de_los_derechos,A,Esto va enfocado al verdadero resguardo que debiese existir y a la transparencia de los derechos que deben ser efectivos en todos sus ámbitos.
6491,2,proteccion_judicial_de_los_derechos,A,El estado tiene el deber de garantizar la protección oportuna de los derechos ciudadanos.
6501,2,proteccion_judicial_de_los_derechos,A,Plazo de 6 meses para presentar un Recurso de Protección
6575,2,proteccion_judicial_de_los_derechos,A,"El Estado debe garantizar, sea cuál sea el derecho, la protección de éstos, creando instancias y/o instituciones que cumplan ese fin."
6581,2,proteccion_judicial_de_los_derechos,A,Es la única manera efectiva de ejercer todos los derechos
6587,2,proteccion_judicial_de_los_derechos,A,Protección de derechos básicos  Derechos a una defensa  Derecho a vivir en sociedad sin distinciones   Derecho a trabajo y la dignidad de los servicios que entrega el Estado
6588,2,proteccion_judicial_de_los_derechos,P,Se entiende que debe existir Un poder independiente del estado que garantice Y vele por los derechos .
6591,2,proteccion_judicial_de_los_derechos,A,"El Estado debe garantizar la protección de todos los derechos, mejorar protección a derechos hoy vulnerados. Ej: detención arbitraria, supervisar la correcta acción de defensores y fiscales."
6593,2,proteccion_judicial_de_los_derechos,A,"Se debe implementar un mecanismo de protección y garantía de los derechos, que estos no sean solo letra muerta sino que podamos ir más allá de una proyección liberal."
6621,2,proteccion_judicial_de_los_derechos,A,"todo ciudadano o mejor dicho habitante, tiene derecho a buscar la proteccón de sus derechos por parte del sistema de justicia."
6652,2,proteccion_judicial_de_los_derechos,A,"LA ÚNICA MANERA DE CONSAGRAR TODOS LOS DERECHOS DESCRITOS, ES TENER UNA REAL POSIBILIDAD DE ACCIONAR Y OBTENER SU CUMPLIMIENTO, POR TANTO DEBE CONSAGRARSE LA FACULTAD Y MECANISMOS QUE PERMITAN A LOS CIUDADANOS, EXIGIR EL CUMPLIMIENTO DE LOS MISMOS POR MECANISMOS EFECTIVOS Y ACCESIBLES."
6660,2,proteccion_judicial_de_los_derechos,A,Que los derechos se puedan exigir en tribunales
6680,2,proteccion_judicial_de_los_derechos,A,"LOS DERECHOS DEBEN ESTAR PROTEGIDOS Y SALVAGUARDADOS POR EL ESTADO, TRIBUNALES Y LOS CIUDADANOS. ES UN DEBER CONOCER Y PROTEGER."
6791,2,proteccion_judicial_de_los_derechos,P,"Que todos tengamos un acceso sencillo, rápido y efectivo a la justicia."
6868,2,proteccion_judicial_de_los_derechos,A,Derecho a desarrollar la democracia como corresponde.
6876,2,proteccion_judicial_de_los_derechos,A,permite a las persona exigir  al estado el cumplimiento de derechos asegurados en la constitución.
6928,2,proteccion_judicial_de_los_derechos,A,Posibilitar que un ente externo objetivo pueda participar en su regulación.
7045,2,proteccion_judicial_de_los_derechos,A,Tiene que haber un trato justo en todo.
7049,2,proteccion_judicial_de_los_derechos,A,"Por favor Justicia y Seguridad de verdad, para proteger a quienes ayudan. Necesitamos mucho la paz, los Adultos Mayores."
7093,2,proteccion_judicial_de_los_derechos,A,"Pese a que existen los mecanismos, éstos no se cumplen."
7124,2,proteccion_judicial_de_los_derechos,A,Para que cuando los derechos sean vulnerados se sancione.
7153,2,proteccion_judicial_de_los_derechos,A,"Que las instituciones se preocupen de defender nuestros derechos , independiente si cometemos o no delito y/o condición en que nos encontramos"
7185,2,proteccion_judicial_de_los_derechos,A,Acceso un abogado en caso de vulneración de derechos
7219,2,proteccion_judicial_de_los_derechos,A,Se debe reforzar el derecho a un acceso a igualitario y pronto a la justicia. Los juicios prolongados constituyen en sí mismos una forma de injusticia
7310,2,proteccion_judicial_de_los_derechos,A,El Estado protector del individuo y  Regulador y regulador y sancionador de los abusos de las empresas
7312,2,proteccion_judicial_de_los_derechos,A,"Apliquen estandares de calidad en la afectacion del medioambiente para las frandes empresas, mas control, mas penalidad a los daños al medioambiente."
7321,2,proteccion_judicial_de_los_derechos,A,"Cuando hablamos de derechos básicos consideramos que este derecho es uno de los mas importantes ya que engloba a muchos otros como vivienda salud educación, etc"
7349,2,proteccion_judicial_de_los_derechos,A,Nuestros derechos deben poder ser tutelados por mecanismos como acciones o recursos.
7356,2,proteccion_judicial_de_los_derechos,A,Asegurar a todos los ciudadanos acceso a la justicia de manera oportuna
7386,2,proteccion_judicial_de_los_derechos,A,Que todos los ciudadanos chilenos tengan el derecho a ser protegidos por ley a sus derechos fundamentales.
7476,2,proteccion_judicial_de_los_derechos,A,"Se partió del supuesto que las leyes deben garantizan los derechos de todos y cada uno de los ciudadanos y que todos deben ser tratados como iguales ante la ley. Al mismo tiempo, que nadie pueda ser condenado por medio de una ley que se dicte con posterioridad al delito configurado"
7491,2,proteccion_judicial_de_los_derechos,A,"la discriminación por color, ideas políticas , discapacidad , creencias, sexo a la libre expresión en una vulneracion  a los derechos humanos ."
7500,2,proteccion_judicial_de_los_derechos,A,Para garantizar que los derechos antes descritos se cumplan y existan instancias de fiscalización.
7502,2,proteccion_judicial_de_los_derechos,A,Se debe considerar este derecho en base la fiscalización para que no se vulneren los derechos establecidos en la constitución y la aplicación de la justicia ante cualquier caso de vulneración de éstos.
7505,2,proteccion_judicial_de_los_derechos,A,A
7563,2,proteccion_judicial_de_los_derechos,A,Debemos fortalecer
7567,2,proteccion_judicial_de_los_derechos,A,"Entendido como derecho a una tutela judicial efectiva: Comprensivo del debido proceso, acceso a la jurisdicción de manera expedita, desformalizada y de calidad."
7576,2,proteccion_judicial_de_los_derechos,A,"Seguridad, representación, protección de los más vunerables. Igualdad ante la ley. Acceso a la justicia."
7620,2,proteccion_judicial_de_los_derechos,A,protección y seguridad judicial de los derechos
7644,2,proteccion_judicial_de_los_derechos,A,Debe haber acceso igualitario y pronto a la justicia. sin juicios prolongados.
7671,2,proteccion_judicial_de_los_derechos,A,Legislar sobre la vulneración de derechos.
7708,2,proteccion_judicial_de_los_derechos,A,garantizar los derechos de ciudadanos y ciudadanas.
7726,2,proteccion_judicial_de_los_derechos,A,"Que los derechos de las personas no estén conculcados por presiones económicas, políticas o cualquier otro poder."
7748,2,proteccion_judicial_de_los_derechos,A,Derecho a ser escuchado y sin exigir judicialmente los derechos que sean vulnerados
7772,2,proteccion_judicial_de_los_derechos,A,Para que los ciudadanos se sientan protegidos y vuelvan a confiar en la justicia
7789,2,proteccion_judicial_de_los_derechos,A,"Esto es vital, pues de nada sirve tener consagrados los derechos en una CPR si luego no es posible hacerlos exigibles."
7876,2,proteccion_judicial_de_los_derechos,A,El estado debe garantizar y facilitar los medios de protección necesarios para asegurar que ningún ciudadano sea vulnerado en sus derechos.
7896,2,proteccion_judicial_de_los_derechos,A,Que el Poder Judicial garantice por constitución este derecho (10 votos).
7897,2,proteccion_judicial_de_los_derechos,A,Acuerdo mayoritario
7904,2,proteccion_judicial_de_los_derechos,A,que no solo los que tienen plata o conocimientos puedan garantizar sus derechos ante la ley sino que todos los chilenos.
7925,2,proteccion_judicial_de_los_derechos,A,el poder judicial debe ser democrático transparente y eficiente los derechos de todos deben prevalecer y no solo el que tiene poder económico pueda sentirse seguro
8148,2,proteccion_judicial_de_los_derechos,A,Sería la garantía para que nuestros derechos se cumplan
8215,2,proteccion_judicial_de_los_derechos,A,"Todos los ciudadanos merecemos protección judicial, como elemento básico ante injurias, presumir acciones no cometidas o calumnias e incluso acusaciones infundadas."
8291,2,proteccion_judicial_de_los_derechos,A,Todos los nuevos derechos consagrados en la constitución deben contar con un resguardo especial. La ciudadanía debe contar con esa seguridad.
8409,2,proteccion_judicial_de_los_derechos,A,Porque o sino no habría certeza jurídica y no podrían exigirse los derecho propios.
8447,2,proteccion_judicial_de_los_derechos,A,"que se cumpla correctamente la protección de estos derechos, de todos los derechos de la constitución"
8480,2,proteccion_judicial_de_los_derechos,P,Actualmente no existe esta figura
8508,2,proteccion_judicial_de_los_derechos,A,"existen pocos conocimiento de los pasos a seguir para proteger los derechos, es sistema es poco amigable."
8518,2,proteccion_judicial_de_los_derechos,A,"Todos los derechos que consagre esta Constitución deben estar asegurados a través de garantías que protejan su legítimo ejercicio y que, si ello es impedido, exista un tercero imparcial que restablezca el orden, puesto que sin ello nuestra Carta Fundamental es una declaración de principios y papel."
8555,2,proteccion_judicial_de_los_derechos,A,Equivalencia en la defensa.
8562,2,proteccion_judicial_de_los_derechos,A,Es imperioso que se vele por los derechos de los demás y a su vez de protección.
8571,2,proteccion_judicial_de_los_derechos,A,Para garantizar los derechos de las personas frente al Estado.
8602,2,proteccion_judicial_de_los_derechos,A,Establecer modalidades de garantizar la efectividad de los derechos individuales y colectivos.
8603,2,proteccion_judicial_de_los_derechos,A,"Alguien debe velar porque se respeten los derechos, es la única manera de que se cumplan."
8626,2,proteccion_judicial_de_los_derechos,A,El estado debe garantizar ante los tribunales de justicia todas las protecciones a los derechos de las personas
