idEla,tema,concepto,acuerdo,fundamento
8656,2,proteccion_judicial_de_los_derechos,A,"¿Quién vigila a los legisladores?; Los cargos de los Gobiernos locales deben ser lectivos por los ciudadanos. Debe haber mayor orientación y mediación en los problemas que surjan en la ciudadanía, una especie de mediación que regula el bienestar común."
8665,2,proteccion_judicial_de_los_derechos,A,Porque necesitamos ser protegidos y que exista igualdad sin importar condición social
8679,2,proteccion_judicial_de_los_derechos,A,Garantizar que los derechos puedan ser exigidos al Estado y a los otros.
8688,2,proteccion_judicial_de_los_derechos,A,Se deben defender ante la ley y sancionar el no cumplimiento de esto. Se debe regularizar.
8699,2,proteccion_judicial_de_los_derechos,A,Los derechos que se conquistan deben tener amparo judicial si es el caso
8720,2,proteccion_judicial_de_los_derechos,A,Que la ley y la justicia resguarden nuestros derechos.
8731,2,proteccion_judicial_de_los_derechos,A,"El estado debe garantizar la igualdad ante la ley de todos los chilenos sin discriminación social, económica ni racial."
8736,2,proteccion_judicial_de_los_derechos,A,"PROTECCIÓN FRENTE AL ABUSO. LA COMUNIDAD REQUIERE DE MECANISMOS DE DEFENSA (TRIBUNAL CONSTITUCIONAL, CONTRALORÍA, FISCALÍAS, OMBUSMAN) FRENTE A LOS ATROPELLOS DE DERECHOS POR AUTORIDADES PÚBLICAS O ENTIDADES PRIVADAS PODEROSAS."
8744,2,proteccion_judicial_de_los_derechos,A,"sin un marco legal para cada una, no hay como ejecutar."
8750,2,proteccion_judicial_de_los_derechos,A,El estado debe velar y el poder judicial regular que los derechos establecidos por nuestra constitución sean respetados por cada una de las instituciones públicas y privadas de nuestro país.
8763,2,proteccion_judicial_de_los_derechos,A,los derechos se transforman solo en principios si no se resguardan.
8769,2,proteccion_judicial_de_los_derechos,A,"• La actual Constitución garantiza algunos derechos, pero muchos se quedan fuera. Deberían estar todos protegidos.  • Cualquiera debería poder concurrir a la justicia para garantizar sus derechos"
8787,2,proteccion_judicial_de_los_derechos,A,.
8789,2,proteccion_judicial_de_los_derechos,A,"Necesaria garantía por parte del Estado, en el cumplimiento de la ley, con el fin de proteger a sus individuos."
8792,2,proteccion_judicial_de_los_derechos,A,"Los derechos garantizados por la Constitución, deben de gozar de protección judicial."
8817,2,proteccion_judicial_de_los_derechos,A,Mecanismos claros de protección y tutela de Derechos.
8830,2,proteccion_judicial_de_los_derechos,A,que existan instrumentos jurídicos que permitan la protección efectiva de los derechos
8855,2,proteccion_judicial_de_los_derechos,A,Mecanismo de exigibilidad judicial frente a la vulneración de los derechos.
8888,2,proteccion_judicial_de_los_derechos,A,Porque sólo así esta asegurado el ejercicio de los demás derechos.
8898,2,proteccion_judicial_de_los_derechos,A,Protocolizar judicialmente los derechos.
8902,2,proteccion_judicial_de_los_derechos,A,Debe promoverse y defenderse los derechos de todos.
8904,2,proteccion_judicial_de_los_derechos,A,los derechos deben estar garantizados judicial mente para que de esta forma no sean pasados a llevar.
8919,2,proteccion_judicial_de_los_derechos,A,DERECHO A TENER TRIBUNALES IMPARCIALES Y PROCESOS JUSTO PARA GARANRIZAR LOS DERECHOS DE LAS PERSONAS
8928,2,proteccion_judicial_de_los_derechos,A,justicia se haga cargo de los derechos de cada individuo y que vele y proteja a las personas
8971,2,proteccion_judicial_de_los_derechos,A,": Es necesario que los tribunales de justicia puedan garantizar la igualdad ante la ley, la protección social, la educación, etc."
8973,2,proteccion_judicial_de_los_derechos,A,deben estar resguardado judicialmente nuestro derechos
8978,2,proteccion_judicial_de_los_derechos,A,"Que existan los mecanismos adecuados que permitan salvaguardar los derechos de las personas ante los tribunales de justicia, con posibilidad de acceso para todos."
8981,2,proteccion_judicial_de_los_derechos,A,Que los tribunales protejan los derechos de los ciudadanos.
9073,2,proteccion_judicial_de_los_derechos,A,"Hay que hacer cumplir los derechos, es necesaria la constitución pero con igualdad para todos."
9097,2,proteccion_judicial_de_los_derechos,A,ningún derecho reconocido constitucionalmente pasará de mera declaración sino se incorpora una herramienta judicial que los haga exigibles.
9100,2,proteccion_judicial_de_los_derechos,A,"Que exista dentro de la carta fundamental el derecho a procedimientos justos, imparciales y rápidos, que brinden la garantía de un resultado favorable."
9136,2,proteccion_judicial_de_los_derechos,A,"Se espera que los derechos, tengan realmente una garantía y protección jurídica para su aplicación."
9161,2,proteccion_judicial_de_los_derechos,A,Aplicación de los derechos.
9231,2,proteccion_judicial_de_los_derechos,A,El Estado debe proveer a los ciudadanos de una protección efectiva ante la justicia cuando estos se vean vulnerados. No se pueden seleccionar otros términos sin asegurar que se protejan estos derechos de manera efectiva
9260,2,proteccion_judicial_de_los_derechos,A,Ningún derecho tiene sentido si no existe la protección judicial de los derechos garantizada por el Estado.
9264,2,proteccion_judicial_de_los_derechos,A,Es el mecanismo que nos permite proteger y garantizar el cumplimiento de todos los demás derechos.
9266,2,proteccion_judicial_de_los_derechos,A,Hacer exigible el cumplimiento de los derechos y punible su no cumplimiento.
9277,2,proteccion_judicial_de_los_derechos,A,Debe existir un funcionamiento correcto y de control público.
9279,2,proteccion_judicial_de_los_derechos,P,Para que los derechos sean resguardados efectivamente.
9284,2,proteccion_judicial_de_los_derechos,A,- Que la constitución la misma protección judicial a todos los ciudadanos sin importar su condición social.
9340,2,proteccion_judicial_de_los_derechos,A,Los derechos deben ser protegidos judicialmente de manera amplia y no solamente limitada a los “derechos libertades”
9355,2,proteccion_judicial_de_los_derechos,A,"Para que los derechos sociales tengan una incidencia práctica, los ciudadanos deben poder realizar una acción judicial como una  herramienta para hacerlos efectivos."
9383,2,proteccion_judicial_de_los_derechos,A,Se debe generar una defensa gratuita y de buena calidad cuando nuestros derechos se pasen a llevar. El Estado debe garantizar esta defensa.
9397,2,proteccion_judicial_de_los_derechos,A,Debemos tener el derecho de ser representados ante la justicia y rehabilitados/as y/o sancionados por el poder judicial dependiendo de la falta.
9402,2,proteccion_judicial_de_los_derechos,P,Que el estado disponga de profesionales que defiendan nuestros derechos
9408,2,proteccion_judicial_de_los_derechos,D,la consitucion debe velar por cumplimiento de los derechos constitucionales
9422,2,proteccion_judicial_de_los_derechos,A,"Para que sea efectivo el goce de derechos, asegurando que cada persona puede ejercerlo en igualdad de condiciones. Para que sea efectivo el goce de derechos, para que así cada persona pueda ejercerlo en igualdad de condiciones, independiente de su origen social, étnico, religioso, sexual, etc."
9444,2,proteccion_judicial_de_los_derechos,A,Sin esto no se pueden garantizar que se ejerzan los derechos.
9452,2,proteccion_judicial_de_los_derechos,A,Se debe reforzar el acceso igualitario y pronto a la justicia. Los juicios prolongados constituyen en si una forma de INJUSTICIA
9486,2,proteccion_judicial_de_los_derechos,A,debe existir un marco regulatorio para el respeto a los derechos.
9496,2,proteccion_judicial_de_los_derechos,A,"Es fundamental ya que, solo se reconocen ciertos derechos de manera constitucional, lo que genera vacíos en la protección del individuo."
9563,2,proteccion_judicial_de_los_derechos,A,"Que todos los derechos, sin exclusión, estén garantizados por protección judicial en caso de infracción"
9579,2,proteccion_judicial_de_los_derechos,A,Que los deportistas sean asesorados jurídicamente
9609,2,proteccion_judicial_de_los_derechos,A,Protección frente a la vulneración de los derechos.
9664,2,proteccion_judicial_de_los_derechos,A,La constitución debe garantizarnos que nos protegerá a través del poder judicial de cualquier forma de discriminación de nuestros derechos fundamentales a  objeto de construir un país más justo y con mayor equidad.
9688,2,proteccion_judicial_de_los_derechos,P,Protección estatal ante situaciones que amenacen la seguridad física y psíquica de las personas.
9772,2,proteccion_judicial_de_los_derechos,A,"Que sean protegidos por leyes nuestros derechos, que podamos recurrir a la ley para respaldarlos y protegerlos."
9775,2,proteccion_judicial_de_los_derechos,A,no basta con tener derechos sino es necesarios que estos sean protegidos por la constitución
9803,2,proteccion_judicial_de_los_derechos,A,importancia que los derechos sean protegidos y respetados en la constitución
9815,2,proteccion_judicial_de_los_derechos,A,El estado debe garantizar la protección de los derechos básicos garantizados por el sistema judicial.
9836,2,proteccion_judicial_de_los_derechos,A,•Se debe reforzar el derecho a un acceso a igualitario y pronto a la justicia. Los juicios prolongados constituyen en sí mismos una forma de injusticia
9875,2,proteccion_judicial_de_los_derechos,A,Las leyes cuidan nuestros derechos para asegurar que podamos ejercerlos.
9885,2,proteccion_judicial_de_los_derechos,A,debe quedar explicito la proteccion judicial a los derechos
9893,2,proteccion_judicial_de_los_derechos,A,"Se refiere a que los derechos de las personas  asociados a la salud y la educación, adquieran  la categoría  de verdaderos derechos protegidos  procesalmente, para que se pueda reestablecer  el derecho vulnerado  y asegurar su protección mediante recursos de protección cuando  hayan sufrido la perturbación o amenaza  de estos derechos"
9900,2,proteccion_judicial_de_los_derechos,A,"Debe existir un mecanismo de tutela de los derechos, para que su reconocimiento pueda ser protegido a través de los tribunales."
9928,2,proteccion_judicial_de_los_derechos,A,No todos los derechos se deben accionar ante la justicia.
9937,2,proteccion_judicial_de_los_derechos,A,"debemos crear las acciones necesarias que puedan ejercer los ciudadanos, para proteger sus derechos."
9967,2,proteccion_judicial_de_los_derechos,P,"Si bien se debate su importancia frente al sufragio, se considera este un derecho mayor."
9982,2,proteccion_judicial_de_los_derechos,A,"Proteger los derechos para que estos no sean transgredidos, violados o dejados de lado"
9995,2,proteccion_judicial_de_los_derechos,A,el estado debe garantizar el desarrollo y la efctividad del conjunto de derechos.  establecer acciones y recuroso que permitan su reclamo ante las instancias judiciales
10014,2,proteccion_judicial_de_los_derechos,A,Garantiza que todos los derechos se cumplan y se respeten.
10026,2,proteccion_judicial_de_los_derechos,A,Que se cumpla los derechos con procedimientos justos e imparciales y el gobierno garantice una autoridad competente. Para que esto se logre una asamblea constituyente
10159,2,proteccion_judicial_de_los_derechos,A,"Para garantizar el sentido de seguridad, protección de ellos mismos y de sus activos"
10180,2,proteccion_judicial_de_los_derechos,A,"Con educación civica en establecimientos y con prensa escrita, radios y TV, promoviendo a través de sus programas a un sujeto consciente de sus deberes y derechos, que pueda recurrir al poder judicial con empode3ramiento."
10249,2,proteccion_judicial_de_los_derechos,A,garantia ante todo
10256,2,proteccion_judicial_de_los_derechos,A,Incluye todos los derechos y la justicia garantiza su ejercicio pleno.
10283,2,proteccion_judicial_de_los_derechos,A,igualdad frente a la ley sin importar las condiciones económicas y que los juicios tengan lenguaje se señas
10337,2,proteccion_judicial_de_los_derechos,A,Garantizar que estos sean protegidos.
10363,2,proteccion_judicial_de_los_derechos,P,"Se ha establecido que este derecho debería estar garantizado por la Constitución, para que todos los demás derechos puedan cumplirse si son precarizados o violados por las instituciones del Estado o los privados."
10394,2,proteccion_judicial_de_los_derechos,A,"Entregando la responsabilidad al Estado de crear lo medios necesarios para que realmente se proteja el ejercicio libre e igualitario de todos los derechos, además de establecer procedimientos más amigables y transparentes para acceder a la justicia real y equitativa."
10411,2,proteccion_judicial_de_los_derechos,A,"Fue un acuerdo total del grupo, no se escribió una fundamentación."
10531,2,proteccion_judicial_de_los_derechos,A,Existencia de mecanismo efectivo para el ejercicio y respeto de los derechos.
10584,2,proteccion_judicial_de_los_derechos,A,Acceso e igualdad ante la ley
10607,2,proteccion_judicial_de_los_derechos,A,.
10608,2,proteccion_judicial_de_los_derechos,A,-
10700,2,proteccion_judicial_de_los_derechos,A,Que se resguarden los derechos de cada ciudadano.
10701,2,proteccion_judicial_de_los_derechos,A,se debe mantener la posibilidad de que todos los ciudadanos tengan derecho a interponer recursos de amparo ante la violación de sus derechos fundamentales.
10703,2,proteccion_judicial_de_los_derechos,A,Se debe garantizar la protección judicial de los derechos fundamentales de las personas de manera que ninguna institución sobre las personas.
10707,2,proteccion_judicial_de_los_derechos,A,"Creación de un organismo estatal, que vele por la seguridad y protección de los ciudadanos."
10750,2,proteccion_judicial_de_los_derechos,A,Para que todos podamos denunciar y estar seguros que se harta un buen proceso.
10797,2,proteccion_judicial_de_los_derechos,A,Garantía de que nuestros derechos se respeten a través de la institucionalidad judicial
10845,2,proteccion_judicial_de_los_derechos,D,Todos deben tener la posibilidad de que el Estado sea garante del cumplimiento de los derechos
10865,2,proteccion_judicial_de_los_derechos,A,"Es evidente, para que la Constitución y el Estado velen por los valores y derechos antes mencionados, que esta misma tenga un respaldo legal para hacer valer estos derechos realmente."
10877,2,proteccion_judicial_de_los_derechos,A,derecho que resguarda que los derechos de soporte sean realizados y no conculcados.
10927,2,proteccion_judicial_de_los_derechos,A,O tutela judicial de los derechos. Que existan los mecanismos para que efectivamente sean respetados.
11023,2,proteccion_judicial_de_los_derechos,A,HERRAMIENTAS PARA DEFENDER EL DERECHO. FORMA DE GARANTIA. QUE SEA DE FACIL ACCESO.
11066,2,proteccion_judicial_de_los_derechos,P,"La persona en contra argumenta que no es relevante, además de estar contemplado en otros ámbitos."
11082,2,proteccion_judicial_de_los_derechos,A,"Reconocimiento y ejercicio libre/responsable de los derechos de 1a. generación (civiles y políticos), de 2da. generación. (económicos, sociales y culturales) y  de 3ra. generación (justicia, paz y solidaridad), que como los define la ONU abarcan los principios de Libertad, Igualdad y Solidaridad."
11170,2,proteccion_judicial_de_los_derechos,A,"Un derecho que no es exigible judicialmente, son palabras al viento. La posibilidad de hacer cumplir un derecho es consustancial al mismo."
11212,2,proteccion_judicial_de_los_derechos,A,"Se debe establecer los principios del debido proceso, justo y pronto procedimiento administrativo. Ello porque hay muchos trámites (burocracia) que hacen las instituciones en contra de los ciudadanos los cuales eternizan los procesos sin tener un resultado con prontitud"
11248,2,proteccion_judicial_de_los_derechos,A,la necesidad de que los derechos estén reguardados a traves de normas y leyes
11252,2,proteccion_judicial_de_los_derechos,A,Se debe reforzar el derecho a un acceso igualitario y pronto a la justicia.
11306,2,proteccion_judicial_de_los_derechos,A,Se debe reforzar el derecho a un acceso igualitario y pronto a la justicia. Los juicios prolongados constituyen en sí mismos una forma de injusticia.
11343,2,proteccion_judicial_de_los_derechos,A,Todos los chilenos y chilenas tiene el derecho  a tener una una protección  judicial para garantizar que los derechos efectivamente se resguarden.
11344,2,proteccion_judicial_de_los_derechos,P,Porque es la garantía que tienen las personas de no ser vulneradas arbitrariamente.
11346,2,proteccion_judicial_de_los_derechos,A,velar protección y garantías de los procesos y sobre todo la posibilidad de garantizar al acompañamiento judicial.
11356,2,proteccion_judicial_de_los_derechos,A,Un sistema que asegure la proteccion efectiva y tutelar de los derechos
11369,2,proteccion_judicial_de_los_derechos,A,Garantizar efectivamente los derecho de los ciudadanos y protegerlos.
11380,2,proteccion_judicial_de_los_derechos,A,Porque todos podemos necesitar que nos ayuden en la defensa de nuestros derechos.
11395,2,proteccion_judicial_de_los_derechos,P,Que los ciudadanos seamos participes de las decisiones municipales.
11475,2,proteccion_judicial_de_los_derechos,A,"La protección de los derechos fundamentales de las personas es fundamental, sin este valor, otros derechos, como igual ante la ley, serían vulnerados. Insistimos que los animales como seres sintientes también deben tener derecho que dignifiquen su vida, uso y/o muerte."
11477,2,proteccion_judicial_de_los_derechos,A,La justicia como garante del cumplimiento de todos los derechos para todas las personas.
11519,2,proteccion_judicial_de_los_derechos,A,Reafirman el poder judicial a la manipulación de partidos políticos
11577,2,proteccion_judicial_de_los_derechos,A,Posibilidad de ejecutar los derechos consagrados.
11589,2,proteccion_judicial_de_los_derechos,A,"Que el Estado entregue asesoría y apoyo judicial a las personas, cuando éstas sean vulneradas en sus derechos."
11593,2,proteccion_judicial_de_los_derechos,A,Que sea efectiva y real porque en la actualidad no existe.
11603,2,proteccion_judicial_de_los_derechos,A,Para proteger a las personas de las arbitrariedades. Tener abogados estatales de calidad es base para la igualdad y respeto de los derechos humanos.
11615,2,proteccion_judicial_de_los_derechos,A,Debe existir los mecanismos expedito que nos permitan como y donde podemos reclamar la protección incluso judicial de nuestros derechos
11619,2,proteccion_judicial_de_los_derechos,P,"Si bien en una primera instancia se elige este derecho, luego existe una amplia discusión respecto a este concepto. Esto debido a que no todos están de acuerdo con que las víctimas y victimarios tengan los mismos derechos. Algunos señalan que ese es parte del problema de la justicia chilena."
11623,2,proteccion_judicial_de_los_derechos,A,A
11625,2,proteccion_judicial_de_los_derechos,P,"“Leyes que amparen a los ciudadanos”. Debe concretarse la garantía de derechos, generando mejorías en las políticas públicas)."
11649,2,proteccion_judicial_de_los_derechos,A,"que las personas puedan ejercer, exigir la materialización de los derechos"
11659,2,proteccion_judicial_de_los_derechos,A,Debe garantizarse entre leyes y normas el cumplimiento de nuestros derechos como ciudadanos.
11671,2,proteccion_judicial_de_los_derechos,A,Que exista una institución que resguarde los derecho de aquellos/llas ciudadanos/nas que no tienen las competencias judiciales y administrativas para ello.
11702,2,proteccion_judicial_de_los_derechos,A,TODO CIUDADANO TIENE DERECHO A RECLAMAR LA PROTECCIÓN JUDICIAL DE SUS DERECHOS
11745,2,proteccion_judicial_de_los_derechos,A,"La carta constitucional debe otorgar protección judicial de los derechos establecidos, las leyes promulgadas deben ser garantes de esta condición"
11746,2,proteccion_judicial_de_los_derechos,A,Se garantiza la protección judicial de cada uno de los derechos establecidos en ésta Constitución.
11758,2,proteccion_judicial_de_los_derechos,A,- Sirve para garantizar las materialización y cumplimiento de ciertos derechos  - Es un mecanismo de garantía de los Derechos y Debes.
11759,2,proteccion_judicial_de_los_derechos,A,"Debe incluir los derechos sociales y colectivos tales como Salud, Educación y Vivienda. Incluye la igualdad en el acceso a la justicia e incluye el debido proceso."
11810,2,proteccion_judicial_de_los_derechos,A,"No importando la condición u origen social y económico de la persona, se debe asegurar la protección de sus derechos en igualdad de condiciones."
11817,2,proteccion_judicial_de_los_derechos,A,Para garantizar el cumplimiento de los derechos
11825,2,proteccion_judicial_de_los_derechos,A,"¿Hay protección judicial de los derechos de todas las personas? ¿en el caso de los funcionarios públicos, y de los funcionarios judiciales, que ocurre? Curiosamente ocurre que quienes están llamados a dar protección judicial a los derechos de las personas (que no son funcionarios), incurren en un conflicto contencioso administrativo, al existir derecho meramente declarativos que no son efectivamente justiciables, el recurso de protección ha sido un camino alternativo, poco eficaz, protege solo algunos derechos de forma incompleta."
11842,2,proteccion_judicial_de_los_derechos,A,"El Estado establecerá como uno de los principales objetivos de actividad de los tribunales de Justicia la de amparar la vida, la libertad, la dignidad, el honor, el patrimonio, las relaciones familiares y los demás derechos e intereses legítimos de los ciudadanos."
11912,2,proteccion_judicial_de_los_derechos,P,"Si todos estos derechos quedan solo escritos teóricamente, de nada serviría si no se lleva a la práctica con su protección judicial, quedando así asegurados."
11935,3,proteccion_judicial_de_los_derechos,A,CREAR PROCEDIMIENTOS JUSTOS IMPARCIALES Y RÁPIDOS PARA TODOS
11980,2,proteccion_judicial_de_los_derechos,A,"Asegurar la defensa de los derechos a través de acciones constitucionales, para que no sean letra muerta."
11994,2,proteccion_judicial_de_los_derechos,A,"Protección del ser humano en todos los derechos  salud ,educación ,social"
12002,2,proteccion_judicial_de_los_derechos,A,La ley debe proteger a los ciudadanos.
12007,2,proteccion_judicial_de_los_derechos,A,Esto garantiza que nuestros derechos se cumplan y protejan correctamente.
12141,2,proteccion_judicial_de_los_derechos,A,que se cumplan los procesos judiciales
12177,2,proteccion_judicial_de_los_derechos,A,debe existir un organismo que regule la ejecución de derechos.
12204,2,proteccion_judicial_de_los_derechos,A,"Es la base de todo el el respeto, actuar y convivir en buenos términos. Además, de ser un respaldo garante mediante leyes estipuladas."
12205,2,proteccion_judicial_de_los_derechos,A,Permite que los demás derechos puedan ser garantizados y ejercidos sin excepción.
12224,2,proteccion_judicial_de_los_derechos,P,Si los derechos por los que hemos votado no van a estar protegidos de manera legal no sirve de mucho votarlos. Deben estar protegidos.
12230,2,proteccion_judicial_de_los_derechos,P,"PLANTEADO TAMBIEN DENTRO DE LA DISCUSIÓN AL MOMENTO DE PROPONER QUE EL ESTADO DEBE SER GARANTE DE LOS DERECHOS Y ESTOS DEBEN SER RESPETADOS. LA VIOLACION DE ESTOS DERECHOS, DEBE TRAER COMO CONSECUENCIA ENFRENTARSE A LA JUSTICIA Y A LOS DISTINTOS PROCESOS QUE ESTO CONLLEVA"
12278,2,proteccion_judicial_de_los_derechos,A,"Se basa en la necesidad de los ciudadanos de acceder al sistema de justicia a través de órganos imparciales, que aseguren una adecuada protección de sus derechos."
12304,2,proteccion_judicial_de_los_derechos,A,"Asegura una fiscalización y real cumplimiento de lo que actualmente estamos construyendo. Además se evitaría el uso de los tribunales constitucionales, aplicando sanciones duras a quienes no cumplen ni respetan los derechos consagrados en esta constitución"
12305,2,proteccion_judicial_de_los_derechos,A,"Si no existe protección de los derechos, de nada sirve."
12318,2,proteccion_judicial_de_los_derechos,A,id
12323,2,proteccion_judicial_de_los_derechos,A,"No basta con tener derechos, es necesaria la protección judicial de los mismos a favor de los ciudadanos."
12338,2,proteccion_judicial_de_los_derechos,A,Debe existir protección de la población de más proyección Judicial con cobertura y calidad.
12352,2,proteccion_judicial_de_los_derechos,A,-
12355,2,proteccion_judicial_de_los_derechos,P,"Porque el estado debe garantizar los derechos de las persona, lo que permite garantizar el ejercicio real de los derechos en la sociedad."
12364,2,proteccion_judicial_de_los_derechos,A,que nos protejan
12394,2,proteccion_judicial_de_los_derechos,A,Debe asegurarse para todas las personas sin distinción
12401,2,proteccion_judicial_de_los_derechos,A,garantía de eficacia de los derechos incluso los derechos sociales  Acceso a la justicia subordinado a la protección social
12443,2,proteccion_judicial_de_los_derechos,A,Protecion de nuestro derechos que la constitución garantize
12469,2,proteccion_judicial_de_los_derechos,A,"Para que nuestro país respete a las personas en su integridad sus distinciones, el derecho y respeto por la vida y las diferencias"
12484,2,proteccion_judicial_de_los_derechos,A,"Fortalecer la justicia, eliminación del fuero en todo ambito"
12502,2,proteccion_judicial_de_los_derechos,A,Que exista un debido proceso imparcial y que la tutela de los derechos este fundamentada en la constitución.
12503,2,proteccion_judicial_de_los_derechos,A,"Defensa judicial a quien no la pueda pagar, sea otorgada por el Estado, de profesionales y no de estudiantes."
12540,2,proteccion_judicial_de_los_derechos,P,"Mecanismo de cautela constitucional (recurso de protección, ""habeas corpus"")"
12571,2,proteccion_judicial_de_los_derechos,A,"modificar ley procesal penal, y favorecer y proteger a la victima antes que al victimario (ej. entregar abogado con recurso del estado)"
