idEla,tema,concepto,acuerdo,fundamento
3,3,respeto_por_la_constitución,A,Es la columna vertebral del sistema político del estado
8,3,respeto_por_la_constitución,A,"Toda colectividad debe respetar el marco regulatorio que se ha dado.  Este respeto se sustenta en la legitimidad de su origen, es decir, en ser el resultado de un proceso participativo."
9,3,respeto_por_la_constitución,P,El marco de principios y normas que nos rigen como país debe ser respetada pero también justificadamente cuestionada cuando no representa a la mayoría (1980).
12,3,respeto_por_la_constitución,A,"Uno de los principales deberes, es generar respeto por la constitución, ya que de esta manera se forman ciudadanos que den peso a lo que se plantea actualmente."
13,3,respeto_por_la_constitución,A,"Respeto por la NUEVA constitución, emanada de la asamblea constituyente."
14,3,respeto_por_la_constitución,A,"Que la carta fundamental que surja en democracia, a través de una asamblea constituyente, sea respetada por todos."
16,3,respeto_por_la_constitución,A,Todos tenemos obligación como ciudadanos a respetar y hacer cumplir la constitución.
17,3,respeto_por_la_constitución,A,"Al ser nosotros parte de la creación de esta, debe si o si existir un respeto por ella y acatarla."
20,3,respeto_por_la_constitución,A,Es un deber fundamental de todo ciudadano y de todos los dirigentes de las instituciones.
24,3,respeto_por_la_constitución,A,"deber ciudadano, es norma fundamental que es la base para todas las normas del país"
29,3,respeto_por_la_constitución,A,Como ciudadanos debemos respetar las leyes que nos rigen para mantener el orden
31,3,respeto_por_la_constitución,A,si estamos en esto es para respetar nuestra nueva constitución.
33,3,respeto_por_la_constitución,A,"es la que nos rige y nos dicta que hacer y que no, para el cuidado de nuestra integridad."
36,3,respeto_por_la_constitución,A,"Es primordial este respeto por cuanto permite asegurar las bases de un Estado de Derecho y porque fija los límites y define las relaciones entre los poderes del Estado, permitiendo el gobierno y organización de las instituciones. Asimismo, garantiza al pueblo derechos y libertades."
46,3,respeto_por_la_constitución,A,"Se debe respetar la constitución asi como las demás leyes y normas. El respeto a la constitución, garantizará la unidad nacional y una estabilidad política."
48,3,respeto_por_la_constitución,A,"Es la carta fundamental, plantea las reglas del juego y es absolutamente necesario respetarla."
54,3,respeto_por_la_constitución,A,Nosotros como adultos mayores pensamos que sea cual sea el veredicto hay que respetarlo igual y hay que hacerse participe y cumplir todas las normas establecidas.
55,3,respeto_por_la_constitución,A,Sin comentarios
56,3,respeto_por_la_constitución,A,"Porque todos debemos respetar, familia, políticos y ciudadano por igual"
58,3,respeto_por_la_constitución,A,la constitución se respeta y tiene que regir para todos igual sin importar el cargo que tenga en la sociedad
61,3,respeto_por_la_constitución,A,"Si se quiere mejorar la situación hay que respetar la Constitución con un compromiso y valorarla, pero esta no debe ser desigual."
63,3,respeto_por_la_constitución,A,Cada ciudadano debe respetar lo plasmado en la constitución.
65,3,respeto_por_la_constitución,A,los ciudadanos debemos respetar la constitucion
66,3,respeto_por_la_constitución,A,"Si se respeta la constitución, se respetarán todo lo que hemos implantado."
68,3,respeto_por_la_constitución,A,Con el respeto a la constitución  legitimamos los derechos  y deberes comprometidos  a todas las personas (validamos  esta mención  para la nueva constitución).
70,3,respeto_por_la_constitución,A,Asegurar vivir en estado de derechos. Nos asegura una buena convivencia con las personas.
74,3,respeto_por_la_constitución,A,- Constitución marca precedencia y jerarquía sobre otras leyes y normas. - Permite existencia del Estado en el tiempo. - Debe ser un norte permanente
78,3,respeto_por_la_constitución,A,Es lo que nos resguarda los derechos y deberes.
79,3,respeto_por_la_constitución,A,"Una constitución debiese ser fundamentada y consultada con las bases. Una vez realizada una constitución, ésta debería ser respetada, en señal de respeto a nosotros como sociedad. El conflicto actual, es que la constitución vigente es basada en la opinión de una minoría, en beneficio de esta misma."
80,3,respeto_por_la_constitución,A,xxxxx
86,3,respeto_por_la_constitución,A,"Asegurar a todas las personas los derechos y obligaciones que allí se mencionan, ya sea para Gobernantes y Gobernados.   Establecer  e implementar los conceptos fundamentales para una nueva Constitución."
87,3,respeto_por_la_constitución,A,Respeto a las leyes constitucionales
91,3,respeto_por_la_constitución,A,"que para la nueva construcción de la constitución que nos regirá como país ,debe ser respetada por todos los ciudadanos , sean empresarios ,políticos,trabajadores o niños .-"
98,3,respeto_por_la_constitución,A,"Siendo la constitución la norma fundamental, es básico que la ciudadanía parta por acatarla."
100,3,respeto_por_la_constitución,A,"Todo lo establecido en ella pierde legitimidad si el pueblo no la respeta, no se puede vivir en comunidad sin respetarla."
104,3,respeto_por_la_constitución,A,Al respetar la constitución podríamos respetar y cumplir todas las leyes establecidas en ella.
105,3,respeto_por_la_constitución,A,sin observaciones
107,3,respeto_por_la_constitución,A,"Respetar la constitución que nos rige a todos y así poder vivir en una sociedad justa, sin altercados."
108,3,respeto_por_la_constitución,A,si esta constitución la construimos todos juntos es nuestra responsabilidad respetar lo que estamos realizando  en democracia lo que jamás habíamos tenido oportunidad de hacer.
115,3,respeto_por_la_constitución,A,Sin este deber se complica todo
117,3,respeto_por_la_constitución,A,Es indispensable para mantener el Estado de Derecho y vivir con apego a la ley.
124,3,respeto_por_la_constitución,A,.
125,3,respeto_por_la_constitución,A,Cuyo reguardo radique en instituciones elegidas democráticamente (no como funciona hoy el TC).
126,3,respeto_por_la_constitución,A,PORQUE ES LA NORMA FUNDAMENTAL QUE ORDENA LA VIDA EN SOCIEDAD.
129,3,respeto_por_la_constitución,A,Contar con una norma general que rija a todos los ciudadanos
130,3,respeto_por_la_constitución,A,"Por las leyes, normas, derechos y deberes."
131,3,respeto_por_la_constitución,A,"Es clave que esta se respete, sea estable y sea la guía fundamental de nuestra convivencia."
133,3,respeto_por_la_constitución,A,xx
138,3,respeto_por_la_constitución,A,RESPETAR
140,3,respeto_por_la_constitución,A,Deber que retroalimenta el fin de la misma Constitución
141,3,respeto_por_la_constitución,A,Total.
143,3,respeto_por_la_constitución,A,Mayores quiebres democráticos en el país dicen relación con el quebrantamiento de la constitución.
144,3,respeto_por_la_constitución,A,"Si esta nueva constitución será construida en democracia, como mínimo, se debe respetar en su totalidad."
147,3,respeto_por_la_constitución,A,Derecho fundamental que nos permita tener buena convivencia.
148,3,respeto_por_la_constitución,A,LA CONSTITUCION DEBE PERMITIR LA CONVIVENCIA DE LOS CIUDADANOS EN PAZ Y RESPETO QUE GRANTICEN LOS DERECHOS HUMANOS DE TODOS.
153,3,respeto_por_la_constitución,A,"Siendo esta nuestra carta fundamental debemos respetarla y enseñar a nuestros hijos  a hacerlo  esta deberá ser muy clara  y transparente, que no de pie  a malas interpretaciones"
161,3,respeto_por_la_constitución,A,"Si estamos discutiendo por la nueva Constitución y su importancia, debe ser el texto legal más respetado del país, por regular nuestra vida cívica."
164,3,respeto_por_la_constitución,P,"El respeto por la constitucion es un deber fundamental para el buen funcionamiento de las leyes, las institucionnes y la sociedad chilena."
166,3,respeto_por_la_constitución,A,"Debe ser respetada por la institucionalidad, la ciudadanía y las fuerzas armadas."
168,3,respeto_por_la_constitución,A,Sujeción absoluta a la nueva constitución que nos representará.
171,3,respeto_por_la_constitución,A,"al ser democrática en su concepción, el mayor compromiso"
176,3,respeto_por_la_constitución,A,"Una sociedad libre y democrática se basa en el respeto la estructura de valores y principios que la propia ciudadanía se ha impuesto. Esto implica el respeto irrestricto a la constitución por parte de toda la ciudadana, el estado y sus instituciones."
178,3,respeto_por_la_constitución,A,"Porque es la Ley fundamental del país y, más aún, si esta surge del consenso democrático de la población y no como la del 80."
181,3,respeto_por_la_constitución,A,Todos de acuerdo
187,3,respeto_por_la_constitución,A,Se respeta la constitución hecha por todos.
198,3,respeto_por_la_constitución,A,Es la norma más importante.
200,3,respeto_por_la_constitución,A,"respeto a la constitución soberana, tanto en su elaboración como en sus posibles ajustes. Que sea posible su modificación por parte del Soberano."
202,3,respeto_por_la_constitución,A,La estabilidad de una nación debe asentarse en el pleno respeto a la Constitución.
209,3,respeto_por_la_constitución,A,El respeto por la constitución debe ser igualitario para toda la ciudadanía.
210,3,respeto_por_la_constitución,A,Es la norma más importante y fundamental que regula un país.
219,3,respeto_por_la_constitución,A,"Creemos que debe ser uno de los servicios a promover. Toda persona, grupo e institución debe respetar los preceptos consagrados en la constitución, ya que ésta es la máxima norma jurídica de un Estado."
222,3,respeto_por_la_constitución,A,"Da las bases para la vida en comunidad, rige las relaciones de la sociedad y debe respetarse."
226,3,respeto_por_la_constitución,P,Debemos respetar la Constitución.
228,3,respeto_por_la_constitución,A,SE TRABAJARON SOLO DERECHOS POR ACUERDO DE LOS PARTICIPANTES
232,3,respeto_por_la_constitución,A,"Hemos elegido los conceptos en función de las carencias que hoy tiene nuestra sociedad, entendiendo que existen otros que la disposición institucional actual ya contempla."
233,3,respeto_por_la_constitución,A,.
239,3,respeto_por_la_constitución,P,"Respeto por la ""nueva"" Constitución."
240,3,respeto_por_la_constitución,A,"Respetar la constitución, los procesos constituyentes, que en ella están plasmados los derechos de todos, una constitución que respete la diversidad e igualdad."
242,3,respeto_por_la_constitución,A,Para ser escuchados y respetados individual y colectivamente.
243,3,respeto_por_la_constitución,A,Cada chileno tiene que respetar la constitución ejerciendo los deberes y reconociendo sus derechos.
244,3,respeto_por_la_constitución,A,4 de los participantes votaron por esta opción
245,3,respeto_por_la_constitución,A,Porque todas las leyes fueron hechas para cumplirlas y así poder mantener la paz entre las personas.
246,3,respeto_por_la_constitución,A,Cumplimiento de normas
247,3,respeto_por_la_constitución,A,Cada chileno debe acatar lo dispuesto en la carta magna siempre y cuando esta sea representativa por ser producto de un proceso democrático y participativo.
250,3,respeto_por_la_constitución,A,Es deber de todo ciudadano el respeto por la Nueva Constitución redactada en Democracia y legitimada por la participación ciudadana voluntaria.
252,3,respeto_por_la_constitución,A,"Los ciudadanos en todos sus ámbitos de la vida en sociedad deben ser respetuosos de la constitución, en especial si esta es generada por la sociedad misma."
261,3,respeto_por_la_constitución,A,para cuidar a la democracia
262,3,respeto_por_la_constitución,A,Es fundamental inculcar esto en los jóvenes
263,3,respeto_por_la_constitución,A,"Es fundamental respetar la constitución, para velar por el cumplimiento de los derechos y deberes de las personas y las autoridades que nos gobierna."
265,3,respeto_por_la_constitución,A,Respetar los derechos de todas las personas y comunidades reconocidas por la constitución.
266,3,respeto_por_la_constitución,A,todo individuo debe conocer y respetar la constitución que rige a la nación
274,3,respeto_por_la_constitución,A,"La constitución hay que respetarla, cumplir con lo que manda."
278,3,respeto_por_la_constitución,A,todos los ciudadanos la respetemos
279,3,respeto_por_la_constitución,A,CREEMOS QUE LA NUEVA CONSTITUCION ES EL NUEVO SER QUE ES CHILE
283,3,respeto_por_la_constitución,A,...
289,3,respeto_por_la_constitución,A,Significa respeto por la nueva constitución generada de este proceso participativo.
291,3,respeto_por_la_constitución,A,"Se debe establecer el deber de todos de conocer y ser garantes de las instituciones democráticas. Si bien los partidos políticos son importantes, nosotros no podemos dejar de preocuparnos por las cosas que importan al país, como son nuestras leyes e instituciones."
296,3,respeto_por_la_constitución,A,"que todos los principios, valores, derechos alcancen un rango constitucional"
297,3,respeto_por_la_constitución,A,"Toda persona y todo órgano del Estado debe dar fiel cumplimiento a lo dispuesto por la constitución y las leyes, no pudiendo vulnerar dichas disposiciones y garantías fundamentales para la vida en sociedad"
298,3,respeto_por_la_constitución,A,- Que todos los ciudadanos respetemos lo que se establece en la carta fundamental - Que vuelva la educación cívica en todas las instancias y organizaciones - Que sea un real acuerdo social y democratico.
302,3,respeto_por_la_constitución,A,"La Constitución es el marco regulatorio para el buen funcionamiento del país. No respetarla (los ciudadanos o la clase política) es impedir el desarrollo y correcto andar de Chile, así como el bienestar de las personas. Y es necesario considerar en ella los aportes de este proceso constituyente."
304,3,respeto_por_la_constitución,A,Respetar la constitución legítima y democráticamente sancionada
309,3,respeto_por_la_constitución,P,"resulta importante consagrar el deber del respeto por la constitución, toda vez que es la base de nuestro ordenamiento jurídico."
313,3,respeto_por_la_constitución,A,Carta fundamental creada en democracia por lo que se debe mantener el respeto de las normas (derechos y deberes). Respeto a los derechos de los demás
315,3,respeto_por_la_constitución,A,"En este cabildo todos los puntos fueron discutidos y sometidos a votación, los que aqui se registran son los que obtuvieron las 7 primeras mayorías."
318,3,respeto_por_la_constitución,A,Porque la estamos construyendo nosotros mismos.
319,3,respeto_por_la_constitución,A,Si la constitución se respeta no habría lugar a conflicto. Si está fue acordada de acuerdo al procedimiento democrático.
320,3,respeto_por_la_constitución,A,corresponde a la ley e mayor jerarquía y sienta las bases para el correcto orden de nuestra sociedad.
327,3,respeto_por_la_constitución,A,"La carta magna no debe ser vulnerada, siempre y cuando la Constitución sea de acuerdo y principios de igualdad y equidad."
335,3,respeto_por_la_constitución,A,"porque al ser voluntad soberana de la ciudadanía, al vulnerarlos estaríamos pasándonos a llevar unos con otros"
337,3,respeto_por_la_constitución,A,Como carta fundamental que rige a los ciudadanos debe ser respetada por todos
338,3,respeto_por_la_constitución,A,Este deber es fundamental pero dicho respeto no puede materializarse en una institución como el tribunal constitucional. Debe conciliarse la constitución con las grandes reformas y cambios sociales.
340,3,respeto_por_la_constitución,A,"solo el respeto a la constitución y a las leyes aseguraran el orden social y paz ciudadana , con respeto a los derechos humanos"
344,3,respeto_por_la_constitución,A,"Incluimos en este item, el respeto de los derechos del otro. Estamos a favor de la Democracia, y respetar la nueva constitución, no la actual."
345,3,respeto_por_la_constitución,A,"respetoa una constitucion nueva y hecha por todos y todas, no a una constitucion desactualizada y hecha  entre cuatro paredes.  ademas la constitucion debe ir por sobre el resto de leyes pues es el principio basico que las guian, por lo cual debe ser respetada."
347,3,respeto_por_la_constitución,A,1.- Incluye su renovación por simple  mandato soberano.
353,3,respeto_por_la_constitución,A,En todo su contexto.
358,3,respeto_por_la_constitución,A,constitución respetada por todas los poderes e instituciones del estado.
362,3,respeto_por_la_constitución,A,"Es la carta fundamental que rige los destinos del pais , establece los poderes ejecutivo legislativo y judicial ,establece los derechos y deberes de los ciudadanos."
363,3,respeto_por_la_constitución,A,finalmente es para formar na constitución que ejerza respeto a todos los chilenos.
364,3,respeto_por_la_constitución,A,"Si se realiza una gran consulta ciudadana para lograr una nueva constitucion, lo minimo que se debe tener es respeto por ella y por los Chilenos que han contribuido a ella."
368,3,respeto_por_la_constitución,A,"La constitución será respetada, analizada, respaldada y difundida en la medida que represente los intereses de la sociedad chilena en forma igualitaria, democrática y participativa."
370,3,respeto_por_la_constitución,A,Rige la vida de los ciudadanos.
371,3,respeto_por_la_constitución,A,LA CONSTITUCIÓN ES LA UNIDAD BÁSICA QUE RIGE A TODO EL PAÍS Y ASÍ ASEGURAR EL BIEN COMÚN.
372,3,respeto_por_la_constitución,A,"Si la constitución está bien hecha, es construida en base a las necesidades de las personas, de manera representativa, por supuesto que debe ser respetada por todos para tener una convivencia pacífica que apunte hacia el desarrollo humano."
374,3,respeto_por_la_constitución,A,"basada en un tribunal constitucional elegido democráticamente, compuesto por personas naturales que se postulen voluntariamente."
377,3,respeto_por_la_constitución,A,Siempre y cuando esta haya sido elaborada y ratificada por la voluntad del pueblo.
379,3,respeto_por_la_constitución,A,respeto a la constitucion que nace en democracia desde el pueblo y para el pueblo
382,3,respeto_por_la_constitución,A,Por una nueva constitución fundamentada en la SOBERANIA POPULAR.  Pueblo congregado y responsable.  Valor 6.
383,3,respeto_por_la_constitución,D,Tiene que ser democrática  y gestada en un estado de Derecho.
385,3,respeto_por_la_constitución,A,Porque la constitución es la madre de todas las leyes y debe respetarse
386,3,respeto_por_la_constitución,D,se debe cambiar ya que es un deber y responsabilidad del cual no fuimos participes.
387,3,respeto_por_la_constitución,A,Velar por adecuado ejercicio (implementación) de la constitución y esta puede generar un orden a nivel social.
390,3,respeto_por_la_constitución,A,Es la base de la convivencia entre todos nosotros por lo que TODOS debemos respetarla.
392,3,respeto_por_la_constitución,A,Consideramos que el respeto a la Constitución debe ser un acuerdo básico entre los ciudadanos. Pero para que el respeto sea genuino ésta debe ser legítima en su origen y aprobación. Es decir debe considerar en forma efectiva la participación de la ciudadanía.
401,3,respeto_por_la_constitución,A,Que los parlamentarios y fuerzas armadas respeten la constitución
402,3,respeto_por_la_constitución,A,Se entiende que es la única manera de lograr un acuerdo de convivencia entre los ciudadanos y personas jurídicas que habitamos este país.
407,3,respeto_por_la_constitución,A,Se trata del respeto por una constitución que se genera en las bases ciudadanas.
409,3,respeto_por_la_constitución,A,"Que la constitución no pueda ser inmodificable. Que las instituciones respeten el orden jurídico, no tan sólo los ciudadanos. Una constitución respetada y legítima tiene que ser producto de la voluntad y elaboración popular."
411,3,respeto_por_la_constitución,A,Siempre y cuando sea una constitución renovada y no retrograda
412,3,respeto_por_la_constitución,A,"Deber de los ciudadanos de conocer y respetar la constitución, para asegurar y dar cumplimiento a lo que en ella se dice."
413,3,respeto_por_la_constitución,A,"Considerando que la constitución es el pilar básico por el cuál se sustenta la visión de nuestro país, no puede ser transgredida bajo ninguna circunstancia y forma."
414,3,respeto_por_la_constitución,A,La constitución sustenta el funcionamiento y ordenamiento nacional y sistematiza su ordenamiento.
418,3,respeto_por_la_constitución,A,Esencial para un estado de derecho
419,3,respeto_por_la_constitución,A,"Los asistentes consideran importante el respeto por la constitución, sobre todo de la nueva que se realizara con bases ciudadanas."
422,3,respeto_por_la_constitución,A,respetar las normas es clave para una convivencia social adecuada
423,3,respeto_por_la_constitución,A,se respete como norma fundamental del estado.
424,3,respeto_por_la_constitución,A,"Es nuestra carta fundamental, es la que esperamos tener como guía y garantía de una buena convivencia"
426,3,respeto_por_la_constitución,A,Creemos indispensable mantener este deber en forma que está contemplado en la Constitución actual.
428,3,respeto_por_la_constitución,A,Son leyes que se elaboran para respetarlas por todos.
430,3,respeto_por_la_constitución,A,"RESPETO A UNA NUEVA CONSTITUCIÓN, QUE EN SU ELABORACIÓN PARTICIPEN LA MAYOR CANTIDAD DE CIUDADANOS."
434,3,respeto_por_la_constitución,A,Como carta fundamental y avaladora de todos los procesos democráticos de un país.
441,3,respeto_por_la_constitución,A,"La constitución debe contener nuestros fundamentales principios como país y para proteger lo que somos como tal, debemos respetarla"
442,3,respeto_por_la_constitución,A,Una Constitución que todos cumplan.
444,3,respeto_por_la_constitución,A,xx
448,3,respeto_por_la_constitución,A,2. Acatar y seguir los principios que se acuerden para este documento es básico para ser parte de este país.
452,3,respeto_por_la_constitución,A,"Es necesario generar un mejor conocimiento, para que la gente conozca y respete la Constitución. Además, el único modo de que esta se respete es a través de un proceso constituyente participativo, pues es la forma de que las personas se identifiquen con esta."
459,3,respeto_por_la_constitución,A,se asegura los derechos consignados en la constitución
463,3,respeto_por_la_constitución,A,"Respeta  el marco que establecemos para actuar, nuestro marco referencial sobre el que se definen las reglas de convivencia"
464,3,respeto_por_la_constitución,A,Estamos de acuerdo
465,3,respeto_por_la_constitución,A,"EL MÁS IMPORTANTE, REQUIERE CONCIENCIA CÍVICA Y ANTE PONER EL BIEN COMÚN POR SOBRE LOS INTERESES DE GRUPOS ECONÓMICOS."
466,3,respeto_por_la_constitución,A,"Mantener el respeto a la constitución como ley suprema, de donde emanan los derechos del resto de las leyes."
469,3,respeto_por_la_constitución,A,Porque todas sin escepción debemos respetarla siempre y cuando esta sea justa
470,3,respeto_por_la_constitución,A,.
471,3,respeto_por_la_constitución,A,.
481,3,respeto_por_la_constitución,A,Por sobre todo.
482,3,respeto_por_la_constitución,A,Se considera la constitución como la columna vertebral de institucionalidad
484,3,respeto_por_la_constitución,A,acuerdo unànime
486,3,respeto_por_la_constitución,A,• ES LOGICA QUE DEBEMOS RESPETAR NUESTRA LEY MADRE.
490,3,respeto_por_la_constitución,A,Permite que las personas puedan vivir en sociedad conforme a los valores predominantes en ella y dirimir los conflictos de intereses. La Constitución es la carta de navegación de cualquier sociedad.
493,3,respeto_por_la_constitución,A,Promover este deber en toda persona o institución es fundamental porque es la máxima norma juridica
494,3,respeto_por_la_constitución,A,"Sin este deber, se corre el riesgo de que se rompa el pacto social."
495,3,respeto_por_la_constitución,A,Deber principal
502,3,respeto_por_la_constitución,A,"Que todos sean afectados por las mismas leyes, no dando lugar a la impunidad"
504,3,respeto_por_la_constitución,A,Es la norma fundamental del Estado y la sociedad
505,3,respeto_por_la_constitución,A,Porque nacerá de nosotros.
507,3,respeto_por_la_constitución,A,"para lograr la legalidad de las instituciones, el estado y sus ciudadanos."
508,3,respeto_por_la_constitución,A,Si nos involucramos y queremos un cambio en la constitución debemos respetar las resoluciones de forma democrática y representativa de todas y de todos.
509,3,respeto_por_la_constitución,A,"Pleno consenso que la Constitución es La Llave Maestra para gobernantes y gobernados; dirigentes y dirigidos; dominantes y dominados. Alcaldes y ciudadanos, para que estos puedan proceder conforme a derecho."
513,3,respeto_por_la_constitución,A,educación cívica en todos los colegios como era antes
514,3,respeto_por_la_constitución,P,Que cumpla la constitución por ser la voz del pueblo.
516,3,respeto_por_la_constitución,A,"Así como respeto a las leyes. Todos deben respetar la constitución y sus leyes, significa vivir en un país democrático, con estado de derecho."
521,3,respeto_por_la_constitución,A,Ley primaria de la República.
523,3,respeto_por_la_constitución,A,COMO BASE LEGAL DE LOS DERECHOS Y DEBERES DE LA VIDA EN SOCIEDAD
525,3,respeto_por_la_constitución,A,Consideramos que es un deber que debe estar presente en la constitución.
526,3,respeto_por_la_constitución,A,(.)
527,3,respeto_por_la_constitución,A,"A nueva Constitucionalidad acordada a través de un debate público, surgida desde y refrendada por la ciudadanía, para facilitar procesos de revisión de los instrumentos necesarios para la estabilidad social e institucional en respuesta al buen vivir de todas y todos. Equilibrio de los DESC."
