idEla,tema,concepto,acuerdo,fundamento
11501,1,respeto_conservación_de_la_naturaleza_o_medio_ambiente,A,"Tomando en cuenta los últimos problemas ecológicos ocurridos por la explotación de la industria salmonera en el país, creemos que el cuidado y respeto por el medio ambiente y la naturaleza no es prioridad ni un tema relevante en las leyes. La calidad de vida y la esperanza de vida dependen de ello."
11503,1,respeto_conservación_de_la_naturaleza_o_medio_ambiente,A,"En todos los ámbitos sociales, justicia, política."
11509,1,respeto_conservación_de_la_naturaleza_o_medio_ambiente,A,"La naturaleza, su conservación, respeto y protección es un bien bien público que pertenece a todos los chilenos. Así el cuidado de la fauna, flora, bosques nativos, ríos, lagos, lagunas, esteros, glaciares, mar, fiordos, canales, aguas subterráneas, etc. aseguran la supervivencia de la patria."
11519,1,respeto_conservación_de_la_naturaleza_o_medio_ambiente,A,"Para mantener una vida llena de energía, que se verifique en ámbitos personales"
11525,1,respeto_conservación_de_la_naturaleza_o_medio_ambiente,A,Lucha que busca la protección sustentable y sostenible del medio ambiente. Esto permite el desarrollo humano a largo plazo y la supervivencia de todas las especies del planeta.
11528,1,respeto_conservación_de_la_naturaleza_o_medio_ambiente,A,recuperación del agua para Chile. Nacionalización de los recursos naturales
11532,1,respeto_conservación_de_la_naturaleza_o_medio_ambiente,A,Debe considerar como principio básico de la carta fundamental la conservación de la naturaleza que permita heredar un mejor Chile a los niños.
11534,1,respeto_conservación_de_la_naturaleza_o_medio_ambiente,A,"hacernos cargo y cuidar del espacio que tenemos. Requiere ser explicitado; sino se pone sobre la mesa, se ignora por obvio. Sino se cuida lo que tenemos, ponemos en riesgo las futuras generaciones; así como también a las comunidades que actualmente dependen del buen estado de recursos naturales disponible (e.g., pesca artesanal, extracción de marisco, agricultura de baja escala, disponibilidad de agua potable, etc.)."
11536,1,respeto_conservación_de_la_naturaleza_o_medio_ambiente,A,El control y  cuidado por la naturaleza y/o medio ambiente con sustentabilidad para ser utilizado por la sociedad.
11543,1,respeto_conservación_de_la_naturaleza_o_medio_ambiente,A,"Creemos que es importante que a nivel constitucional se protejan nuestros recursos naturales y el medio ambiente de nuestro país, ya que Chile posee una riqueza única en el mundo que debemos resguardar para el futuro y las siguientes generaciones."
11549,1,respeto_conservación_de_la_naturaleza_o_medio_ambiente,A,"sustentable y sostenible en el tiempo, privilegiar la conservación del habitat humano"
11550,1,respeto_conservación_de_la_naturaleza_o_medio_ambiente,A,la tecnología industrial destruye al medio ambiente a nuestra naturaleza por falta de cultura ciudadana.
11551,1,respeto_conservación_de_la_naturaleza_o_medio_ambiente,A,"Vivir en un ambiente libre de contaminación. Poner énfasis gastar mas recursos en reciclar, dicta políticas mas severas"
11553,1,respeto_conservación_de_la_naturaleza_o_medio_ambiente,A,1. Creemos que nuestro país tiene mucha riqueza en recursos naturales y esta no es valorada ni protegida
11555,1,respeto_conservación_de_la_naturaleza_o_medio_ambiente,A,"Conservar el medio en aquellas condiciones necesarias que permitan el desarrollo de la vida de las distintas especies en sus hábitats: marinas, vegetales y animales, propias de un lugar en específico. El cuidado del medio ambiente asegura las condiciones básicas para el desarrollo de las personas."
11557,1,respeto_conservación_de_la_naturaleza_o_medio_ambiente,A,"esto debería estar de la mano con el respeto a la naturaleza, no aprovechándose de  ella con fines económicos."
11562,1,respeto_conservación_de_la_naturaleza_o_medio_ambiente,A,Toda la sesión a favor de este concepto ya que se habla de la conservación de los puntos verdes.
11567,1,respeto_conservación_de_la_naturaleza_o_medio_ambiente,A,"nacionalizar y re-nacionalizar los recursos naturales, para garantizar su conservación e implementar un modelo de desarrollo socio-económico sustentable con el uso de energías limpias. el medio ambiente es un bien común de todos."
11568,1,respeto_conservación_de_la_naturaleza_o_medio_ambiente,A,Sustentabilidad
11572,1,respeto_conservación_de_la_naturaleza_o_medio_ambiente,A,Protección a nuestro medio ambiente. El estado debe establecer ese derecho y regular los beneficios otorgados a empresas extranjeras y nacionales que exploten los recursos naturales del país. Invertir en energías sustentables.
11573,1,respeto_conservación_de_la_naturaleza_o_medio_ambiente,A,"Creemos en el respeto y la conservación de la naturaleza y el medioambiente. Creemos que nuestra vida ciudadana debe desarrollarse de manera armoniosa con nuestra naturaleza y territorio. Adscribimos al respeto por nuestra tierra y sus recursos, cuyos insumos deben ser nacionalizados para garantizar la sustentabilidad de nuestro medio en la nación. Por lo tanto, emerge de nuestra definición el concepto de Habitar, pues procuramos que la armonía se logre con una adecuada habitación del ser humano en nuestro territorio, no exigiendo al medio recursos que naturalmente no provee, sino más bien situar nuestra vida y sus necesidades a los recursos noblemente dispuestos por la naturaleza."
11577,1,respeto_conservación_de_la_naturaleza_o_medio_ambiente,D,"Porque para muchos (7) se trataba más de un derecho o incluso de un deber del Estado, pero no de un principio."
11582,1,respeto_conservación_de_la_naturaleza_o_medio_ambiente,A,Respetar y Conservar el medio ambiente y la naturaleza es una manera de agradecer a Dios por lo que nos a regalado. Recomendamos que debería ser lectura obligatoria  en la educación la carta encíclica del papa Francisco denominada LAUDATO SI'  sobre el cuidado de la casa común.
11585,1,respeto_conservación_de_la_naturaleza_o_medio_ambiente,A,"Este valor no se considera ni respeta como corresponde, se necesita tomar mas conciencia ya que es la fuente de trabajo de la mayoría de los Chilenos, y sin esto no hay desarrollo para el País."
11587,1,respeto_conservación_de_la_naturaleza_o_medio_ambiente,A,"Relevar el concepto ""Socioambiental"" (humanos, colectivos y sus dinámicas, son parte de la naturaleza). Valor por sobre el interés de la propiedad privada, y considerando la Naturaleza como un todo y en su valor intrínseco"
11594,1,respeto_conservación_de_la_naturaleza_o_medio_ambiente,A,Deber del estado en conservar la naturaleza y garantizar el acceso a un medio ambiente libre de contaminación por sobre el desarrollo económico esto debe ser siempre sustentable.
11596,1,respeto_conservación_de_la_naturaleza_o_medio_ambiente,A,VALOR QUE CONSAGRE EL CUIDADO DE LA NATURALEZA Y DE SUS RECURSOS FINITOS.
11598,1,respeto_conservación_de_la_naturaleza_o_medio_ambiente,A,Porque este país es una belleza natural que como ciudadanos responsables debemos proteger.
11602,1,respeto_conservación_de_la_naturaleza_o_medio_ambiente,A,"Garantizar el cuidado del medio ambiente y el uso de los recursos naturales del país, evitando el uso indiscriminado"
11603,1,respeto_conservación_de_la_naturaleza_o_medio_ambiente,A,Conservar la naturaleza es proteger la vida. Más areas verdes es mejor calidad de vida. Por las siguientes generaciones.
11609,1,respeto_conservación_de_la_naturaleza_o_medio_ambiente,A,"TENEMOS QUE CUIDAR Y RESPETAR NUESTRA BIODIVERSIDAD SOBRE LA FAZ DE LA TIERRA,."
11612,1,respeto_conservación_de_la_naturaleza_o_medio_ambiente,A,"Generación de regulaciones para el funcionamiento y la eliminación de desechos de las empresas. Además el estado debe fomentar educación, cuidado y mantención del medio ambiente y recursos naturales, generar avances del país bajo el concepto de desarrollo sustentable."
11615,1,respeto_conservación_de_la_naturaleza_o_medio_ambiente,A,"Debemos velar porque se cuide la naturaleza, sobre todo para generaciones futuras"
11622,1,respeto_conservación_de_la_naturaleza_o_medio_ambiente,A,El mundo como va se va a quedar sin personas. Antes de los derechos de las personas preocupémonos en tener un planeta habitable donde vivan esas personas
11623,1,respeto_conservación_de_la_naturaleza_o_medio_ambiente,A,Se debe velar por la sostenibilidad del territorio
11629,1,respeto_conservación_de_la_naturaleza_o_medio_ambiente,A,"ES UNO DE LOS ASPECTOS, VALORES CENTRALES QUE DEBEN ESTAR CONSIGNADOS."
11631,1,respeto_conservación_de_la_naturaleza_o_medio_ambiente,A,La conservación del entorno es fundamental para una convivencia sana y para la práctica plena de nuestros derechos. La conservación de la naturaleza redunda en una mejor salud de la población.
11632,1,respeto_conservación_de_la_naturaleza_o_medio_ambiente,A,legislación actual es insuficiente y débil con empresas extranjeras.  Formación del hogar y colegio respecto al medio ambiente.  Actual constitución esta al servicio del capital
11635,1,respeto_conservación_de_la_naturaleza_o_medio_ambiente,A,Reconocer recursos naturales como bien público y responsabilizarnos de ellos. Educación ambiental estatal. Cambio de paradigma de crecimiento económico como única forma de progreso. Valorizar uso y explotación de recursos. Desmercantilizar la relación sociedad-naturaleza
11637,1,respeto_conservación_de_la_naturaleza_o_medio_ambiente,A,"Por cuidar nuestro entorno y el lugar donde vivimos , asi pueda haber una cultura ."
11638,1,respeto_conservación_de_la_naturaleza_o_medio_ambiente,A,"Es un acuerdo total y entendemos que se debe velar por el cuidado y sustentabilidad de nuestro medio ambiente para futuras generaciones, entendiendo que es fundamental para el bien común y por sobre la función social."
11641,1,respeto_conservación_de_la_naturaleza_o_medio_ambiente,A,"importancia de conocer, respetar y vivir en armonía con nuestro medio ambiente, que es parte de nuestro bienestar. Que desde pequeños se nos enseñe nuestra cultura y el respeto por ella. Valor que se ha perdido en la actualidad."
11642,1,respeto_conservación_de_la_naturaleza_o_medio_ambiente,A,"respeto al medio ambiente, proteger la naturaleza"
11647,1,respeto_conservación_de_la_naturaleza_o_medio_ambiente,A,Deber de todos cuidarla para las futuras generaciones.
11655,1,respeto_conservación_de_la_naturaleza_o_medio_ambiente,A,El planeta es el que nos sostiene. La economía debe considerar un desarrollo sustentable.
11670,1,respeto_conservación_de_la_naturaleza_o_medio_ambiente,A,Enfocarnos en salvar el planeta Muchos perros botados Plazas muy abandonadas
11676,1,respeto_conservación_de_la_naturaleza_o_medio_ambiente,A,"Es importante la armonía con el medio ambiente puesto que sustenta nuestro entorno. Es necesario tener conciencia del  ecosistema y que es una responsabilidad colectiva (personas, empresas y Estado)."
11678,1,respeto_conservación_de_la_naturaleza_o_medio_ambiente,A,Hay que cuidar nuestro entorno y recursos naturales para dejar un país sustentable a las futuras generaciones
11694,1,respeto_conservación_de_la_naturaleza_o_medio_ambiente,A,"Base de sustento de vida para pueblos originarios, es la relación y respeto a la naturaleza (H2O-suelo-aire-sol- energía-seres vivos en general)"
11695,1,respeto_conservación_de_la_naturaleza_o_medio_ambiente,P,"La tolerancia y valoración activa de las ideas, la cultura, opciones, las creencias, las costumbres, la cultura del prójimo constituye un deber y derecho recíprocamente exigible. El respeto mutuo genera las condiciones sociales armónicas necesarias  para el desarrollo de los ciudadanos y el avance de las comunidades humanas."
11698,1,respeto_conservación_de_la_naturaleza_o_medio_ambiente,P,Es el legado a las futuras generaciones
11700,1,respeto_conservación_de_la_naturaleza_o_medio_ambiente,P,"Existe la necesidad de avanzar hacia políticas de conservación del medio natural, como eje de desarrollo, implementación de sistemas de energía sustentables, y como bien preciado para nuestros descendientes."
11702,1,respeto_conservación_de_la_naturaleza_o_medio_ambiente,A,DESARROLLASE  EN UN AMBIENTE  LIBRE DE AMENAZAS Y CONTAMINACIÓN
11710,1,respeto_conservación_de_la_naturaleza_o_medio_ambiente,P,Garantizar la conservación del medio ambiente con un sano equilibrio con el desarrollo sustentable y local. Entendiendo que todos habitamos una casa común que es la tierra.
11712,1,respeto_conservación_de_la_naturaleza_o_medio_ambiente,A,El medio ambiente es nuestra casa grande y sin cuidado del mismo no hay equilibrio ni futuro
11722,1,respeto_conservación_de_la_naturaleza_o_medio_ambiente,A,De lo contrario no tendremos nada que entregar a las próximas generaciones
11723,1,respeto_conservación_de_la_naturaleza_o_medio_ambiente,A,Relación armónica y respetuosa con el entorno y con el territorio sobre la cual se funda la calidad de vida de los seres humanos. Implica desarrollar una nueva economía de carácter sustentable
11724,1,respeto_conservación_de_la_naturaleza_o_medio_ambiente,A,Estado debe proteger los recursos naturales.
11726,1,respeto_conservación_de_la_naturaleza_o_medio_ambiente,A,Tiene que estar incluido porque es la herencia para las futuras generaciones
11727,1,respeto_conservación_de_la_naturaleza_o_medio_ambiente,A,"se debe entender en relación al desarrollo sustentable, como lo es la administración eficiente y racional de los recursos naturales"
11734,1,respeto_conservación_de_la_naturaleza_o_medio_ambiente,A,"Solo con el cuidado y respeto de nuestro medio ambiente, podremos asegurar un futuro a nuestra descendencia."
11737,1,respeto_conservación_de_la_naturaleza_o_medio_ambiente,A,"Tanto en la dimensión ciudadana del día a día de las personas, como en el impacto del modelo de desarrollo en la naturaleza"
11738,1,respeto_conservación_de_la_naturaleza_o_medio_ambiente,A,"creemos fundamental cuidar y preservar la naturaleza, y sobre todo limitar la apropiación de os recurso naturales de todo el país por un grupo que usa y abusa de ellos para fines personales"
11745,1,respeto_conservación_de_la_naturaleza_o_medio_ambiente,A,"Es necesario garantizar una explotación responsable del medio ambiente, permitiendo obtener beneficios pero conservando el patrimonio natural."
11749,1,respeto_conservación_de_la_naturaleza_o_medio_ambiente,A,"Respetar la diversidad que presenta cada comuna, región, leyes adecuadas a la conservación de la naturaleza."
11750,1,respeto_conservación_de_la_naturaleza_o_medio_ambiente,A,ES FUTURO
11753,1,respeto_conservación_de_la_naturaleza_o_medio_ambiente,A,Si no cuidamos nuestra tierra y recursos ponemos en peligro la vida del planeta. Es necesario administrar de buena forma los recursos bajo el concepto de desarrollo sustentable.
11759,1,respeto_conservación_de_la_naturaleza_o_medio_ambiente,A,"Debe reconocerse como práctica el cuidado de nuestro entorno, el cual requiere tanto la conservación como responder a nuestra historia y antepasados."
11762,1,respeto_conservación_de_la_naturaleza_o_medio_ambiente,A,"es necesario el respeto para la conservación de la naturaleza. que no exista abusos irracionales, que no se lucre con los recursos naturales"
11770,1,respeto_conservación_de_la_naturaleza_o_medio_ambiente,P,"El actual deterioro del medio ambiente es producto de la explotación irracional de los recursos naturales. El Estado debe asegurar a las personas la conservación, el uso, y la explotación racional del medio ambiente. La naturaleza debe estar al servicio de la sociedad."
11773,1,respeto_conservación_de_la_naturaleza_o_medio_ambiente,A,Los ciudadanos tienen el derecho a vivir en un medio ambiente libre de contaminación. El estado y la sociedad tienen el deber de proteger y preservar el medio ambiente.
11777,1,respeto_conservación_de_la_naturaleza_o_medio_ambiente,D,Se diacutiò sobre sustentabilidad. Hubo 1 desacuerdo por encontrar que faltaba desarrollo econòmico ligado con la protecciòn del medio ambiente
11778,1,respeto_conservación_de_la_naturaleza_o_medio_ambiente,A,"(8 votos) fundamentado en que en la actualidad esto no está contemplado y es fundamental cuidar el medio ambiente para poder vivir en la sociedad que queramos construir, si dañamos nuestro medio ambiente no nos quedará nada, el país debe crecer pero con sustentabilidad."
11779,1,respeto_conservación_de_la_naturaleza_o_medio_ambiente,A,"El Estado tiene el deber de educar a sus ciudadanos en el cuidado del medio ambiente, fomentar su investigación científica y de hacerlo respetar mediante marcos regulatorios que garanticen consultas a las comunidades, fiscalizaciones estrictas y sanciones justas."
11782,1,respeto_conservación_de_la_naturaleza_o_medio_ambiente,P,Utilización y cuidado de los recursos que tiene el país. Implica manejos sustentables y solidarios. Parte de los integrantes consideran esto como un deber.
11790,1,respeto_conservación_de_la_naturaleza_o_medio_ambiente,A,"el medioambiente no se respeta, las personas no tienen conciencia de que al no cuidarla tendrán un mal futuro"
11791,1,respeto_conservación_de_la_naturaleza_o_medio_ambiente,A,"RESPONSABILIDAD DE TODOS CUIDAR EL PLANETA, NUESTRO HOGAR"
11797,1,respeto_conservación_de_la_naturaleza_o_medio_ambiente,A,"Se debe relevar el respeto y conservación de los recursos naturales Utilizar el término de la “Función Social” del agua, el paisaje, el subsuelo"
11804,1,respeto_conservación_de_la_naturaleza_o_medio_ambiente,A,Aspecto clave en el desarrollo nacional
11807,1,respeto_conservación_de_la_naturaleza_o_medio_ambiente,A,Falta efectividad. Es necesario legislar. Es muy importante para el futuro.  Las industrias contaminan demasiado. Debe existir una fuerte Institución que vele por el respeto y conservación.
11810,1,respeto_conservación_de_la_naturaleza_o_medio_ambiente,A,Salvaguardar los recursos naturales y garantizar un desarrollo sustentable del país.
11813,1,respeto_conservación_de_la_naturaleza_o_medio_ambiente,P,"En nuestro país contamos con un patrimonio natural y es imprescindible conservarlo, se crea a temprana edad una conciencia de cuidado ecológico, se deben tomar medidas mas rígidas en el cuidado de la naturaleza."
11814,1,respeto_conservación_de_la_naturaleza_o_medio_ambiente,A,Cuidar el medio ambiente nos protege de enfermedades y de la contaminación.
11822,1,respeto_conservación_de_la_naturaleza_o_medio_ambiente,A,Todos somos parte del ecosistema y lo que hagamos en él afecta no solo a los seres humanos sino al resto de los seres vivos como la flora y fauna.
11824,1,respeto_conservación_de_la_naturaleza_o_medio_ambiente,A,"Es un elemento de suma importancia ya que sostiene a nuestra humanidad y de aquí  obtenemos los recursos para subsistir y sostenernos, necesitamos vivir en un ambiente digno y limpio, donde  se pueda respirar y sentirnos conformes,  respetando a las diferentes  flora y fauna."
11833,1,respeto_conservación_de_la_naturaleza_o_medio_ambiente,A,"La explotación sin control de nuestros bosques y mares por la empresa privada, genera graves daños a la población chilena. El estado debe aplicar leyes más severas"
11836,1,respeto_conservación_de_la_naturaleza_o_medio_ambiente,A,Prevención y educación de la población en relación al cuidado y la preservación del medio ambiente
11841,1,respeto_conservación_de_la_naturaleza_o_medio_ambiente,A,"El estado debe comprometerse a asegurar de los ecosistemas naturales, suelo agrícola, la protección de las aguas para consumo humano y su uso en riego, de manera de asegurar un desarrollo sostenible y sustentable."
11842,1,respeto_conservación_de_la_naturaleza_o_medio_ambiente,A,"La Tierra nos da la vida, es nuestro cobijo, nuestro hogar y nuestro albergue. Es responsabilidad de todos los ciudadanos respetarla y conservarla para una mejor calidad de vida de todos los que la habitamos y para nuestras generaciones futuras."
11853,1,respeto_conservación_de_la_naturaleza_o_medio_ambiente,A,"Que se proteja, respete y utilice de forma consiente los recursos naturales presentes en nuestro país. Porque tenemos el deber colectivo e individual del cuidado de la casa común. Por unanimidad se elige respeto y conservación."
11862,1,respeto_conservación_de_la_naturaleza_o_medio_ambiente,A,"Es necesario una mayor fiscalización respeto a la conservación de la naturaleza o medio ambiente, por los daños y la sobreexplotación de los recursos. Del cuidado del medio ambiente depende la preservación de nuestra identidad."
11871,1,respeto_conservación_de_la_naturaleza_o_medio_ambiente,A,"En relación a los recursos naturales y el medio ambiente, se debería dar a través de la sensibilización psicoeducativa y la creación de políticas públicas que recuperen el recurso natural."
11877,1,respeto_conservación_de_la_naturaleza_o_medio_ambiente,A,"Garantiza la buena condición de vida, respetando tanto a las personas como a los animales y plantas."
11880,1,respeto_conservación_de_la_naturaleza_o_medio_ambiente,A,"Al proteger la naturaleza, ayudamos a que la flora y fauna del país se mantenga y se respeten los recursos de cada región, ademàs se debe fiscalizar de mejor manera la explotación de recursos."
11882,1,respeto_conservación_de_la_naturaleza_o_medio_ambiente,A,Porque cada día se toma más conciencia de los recursos naturales y la protección de estos. Necesitamos de ellos para vivir día a día y nuestra sobre vivencia depende de la naturaleza como la naturaleza necesita de nuestra protección para conservar flora y fauna.
11883,1,respeto_conservación_de_la_naturaleza_o_medio_ambiente,A,"Está en relación a la sustentabilidad, tener un lugar donde vivir para nosotros y las generaciones futuras. Para que la humanidad sobreviva. Permitir otras formas de desarrollo que conserve el medio ambiente. Necesidad urgente que tiene relación directa con preservación de la especie humana y vida"
11887,1,respeto_conservación_de_la_naturaleza_o_medio_ambiente,A,"Debe ser inculcado desde la infancia para cuidar y agradecer el espacio donde vivimos y asegurar una buena calidad de vida en base a ello, sin la destrucción de los actuales modos de producción económica."
11888,1,respeto_conservación_de_la_naturaleza_o_medio_ambiente,A,Fundamental para sentar las bases del futuro.
11892,1,respeto_conservación_de_la_naturaleza_o_medio_ambiente,A,"protección de especies (animal y vegetal), para el aprovechamiento y recuperación de los recursos"
11894,1,respeto_conservación_de_la_naturaleza_o_medio_ambiente,A,"El Estado debe velar y garantizar un medio ambiente libre de contaminación, actualizando, incentivando, concientizando, y generando políticas sustentables, resguardando la protección de la naturaleza."
11902,1,respeto_conservación_de_la_naturaleza_o_medio_ambiente,A,Es esencial para nuestra descendencia un lugar habitable y con espacios de recreación. Es fundamental la sustentabilidad.
11906,1,respeto_conservación_de_la_naturaleza_o_medio_ambiente,A,"ES LA PRESERVACION Y LA CONCIENCIA DEL ECOSISTEMA BAJO UN NUEVO VÍNCULO DEL HOMBRE CON LA NATURALEZA, NO BAJO UN SUPUESTO DE SUPERIORIDAD, SINO DE CONEXIÓN, RESCATANDO LAS COSMOVISIONES ANCESTRALES DE PUEBLOS ORIGINARIOS. IMPLICA NO VER A LA NATURALEZA COMO UN RECURSO A EXPLOTAR, SINO COMO UN MEDIO"
11912,1,respeto_conservación_de_la_naturaleza_o_medio_ambiente,A,"Si bien no representa una urgencia comparada con los demás valores, se considera una importante pues el medio ambiente es el espacio material donde la vida humana se desenvuelve."
11917,1,respeto_conservación_de_la_naturaleza_o_medio_ambiente,A,"El valor del respeto al medio ambiente nos identifica a todos como chilotes, porque vemos la falta de proyección en el tema conservación."
11918,1,respeto_conservación_de_la_naturaleza_o_medio_ambiente,A,"Principio base en toda organización, sin el cual nada puede construirse ni sostenerse."
11923,1,respeto_conservación_de_la_naturaleza_o_medio_ambiente,A,Todas las riquezas básicas deben pertenecer al estado y tutelar el respeto por ellas
11924,1,respeto_conservación_de_la_naturaleza_o_medio_ambiente,A,Hay que mirarlo desde una perspectiva sostenible (no sustentable) para el bien común. Se mira a la naturaleza de manera instrumental.
11926,1,respeto_conservación_de_la_naturaleza_o_medio_ambiente,A,"nos parece muy importante el respeto por el entorno y la naturaleza, para las generaciones futuras."
11927,1,respeto_conservación_de_la_naturaleza_o_medio_ambiente,A,"Respeto a la naturaleza y a la justicia social, es necesario porque somos parte de la naturaleza, cada decision deberia estar orientada a la sustentabilidad pues es requisito de nuestra existencia."
11928,1,respeto_conservación_de_la_naturaleza_o_medio_ambiente,A,Principio Constitucional que asegura la responsabilidad del Estado en la protección y conservación de nuestros recursos naturales y patrimonio ambiental.
11932,1,respeto_conservación_de_la_naturaleza_o_medio_ambiente,A,: El futuro del país y su desarrollo depende de este valor ya que somos un país con equilibrios frágiles
11934,1,respeto_conservación_de_la_naturaleza_o_medio_ambiente,A,Cuidado por el medio ambiente
11935,1,respeto_conservación_de_la_naturaleza_o_medio_ambiente,A,COMO UN BIEN DE LA HUMANIDAD YA QUE SU CUIDADO O MANTENIMIENTO PERMITIRA LA EXISTENCIA FUTURA DE TODOS LOS SERES VIVOS
11973,1,respeto_conservación_de_la_naturaleza_o_medio_ambiente,A,"Las grandes empresas han hecho un inmenso daño al medio ambiente y la sociedad no lo protege, hacen falta políticas públicas."
11976,1,respeto_conservación_de_la_naturaleza_o_medio_ambiente,P,Sin cuidado del medio ambiente no hay protección ni sustentabilidad.
