idEla,tema,concepto,acuerdo,fundamento
11418,3,respeto_por_la_constitución,A,"Respeto por el cumplimiento de si misma como herramienta fundamental del orden cívico y la tendencia de desarrollo país. Los ciudadanos deberían tener estatus de garantes de su cumplimiento, a través del seguimiento de Estado, las políticas públicas y el funcionamiento de las instituciones."
11424,3,respeto_por_la_constitución,A,DEBER FUNDAMENTAL HACIA EL MARCO BÁSICO DE UNA SOCIEDAD
11426,3,respeto_por_la_constitución,A,Regirse por las normas que nos hemos dado como pais
11428,3,respeto_por_la_constitución,A,Todos debemos respetar la constitución
11431,3,respeto_por_la_constitución,A,Porque tenemos que respetar todo aquello que dicta la constitución.
11432,3,respeto_por_la_constitución,A,"Estricta obligación para ciudadanos e instituciones es respetar la constitución, considerando si que ella tiene su origen en un proceso democrático y de participación ciudadana"
11444,3,respeto_por_la_constitución,A,"La Constitución es algo que salió de nosotros, por lo tanto hay que respetarlo"
11447,3,respeto_por_la_constitución,A,Porque lo fundamental en todo este proceso es el respeto a la constitución.
11450,3,respeto_por_la_constitución,A,Respeto lo que entre todos se ha acordado para garantizar la sana convivencia.
11458,3,respeto_por_la_constitución,A,Creemos que el principal deber debe ser velar la misma que esta rigiendo.
11466,3,respeto_por_la_constitución,A,SI SOMOS CAPACES DE RESPETAR LA CONSTITUCIÓN SEREMOS CAPACES DE RESPETARNOS COMO CUIDADNOS Y HACER CUMPLIR Y RESPETAR LAS LEYES.
11470,3,respeto_por_la_constitución,A,en documento adjunto
11472,3,respeto_por_la_constitución,A,"Es fundamental que sea un deber el respeto por la constitución, ya que esta es la que articula a las demás responsabilidades y deberes de los ciudadanos."
11473,3,respeto_por_la_constitución,A,"ya que se establecen nuestros Derechos y obligaciones, por ende se debe respetar, promover, desarrollar, proteger y establecer. convoca a todos los ciudadanos."
11482,3,respeto_por_la_constitución,A,Los chilenos y chilenas debemos comprometernos a respetar lo acordado en la nueva constitución nacida en democracia.
11483,3,respeto_por_la_constitución,A,Base del estado de derecho.
11485,3,respeto_por_la_constitución,A,"El respeto a una nueva constitución que incluya los valores y derechos seleccionados arriba asegurará la convivencia. Transversalidad de este deber que incluya cumplimiento de leyes y normas, cumplimiento de obligaciones fiscales, etc."
11490,3,respeto_por_la_constitución,A,"Todos los chilenos debemos presentar una actitud respetuosa frente a nuestra constitución, todas nuestras acciones deben reflejar los lineamientos de nuestra organización como estado."
11493,3,respeto_por_la_constitución,A,.
11498,3,respeto_por_la_constitución,A,Nadie esta sobre las leyes y nadie puede pasar por sobre ellas.
11503,3,respeto_por_la_constitución,A,"Respeto por la nueva constitución, a nuestra carta magna que sea construida por todos los ciudadanos."
11506,3,respeto_por_la_constitución,A,La madre de todas las leyes
11507,3,respeto_por_la_constitución,A,"Si nace de la voluntad democrática y propende al respeto, el bien común y la justicia."
11510,3,respeto_por_la_constitución,A,Es un deber de todo ciudadano respetar nuestra constitución.  si tenemos derechos debemos tener deberes para con nuestro país.
11511,3,respeto_por_la_constitución,A,Necesitamos un marco jurídico actualizado que nos regule
11519,3,respeto_por_la_constitución,A,Votación y propuesta publicas en asamblea
11523,3,respeto_por_la_constitución,A,Todas las personas participantes están de acuerdo en que es necesario partir desde este cumplimiento.
11527,3,respeto_por_la_constitución,A,Respeto por el cumplimiento de la constitución.
11529,3,respeto_por_la_constitución,A,Promover este deber en toda persona o institución es fundamental porque es la máxima norma juridia
11532,3,respeto_por_la_constitución,A,Debe respetarse aquello establecido en la Carta Fundamental para el correcto resguardo del país y sus personas.
11534,3,respeto_por_la_constitución,A,Esencial el respeto por las leyes
11536,3,respeto_por_la_constitución,A,Es la carta fundamental por la cual se rige el desarrollo de la sociedad a la cual pertenecemos
11541,3,respeto_por_la_constitución,A,"La Constitución representa ciertos parámetro que nos permiten vivir en un ambiente de paz y respeto, por lo que hay que respetarla."
11543,3,respeto_por_la_constitución,A,Porque es el marco general que nos vamos a dar como sociedad. Es la forma en que validamos y respetamos nuestros acuerdos. Queremos que sea una constitución construida en democracia.
11544,3,respeto_por_la_constitución,A,Si participamos de este proceso es porque respetamos las decisiones que tome la mayoria.
11549,3,respeto_por_la_constitución,A,"Al participar de la nueva constitución, lo primero es el respeto a ella siempre que sea una constitución en la cual el pueblo participe"
11550,3,respeto_por_la_constitución,A,la constitución va hacer respetada cuando nos respeten como ciudadano y nos den un derecho a ser oidos.
11551,3,respeto_por_la_constitución,A,que se respete la opinión que estamos generando en este momento
11556,3,respeto_por_la_constitución,A,Es la carta de navegación de un sistema y fundamental en el orden de las leyes.
11562,3,respeto_por_la_constitución,A,Porque si no se respeta no tiene valides el dialogo del proceso constituyente
11563,3,respeto_por_la_constitución,A,Esta es la madre de todas las leyes por lo tanto es el inicio para respetar al resto de las leyes.
11567,3,respeto_por_la_constitución,A,"por una nueva constitución que sea representativa e inclusiva y que legitime los derechos y los deberes de todos, se debe respetar y validar mediante la participación abierta a la generación de reformas que impidan beneficios para ciertos sectores económicos y políticos."
11571,3,respeto_por_la_constitución,A,Sin fundamento
11572,3,respeto_por_la_constitución,A,El Estado y todos los ciudadanos deben mantener un respeto y apego irrestricto a la Constitución.
11573,3,respeto_por_la_constitución,A,"Respeto a la pauta de convivencia de una nación, que sea una constitución legítima. Protección, promoción y respeto a los derechos humanos."
11576,3,respeto_por_la_constitución,A,Tenemos que respetar las leyes de nuestra constitución.
11578,3,respeto_por_la_constitución,A,siempre
11585,3,respeto_por_la_constitución,A,"Ya nos rige una constitucion, por lo tanto esta nos representa y debería ser respetada por cada uno de los Chilenos."
11589,3,respeto_por_la_constitución,A,"Porque es la Ley fundamental que rige los derechos y deberes, y regula la actividad del Estado."
11594,3,respeto_por_la_constitución,P,Se debe proteger aquella constitución que es producto de la autodeterminación de la sociedad.
11596,3,respeto_por_la_constitución,A,"DEBER DE TODO CIUDADANO RESPETAR LA CONSTITUCIÓN Y SUS LEYES, INDEPENDIENTE DE SU POSICIÓN SOCIAL, PODER ECONÓMICO O POLÍTICO."
11602,3,respeto_por_la_constitución,A,es la carta fundamental de la nación . El respeto recae en que se tratará en una carta con amplio respaldo ciudadano
11603,3,respeto_por_la_constitución,A,Asegura que las autoridades respeten los derechos de los ciudadanos y limita su poder.
11605,3,respeto_por_la_constitución,A,"La Constitución Política establece las normas fundamentales para la convivencia en una sociedad, motivo por el cual debe ser respetada."
11606,3,respeto_por_la_constitución,A,no vulnerar ni saltarse la constitución para leyes ni transformaciones a no ser que se realice una consulta ciudadana.
11608,3,respeto_por_la_constitución,A,Los participantes no fundamentaron dicho principio
11614,3,respeto_por_la_constitución,A,ES IMPORTANTE PORQUE EN ELLA ESTÁ TODO NUESTRO ORDENAMIENTO JURÍDICO.
11615,3,respeto_por_la_constitución,A,Todos debemos respetar las reglas del juego que fija la Constitución.
11619,3,respeto_por_la_constitución,A,"La nueva constitución será escrita con las ideas y deseos de todos los chilenos, por lo que será nuestro deber respetarla."
11622,3,respeto_por_la_constitución,P,"Si estamos elaborando nuestra propia constitución, el fin es que esta sea respetada. Cuidar lo nuestro habla de madurez cívica"
11625,3,respeto_por_la_constitución,A,"La constitución es nuestro marco regulatorio que tenemos como nación lo cual debe ser respetado para mantener un orden social. Para ello, es importante la participación de la ciudadanía, para su efectivo reconocimiento y legitimación."
11628,3,respeto_por_la_constitución,A,"Es deber del Estado y de las personas respetar la constitución, siempre y cuando ésta haya sido fruto de un amplio proceso ciudadano participativo y vinculante."
11629,3,respeto_por_la_constitución,A,DEBER DE OBSERVACION Y PRACTICA DE LA CONSTITUCIÓN.
11630,3,respeto_por_la_constitución,A,Todos los ciudadanos debemos respetar la constitución y el marco legal de nuestro pais
11631,3,respeto_por_la_constitución,A,"Una vez la Constitución refleje los cambios requeridos por la sociedad actual, debe ser respetada por tod@s."
11632,3,respeto_por_la_constitución,A,"LA constitución es parte de nosotros, será legitimada si es fruto de la participación ciudadana, sentirnos identificados con ella y enseñarla.  Debe recoger necesidades, garantizar que se cumpla y contener sanciones por infracción a la constitución."
11633,3,respeto_por_la_constitución,A,Todos debemos respetar la constitución y sus leyes que de ella derivan para la correcta convivencia social
11634,3,respeto_por_la_constitución,A,"Si la Constitución fue diseñada por todos, se dio la oportunidad de participar, opinar, interactuar, esta es representativa, asegurando en democracia su cumplimiento"
11637,3,respeto_por_la_constitución,P,Consideraba que no representaba el sentir de la ciudadania
11638,3,respeto_por_la_constitución,A,En todos sus aspectos.
11641,3,respeto_por_la_constitución,A,Documento que sustenta las políticas de base que un país libre quiere sostener para el bien común.
11642,3,respeto_por_la_constitución,A,porque es la nos va regir a todos
11645,3,respeto_por_la_constitución,A,Compromiso con la norma fundamental establecida.
11647,3,respeto_por_la_constitución,A,Ordenamiento de la vida ciudadana
11659,3,respeto_por_la_constitución,A,Que se genere un respeto transversal por la carta magna.
11662,3,respeto_por_la_constitución,A,Entender la constitución como el alma del funcionamiento de la sociedad (hay que respetarla).
11664,3,respeto_por_la_constitución,A,base de convivencia social y que establece criterios para un bien comun
11666,3,respeto_por_la_constitución,A,"Respeto por la constitución y las leyes. Es deber respetar la constitución, leyes y normas que rigen la vida en democracia."
11669,3,respeto_por_la_constitución,A,"Base de la sociedad y si no la respetamos, no nos respetamos a nosotros mismos."
11670,3,respeto_por_la_constitución,A,Respeto por la constitución
11676,3,respeto_por_la_constitución,A,"Creemos que este deber, encierra todos los demás (deberes y derechos). La constitución otorga el ordenamiento jurídico de todo, es lo que manda. Vemos día a día, que en la práctica no se cumple ni se respeta. Es prioridad el debate sobre esto."
11678,3,respeto_por_la_constitución,A,"Valoramos considerar nuestra opinión para elaborar la Constitución actual, que incluye valores, deberes y derechos de los ciudadanos"
11683,3,respeto_por_la_constitución,A,"Pese a que es algo lógico, pues todo ciudadano debe respetar la Constitución, nos parece central que esta se dé a conocer, se trabaje en los colegios y los ciudadanos decidan respetarla, más allá de una simple imposición, como respaldo al proyecto de sociedad en que vivimos y queremos alcanzar."
11684,3,respeto_por_la_constitución,A,"El respeto por la constitución incluiría casi todos los demás deberes, el respeto a la ley, derechos de los demás etc…"
11685,3,respeto_por_la_constitución,A,"Es básico respetar, es lo que ordena al país. Debe regular a las leyes."
11695,3,respeto_por_la_constitución,A,Cada individuo está sujeto al imperio de la Constitución y las leyes. Este deber es el correlato necesario para requerir su protección.
11698,3,respeto_por_la_constitución,A,Base de la convivencia nacional parte por el respeto a la constitucion
11702,3,respeto_por_la_constitución,A,CONSTITUYE UN REQUISITO BÁSICO PARA LA CONVIVENCIA PACÍFICA DE UNA COMUNIDAD NACIONAL
11711,3,respeto_por_la_constitución,A,la constitución debe respetarse siempre y cuando exista la pre eminencia de la libertad de expresión
11714,3,respeto_por_la_constitución,A,"Respeto por la nueva constitución co-construida por todos los chilenos que participan del proceso. Esto le otorga una legitimidad desde su origen, ya que por primera vez, el ciudadano común y corriente participa, y eso es importante, fortalece la identidad con la República de Chile."
11716,3,respeto_por_la_constitución,A,esto debe ser el contrato social al que nos obligamos con derechos y deberes
11723,3,respeto_por_la_constitución,A,Respeto por el ordenamiento y leyes constitucionales que rigen a Chile como país y que definen los principios que nos gobiernan a todos y todas y nuestra vida en sociedad/comunidad.
11724,3,respeto_por_la_constitución,A,Deber básico para la convivencia.
11726,3,respeto_por_la_constitución,A,"Esto lo estamos haciendo para cambiar la constitución, hacerla democrática, participativa y para eso hay que respetarla"
11730,3,respeto_por_la_constitución,A,Una sociedad mas justa se funda en el respeto al ordenamiento que se dà. Por lo tanto es esencial  el cumplimiento de este deber.
11734,3,respeto_por_la_constitución,A,Respeto por la Constitución
11737,3,respeto_por_la_constitución,A,"Entendiendo que hablamos de una nueva constitución que se construye en sociedad, Incluye el respeto a las leyes y normas"
11744,3,respeto_por_la_constitución,A,Que se consagre el respeto y cumplimiento de la Constitución como la norma fundamental que prima e ilumina a todas las demás normas del país.
11745,3,respeto_por_la_constitución,A,"Es necesario al establecer una carta fundamental estructurada en democracia, que esta se respete"
11749,3,respeto_por_la_constitución,A,Respeto hacia la nueva constitución porque nuestras opiniones serán consideradas seria un fraude que nos reunamos para que luego no se represente en nada  lo que necesitamos como ciudadanos.
11753,3,respeto_por_la_constitución,A,"Porque la Constitución es la Carta Fundamental, por lo tanto, todas las acciones de los ciudadanos deben estar supeditadas a ella."
11754,3,respeto_por_la_constitución,A,hoy y siempre
11758,3,respeto_por_la_constitución,A,"- Es esencial para que se cumplan las normas que ella contemple.  - Es la ""ley de leyes"", por ende debemos obedecerla. - Nos garantiza derechos y deberes."
11760,3,respeto_por_la_constitución,A,Se debe respetar la constitución cuando esta ha sido debatida en democracia.
11762,3,respeto_por_la_constitución,A,carta que rige todos los aspectos del acontecer nacional
11763,3,respeto_por_la_constitución,A,"Creemos que debe ser uno de los derechos a promover. Toda persona, grupo e institución debe respetar los preceptos consagrados en la constitución, ya que esta es la máxima norma jurídica de  un Estado."
11770,3,respeto_por_la_constitución,A,"Los ciudadanos deben respetar la nueva Constitución, pues  ésta será la decisión del conjunto de la sociedad."
11772,3,respeto_por_la_constitución,D,"La creación de esta constitución, validada participativamente,  debiese ser resguardada. Esto no concitó acuerdo en el grupo, ya que se señaló que la constitución no debe ser respetada bajo algunas circunstancias, como por ejemplo, cuando gobiernos de facto la utilizan para el ejercicio del poder."
11773,3,respeto_por_la_constitución,A,"Es deber de todos respetar la nueva Constitución que ha de definirse en democracia, siempre y cuando considere las prioridades del pueblo."
11775,3,respeto_por_la_constitución,A,hay una persona que no está de acuerdo
11777,3,respeto_por_la_constitución,D,3 desacuerdos y 1 acuerdo parcial
11779,3,respeto_por_la_constitución,D,Existen desacuerdos con respecto a que si este deber está implícito o no y si dicho respeto debería ser imperativo o meritorio.
11782,3,respeto_por_la_constitución,A,.
11787,3,respeto_por_la_constitución,A,Apego a lo que se dicta en la nueva constitución.
11791,3,respeto_por_la_constitución,A,RESPETAR EL MARCO DE LEYES DEL PAIS
11797,3,respeto_por_la_constitución,A,Debemos respetar esta “nueva” construida entre todos
11798,3,respeto_por_la_constitución,A,"si efectivamente es un acuerdo ciudadano, y donde los ciudadanos  puedan sentir que están realmente garantizados los derechos fundamentales."
11799,3,respeto_por_la_constitución,A,Sin ella el trabajo que estamos haciendo no tendría sentido.
11800,3,respeto_por_la_constitución,A,ley fundamental que define el régimen de nuestros derechos y libertades como ciudadano
11801,3,respeto_por_la_constitución,A,Promover la buena convivencia
11804,3,respeto_por_la_constitución,A,"En cuanto sea legítima, y garantice un buen vivir y derechos"
11806,3,respeto_por_la_constitución,A,Ley fundamental que define el régimen de los derechos y libertades de los ciudadanos y delimita los poderes e instituciones.
11807,3,respeto_por_la_constitución,A,"Absolutamente. Si no existe respeto, no existe por los derechos políticos y sociales. La Constitución evita, al ser respetada, los abusos del poder, al establecer límites."
11810,3,respeto_por_la_constitución,A,"Los ciudadanos deben asegurar el cumplimiento y el respeto a la constitución, una vez informados de su contenido."
11813,3,respeto_por_la_constitución,A,"Regirnos y seguir lo estipulado por la constitución, respetarse las leyes fundamentales del país."
11815,3,respeto_por_la_constitución,A,La constitución es la base del cómo  se deben comportar y relacionar valórica y  legalmente  los habitantes de un país. Por lo tanto respetar la constitución significa el respeto a uno mismo como el respeto a un/a otro.
11817,3,respeto_por_la_constitución,A,"Garantizar nuestro actuar, derechos y deberes"
11824,3,respeto_por_la_constitución,A,"Porque una vez que se cree una constitución nueva y legitimada de manera transversal, debe ser respetado sus lineamientos generales en pos de la construcción de nuestra sociedad  y el buen vivir. Sino se respetan nuestras mismas normas resulta muy complejo construir sociedad."
11833,3,respeto_por_la_constitución,A,Cuando los ciudadanos participan y opinan será una constitución legitimada
11836,3,respeto_por_la_constitución,A,"En la medida en que la constitución sea co-construida será respetada por la ciudadanía, ser partícipe garantiza un mayor involucramiento y respeto.  Se hace urgente incluir educación cívica en la educación formal."
11838,3,respeto_por_la_constitución,A,existiendo la oportunidad de una nueva tenemos la posibilidad de hacernos cargo de lo que en ella aparezca.
11842,3,respeto_por_la_constitución,A,"El pleno respeto y cumplimiento de las leyes emanadas de la Constitución es la base para enfrentar la delincuencia, abatir la impunidad y mantener el Estado de Derecho para lograr así una convivencia social basada en la protección de los derechos de los todos los ciudadanos."
11845,3,respeto_por_la_constitución,A,aspecto fundamental para el desarrollo democrático de un país. Respetar las reglas nos permite jugar mejor
11862,3,respeto_por_la_constitución,A,"Respeto por una Constitución democraticamente elegida, no impuesta por un grupo minoritario de personas."
11865,3,respeto_por_la_constitución,A,"Si bien la actual constitucion tiene puntos importantes y que en teoria promueven el bien comun, en la practica no actua de manera fidedigna por lo cual, el respeto hacia ella es fundamental para un buen funcionamiento de la nacion."
11866,3,respeto_por_la_constitución,A,TODOS DEBEN RESPETARLA AUNQUE NO ESTÉN COMPLETAMENTE DE ACUERDO CON ELLA.
11869,3,respeto_por_la_constitución,A,"Es fundamental que se respete y se cumpla, ya que es nuestra carta magna que nos rige en nuestra vida de compromiso como ciudadanos."
11873,3,respeto_por_la_constitución,A,Esta es la carta fundamental de un país y debe ser respetada por todos
11874,3,respeto_por_la_constitución,A,es un fin que engloba todos los puntos anteriores.
11876,3,respeto_por_la_constitución,A,Que mi opinión se valorice y contribuyente al país
11877,3,respeto_por_la_constitución,A,Permite el respeto por los otros.
11880,3,respeto_por_la_constitución,P,"Se debe respetar la constitución al legislar sobre distintos aspectos del país, pero sin limitar a que algún aspecto de la constitución pueda ser modificada en caso de que la ciudadanía este de acuerdo en que sea modificada."
11882,3,respeto_por_la_constitución,A,"es la carta magna que nos regirá como sociedad, por lo tanto debemos respetarla y obedecerla"
11889,3,respeto_por_la_constitución,A,...
11890,3,respeto_por_la_constitución,A,"La constitución es nuestra carta de navegación y la que nos dice lo que podemos y no podemos hacer, por lo cual debemos respetarla."
11891,3,respeto_por_la_constitución,A,BASICO PARA QUE EXISTA ESTABILIDAD EN EL PAIS Y VALIDAR EL PROCESO CONSTITUYENTE.
11892,3,respeto_por_la_constitución,A,HACER CUMPLIMIENTO DE LOS DEBERES Y DERECHOS QUE SE ESTABLECEN COMO ACUERDO O NORMAS EN CONVIVENCIA SOCIAL
11893,3,respeto_por_la_constitución,A,el estado no puede pasar a llevar u objetar las leyes
11894,3,respeto_por_la_constitución,A,0
11902,3,respeto_por_la_constitución,A,Una constitución que garantice los derechos y deberes fundamentales para el pueblo levantados en función de sus creencias debe ser respetada para continuar siendo legítima.
11904,3,respeto_por_la_constitución,A,respetarla.
11906,3,respeto_por_la_constitución,A,PRINCIPIO BÁSICO DEL ORDENAMIENTO SOCIAL EN LA MEDIDA QUE LA CONSTITUCIÓN SEA LEGÍTIMA.
11909,3,respeto_por_la_constitución,A,"ya que corresponde a la norma general, por tanto seria el primer paso para fundamentar el quehacer nacional"
11912,3,respeto_por_la_constitución,P,"Al redactar una carta fundamental, es de vital importancia que esta sea respetada por todos los que se han de regir por la misma, y con ello se cumplan las normas que se dictan en su escrito."
11917,3,respeto_por_la_constitución,A,"Como la carta fundamental que es, ésta debe regir nuestras leyes, actos y conciencias."
11918,3,respeto_por_la_constitución,A,En atención a que el incumplimiento de este deber poneen riesgo laregulación y el efectivo ejercicio del poder normado por la constitución.
11921,3,respeto_por_la_constitución,A,para garantizar la estabilidad del gobierno.
11923,3,respeto_por_la_constitución,A,Obligación de todo ciudadano
11924,3,respeto_por_la_constitución,A,Deber cívico fundamental de la vida en comunidad política.
11928,3,respeto_por_la_constitución,A,"Si la ciudadanía participa para darse su propia constitución, entonces se puede asegurar el respeto y aprecio a la misma."
11935,3,respeto_por_la_constitución,A,PORQUE ES EL INSTRUMENTO RACIONAL DE REGULACION DE VIDA DE UNA SOCIEDAD Y REGULA EL PODER
11947,3,respeto_por_la_constitución,A,con 22 de 22 se elige debido a que todos los presentes establecieron que la constitución es la base de todo y por eso se debe respetar
11948,3,respeto_por_la_constitución,A,"La constitución debe representar las necesidades de la ciudadanía, que la gente realmente la respete, esto con “asamblea constituyente”."
11949,3,respeto_por_la_constitución,A,.
11955,3,respeto_por_la_constitución,A,VALIDACIÓN DE LA CARTA FUNDAMENTAL
11959,3,respeto_por_la_constitución,A,La aplicación de las leyes es deficiente. SI existe respeto por la ley y entre nosotros podremos llevar a cabo cualquier cometido que se proponga.
11961,3,respeto_por_la_constitución,A,crear y reforzar organismos  para hacer cumplir las normas
11963,3,respeto_por_la_constitución,A,"Toda persona, grupo e institución debe respetar los preceptos consagrados en la constitución, ya que ésta es la máxima norma jurídica de un Estado."
11968,3,respeto_por_la_constitución,A,Para  vivir en comunidad  armónicamente  hay  que  respetar  las  normas.
11969,3,respeto_por_la_constitución,A,toda la legalidad debe adecuarse al marco constitucional
11973,3,respeto_por_la_constitución,A,"Respeto por la constitución que nos regirá por muchos años, y de que formamos parte en su formulación."
11976,3,respeto_por_la_constitución,P,Es la base de lo que nos rige como nación.
11980,3,respeto_por_la_constitución,A,Sujeción de los ciudadanos y las instituciones a la carta fundamental originada en un mecanismo legítimo.
11984,3,respeto_por_la_constitución,A,.
11989,3,respeto_por_la_constitución,A,se debe promover respetar los preceptos sagrados en la constitución y sea una o un grupo de personas debe respetarse ya que es la máxima norma jurídica de un estado.
11990,3,respeto_por_la_constitución,A,Que los estamentos del estado cumplan con la normativa de la constitucion.
11992,3,respeto_por_la_constitución,A,"En cuanto tenga una validez democrática y su origen fruto de un consenso universal, por tanto plebiscitado en democracia efectiva."
11993,3,respeto_por_la_constitución,A,Deber de todos los ciudadanos
11994,3,respeto_por_la_constitución,A,los cambios que se realicen a ello que sean cumplidos y beneficiosos
11997,3,respeto_por_la_constitución,A,Por ser el marco institucional que nos rige
11999,3,respeto_por_la_constitución,A,EL ESTADO DEBE HACER CUMPLIR Y RESPETAR LA CONSTITUCIÓN POR TODAS LAS AUTORIDADES E INSTITUCIONES DEL ESTADO Y PRIVADOS
