idEla,tema,concepto,acuerdo,fundamento
3936,3,respeto_por_la_constitución,A,"Como ley fundamental, se requiere que como ciudadanos seamos participes de su diseño estructural así como también nos encargaremos de cumplir sus artículos con responsabilidad."
3937,3,respeto_por_la_constitución,A,Respeto  y  acatamiento  de la  constitución  que   regula  la  vida  pública y  comunitaria  de cada  uno de los   ciudadanos.
3939,3,respeto_por_la_constitución,A,acuerdo de inclusion
3941,3,respeto_por_la_constitución,A,"Concluimos   que  una  carta  fundamental,  no solo debe  contener  derechos,  debe  contener  la obligación de  respetar la misma  y  las  leyes  que   integran el ordenamiento."
3944,3,respeto_por_la_constitución,A,CUARTA MÁS VOTADA
3945,3,respeto_por_la_constitución,A,Vivir en paz y compromisos con los ciudadanos.
3949,3,respeto_por_la_constitución,A,Porque es fundamental para que se cumpla lo que implica este proceso.
3951,3,respeto_por_la_constitución,A,La tenemos que respetar porque fuimos nosotros quienes la construimos.
3952,3,respeto_por_la_constitución,A,"c.1.1.-  Porque es la Columna Vertebral de una Sociedad Organizada. c.1.2.-   Es la que nos rige o regirá , dándonos una entidad como nación"
3958,3,respeto_por_la_constitución,A,muchas veces se desconoce y por ende no se respeta. El estado debería hacer llegar estos documentos a todas las organizaciones
3959,3,respeto_por_la_constitución,A,DEBEMOS REGIRNOS Y RESPETAR CADA ASPECTO QUE ENMARCA LA CONSTITUCIÓN
3964,3,respeto_por_la_constitución,A,Este deber debe ser fundamental para la consagración de la nueva constitución.
3966,3,respeto_por_la_constitución,A,Porque la Constitución rige todos los estamentos del Estado
3968,3,respeto_por_la_constitución,A,"Que la Constitución nunca más sea violentada, que los derechos de los pueblos sean respetados."
3971,3,respeto_por_la_constitución,P,"La constitución se debe entender como algo que puede cambiar, cuando existe algo que ya no sirve se debe propasar desde la disrupción."
3973,3,respeto_por_la_constitución,A,Porque es nuestro estatuto de vida.
3974,3,respeto_por_la_constitución,A,"Una de las principales responsabilidades de un ciudadano o ciudadana es el respeto a la carta magna sobre la cual se resguardan los derechos y deberes en un estado democrático, más relevancia cobra si aquella Constitución ha sido construida de forma legítima y soberana por los propios conciudadanos en una acción opinante informada y ordenada."
3979,3,respeto_por_la_constitución,P,En la medida que ha sido generada por la soberanía popular. Debe contener espacios para reformarla y actualizarla bajo las mismas reglas con que se creó
3980,3,respeto_por_la_constitución,A,Es la carta fundamental y que nos rige y va ser representativa a partir de este ejercicio en que valoramos y respetamos
3983,3,respeto_por_la_constitución,A,Hay que respetar la constitución.
3986,3,respeto_por_la_constitución,A,Es la base para poder regirnos y ser guía del actuar de cada uno de los ciudadanos.
3991,3,respeto_por_la_constitución,A,"porque es la base que fundamenta a nuestro chile, donde encontramos nuestros derechos y deberes como ciudadanos . Ademas, es la ley en la que se rigen y deriban todas las otras leyes que rigen a nuestro país."
3992,3,respeto_por_la_constitución,A,ES POR LO CUAL SE DICTA LA PATRIA Y DEBE SER DE RESPETO ABSOLUTO
3994,3,respeto_por_la_constitución,P,"Si estamos debatiendo sobre Constitución, pues hay que respetarla."
4000,3,respeto_por_la_constitución,A,"Es fundamental respetarla, ya que de ella nace toda la normativa nacional, y se entiende que nos protege y obliga a todas y todos por igual."
4005,3,respeto_por_la_constitución,A,porque debe ser un deber fundamental salvaguardar y respetar la constitución por parte de todas las personas e instituciones
4006,3,respeto_por_la_constitución,A,"Como ciudadanos tenemos que tener conciencia de nuestros derechos y deberes, exigiendo los primeros y cumpliendo con los segundos, desarrollando así una sociedad más justa y con límites claros."
4007,3,respeto_por_la_constitución,A,.
4014,3,respeto_por_la_constitución,P,Una nueva constitución desarrollada en democracia y con la participación de los ciudadanos es la carta fundamental que direcciona nuestras actividades tras el bien común.
4017,3,respeto_por_la_constitución,A,es la base de la convivencia comun
4018,3,respeto_por_la_constitución,A,"Es esencial proteger, defender una constitución hecha en democracia y con participación"
4020,3,respeto_por_la_constitución,A,Deber primordial ya que es la carta fundamental; la Constitución debe nacer de un proceso participativo y velar por el bien común de todas las personas. Es obligación de todas las personas cumplir con los principios de la Constitución.
4021,3,respeto_por_la_constitución,A,"La constitución debe ser la carta magna de un país, todas las leyes deben emanar de ellas y todos debemos regirnos por esto. Se señala que la participación en este proceso implica que creen que la constitución se debe respetar"
4022,3,respeto_por_la_constitución,A,"Todas las autoridades y miembros del Estado, así como los/as ciudadanos/as deben regirse a los acuerdos suscritos en la nueva Constitución."
4031,3,respeto_por_la_constitución,A,Respetar lo que se estipula en la Constitución
4036,3,respeto_por_la_constitución,A,fundamental
4037,3,respeto_por_la_constitución,A,Deber de todo ciudadano
4041,3,respeto_por_la_constitución,A,"La Constitución, esta que crearemos encarnará los valores básicos en los que queremos vivir nuestra vida común, por ello el Estado y las personas, deben respetar su contenido."
4042,3,respeto_por_la_constitución,A,"RECONOCER NUESTRAS LEYES, DEJANDO DENTRO DE LA EDUCACION ESPACIOS QUE PERMITAN CONOCER LOS DERECHOS, DEBERES DE CADA CIUDADANO"
4045,3,respeto_por_la_constitución,A,"reconocerla como la carta fundamental del país, desarrollar aún más la promoción de la misma"
4046,3,respeto_por_la_constitución,A,"Si no existe el deber de respetar la Constitución y se entiende así, seguiremos eternamente con la discusión de que Constitución queremos."
4049,3,respeto_por_la_constitución,A,Como ciudadanos participamos de un proceso constitucional y debemos asegurar que se cumpla.
4050,3,respeto_por_la_constitución,A,"todos los chilenos deben respetar la constitución, sus normas, reglas, derechos y deberes."
4051,3,respeto_por_la_constitución,A,"Especificando el respeto por la NUEVA CONSTITUCIÓN, No la actual"
4052,3,respeto_por_la_constitución,A,Promover su conocimiento y respeto siempre
4055,3,respeto_por_la_constitución,A,SINO SE RESPETA CON QUÉ FINALIDAD SE VA A REFORMULAR
4064,3,respeto_por_la_constitución,A,"Representa la opinión de la mayoría de las personas, en los parámetros determinados y estipulados en ésta."
4065,3,respeto_por_la_constitución,A,Respeto con la Constitucion en la medida que sea acorde con lo que la gente pide que esté en la Constitución. Evaluar la continuidad del Tribunal Constitucional.
4070,3,respeto_por_la_constitución,A,"ES LA LEY MADRE SOBRE NUESTRA FORMA DE GOBIERNO, SITUACIÓN SOCIAL Y ECONÓMICA."
4074,3,respeto_por_la_constitución,A,"El Estado y todos los ciudadanos deben mantener un respeto a la Constitución y a las normas que son las normas que nos regulan, para poder tener una convivencia sana y pacífica."
4075,3,respeto_por_la_constitución,A,Que sea una constitución justa para que sea respetada por los ciudadanos
4078,3,respeto_por_la_constitución,A,Unánime
4080,3,respeto_por_la_constitución,A,acuerdo unánime.
4082,3,respeto_por_la_constitución,A,El respeto por la constitución es importante para el orden.
4085,3,respeto_por_la_constitución,A,"Respeto pos las instituciones públicas, por los derechos y deberes establecidos constitucionalmente."
4088,3,respeto_por_la_constitución,A,Pilar fundamental de la sociedad y de la patria
4090,3,respeto_por_la_constitución,A,Porque es el órgano superior bajo el cual todos convivimos.
4096,3,respeto_por_la_constitución,A,"PRIMERA PRIORIDAD, 20 MENCIONES, CONSIDERAMOS QUE LA CARTA MAGNA DEBE SER RESPETADA POR TODOS LOS CHILENOS Y QUIENES VIVAN EN EL PAÍS."
4098,3,respeto_por_la_constitución,A,Debemos respetarla porque todas nuestras leyes están incluidas en ella.
4099,3,respeto_por_la_constitución,A,se plantea como uno de los deberes mas importantes
4104,3,respeto_por_la_constitución,A,"Si la constitución es un acuerdo colectivo, es necesario velar por su cumplimiento. Esta exigencia no es solo hacia los ciudadanos comunes sino también a los políticos, FFAA, poder judicial, etc."
4105,3,respeto_por_la_constitución,A,.
4106,3,respeto_por_la_constitución,A,Base del cumplimiento y obligación de todos.
4109,3,respeto_por_la_constitución,A,La Constitución es la carta fundamental del país y como ciudadanos debemos respetar y hacer que esta se cumpla.
4112,3,respeto_por_la_constitución,A,"Entendiendo que la constitución es la madre de todas las leyes, es necesario que todos los ciudadanos la respeten para poder vivir en paz."
4113,3,respeto_por_la_constitución,A,"Para que en el pais exista un convivencia, reglamentada y elaborada por todos.-"
4114,3,respeto_por_la_constitución,A,Según acuerdo de la asamblea
4115,3,respeto_por_la_constitución,A,"Siempre que la Constitución sea representativa de la mayoría del pueblo, existe el deber de respetarla, sin importar su condición o poder."
4117,3,respeto_por_la_constitución,A,"En todo ámbito y todo tipo de personas, de no hacerlo sanciones firmes"
4119,3,respeto_por_la_constitución,A,"Siempre y cuando haya sido construida, reconocida y validada por la ciudadanía."
4121,3,respeto_por_la_constitución,A,Porque esta constitución sea la primera construída por nosotros y eso nos garantizará un mejor vivir en el nuevo Chile
4123,3,respeto_por_la_constitución,A,Es necesario respetar la Constitución porque nos está permitiendo opinar a todos sobre las decisiones del país.
4125,3,respeto_por_la_constitución,A,"EL RESPETO POR LA CONSTITUCIÓN SE BASA EN QUE DEBE ESTAR IDENTIFICADA CON TODOS Y CADA CIUDADANO, QUE REPRESENTE NUESTROS INTERESES, INQUIETUDES Y NECESIDADES ."
4127,3,respeto_por_la_constitución,A,Orden fundamental para el país y su convivencia.
4131,3,respeto_por_la_constitución,A,Requerimiento básico para la regulación de una sociedad.
4134,3,respeto_por_la_constitución,A,Por qué son las leyes y las normas que nos rigen y es la base de un país
4135,3,respeto_por_la_constitución,A,Porque es la norma fundamental de convivencia.
4136,3,respeto_por_la_constitución,A,Porque se hizo participativamente
4139,3,respeto_por_la_constitución,A,"leyes madres para vivir en sociedad , pero debemos mejorarla"
4144,3,respeto_por_la_constitución,A,"Nº 4 Nos parece imperativo el Deber de respetar nuestra constituciòn, somos una sociedad de Derecho en donde no podemos permitirnos el no respetar la constituciòn y las leyes, màs si estàs surgen de un proceso participativo."
4145,3,respeto_por_la_constitución,A,Seguir respetando la constitución y que nos sigan respetando a nosotros
4146,3,respeto_por_la_constitución,A,La constitución nueva y democrática nos representará y será respetada por todos los ciudadanos de este país.
4147,3,respeto_por_la_constitución,P,"Todos tenemos el derecho a regirnos por una constitución que nos represente, y que no sea excluyente."
4148,3,respeto_por_la_constitución,A,"Base del estado de derecho, especialmente si es una Constitución legítima generada democráticamente."
4149,3,respeto_por_la_constitución,A,SI QUEREMOS CAMBIO DEBEMOS RESPETAR
4152,3,respeto_por_la_constitución,A,"Como carta de navegación del estado debe ser respetada por todos y todas, es un principio básico el que las leyes que se generan y las acciones de cada parte estén acordes con la constitución ya que nosotros mismos la hemos definido y validado"
4157,3,respeto_por_la_constitución,A,Respeto por la NUEVA CONSTITUCION
4159,3,respeto_por_la_constitución,A,"Debemos respetar nuestra constitucion cien por ciento, porque es y sera creada por todos los ciudadanos."
4169,3,respeto_por_la_constitución,A,SI LA CONSTITUCIÒN NO ES RESPETADA Y CUMPLIDA POR TODOS PIERDE SU RAZÒN DE SER.
4177,3,respeto_por_la_constitución,A,COMO LEY BASE DEL ESTADO
4179,3,respeto_por_la_constitución,A,pero también con la posibilidad de adaptarla ante nuevas necesidades de la ciudadanía.
4181,3,respeto_por_la_constitución,A,Se acuerda que este deber constitucional es fundamental
4182,3,respeto_por_la_constitución,A,Es la norma fundamental. Debe respetada por todos.
4183,3,respeto_por_la_constitución,A,Se conversó que se subentendía que este deber era lógico.
4193,3,respeto_por_la_constitución,A,Al ser la norma fundamental es imprescindible que la nueva constitución sea respetada por todos
4197,3,respeto_por_la_constitución,A,"a partir de la constitución se rige todo en Chile, si no hay un cumplimento de esta, es imposible ser un país ordenado justo y con seguridad."
4198,3,respeto_por_la_constitución,A,"Una constitución democrática de la que actualmente estamos formando parte en su realización y construcción, debe ser respetada por todo el país, ya que es la base de un buen gobierno y la carta fundamental que señala nuestros derechos y obligaciones."
4199,3,respeto_por_la_constitución,A,"La constitución es la norma base para que cualquier Estado se rija, por lo cual se debe respetar para que la sociedad funcione y no caiga en anarquía. Se deben reconocer las instituciones básicas y ser capaz de seguir estas reglas."
4203,3,respeto_por_la_constitución,A,"Porque es nuestra ley fundamental y porque debemos ser consecuentes con los deberes y derechos que la constitución establece, validado por este proceso constituyente."
4206,3,respeto_por_la_constitución,A,Respeto porque nos ordena como sociedad.
4209,3,respeto_por_la_constitución,A,"Respetar una constitución creada de manera participativa es respetar a la ciudadanía, reconociendo el poder popular"
4213,3,respeto_por_la_constitución,A,Si o si. Asegurar procesos democráticos.
4217,3,respeto_por_la_constitución,A,"Porque es la que nos conduce como país y hemos participado en su construcción por lo tanto, debemos velar por su cumplimiento."
4223,3,respeto_por_la_constitución,A,Por ser la Ley fundamental del Estado.
4229,3,respeto_por_la_constitución,A,Emanada de la ciudadanía. Con el cumplimiento de sus leyes y normas.
4235,3,respeto_por_la_constitución,P,"Sí somos participes de este proceso, debemos en primer lugar imponernos respeto a la constitución."
4241,3,respeto_por_la_constitución,A,"Es necesario conocerla y respetarla,ya que es la base para nuestras leyes e instituciones funcionen correctamente."
4249,3,respeto_por_la_constitución,A,.
4251,3,respeto_por_la_constitución,A,"Todos debemos, sin excepciones, respetar las reglas generales de convivencia que nos hemos dado para vivir en sociedad y que no es otra cosa que la propia Constitución y las leyes que de ella derivan"
4252,3,respeto_por_la_constitución,A,Siempre y cuando la constitución sea redactada en democracia y construida democrática y participativamente.
4259,3,respeto_por_la_constitución,A,"Es básico y se entiende que es la carta fundamental.  Además, hoy la estamos construyendo entre todos y todas."
4268,3,respeto_por_la_constitución,A,Comprendiendo una constitución legítima y validada democráticamente.
4272,3,respeto_por_la_constitución,A,porque es el Marco legal al cual deben referirse todos los habitantes de Chile.
4273,3,respeto_por_la_constitución,A,Una vez esta se formule correctamente debe ser respetado por las autoridades y ciudadanos.
4274,3,respeto_por_la_constitución,A,"Deber fundamental de todo ciudadano, respetar y conocer"
4276,3,respeto_por_la_constitución,A,la asamblea considera que es necesario que la constitución en primera instancia debe ser reconocida e interiorizada por los altos mandos del país para que luego pueda ser trasmitida a los ciudadanos y de esa forma poder cumplir con lo establecido en la constitución y respetar lo que ahí se acordó.
4283,3,respeto_por_la_constitución,A,SIN ESO NO ES POSIBLE HACER NADA.
4294,3,respeto_por_la_constitución,A,EL RESPETO POR LAS LEYES PARTE POR LA CONSTITUCION
4295,3,respeto_por_la_constitución,A,"El respeto a la carta fundamental es el inicio de todo, la base."
4296,3,respeto_por_la_constitución,A,Se debe Respetar  la constitución.
4298,3,respeto_por_la_constitución,A,.
4300,3,respeto_por_la_constitución,P,"QUE ESTA SEA COHERENTE CON NUESTRA SOCIEDAD, Y SEA EDUCADA EN LOS COLEGIOS Y QUE TODAS LAS LEYES SEAN REPRESENTATIVAS DE ESTA Y NO AFECTEN O ATENTEN CON LOS PRINCIPIOS CONSTITUCIONALES."
4301,3,respeto_por_la_constitución,A,que se respete nuestra constitución en toda su extencion.
4302,3,respeto_por_la_constitución,A,"QUE NINGUNA LEY, NORMA O REGLA LA CONTRADIGA."
4305,3,respeto_por_la_constitución,P,"Respeto a la máxima ley de una nación, la piedra angular de toda nación"
4310,3,respeto_por_la_constitución,A,"Dado que se entiende que el proceso constituyente conlleva a elaborar un nuevo Pacto Social, es ineludible el respeto de este acuerdo construido entre todos."
4315,3,respeto_por_la_constitución,A,Guía del país. Si se proponen cambios es porque hay que respetarla.
4319,3,respeto_por_la_constitución,A,"Respetar la carta fundamental es un deber que implica respetar a la sociedad como conjunto. Es respetar las reglas que todos acordamos, en el entendido que la Constitución es fruto de un acuerdo"
4332,3,respeto_por_la_constitución,A,Creer y cumplir lo que indica la constitución y hacer cumplir la constitución.
4334,3,respeto_por_la_constitución,A,"Para ordenar, evitar caos, ordenar lo estamentos y cumplirlos, seguridad ciudadana y crecer como país."
4335,3,respeto_por_la_constitución,A,Es esencial respetar la constitución y las leyes para vivir en sociedad
4337,3,respeto_por_la_constitución,A,Acuerdo total
4341,3,respeto_por_la_constitución,A,Respetar una constitucion que sea refrendada en ASAMBLEA CONSTITUYENTE .
4343,3,respeto_por_la_constitución,A,Compromiso básico para llevar a cabos estos grandes cambios. Si a las reformas de Gobierno
4345,3,respeto_por_la_constitución,A,Es la parte fundamental y la comùn bitàcora de este viaje grupal en tiempos finitos.
4347,3,respeto_por_la_constitución,A,si hacemos una constitucion es para respetarla
4348,3,respeto_por_la_constitución,P,La constitución nos rige como nacion
4349,3,respeto_por_la_constitución,A,"Respeto por la constitución, leyes y normas, cumplimiento a la normativa legal vigente como herramienta de control social y parámetros de conductas en el marco del estado de derechos."
4355,3,respeto_por_la_constitución,A,"Toda sociedad ordenada y pacifica debe respetar las normas mínimas de convivencia, que es lo que entendemos por constitución."
4357,3,respeto_por_la_constitución,A,Por que de una constitución se generan todas las leyes fundamentales .
4360,3,respeto_por_la_constitución,A,"Respeto a la constitución redactada y votada en democracia por todos los chilenos, que sea legítima de origen, no como la que hoy nos rige."
4361,3,respeto_por_la_constitución,A,"El Estado, sus instituciones y los ciudadanos deben comprometerse con cumplir los valores, principios y deberes establecidos en la constitución (en particular, las fuerzas armadas)."
4365,3,respeto_por_la_constitución,A,Defensa de los fundamentos que proponemos para nuestra nueva constitución política.
4371,3,respeto_por_la_constitución,A,"Porque es nuestra carta fundamental,  elaborada entre todos,  participativa e inclusiva."
4372,3,respeto_por_la_constitución,P,Respetar las leyes dadas por la constitución.
4373,3,respeto_por_la_constitución,A,LA CONSTITUCIÓN DEBE GARANTIZAR ANTE TODO EL CUMPLIMIENTO DE LAS LEYES QUE NOS RIGEN
4380,3,respeto_por_la_constitución,A,DEBIESE ESTAR CONSAGRADO EN LA FUTURA CARTA
4383,3,respeto_por_la_constitución,P,7 integrantes se manifiestan de acuerdo con este deber.
4386,3,respeto_por_la_constitución,A,ES OBLIGACION DE TODOS LOS CIUDADANOS RESPETAR LA CONSTITUCION
4387,3,respeto_por_la_constitución,A,Si esta constitución está hecha por nosotros mismos es también deber nuestro respetarla
4393,3,respeto_por_la_constitución,A,Respeto por NUESTRA constitución. Primera vez que tenemos la oportunidad de decir lo que pensamos y dar ideas de lo que rige la conducta de los chilenos. Poder expresar en espacio formal el país en el que queremos vivir.
4400,3,respeto_por_la_constitución,A,La carta fundamental debe ser respetada por todos los ciudadanos chilenos.
4401,3,respeto_por_la_constitución,A,Debe respetar las personas sus familias y su entorno.
4402,3,respeto_por_la_constitución,A,"Esta constitución debe considerar los encuentros locales, considerando los deberes, derechos y responsabilidades de los chilenos."
4408,3,respeto_por_la_constitución,A,Es nuestra base y por lo mismo queremos que sea modificada para el  bien de todos.
4409,3,respeto_por_la_constitución,A,Porque es la base de la ley y Estado
4410,3,respeto_por_la_constitución,A,"- Asegurar la legitimidad de la constitución en su origen, lo que sólo se cumple con una asamblea constituyente."
4414,3,respeto_por_la_constitución,A,Incluido dentro del Item responsabilidad
4418,3,respeto_por_la_constitución,A,necesario para la convivencia en paz y crecimiento homogéneo del país.
4419,3,respeto_por_la_constitución,A,Deber fundamental para la paz y convivencia social
4420,3,respeto_por_la_constitución,A,No tendría sentido el no respetar una constitución originada en nosotros mismos. El respeto deber partir por sentirnos parte de la constitución misma.
4424,3,respeto_por_la_constitución,A,sin fundamento
4425,3,respeto_por_la_constitución,P,"Para todos y todas los chilenos, sin importar su posición en la sociedad."
4426,3,respeto_por_la_constitución,A,"todos los individuos, sin diferencias sociales debenrespetar la constitución."
4427,3,respeto_por_la_constitución,A,si porque la estamos cambiando
4429,3,respeto_por_la_constitución,P,"Se espera que esta nueva Constitución, sea construida de manera participativa e inclusiva, por lo cuál nadie debe trasgredirla. Exigimos Asamblea Constituyente."
4430,3,respeto_por_la_constitución,A,"LA CONSTITUCIÓN ES EL PILAR FUNDAMENTAL DE UN ESTADO DE DERECHO, EL ESTADO DEBE ASEGURARSE DE QUE SEA CONOCIDA POR TODOS, Y LAS PERSONAS, PODERES DEL ESTADO, INSTITUCIONES, DEBEN CUMPLIRLA. QUIEN O QUE NO SE SUBORDINA, ACTÚA EN SEDICIÓN."
4434,3,respeto_por_la_constitución,A,ESTE DEBER ESTÁ A LA BASE DE TODOS LOS DEMÁS.
4438,3,respeto_por_la_constitución,A,"Una vez aprobada por una Asamblea Constituyente, debe ser responsabilidad del pueblo su respeto y vigencia."
4440,3,respeto_por_la_constitución,A,"La base de un país, que no puede ser violada. Busque asegurar el bienestar del pueblo y sus derechos"
4441,3,respeto_por_la_constitución,A,Prioridad 5
4444,3,respeto_por_la_constitución,A,"La constitución, como carta magna reguladora de la vida social y del funcionamiento del Estado, debe ser respetada por todas y todos, pero siempre y cuando su construcción sea resultado de un proceso social participativo, justo y democrático."
4449,3,respeto_por_la_constitución,A,Cumplir las leyes que nos otorgamos como ciudadanos.
4452,3,respeto_por_la_constitución,A,Que se haga valer y que sea respetada especialmente por los que dirigen el país.
4454,3,respeto_por_la_constitución,P,"La Constitución debe declarar en forma explícita que SE RESPETA, es decir, no puede quedar ninguna posibilidad abierta a que se intente un golpe de Estado o conspirar contra un gobierno legítimamente electo."
4456,3,respeto_por_la_constitución,A,"El derarrollo del pais solo se logra mediante el respeto por la constitucion, las leyes y las normas vigentes por de la ciudadania, asi como por todos los organismos del estado, incluyendo los poderes ejecutivo, legislativo y judicial, asi como tambien las fuerzas armadas y de orden."
4463,3,respeto_por_la_constitución,A,"Norma fundamental, de ahí parte todo"
4468,3,respeto_por_la_constitución,A,"Es primordial respetar una constitución creada por todas y todos, no a esta constitución que fue impuesta."
4475,3,respeto_por_la_constitución,A,"La constitución garantiza un trato igualitario a las personas, respeto a los derechos establecidos y afianzamiento de la justicia."
4480,3,respeto_por_la_constitución,A,"Conocer las instituciones y resguardaras. Nosotros no podemos dejar de preocuparnos por las cosas que importan al país, como son nuestras leyes e instituciones."
4482,3,respeto_por_la_constitución,A,Pilares CChC
4484,3,respeto_por_la_constitución,A,RESPETAR LAS LEYES ESTABLECIDAS EN LA CONSTITUCION Y REGIRSE DEBIDAMENTE POR ELLAS
4490,3,respeto_por_la_constitución,A,fundamento de todos los derechos
4491,3,respeto_por_la_constitución,A,.
4494,3,respeto_por_la_constitución,A,Primera obligación de todo ciudadano.
4496,3,respeto_por_la_constitución,A,"Se debe respetar la constitución formal y materialmente, es decir que no sólo se diga que hay derechos, sino que efectivamente se respeten."
4501,3,respeto_por_la_constitución,D,por no cumplimiento a las comunidades indígenas (la araucanía no existe para el gobierno actual)
4504,3,respeto_por_la_constitución,A,La Constitución fija las reglas o normas fundamentales conforme a las cuales se va  a convivir en el país.
4506,3,respeto_por_la_constitución,A,toda norma y/o ley debe estar supeditada a la constitución construida por la ciudadania
4517,3,respeto_por_la_constitución,A,"Porque ella plasma todo lo que asegura una vida digna, de DDHH, del medio ambiente. Que sea respetada por todas las clases sociales."
