idEla,tema,concepto,acuerdo,fundamento
3727,1,respeto_conservación_de_la_naturaleza_o_medio_ambiente,A,El medio ambiente es la base de todo sustento. Actualmente la economía esta por sobre el respeto a la Naturaleza.
3730,1,respeto_conservación_de_la_naturaleza_o_medio_ambiente,A,"considerar nuestrio entorno como eje fundamental para el desarrollo sustentable, manteniendo el equilibrio con la narutaleza"
3737,1,respeto_conservación_de_la_naturaleza_o_medio_ambiente,A,"bueno este concepto es algo indispensable en la nueva constitución si como país queremos seguir teniendo una tierra habitable, es urgente tener políticas publicas para la real protección de la naturaleza que hoy en día es victima del extractivismo."
3738,1,respeto_conservación_de_la_naturaleza_o_medio_ambiente,A,"respeto al medio ambiente y al patrimonio. terminar con políticas extraccionistas -conciencia, educación y fiscalización. -participación ciudadana vinculante. -"
3743,1,respeto_conservación_de_la_naturaleza_o_medio_ambiente,A,No dañar el hogar donde habitamos.
3748,1,respeto_conservación_de_la_naturaleza_o_medio_ambiente,A,"Se entienda como un valor principal y que la actuación del estado esté supeditada a este principio, en conjunto con el principio de buen vivir."
3750,1,respeto_conservación_de_la_naturaleza_o_medio_ambiente,A,Nuestra sociedad se debe desarrollar de forma sustentable.
3753,1,respeto_conservación_de_la_naturaleza_o_medio_ambiente,A,"que las normas y las leyes mantengan áreas verdes, respetando nuestra naturaleza, fomentar e involucrar a la ciudadanía la  importancia de estos recursos."
3755,1,respeto_conservación_de_la_naturaleza_o_medio_ambiente,A,conservar la flora la fauna y las riquezas básicas para lograr un mejor futuro.
3761,1,respeto_conservación_de_la_naturaleza_o_medio_ambiente,A,"El Estado debe garantizar un desarrollo sustentable, que respete paisajes, culturas locales, biodiversidad y distintos estilos de vida, entendiendo al medioambiente como bien común y exigiendo una responsabilidad individual y colectiva para construir una cultura sustentable."
3766,1,respeto_conservación_de_la_naturaleza_o_medio_ambiente,A,"Queremos un estado en que se respeten los recursos naturales y el medio ambiente, se requiere el compromiso de los individuos y del estado a traves de sus politicas publicas. como el reciclaje, leyes para no contaminar el medio ambiente, etc."
3767,1,respeto_conservación_de_la_naturaleza_o_medio_ambiente,A,Es algo que no puede quedar ajeno a la socedad y que puede generar cambios en las relaciones humanas.
3769,1,respeto_conservación_de_la_naturaleza_o_medio_ambiente,A,Que se deje de dar preferencia a los sectores privados en la destrucción del medio ambiente y que se cuide nuestro entorno.
3775,1,respeto_conservación_de_la_naturaleza_o_medio_ambiente,A,EN LA PRACTICA SE VE QUE NO HAY RESPETO POR LO QUE NOS RODEA Y QUE NOS SIRVE A LOS SERES VIVIENTES.
3777,1,respeto_conservación_de_la_naturaleza_o_medio_ambiente,A,Proteger el medio ambiente nos favorece a todos. Evitando la sobre explotación de los recursos naturales
3781,1,respeto_conservación_de_la_naturaleza_o_medio_ambiente,A,Respetar la naturaleza y el medio ambiente
3787,1,respeto_conservación_de_la_naturaleza_o_medio_ambiente,A,Proteger el ecosistema planetario porque es donde vivimos.
3788,1,respeto_conservación_de_la_naturaleza_o_medio_ambiente,A,"Esto, además, aporta a la mejor calidad de vida. Debe estar protegido por leyes más acotadas y tener más relevancia. Regido por la declaración del desarrollo sustentable."
3791,1,respeto_conservación_de_la_naturaleza_o_medio_ambiente,A,"respeto y conservación, naturaleza y medio ambiente, sustentable prioritaria por sobre intereses económicos"
3805,1,respeto_conservación_de_la_naturaleza_o_medio_ambiente,A,Conservation del medio ambiente Explotación sustentable Garantia de espacios verdes Derechos de los animales
3809,1,respeto_conservación_de_la_naturaleza_o_medio_ambiente,P,Avanzando sin destruir ni mermar nuestro bien más preciado.
3813,1,respeto_conservación_de_la_naturaleza_o_medio_ambiente,A,No podemos permitirnos el continuo deterioro de nuestro medio ambiente. Debemos actuar antes que sea demasiado tarde
3817,1,respeto_conservación_de_la_naturaleza_o_medio_ambiente,A,"Es imortantisimo poder respetar los recursos naturales, vivir en armonía con éstos, tener una conciencia acerca del daño que realizamos al medio ambiente y sí la CPE lo incluyera, se podría inculcar el respeto a la conservación de la naturaleza."
3821,1,respeto_conservación_de_la_naturaleza_o_medio_ambiente,A,"Respeto a naturaleza y medio ambiente, así como establecer regulaciones especiales para uso de recursos y bienes naturales de nación, que deben ser considerados como pertenecientes a todos chilenos/as (agua, minas, mar, etc)."
3825,1,respeto_conservación_de_la_naturaleza_o_medio_ambiente,A,Es importante cuidar y proteger el medio ambiente para las futuras generaciones
3826,1,respeto_conservación_de_la_naturaleza_o_medio_ambiente,A,"Proteger y valorar nuestros recursos naturales, sancionando con penas concretas a quienes violenten y/o destruyan el medio ambiente, flora y fauna del país."
3828,1,respeto_conservación_de_la_naturaleza_o_medio_ambiente,A,"que las decisiones políticas tomen en cuenta el concepto de sustantividad ambiental, priorizando el ecosistema y no soluciones a corto plazo."
3835,1,respeto_conservación_de_la_naturaleza_o_medio_ambiente,A,Permite un desarrollo sustentable y la conservación de recursos. Hoy es un tema relevante.
3844,1,respeto_conservación_de_la_naturaleza_o_medio_ambiente,A,"- Justicia intergeneracional afecta a los más pobres (Pueblo Mapuche y pescadores, por ejemplo)"
3846,1,respeto_conservación_de_la_naturaleza_o_medio_ambiente,A,En la medida que respetemos nuestro medio ambiente aseguramos nuestra existencia.
3849,1,respeto_conservación_de_la_naturaleza_o_medio_ambiente,A,Cuidar y promover el espacio en donde vivirán nuestros hijos.
3852,1,respeto_conservación_de_la_naturaleza_o_medio_ambiente,A,Principio y valor de proteger desde la educación inicial nuestro medio ambiente para cuidar los recursos que están  escaseando
3854,1,respeto_conservación_de_la_naturaleza_o_medio_ambiente,A,"Que el Estado se haga cargo que nuestro paso sea lo menos invasivo que pueda ser, es decir el estado tiene que hacerse cargo de como minimizar el impacto. Respeto de la naturaleza sea más importante que el derecho de la propiedad privada."
3856,1,respeto_conservación_de_la_naturaleza_o_medio_ambiente,A,A
3859,1,respeto_conservación_de_la_naturaleza_o_medio_ambiente,A,El Estado garante de la conservacion del habitat necesario para las futuras generaciones  Equilibrio : Sustentabilidad y sostenabilidad
3865,1,respeto_conservación_de_la_naturaleza_o_medio_ambiente,P,"Chile es un país  con enorme  biodiversidad, riquezas naturales de las que debe hacerse cargo. El Medio ambiente es un bien superior que debe primar sobre lo económico para una vida digna"
3869,1,respeto_conservación_de_la_naturaleza_o_medio_ambiente,A,Calidad del lugar donde vivimos
3873,1,respeto_conservación_de_la_naturaleza_o_medio_ambiente,A,Crucial en tiempos en que el impacto del ser humano en el medio ha sido desastroso. Clave para la sobrevivencia del planeta y sus distintas especies.
3879,1,respeto_conservación_de_la_naturaleza_o_medio_ambiente,A,"Garantizar el respeto por el ambiente, flora y fauna."
3882,1,respeto_conservación_de_la_naturaleza_o_medio_ambiente,A,Aplicar un desarrollo sustentable.
3885,1,respeto_conservación_de_la_naturaleza_o_medio_ambiente,A,"La constitución debe velar por la protección de. Justo medio ambiente generando políticas públicas para ello, y regulación de las explotaciones de todos los recursos naturales teniendo como norte dicha protección por sobre toda determinación que el Mercado y el Capital generen."
3886,1,respeto_conservación_de_la_naturaleza_o_medio_ambiente,A,"Proteger lo básico, que ha sido trastocado por la empresa privada. Integrarlo como tema fundamental y diferenciador."
3890,1,respeto_conservación_de_la_naturaleza_o_medio_ambiente,A,Es indispensable el cuidado
3898,1,respeto_conservación_de_la_naturaleza_o_medio_ambiente,A,Cuidar el medio ambiente
3905,1,respeto_conservación_de_la_naturaleza_o_medio_ambiente,A,"que los animales sean reconocidos en la constitución como ser vivo como tal merecen respeto y que las leyes sean mas severas al maltrato animal no cambiar el cauce de los ríos, conservación del bosque nativo"
3915,1,respeto_conservación_de_la_naturaleza_o_medio_ambiente,A,"Consagrado considerando la importancia que la naturaleza tiene para los Pueblos Originarios, y el vínculo espiritual que les une. Debe considerar la restitución y reparación del daño ya causado en los territorios ancestrales indígenas."
3919,1,respeto_conservación_de_la_naturaleza_o_medio_ambiente,A,Tenemos la obligación de conservar y administrar responsablemente los recursos naturales para las próximas generaciones.
3925,1,respeto_conservación_de_la_naturaleza_o_medio_ambiente,A,"El ser humano tiene que aprender a subsistir sin destruir el medio ambiente y garantizándolo para las generaciones futuras. No se trata de ir al extremo del ecologismo profundo, sino de un equilibrio entre el desarrollo y el respeto al medio ambiente, ya que éste es basal para el futuro."
3931,1,respeto_conservación_de_la_naturaleza_o_medio_ambiente,A,"se escogió como principio, y se analizó en conexión con los recursos naturales. Científicos no son todo lo creíbles que se debiera, particularmente respecto de los recursos naturales.  Los recursos naturales, con regulación estricta, la explotación debe ser controlada y regulada mucho mas de lo que es hoy.   Y la proyección de nuestra especie es importante y la calidad de vida de hoy es fundamental para el desarrollo y el bienestar y la calidad de vida del mañana.  Las áreas verdes y la manera en que se establecen las comunidades debe estar muy bien regulada, para no afectar la calidad de vida de las personas. Los controles y sanciones deben ser muy estrictos."
3934,1,respeto_conservación_de_la_naturaleza_o_medio_ambiente,A,Priorizar el medio ambiente por sobre le desarrollo económico
3936,1,respeto_conservación_de_la_naturaleza_o_medio_ambiente,P,"El medio Ambiente, es el espacio que ocuparán las futuras generaciones es imprescindible conservarla."
3937,1,respeto_conservación_de_la_naturaleza_o_medio_ambiente,A,"Aceptada y  valorar  a  las  demás  personas, como un  derecho legítimo del otro,  sin  considerar clase social,  status , religión ,  etc."
3939,1,respeto_conservación_de_la_naturaleza_o_medio_ambiente,A,"Acuerdo Absoluto, contempla tanto la conservacion como la soberania sobre recursos naturales y alimentaria"
3945,1,respeto_conservación_de_la_naturaleza_o_medio_ambiente,A,"Cuidar y proteger el medio ambiente, no dañar lo que tenemos"
3949,1,respeto_conservación_de_la_naturaleza_o_medio_ambiente,A,Porque no existen políticas. Sin medio ambiente no tenemos vida condición básica para vivir una Constitución.
3958,1,respeto_conservación_de_la_naturaleza_o_medio_ambiente,A,"debemos proteges los recursos naturales, las plantas nativas y el medio ambiente en general"
3960,1,respeto_conservación_de_la_naturaleza_o_medio_ambiente,A,"Respeto por la vida interespecie, protección del medio ambiente y nacionalización de los recursos naturales. Necesidad suprema para seguir coexistiendo."
3971,1,respeto_conservación_de_la_naturaleza_o_medio_ambiente,A,"Estado debe reforzar el respeto por la naturaleza y conservarla, sin que primen los intereses económicos."
3974,1,respeto_conservación_de_la_naturaleza_o_medio_ambiente,A,"Porque vivimos en un mundo donde los recursos naturales hoy son limitados y por lo tanto el generar un estado de sustentabilidad es una labor fundamental tendiente a generar y resguardar la calidad de vida de las personas, entendiendo que existe una relación de interdependencia entre el Ser Humano y su entorno."
3977,1,respeto_conservación_de_la_naturaleza_o_medio_ambiente,A,Es fundamental tener un desarrollo sustentable. El crecimiento economico y social no debe comprometer al medioambiente.
3979,1,respeto_conservación_de_la_naturaleza_o_medio_ambiente,A,"Debe ser regulado, normado y fiscalizado. Se requiere educación e incentivo. Transgresión debe ser penada de modo de hacer poco atractivo su acto."
3980,1,respeto_conservación_de_la_naturaleza_o_medio_ambiente,A,Cuidado y respeto al medio ambiente y la conservación del ecosistema al que pertenecemos.
3983,1,respeto_conservación_de_la_naturaleza_o_medio_ambiente,A,El manejo de los recursos sea inspirado por el respeto y la conservación de la naturaleza. Los recursos naturales pertenecen al estado.
3986,1,respeto_conservación_de_la_naturaleza_o_medio_ambiente,A,"Por la preservación y sustentabilidad de los recursos naturales de nuestro país, pensando en el desarrollo a futuro."
3991,1,respeto_conservación_de_la_naturaleza_o_medio_ambiente,A,"Implica abordar la conservación y respeto de la bio diversidad, protección de los componentes del ecosistema y conservación de los recursos"
3992,1,respeto_conservación_de_la_naturaleza_o_medio_ambiente,A,MAYOR CONCIENCIA CON LOS RESIDUOS QUIMICOS MEJORAR LA EDUCACION SOBRE EL TEMA. MAYORES SANCIONES A EMPRESAS QUE PROVOQUEN DAÑO.
4000,1,respeto_conservación_de_la_naturaleza_o_medio_ambiente,A,Es fundamental el resguardo del medio ambiente para asegurar la sustentabilidad del país y el resguardo de la naturaleza para las futuras generaciones.
4002,1,respeto_conservación_de_la_naturaleza_o_medio_ambiente,A,El desarrollo del país a largo plazo requiere considerar el respeto y el cuidado del medio ambiente.
4006,1,respeto_conservación_de_la_naturaleza_o_medio_ambiente,A,Concientización del medio ambiente y su cuidado. Entendiendo que es el entorno en el que nos desarrollamos.
4014,1,respeto_conservación_de_la_naturaleza_o_medio_ambiente,A,"No puede existir más contaminación ni degradación de recursos naturales, debe existir proyecto País para la explotación y conservación de los recursos para el desarrollo sustentable del País."
4020,1,respeto_conservación_de_la_naturaleza_o_medio_ambiente,P,Debe estar mejor redactado en la Constitución como principio fundamental. Debe ser el principio rector de toda la sociedad. Defensa del patrimonio ambiental. Dejar a las futuras generaciones un entorno saludable. Discrepancia porque se caen proyectos fundamentales para el país con posibilidades de desarrollo.
4022,1,respeto_conservación_de_la_naturaleza_o_medio_ambiente,A,"Tanto los ciudadanos como el Estado debieran orientar su accionar hacia un equilibrio entre el ser humano y su medio, promoviendo intervenciones cuidadas, responsables y conscientes, hacia un desarrollo sustentable en el tiempo."
4025,1,respeto_conservación_de_la_naturaleza_o_medio_ambiente,A,"Generar conciencia y cuidado del medio ambiente.  Generando ademàs sustentabilidad para resguardar los recursos naturales y preservarlos como bien comùn,"
4027,1,respeto_conservación_de_la_naturaleza_o_medio_ambiente,A,":  Respetar el medio ambiente  es pensar en las futuras generaciones en dejarles una país  el cual tenga mayor calidad de vida, ver que día a día la la avaricia del ser humano hace que se destruya el lugar donde ellos los viven sin pensar en que   hay recursos que deben ser cuidado  tale como el agua,  sin agua no hay vida."
4036,1,respeto_conservación_de_la_naturaleza_o_medio_ambiente,A,sin el cuidado al medio ambiente y conservación de la naturaleza nuestras generaciones no podrán resguardar el planeta
4041,1,respeto_conservación_de_la_naturaleza_o_medio_ambiente,A,"Este valor debe incluirse en las políticas públicas, promoverse entre los ciudadanos, e incluirse en las mallas educacionales de todo nivel. Dejando el respeto a la propiedad privada, para estructurarse en función del bien común y de la comunidad."
4042,1,respeto_conservación_de_la_naturaleza_o_medio_ambiente,A,"Que se sancione a quien no respeta la naturaleza, con multas equivalentes a su daño"
4045,1,respeto_conservación_de_la_naturaleza_o_medio_ambiente,P,Valorar la naturaleza y cuidado del medio ambiente para futuras generaciones
4046,1,respeto_conservación_de_la_naturaleza_o_medio_ambiente,A,Al hablar de una nueva Constitución es primordial que se asegure un medio ambiente libre de contaminación para nuestros hijos.
4049,1,respeto_conservación_de_la_naturaleza_o_medio_ambiente,A,Asegurar nuestro ambiente para generaciones futuras.
4051,1,respeto_conservación_de_la_naturaleza_o_medio_ambiente,A,"Somos parte de la naturaleza,no sus dueños"
4052,1,respeto_conservación_de_la_naturaleza_o_medio_ambiente,A,Los asistentes al encuentro concordaron en que este principio debe ser fortalecido desde la familia
4059,1,respeto_conservación_de_la_naturaleza_o_medio_ambiente,A,Es un valor tranversal. Se debe respetar y convivir  con nuestro entorno.
4064,1,respeto_conservación_de_la_naturaleza_o_medio_ambiente,A,"Establecer empatía con el ecosistema, entendiendo que el medio ambiente (planeta) es un ser vivo, por lo cual tiene derecho y tiene directa relación con la existencia de los seres humanos."
4065,1,respeto_conservación_de_la_naturaleza_o_medio_ambiente,A,"El estado debe garantizar el cuidado y conservación de la naturaleza para las futuras generaciones. Velar por el cumplimiento de la normativa ambiental, fiscalizar las grandes empresas extractivas de recursos naturales."
4067,1,respeto_conservación_de_la_naturaleza_o_medio_ambiente,A,"El desarrollo económico y social debe ser sostenible, libre de contaminación, cuidando el entorno, la biodiversidad, evitando la extracción abusiva de los recursos, respetando las comunidades y favoreciendo las políticas ecológicas y el desarrollo urbano digno."
4070,1,respeto_conservación_de_la_naturaleza_o_medio_ambiente,A,"DESARROLLO SUSTENTABLE-ADMINISTRACIÓN EFICIENTE Y RACIONAL DE LOS RECURSOS NATURALES, RESGUARDANDO A LAS GENERACIONES FUTURAS"
4072,1,respeto_conservación_de_la_naturaleza_o_medio_ambiente,A,"El hombre es un ser vivo y como tal forma parte de la biodiversidad. Somos una especie más de las que existen en este planeta y dependemos completamente de la naturaleza para nuestra existencia, supervivencia y desarrollo."
4075,1,respeto_conservación_de_la_naturaleza_o_medio_ambiente,A,"Los recursos naturales y de energía deben ser propiedad del Estado no de empresas particulares que venden el agua, la luz, el gas, los minerales. Etc."
4078,1,respeto_conservación_de_la_naturaleza_o_medio_ambiente,A,Unánime
4079,1,respeto_conservación_de_la_naturaleza_o_medio_ambiente,A,SE está de acuerdo con la definición base entregada en este documento.
4080,1,respeto_conservación_de_la_naturaleza_o_medio_ambiente,A,acuerdo absoluto
4082,1,respeto_conservación_de_la_naturaleza_o_medio_ambiente,A,"Es importante el respeto hacia nuestra naturaleza, ya que es lo que sustenta el mundo."
4088,1,respeto_conservación_de_la_naturaleza_o_medio_ambiente,A,Cuidar y proteger el medio ambiente
4089,1,respeto_conservación_de_la_naturaleza_o_medio_ambiente,A,Para la preservación de recursos; Sustentabilidad; Respecto por calidad de vida y Extracción de recursos de manera consciente.
4096,1,respeto_conservación_de_la_naturaleza_o_medio_ambiente,A,"TERCERA PRIORIDAD CONSIDERADA POR LOS PARTICIPANTES, DADA LA IMPORTANCIA QUE ESTO REVISTE PARA NUESTRO FUTURO, NO SOLO NACIONAL SINO QUE MUNDIAL. (13 MENCIONES)"
4099,1,respeto_conservación_de_la_naturaleza_o_medio_ambiente,A,este es uno de los valores mas importantes
4104,1,respeto_conservación_de_la_naturaleza_o_medio_ambiente,A,"Solamente el respeto permitirán el desarrollo social. Para velar por la vida de las personas es fundamental que el Estado emprenda políticas de conservación y protección de la naturaleza, asegurando así la continuidad de estas vidas en condiciones dignas. Para ello es necesario repensar la forma en que se está llevando adelante el desarrollo, guiado únicamente por indicadores macroeconómicos y no por la vida de las personas ni por el estado en que se encuentra nuestro medio ambiente."
4106,1,respeto_conservación_de_la_naturaleza_o_medio_ambiente,P,No contemplado en la Constitución. Afecta a las personas. Debiera respetarse en el amplio sentido.
4107,1,respeto_conservación_de_la_naturaleza_o_medio_ambiente,A,"El planeta y todos los seres sintientes que lo habitamos tenemos un valor por nosotros/as mismos, independiente de lo útil a otros."
4108,1,respeto_conservación_de_la_naturaleza_o_medio_ambiente,A,Para un mejor futuro de nosotras y nuestros descencientes
4109,1,respeto_conservación_de_la_naturaleza_o_medio_ambiente,A,"La Constitución debe contener como un valor el que los ciudadanos seamos responsables por el medio ambiente en el cual vivimos, protegiendo los recursos naturales y haciéndonos responsables del cuidado de la naturaleza, fauna y flora de nuestro país."
4111,1,respeto_conservación_de_la_naturaleza_o_medio_ambiente,A,La conservacion del patrimonio ambiental debe ser prioritaria en la sociedad y el desarrollo económico debe sujetarse a la protección del medio ambiente.
4113,1,respeto_conservación_de_la_naturaleza_o_medio_ambiente,A,"Proteccion a los recursos naturales, impedir la contaminacion ambiental  para cuidar la salud humana.-"
4119,1,respeto_conservación_de_la_naturaleza_o_medio_ambiente,A,Somos la naturaleza. Los seres humanos somos posteriores a ella y quienes se han encargado de destruirla. Hemos perdido esa conexión esencial con el espacio que es nuestro hogar y del cual dependemos para vivir.
4127,1,respeto_conservación_de_la_naturaleza_o_medio_ambiente,A,Cuidado de los recursos naturales.
4131,1,respeto_conservación_de_la_naturaleza_o_medio_ambiente,A,"La naturaleza es quien nos da la vida, nuestros recursos y es importante recalcar nuestra necesidad de cuidarla y resguardarla."
4135,1,respeto_conservación_de_la_naturaleza_o_medio_ambiente,A,"Explotación de los recursos supeditada al respeto y conservación de los recursos naturales, en beneficio de las generaciones futuras. Modelo de desarrollo con respecto al medio ambiente."
4146,1,respeto_conservación_de_la_naturaleza_o_medio_ambiente,A,"Principio esencial y fundamental que debe estar claro y definido en la Constitución: protección, preservación, educación. Recursos naturales como el agua, esenciales para la vida humana."
4147,1,respeto_conservación_de_la_naturaleza_o_medio_ambiente,A,"Asegurar el bienestar de las generaciones futuras, potenciando las leyes, aumentando los recursos  y fiscalización."
4151,1,respeto_conservación_de_la_naturaleza_o_medio_ambiente,A,"Contaminación ambiental, tala de arboles, industrialización. No existe respeto por el cuidado del medio ambiente, razón por la cual deberían existir mayores sanciones que quedaran estipuladas en la Constitución."
4152,1,respeto_conservación_de_la_naturaleza_o_medio_ambiente,A,"Sin planeta no hay nada,  Gobernanza de los recursos naturales Desarrollo sostenible, el país debe crecer social, económica y ambientalmente al mismo tiempo"
4157,1,respeto_conservación_de_la_naturaleza_o_medio_ambiente,A,"Respeto y conservación de la naturaleza y el medio ambiente, en vías de la conservación y la recuperación de los recursos naturales, ejemplo el agua, el cobre y el cuidado de los bosques de Chile, etc."
4162,1,respeto_conservación_de_la_naturaleza_o_medio_ambiente,A,"Respetarla y que el estado u gobierno genere políticas públicas más duras para su intervención, como también retribución de este."
4163,1,respeto_conservación_de_la_naturaleza_o_medio_ambiente,A,Que se incorpore en la nueva constitucion
4167,1,respeto_conservación_de_la_naturaleza_o_medio_ambiente,A,SON VALORES Y PRINCIPIOS NECESARIO PARA LA SANA CONVIVENCIA Y SUSTENTO DE LA VIDA DEL HOMBRE DENTRO DE LA SOCIEDAD Y EN EL MEDIO AMBIENTE
4177,1,respeto_conservación_de_la_naturaleza_o_medio_ambiente,A,PARA CUIDAR LOS RECURSOS NATURALES
4179,1,respeto_conservación_de_la_naturaleza_o_medio_ambiente,A,"Debe haber respeto al medio ambiente, el grupo considera que las transnacionales  han destruido nuestros recursos y el estado lo permite."
4181,1,respeto_conservación_de_la_naturaleza_o_medio_ambiente,A,Se acuerda que este concepto es fundamental para la constitución
4196,1,respeto_conservación_de_la_naturaleza_o_medio_ambiente,A,A
4198,1,respeto_conservación_de_la_naturaleza_o_medio_ambiente,A,"El respeto y conservación del medio ambiente debe ir acompañado con un desarrollo sustentable del país, con políticas que ayuden que tanto ciudadanos como empresas no depreden los recursos naturales."
4199,1,respeto_conservación_de_la_naturaleza_o_medio_ambiente,P,"Se destaca aquí avanzar hacia el veganismo, pues respetar nuestro medio ambiente es esencial para la coexistencia del hombre, avanzando en el conocimiento de todo tipo de alimentación para los ciudadanos."
4201,1,respeto_conservación_de_la_naturaleza_o_medio_ambiente,A,preocuparnos del bienestar de nuestra naturaleza es parte de nuestra vida
4204,1,respeto_conservación_de_la_naturaleza_o_medio_ambiente,A,fundamental para el desarrollo integral del ser humano.
4209,1,respeto_conservación_de_la_naturaleza_o_medio_ambiente,A,Sustentabilidad Protección del soporte de la vida
4217,1,respeto_conservación_de_la_naturaleza_o_medio_ambiente,A,Porque es la base de la supervivencia de los seres humanos y de las nuevas generaciones.
4223,1,respeto_conservación_de_la_naturaleza_o_medio_ambiente,A,Importante por ser un aspecto critico.
