idEla,tema,concepto,acuerdo,fundamento
7714,1,respeto_conservación_de_la_naturaleza_o_medio_ambiente,A,"El ser humano debe establecer una relación abiótica con el medio ambiente. Que el poder económico, principalmente de los grandes grupos son el causante del desgaste de suelos y aguas. Estos deben ser administrados por el Estado. Son un bien común y necesario para la vida."
7715,1,respeto_conservación_de_la_naturaleza_o_medio_ambiente,A,"Muchos de los conflictos sociales son socioambientales y deben ser abordados de forma territorial a lo largo de nuestro país, no se pretende frenar crecimiento económico, sino lograr un desarrollo sustentable de nuestros recursos, Se requiere límites de explotación, de privatización, edu. ambiental"
7722,1,respeto_conservación_de_la_naturaleza_o_medio_ambiente,P,"Futuro en la calidad de vida, Más áreas verdes, menos destrucción de la naturaleza, leyes de concientización para tomar más en serio, respetar los espacios, ser más responsables con el tema, peleas por las tierras."
7726,1,respeto_conservación_de_la_naturaleza_o_medio_ambiente,A,Fundamentado en la necesaria Sustentabilidad; el respeto por las generaciones futuras y por la armonía que debe existir entre el antropocentrismo y el biocentrismo.
7728,1,respeto_conservación_de_la_naturaleza_o_medio_ambiente,A,"No hay respeto por el medio ambiente, falta regularización y fiscalización."
7737,1,respeto_conservación_de_la_naturaleza_o_medio_ambiente,A,"Conservar el planeta tierra.  Protección de la naturaleza y el derecho de la ciudadanía de fiscalizar esa protección.  Que no se deprede, que no se contamine.  Educación obligatoria e informal medioambiental. Que las riquezas no renovables y las renovables estén bajo control estatal y no privado."
7746,1,respeto_conservación_de_la_naturaleza_o_medio_ambiente,A,No hubo tiempo de discutir sobre este punto.
7748,1,respeto_conservación_de_la_naturaleza_o_medio_ambiente,A,Queremos Proteger nuestra naturaleza
7749,1,respeto_conservación_de_la_naturaleza_o_medio_ambiente,A,"sustentara la vida, por lo cual, si no se respeta, no tendremos sustento como raza humana"
7750,1,respeto_conservación_de_la_naturaleza_o_medio_ambiente,A,Educar sensibilizando desde el medio ambiente. Participación basculante de los ciudadanos. Regularización fuerte del Estado y estudios veraces sobre impactos ambientales.
7755,1,respeto_conservación_de_la_naturaleza_o_medio_ambiente,A,"El Estado debe garantizar y velar por el resguardo de la naturaleza y medio ambiente, como asimismo el respeto a la vida e integridad física y síquica de los animales, por sobre cualquier desarrollo económico imperante"
7756,1,respeto_conservación_de_la_naturaleza_o_medio_ambiente,A,"Debemos rescatar el medio ambiente y naturaleza, y conservar nuestra vegetación nativa y con ello resguardar nuestra convivencia como humanidad."
7761,1,respeto_conservación_de_la_naturaleza_o_medio_ambiente,A,"Respeto al planeta, al territorio. Castigar la contaminación del mar, tierra, agua, cielo"
7764,1,respeto_conservación_de_la_naturaleza_o_medio_ambiente,A,Es necesario porque últimamente se han descubierto casos de explotación indiscriminada al medio ambiente.
7765,1,respeto_conservación_de_la_naturaleza_o_medio_ambiente,A,Campañas tenencias responsable y cuidado del medio ambiente Respeto a la comunidad Más cultura
7769,1,respeto_conservación_de_la_naturaleza_o_medio_ambiente,A,tenemos que proteger el entorno y los recursos no renovables para asegurar la vida.
7772,1,respeto_conservación_de_la_naturaleza_o_medio_ambiente,A,Se debe generar conciencia y proteger el uso de los recursos  naturales para mantener el equilibrio del ecosistema prohibir el uso de elementos contaminantes a nivel industrial y doméstico.
7773,1,respeto_conservación_de_la_naturaleza_o_medio_ambiente,A,Preservar nuestros recursos naturales e integridad territorial.
7775,1,respeto_conservación_de_la_naturaleza_o_medio_ambiente,A,Nacionalización de los recursos naturales como bien público propio de todos los chilenos.
7776,1,respeto_conservación_de_la_naturaleza_o_medio_ambiente,A,las actividades económicas no pueden ser prioritarias frente al daño ambiental que estas pueden causar. las normas de impacto ambiental deben ser mas extrictas
7781,1,respeto_conservación_de_la_naturaleza_o_medio_ambiente,A,"Este valor debe estar signado en una constitución como mecanismo para CUIDAR el lugar físico-territorial donde todos habitamos, en este punto la asamblea anota el agregar como concepto importante el de PROTECCION"
7788,1,respeto_conservación_de_la_naturaleza_o_medio_ambiente,A,"Desarrollar un compromiso, valores y cultura para la conservación del medio ambiente. Deben existir políticas de gobierno y en educación para desarrollar una conciencia ecológica."
7789,1,respeto_conservación_de_la_naturaleza_o_medio_ambiente,A,Este es un principio que debe inspirar la CPR por cuanto el medio ambiente es un bien colectivo que favorece a la sociedad en su conjunto y su cuidado debe tener la máxima protección jurídica.
7796,1,respeto_conservación_de_la_naturaleza_o_medio_ambiente,A,"Respeto de la naturaleza humana, culturas y entorno (los pueblos)."
7797,1,respeto_conservación_de_la_naturaleza_o_medio_ambiente,A,Consideramos imprescindible que constitucionalmente se garantice el respeto al medio ambiente como una forma de asegurarnos a todos los chilenos una buena calidad de vida.
7799,1,respeto_conservación_de_la_naturaleza_o_medio_ambiente,A,"Se considera que debe ser un valor transversal a la constitución y las leyes, siendo obligación del Estado resguardar la soberanía de los recursos naturales. La protección de la naturaleza y el medio ambiente debe ser un principio basal del modelo de desarrollo para garantizar la sustentabilidad."
7800,1,respeto_conservación_de_la_naturaleza_o_medio_ambiente,A,Conciencia de que lo que está pasando en el planeta
7802,1,respeto_conservación_de_la_naturaleza_o_medio_ambiente,A,"Problema global. Nos olvidamos de donde vinimos. Somos tierra, somos agua. Las leyes deben ser generosas cuando se trate de proteger la naturaleza. Que ningún argumento empresarial atente sobre su integridad."
7804,1,respeto_conservación_de_la_naturaleza_o_medio_ambiente,A,"YA QUE SE ESTÁ DESTRUYENDO, NO PENSANDO EN LAS FUTURAS GENERACIONES Y EL LEGADO QUE DEJAMOS"
7805,1,respeto_conservación_de_la_naturaleza_o_medio_ambiente,P,"Hay que proteger nuestro planeta y medio ambiente, pues es el lugar de donde venimos y donde deben vivir las futuras generaciones. Debe ser un tema central AHORA, considerando la crisis climática y medio ambiental que enfrentamos. Este tema debe tener más peso y regulación en la ciudadanía."
7807,1,respeto_conservación_de_la_naturaleza_o_medio_ambiente,A,Debemos respetar y cuidar el Planeta
7826,1,respeto_conservación_de_la_naturaleza_o_medio_ambiente,A,"Concibe un Estado que tiene un modelo económico sustentable y en armonía con el medio ambiente y la naturaleza, incluyendo a las personas y todos los seres vivos que la habitan."
7827,1,respeto_conservación_de_la_naturaleza_o_medio_ambiente,A,"Avanzar hacia relaciones armónicas con la naturaleza, con el patrimonio cultural tangible e intangible."
7834,1,respeto_conservación_de_la_naturaleza_o_medio_ambiente,A,Por afanes comerciales y de ocupación no se puede alterar y destruir la naturaleza ya que esto lleva al deterioro o desaparicion del hombre.
7839,1,respeto_conservación_de_la_naturaleza_o_medio_ambiente,A,"En el derecho a la vida, este capítulo cobra una fundamental relevancia, ya que si no protegemos y respetamos a la naturaleza, nuestros recursos y no cuidamos nuestro medio ambiente, estamos atentando contra nuestra salud y la vida en general. Un capitulo que debe tener un trato especial en la constitución."
7845,1,respeto_conservación_de_la_naturaleza_o_medio_ambiente,A,"Se debe impulsar un desarrollo sustentable, con administración eficiente y razonable de los recursos naturales. El fin es mejorar el bienestar de la población sin deteriorar el medio ambiente ni comprometer el futuro"
7846,1,respeto_conservación_de_la_naturaleza_o_medio_ambiente,A,Los recursos naturales del país pertenecen a la nación de Chile y debemos asegurar que la riquezade estos bienes contribuya al progreso individual y del pais entero
7849,1,respeto_conservación_de_la_naturaleza_o_medio_ambiente,A,Detener el desgaste del medio ambiente y que logremos un equilibrio.
7860,1,respeto_conservación_de_la_naturaleza_o_medio_ambiente,A,Es nuestro creer que la preservación de la naturaleza y medio ambiente esta fuertemente ligado a la sustentabilidad con la cual se manejan los recursos. Este respeto y buen uso debe ser regulado por el Estado. También creemos que debemos recuperar/nacionalizar nuestros recursos naturales.
7864,1,respeto_conservación_de_la_naturaleza_o_medio_ambiente,A,es nuestra fuente de vida lo que s el medio ambiente tenemos que aprender a cuidar nuestro medio ambiente
7866,1,respeto_conservación_de_la_naturaleza_o_medio_ambiente,A,"Modificado por RESPETO POR LA NATURALEZA, MEDIO AMBIENTE Y SUSTENTABILIDAD. No necesariamente CONSERVACIÓN."
7872,1,respeto_conservación_de_la_naturaleza_o_medio_ambiente,A,"En el marco de un modelo de desarrollo depredador con los recursos naturales, en que hay una sobreexplotación de dichos recursos por unos pocos, es fundamental considerar un cambio hacia un modelo de desarrollo sustentable."
7876,1,respeto_conservación_de_la_naturaleza_o_medio_ambiente,A,"De importancia transversal para todos los habitantes del planeta. Influye directamente en la salud y en el bienestar, sobre todo cuando es sabido que las grandes empresas son la que más dañan."
7878,1,respeto_conservación_de_la_naturaleza_o_medio_ambiente,A,"EXPLOTACION DE LOS RECURSOS NATURALES, NO SOLAMENTE DEBEN SER PRIVADOS.DECE HABER PARTICIPACION DEL PUEBLO. HAU MUCHA LIBERTAD PARA EL SAQUEO DE LOS RECURSOS."
7880,1,respeto_conservación_de_la_naturaleza_o_medio_ambiente,A,Entendemos que nuestra existencia está ligada al equilibrio que debe mantener el soporte natural sobre el cual nos desarrollamos como sociedad.
7882,1,respeto_conservación_de_la_naturaleza_o_medio_ambiente,A,Especialmente en cuanto al acceso libre a las semillas. Debe existir una distribución equitativa de estos recursos.
7884,1,respeto_conservación_de_la_naturaleza_o_medio_ambiente,A,"Generar acciones y leyes de protección, preservación y fiscalización de nuestros recursos naturales"
7887,1,respeto_conservación_de_la_naturaleza_o_medio_ambiente,A,Herencia para las futuras generaciones
7894,1,respeto_conservación_de_la_naturaleza_o_medio_ambiente,A,Por el bien de la humanidad
7896,1,respeto_conservación_de_la_naturaleza_o_medio_ambiente,A,Conservar la naturaleza que nos pertenece a todos. Recuperar los bienes nacionales (todos nuestro recursos naturales) (10 votos).
7897,1,respeto_conservación_de_la_naturaleza_o_medio_ambiente,A,Acuerdo mayoritario
7898,1,respeto_conservación_de_la_naturaleza_o_medio_ambiente,A,"Desde las leyes se hace necesario educar y formar a los ciudadanos respecto del cuidado de la naturaleza, establecer más responsabilidades."
7899,1,respeto_conservación_de_la_naturaleza_o_medio_ambiente,P,La cosmovisión andina se fundamenta principalmente en el ecosistema y la protección al medio ambiente en todas sus formas.
7907,1,respeto_conservación_de_la_naturaleza_o_medio_ambiente,A,RESPETO Y CUIDADO DE ÉSTA (NATURALEZA Y MEDIO AMBIENTE
7909,1,respeto_conservación_de_la_naturaleza_o_medio_ambiente,A,"Falta de educación ambiental, conciencia, programas funcionales, reforestación."
7916,1,respeto_conservación_de_la_naturaleza_o_medio_ambiente,A,Se acuerda que esta es la manera más solida de plantearlo para limitar la intervención humana en nuestro medio ambiente
7917,1,respeto_conservación_de_la_naturaleza_o_medio_ambiente,A,Debemos asegurar el respeto a nuestro medio ambiente y ecología a fin de que a través de la sustentabilidad  se fomente el crecimiento de nación y la vida sana y segura.
7927,1,respeto_conservación_de_la_naturaleza_o_medio_ambiente,A,Es fundamental el respeto a la naturaleza para la supervivencia y no se pueden anteponer los intereses económicos sobre la conservación
7936,1,respeto_conservación_de_la_naturaleza_o_medio_ambiente,A,sin fundamento
7938,1,respeto_conservación_de_la_naturaleza_o_medio_ambiente,A,que los recursos naturales sean de los chilenos  y no de las transnacionales
7941,1,respeto_conservación_de_la_naturaleza_o_medio_ambiente,A,"- COMO VECINOS, CONSIDEAMOS QUE HACE FALTA RESPETO POR LA NATURALEZA POR FALTA DE EDUCACIÓN ENTRE OTRAS COSAS. - EXISTE UNA EXPLOTACIÒN DE LOS RECURSOS DE MANERA EXESIVAS EN CASOS DE ALGUNAS EMPRESAS PRIVADAS ETC. -  DEMASIADA CONTAMINACIÒN AMBIENTAL - EXIGIMOS LA NACIONALIZACION DE LOS RECURSOS"
7942,1,respeto_conservación_de_la_naturaleza_o_medio_ambiente,A,"La naturaleza no se debe considerar solo un recurso, sino el hábitat donde vivimos."
7945,1,respeto_conservación_de_la_naturaleza_o_medio_ambiente,A,RESPETO A LAS LEYES CON UN ESTADO GARANTE Y FISCALIZADOR.
7950,1,respeto_conservación_de_la_naturaleza_o_medio_ambiente,A,"Asociado a la calidad de vida; a la conservación, uso y cuidado de los recursos. El deterioro ambiental se convierte en un factor de pobreza."
7951,1,respeto_conservación_de_la_naturaleza_o_medio_ambiente,A,el medio ambiente es el único lugar que debemos cuidar para vivir hoy y mañana.
7953,1,respeto_conservación_de_la_naturaleza_o_medio_ambiente,A,El país deberá incorporar este valor como fundamental en la Constitución para lograr un desarrollo sostenible y sustentable.
7965,1,respeto_conservación_de_la_naturaleza_o_medio_ambiente,A,Regalo de Dios que todos debemos cuidar. no podemos perjudicar más lo que Dios nos dio. ser solidarios y dejar un mundo mejor para las futuras generaciones.
7970,1,respeto_conservación_de_la_naturaleza_o_medio_ambiente,A,"A partir de lo que se ha observado hasta ahora, notamos que existe un deterioro del medio ambiente producto de intereses que van más allá del cuidado de la casa común. Esto es considerado una amenaza latente, por ende es momento de que la constitución GARANTICE el respeto y cuidado de la naturaleza"
7978,1,respeto_conservación_de_la_naturaleza_o_medio_ambiente,A,Respetar y querer nuestro entorno natural como si fuera parte de nuestro organismo.
7988,1,respeto_conservación_de_la_naturaleza_o_medio_ambiente,A,Los recursos naturales no se deben tranzar y se deben cuidar.
7989,1,respeto_conservación_de_la_naturaleza_o_medio_ambiente,A,"El respeto a la naturaleza permite la vida de las futuras generaciones, además garantiza la felicidad y salud de los Seres Humanos y toda vida que existe en el planeta. Consideramos que es un principio de carácter inalienable."
7991,1,respeto_conservación_de_la_naturaleza_o_medio_ambiente,A,No se comprende un desarrollo económico y social a costo de destruir nuestra propia naturaleza. La constitución debe establecer un respeto por el medio ambiente. Somos responsables de nuestros recursos naturales y como país debemos tener una política de crecimiento sustentable.
7997,1,respeto_conservación_de_la_naturaleza_o_medio_ambiente,A,Real preocupacion por cambios climáticos concientizacion por este tetema como afecta día a día la calidad de vida que va en aumento el riesgo hoy nos preocupa porque se nota mas ya estamos llegando a extremos
7998,1,respeto_conservación_de_la_naturaleza_o_medio_ambiente,A,"Principio/valor absoluto que debe encontrarse por sobre otros que atenten negativa y directamente a la naturaleza y/o al medio ambiente. Además, debe de profundizarse en el ordenamiento jurídico a fin de establecer mínimos y máximos de carácter técnico-científico. Todo lo anterior fundado en una proyección del impacto a largo plazo."
8002,1,respeto_conservación_de_la_naturaleza_o_medio_ambiente,A,fomentar protección de los recursos naturales y animales para beneficio mutuo. El Estado se encargue de explotar materias primas y el proceso de productos
8005,1,respeto_conservación_de_la_naturaleza_o_medio_ambiente,A,"La vida en sociedad presupone el respeto por nuestro entorno, el bien común es posbile en la medida que seamos conscientes de las conservación de la naturaleza."
8010,1,respeto_conservación_de_la_naturaleza_o_medio_ambiente,A,"En nuestra forma de vivir hemos dejado de lado esto, nos hemos enfocado en un estilo de vida que no va acorde a la naturaleza. No nos preocupamos de ella. No estamos dejando nada para el futuro. Vivimos sobre la tierra, no puede estar ajena a nosotros."
8014,1,respeto_conservación_de_la_naturaleza_o_medio_ambiente,A,"Modelo de desarrollo sostenible para Chile.  Debe garantizarse la conservación de la biodiversidad y la capacidad de regeneración de los ecosistemas.  Estatuto constitucional del uso racional de los recursos naturales comunes, incluyendo el agua."
8021,1,respeto_conservación_de_la_naturaleza_o_medio_ambiente,A,"Elegimos este valor para reconocer la relevancia de conservar los recursos naturales de nuestro país y su diversidad medioambiental, buscando un equilibrio entre desarrollo económico,  medioambiente y las comunidades que lo habiten."
8025,1,respeto_conservación_de_la_naturaleza_o_medio_ambiente,A,Conservación del medio ambiente
8028,1,respeto_conservación_de_la_naturaleza_o_medio_ambiente,A,"Hubo acuerdo total en que el respeto, cuidado y conservación de la naturaleza debe ser un valor clave en nuestra nueva constitución!"
8034,1,respeto_conservación_de_la_naturaleza_o_medio_ambiente,A,Debemos guardar el medio ambienta para el futuro de nuestros hijos y nietos
8039,1,respeto_conservación_de_la_naturaleza_o_medio_ambiente,A,se propone cambiar este principio por : RESPETO Y CONSERVACIÓN DEL PATRIMONIO NATURAL
8040,1,respeto_conservación_de_la_naturaleza_o_medio_ambiente,A,Esta seleccionada en el cuarto lugar en prioridad por unanimidad
8051,1,respeto_conservación_de_la_naturaleza_o_medio_ambiente,A,Este valor nes consignado como un valor transversal del grupo. todos los membros del grupo lo consideran fundamental
8054,1,respeto_conservación_de_la_naturaleza_o_medio_ambiente,A,Garantizar fondos permanentes para asegurar el cuidado de la naturaleza y el desarrollo del agro nacional
8057,1,respeto_conservación_de_la_naturaleza_o_medio_ambiente,A,Tema indispensable a la hora de discutir sobre la vida en sociedad y nuestra existencia hacia el futuro.
8058,1,respeto_conservación_de_la_naturaleza_o_medio_ambiente,A,-Ministerio del Mar. -Proteger el agua como recurso fundamental del Estado y de la Constitución. -Desarrollo Sustentable garantizado
8061,1,respeto_conservación_de_la_naturaleza_o_medio_ambiente,A,"Se necesitan métodos efectivos en la sustentabilidad de recursos, que haya transparencia y posición clara en el desarrollo sustentable y que se difunda de mejor manera la información acerca de este tema, ya que se necesita el conocimiento pleno para cuidarla correctamente."
8062,1,respeto_conservación_de_la_naturaleza_o_medio_ambiente,A,"tenemos que tener un estado preocupado y que respete nuestro medio ambiente, recuperación de las aguas, regulación plantaciones forestales y políticas de reciclaje."
8067,1,respeto_conservación_de_la_naturaleza_o_medio_ambiente,A,"Para los habitantes de un sector rural es muy importante el cuidado del medio ambiente, va en directo beneficio de la localidad.  Cuidado del agua y de los alimentos"
8079,1,respeto_conservación_de_la_naturaleza_o_medio_ambiente,A,que el estado sea el garante de los recursos naturales. que el ente regulador aplique la ley existente.
8084,1,respeto_conservación_de_la_naturaleza_o_medio_ambiente,A,El Estado tiene el deber de velar por el Respeto/Conservación naturaleza y medio ambiente y el desarrollo sustentable haciéndose institucionalmente responsable generando las condiciones para ello. Evitando el uso abusivo de los recursos naturales para la generación exclusiva de lucro.
8086,1,respeto_conservación_de_la_naturaleza_o_medio_ambiente,A,"Que la Constitución tiene que fiscalizar el medio ambiente, sobre las empresas extranjeras que vienen a explotar nuestras tierras, dejando desastres ecológicos sin ninguna multa sobre ello"
8089,1,respeto_conservación_de_la_naturaleza_o_medio_ambiente,A,Se requiere garantizar constitucionalmente el medio ambiente y que se promueva el desarrollo sustentable.
8099,1,respeto_conservación_de_la_naturaleza_o_medio_ambiente,A,DESARROLLO SUSTENTABLE Y RESPETUOSO DE NUESTRO AMBIENTE ES CENTRAL COMO PRINCIPIO
8100,1,respeto_conservación_de_la_naturaleza_o_medio_ambiente,A,"Desarrollo sustentable y sostenible. Integrar los factores productivos y el medio ambiente, garantizando que su utilización actual no evanece el goce y disfrute de las generaciones futuras."
8101,1,respeto_conservación_de_la_naturaleza_o_medio_ambiente,A,el estado debe ser garante de la conservación y buen uso
8102,1,respeto_conservación_de_la_naturaleza_o_medio_ambiente,A,Preservar nuestro entorno para las generaciones venideras
8103,1,respeto_conservación_de_la_naturaleza_o_medio_ambiente,A,VIVIMOS GRACIAS A LA NATURALEZA Y DEBEMOS CUIDARLA
8104,1,respeto_conservación_de_la_naturaleza_o_medio_ambiente,A,Es necesario que la comunidad se preocupe de la conservación de la naturaleza. Faltamos el respeto a la naturaleza.
8118,1,respeto_conservación_de_la_naturaleza_o_medio_ambiente,A,"Hay que generar un respeto colectivo de la naturaleza y el medio que nos rodea, a la vez defender la misma."
8134,1,respeto_conservación_de_la_naturaleza_o_medio_ambiente,A,"Consideramos este valor fundamental, ya que apunta a la conservación, protección y distribución de los recursos naturales, de manera sustentable, respetando el lugar donde se desarrollan los ecosistemas; garantizando la conservación del medio y entregando ese conocimiento a  las generaciones futuras."
8136,1,respeto_conservación_de_la_naturaleza_o_medio_ambiente,A,"No solo respetar nuestro entorno, sino también pensar en el futuro que queremos dejar a nuestras generaciones."
8138,1,respeto_conservación_de_la_naturaleza_o_medio_ambiente,A,Mayor fiscalización a las empresas privadas y transnacionales. Más educación.
8139,1,respeto_conservación_de_la_naturaleza_o_medio_ambiente,A,"Debe existir conciencia por parte de la población y de las empresas. Se requiere una Educación ambiental, de tal forma de generar una población informada y empoderada. Hay que fomentar la capacidad reflexiva de la población. Como cristianos debemos comprometernos con el cuidado de la creación."
8142,1,respeto_conservación_de_la_naturaleza_o_medio_ambiente,A,"Es importante entender que para la autoconservación de la sociedad, es imperativo desarrolllarse en un ambiente sustentable y de respeto a la naturaleza. Comprender que estamos de paso y que tenemos que cuidar el planeta para las futuras generaciones."
8143,1,respeto_conservación_de_la_naturaleza_o_medio_ambiente,A,"Hace tiempo que se perdió el respeto. Hay deforestación, y cada vez menos áreas verdes. Tenemos el ejemplo del proyecto Alto Maipo (Cuanta naturaleza perdemos por ejemplo ahí), no tomando en cuenta si estamos o no de acuerdo. Los más poderosos son los que mandan. Hace falta conciencia."
8146,1,respeto_conservación_de_la_naturaleza_o_medio_ambiente,A,"Se debe respetar el medio ambiente, reconocimiento de la flora y fauna y cuidado de esta, que no exista tanta contaminación, leyes para que regularicen y un desarrollo sustentable."
8149,1,respeto_conservación_de_la_naturaleza_o_medio_ambiente,A,El respeto involucra una visión ecológica que se traduce en el cuidado y protección de la naturaleza bajo el sello de la sustentabilidad de la vida y con ella de los recursos que lo permiten
8150,1,respeto_conservación_de_la_naturaleza_o_medio_ambiente,A,"Creemos que la naturaleza debe ser Sujeto de Derecho, porque cuando se atenta contra ella se atenta contra la vida de las propias personas, el que la destruye debe ""pagar"" por ello y reparar el daño, en este sentido los bienes de la naturaleza no deben ser vendidos, por ejemplo el agua."
8151,1,respeto_conservación_de_la_naturaleza_o_medio_ambiente,A,más áreas verdes y que no se vendan nuestros recursos naturales
8153,1,respeto_conservación_de_la_naturaleza_o_medio_ambiente,A,"Ley  de medio ambiente, es poco favorable para los ciudadanos comunes, pero favorable para los ciudadanos comunes, pero favorece a las empresas privadas, es necesario un cambio profundo y una mayor fiscalización."
8159,1,respeto_conservación_de_la_naturaleza_o_medio_ambiente,A,Porque ya es hora de darle un respiro y procurar cuidar el equilibrio del planeta.
8163,1,respeto_conservación_de_la_naturaleza_o_medio_ambiente,A,"Tenemos diversos y abundantes recursos naturales, que debemos conservar para nosotros y futuras generaciones. Debemos respetar nuestro hogar."
8172,1,respeto_conservación_de_la_naturaleza_o_medio_ambiente,A,"Porque deberíamos tener en nuestros valores el cuidado del medioambiente, ya que, es el suelo de nuestra vida, si el planeta se contamina, que le estaríamos dejando a nuestros hijos."
8173,1,respeto_conservación_de_la_naturaleza_o_medio_ambiente,A,"Debemos cuidar de la naturaleza por nosotros y por las generaciones futuras, por la supervivencia de la especie humana."
8180,1,respeto_conservación_de_la_naturaleza_o_medio_ambiente,A,crear tribunales que fiscalicen más
8190,1,respeto_conservación_de_la_naturaleza_o_medio_ambiente,A,"mantener y mejorar las condiciones de la naturaleza para esta y las siguientes generaciones, priorizando el equilibrio entre desarrollo y medioambiente."
