idEla,tema,concepto,acuerdo,fundamento
7925,3,respeto_por_la_constitución,A,gracias a la presidenta el proceso constituyente asumido por amplios sectores de la población eligiera una constitución nacida en democracia protectora del bien común por lo tanto la respetara la mayoria
7926,3,respeto_por_la_constitución,A,El no respeto a la constitución es la pérdida de todas las garantías ciudadanas y el permitir el libre atropello de los derechos de todos.
7927,3,respeto_por_la_constitución,A,Si es una constitución construida con la colaboración ciudadana y no impuesta ésta debe ser respetada.
7938,3,respeto_por_la_constitución,P,queremos una constitución que sea creada por el pueblo y para el pueblo no para los empresarios
7941,3,respeto_por_la_constitución,A,ES LA CARTA FUNDAMENTAL
7942,3,respeto_por_la_constitución,A,Reponer la Educación Cívica y distribución gratuita de la nueva constitución.
7943,3,respeto_por_la_constitución,A,Porque es el mayor resguardo de las libertades individuales y del trato igualitario de los individuos. Regula actitudes que intenten imponer poderes absolutos.
7945,3,respeto_por_la_constitución,A,QUE LO QUE SE ACUERDE O ESTABLEZCA EN DEMOCRACIA SE CUMPLA.
7946,3,respeto_por_la_constitución,A,Por que es la norma fundamental.
7951,3,respeto_por_la_constitución,A,es un deber y responsabilidad fundamental de todos los ciudadanos.
7963,3,respeto_por_la_constitución,A,pensamos que la constitución debe ser respetada por todas y todos sin excepcion
7977,3,respeto_por_la_constitución,A,"QUE EMPRESARIOS, CIUDADANOS RESPETEN LA ESENCIA  CONSTITUCIONAL, QUE TIENE POR OBJETIVO VELAR POR LOS DERECHOS DE TODOS."
7978,3,respeto_por_la_constitución,A,"Como regla general, como norma y estatuto que nos guíe en el contexto de nuestra sociedad."
7979,3,respeto_por_la_constitución,A,porque así se solucionan mas rapido los problemas
7980,3,respeto_por_la_constitución,A,La Constitución es la ley mayor y debe existir. Lo ideal es que se construya con los ciudadanos
7987,3,respeto_por_la_constitución,A,NADIE ESTA SOBRE LA LEY
7988,3,respeto_por_la_constitución,A,Respetar la nueva constitución.
7989,3,respeto_por_la_constitución,A,"Creemos en el deber de la ciudadanía en respetar la nueva Constitución construida considerando las indicaciones de las bases, como un elemento importante para la funcionalidad y equilibrio político, económico y social."
7990,3,respeto_por_la_constitución,A,Es necesario que todos los ciudadanos no importando su cargo o función respete la constitución y las leyes.
7991,3,respeto_por_la_constitución,A,"Todo este proceso se basa en el Respeto por la constitución. Como ciudadanos debemos regirnos por lo que dicta la Constitución. Todo ciudadano que no lo haga, está explícitamente declarando que no quiere ser parte de nuestra sociedad y que está dispuesto a trasgreder valores básicos."
7997,3,respeto_por_la_constitución,A,La nueva constitución realmente justa sea respetada a cabalidad
8002,3,respeto_por_la_constitución,A,todos los ciudadanos e instituciones deben respetar la constitución chilena
8008,3,respeto_por_la_constitución,A,"Respetar los valores, derechos y deberes que esta instaura."
8011,3,respeto_por_la_constitución,A,"Es fundamental para nuestra organización social pues ella asegura nuestros derechos y establece los límites que todos debemos respetar, cumpliendo con las leyes que a todos nos gobiernan."
8013,3,respeto_por_la_constitución,A,"cada chileno debe respetar la constitución, documento fundamental de chile"
8018,3,respeto_por_la_constitución,A,Si nos damos un marco para actuar debemos respetarlo.
8024,3,respeto_por_la_constitución,A,Es fundamental respetar la constitución para hacer valer todos los derechos y deberes que en ella se describen para desarrollar un sistema social integro.
8026,3,respeto_por_la_constitución,A,"Entendemos como respeto por la constitución, como un proceso que fue discutido, deliberado por los ciudadanos, por tanto la hace válida en razón del ejercicio democrático, es importante fomentar el respeto, aunque también la enseñanza como incide o en que afecta a los ciudadanos"
8028,3,respeto_por_la_constitución,A,"Que la ""hoja de ruta"" del pais sea cuidada, respetada y puesta verdaderamente en practica por todos los ciudadanos y primeramente por las autoridades."
8034,3,respeto_por_la_constitución,A,Como ciudadanos le debemos respeto y hacerla respetar.
8036,3,respeto_por_la_constitución,A,"Si estamos dialogando para crear un nuevo marco que nos regule, es vital que respetemos las leyes que nosotros mismos creamos"
8039,3,respeto_por_la_constitución,A,esencial a la hora de respetar la Carta Fundamental hecha con la participación ciudadana
8042,3,respeto_por_la_constitución,A,No se deben transgredir las normas establecidas en la constitución.
8051,3,respeto_por_la_constitución,A,Respetar la constitución emanada desde nosotros mismos es algo fundamental.
8052,3,respeto_por_la_constitución,A,Creemos fundamental el respeto por una nueva constitución hecha en forma democrática y participativa.
8057,3,respeto_por_la_constitución,A,"La constitución es la norma fundamental, reflejándose en ella los principios y acuerdos que como comunidad hemos alcanzado (al menos en teoría)."
8058,3,respeto_por_la_constitución,A,-Consideramos que es fundamental este ítem porque es la base para vivir de manera justa e igual en Chile. El respeto significa que todos conozcamos nuestros deberes y derechos y los podamos practicar de manera consciente. (Lo agregamos porque el sistema lo pedía a la hora de subir el archivo)
8059,3,respeto_por_la_constitución,A,SIEMPRE QUE ESTA VENGA EMANADA DEL PUEBLO
8061,3,respeto_por_la_constitución,A,Es básico que se respete la norma que nosotros mismos estamos estableciendo.
8062,3,respeto_por_la_constitución,A,"respetar y cumplir los derechos, deberes y responsabilidad de la nueva constitución que Chile quiere."
8067,3,respeto_por_la_constitución,A,Que se inicie respetando este trabajo que se realizo a nivel local
8076,3,respeto_por_la_constitución,A,Elección por votación
8076,4,respeto_por_la_constitución,A,Hubo un error acá.
8079,3,respeto_por_la_constitución,A,que las fuerzas armadas no sean garantes de la constitucion y que exista mayor informacion en los colegios.
8084,3,respeto_por_la_constitución,A,Es la base para tener un Estado de Derecho
8089,3,respeto_por_la_constitución,A,"Los ciudadanos deben tener formación cívica durante la escolaridad, de la manera más simple pero significativa. La Constitución debe ser conocida y aprendida por todos los ciudadanos."
8093,3,respeto_por_la_constitución,A,Sin fundamento
8095,3,respeto_por_la_constitución,A,"Deber primordial, pues deben garantizarse el respeto por las normas constitucionales, Aquí también agregamos el cumplimiento del Estado en materia de  los tratados y obligaciones internacionales , aquí hablamos de un respeto tanto de la comunidad como del Estado como un sólo ente"
8098,3,respeto_por_la_constitución,A,para una sana convivencia entre todos los chilenos y chilenas
8099,3,respeto_por_la_constitución,A,UNÁNIME ACUERDO
8100,3,respeto_por_la_constitución,A,"porque tenemos un compromiso con los demás y con la sociedad. Debemos comportarnos de acuerdo a ciertos parámetros, ciertas normativas, que nos permiten convivir como ciudadanos y vivir en paz y respeto"
8101,3,respeto_por_la_constitución,A,Es necesaria para que nuestro este en orden
8102,3,respeto_por_la_constitución,A,"Fija los límites y define las relaciones entre los poderes legislativo, ejecutivo y judicial del Estado, estableciendo así las bases para su gobierno y organización de las instituciones en que tales poderes se asientan. También garantiza al pueblo derechos y libertades."
8103,3,respeto_por_la_constitución,A,"QUE SE RESPETE LA NUEVA CONSTITUCIÓN, CON DERECHOS IGUALES PARA TODOS CONSTITUCIÓN NUEVA EN DEMOCRACIA"
8104,3,respeto_por_la_constitución,A,Es la base de todos los deberes y responsabilidades
8114,3,respeto_por_la_constitución,A,debemos respetar.
8116,3,respeto_por_la_constitución,A,Ley fundamental que define el régimen de los derechos y libertades delos ciudadanos y delimita los poderes e instituciones.
8118,3,respeto_por_la_constitución,A,todos los ciudadanos deben estar conscientes y obligados a respetar los acuerdos que dan origen a la nueva constitución.
8129,3,respeto_por_la_constitución,P,Respetar la carta fundamental como base de la regulación del estado.
8134,3,respeto_por_la_constitución,A,"entendido como el cumplimiento irrenunciable a los lineamientos constitucionales, asegurando la difusión y conocimiento público de la misma."
8138,3,respeto_por_la_constitución,A,conocimiento y educación
8142,3,respeto_por_la_constitución,A,Nuestra Constitución es la Ley fundamental de nuestro país que debe ser respetada por todos incluyendo a nuestras autoridades. Con una Constitución moderna y representativa los ciudadanos nos veríamos más convocados a respetarla.
8146,3,respeto_por_la_constitución,A,"Es deber de todos los ciudadanos respetar la constitución especialmente de que se hará por un proceso participativo, ciudadano y democrático como en la actualidad."
8148,3,respeto_por_la_constitución,A,Que sea la carta fundamental que regirá el país
8150,3,respeto_por_la_constitución,A,"Todos deben respetar una Constitución Democraticamente generada, por consenso social, que se supone cuenta con la aprobación de la mayoría de los ciudadanos."
8151,3,respeto_por_la_constitución,A,que se respeten los acuerdos a los que se lleguen en la nueva constitución
8153,3,respeto_por_la_constitución,A,"A nivel educación educativo tener clases de educación cívica. Local de organizaciones funcionales reciban capacitación, respecto a lo que es importante nuestra constitución, en cuanto a derechos y deberes."
8157,3,respeto_por_la_constitución,A,"Es el marco institucional para todo lo demás, de otro modo este ejercicio no sirve de nada."
8163,3,respeto_por_la_constitución,A,Respetar las nuevas ideas que surjan de este proceso.
8166,3,respeto_por_la_constitución,A,"Siendo la Constitución la norma rectora que emana del ejercicio de la soberanía del pueblo, titular del poder constituyente originario, debe ser respetada por todos los poderes del Estado, instituciones y ciudadanos."
8168,3,respeto_por_la_constitución,A,Respetar las normas y reglas establecidas por esta.
8173,3,respeto_por_la_constitución,A,La constitución debe respetarse porque fija las reglas de las relaciones políticas y el ejercicio del poder.
8180,3,respeto_por_la_constitución,A,respeto tanto de las autoridades como del ciudadano
8181,3,respeto_por_la_constitución,A,Respetar la nueva constitucion que es legitima.
8189,3,respeto_por_la_constitución,A,Constituye un deber fundamental del ejercicio de ciudadanía.
8191,3,respeto_por_la_constitución,A,"Esto le da un orden a la sociedad o país, si no se asegura podríamos caer en una anarquía."
8201,3,respeto_por_la_constitución,A,"Conocer , estudiar la constitución  Informar en colegios  Creación de espacios a nivel comunitario"
8208,3,respeto_por_la_constitución,A,Validar por nosotros mismos el escenario.
8210,3,respeto_por_la_constitución,A,"Las personas  pasan a llevar los límites y las normas existentes, no hay respeto a la constitución. Si no hay respeto a la constitución se da mal ejemplo a los niños. Las personas no conocen las leyes de la constitución, por lo tanto no pueden respetarla."
8214,3,respeto_por_la_constitución,A,Cumplir lo que la nueva constitución establecerá
8215,3,respeto_por_la_constitución,A,"Siendo la ""Carta Magna"" del país, es imporante que exista un respeto mínimo hacía ella, tomando en cuenta su futura bae ciudadana en contenido."
8219,3,respeto_por_la_constitución,A,xxxxxxxxxxxxxxxxxxxxxxxxxx
8223,3,respeto_por_la_constitución,A,Todos debemos respetar las reglas generales de convivencia que nos hemos dado para vivir en sociedad y que no es otra cosa que la propia Constitución y las leyes que de ella derivan
8227,3,respeto_por_la_constitución,A,"Se produce debate en leyes y normas y constitución, por definición deberían estar fusionados, esta posición se somete a votación obteniendo"
8231,3,respeto_por_la_constitución,A,Toda sociedad requiere de un marco regulatorio.
8238,3,respeto_por_la_constitución,A,Todos debemos respetar las reglas generales de convivencia que nos hemos dado para vivir en sociedad y que no es otra cosa que la propia Constitución
8239,3,respeto_por_la_constitución,A,Difundir lo preceptos de la constitución mediante la educación cívica para que todos los chilenos conozcan su constitución y la respeten.
8243,3,respeto_por_la_constitución,A,"deber que ampara una nueva constitución, es responsabilidad de todos y todas"
8245,3,respeto_por_la_constitución,A,"A nivel nacional, le sigue el respeto a la constitución que es la que como ciudadanos nos hemos dado."
8250,3,respeto_por_la_constitución,A,"Es la base para la buena convivencia ciudadana, el respeto por las personas, ambiente, asociaciones cumplimiento de leyes extablecidas, etc."
8256,3,respeto_por_la_constitución,A,QUE LO QUE SE ESTABLECE COMO CARTA FUNDAMENTAL NO SEA VULNERADO
8258,3,respeto_por_la_constitución,A,Que se haga cumplir lo que en esta aparece. Aquí están los fundamentos de una nación.
8261,3,respeto_por_la_constitución,A,Porque es representativa del pueblo y fue hecha por la gente
8264,3,respeto_por_la_constitución,A,Los participantes de forma unánime consideran este deber como fundamental
8267,3,respeto_por_la_constitución,A,Para aportar debemos ser participes y respetar la constitución.
8271,3,respeto_por_la_constitución,A,Deber de todo ciudadano respetar la constitución
8272,3,respeto_por_la_constitución,A,"La constitución es la ley fundamental del Estado, define los derechos y deberes de los ciudadanos y organiza sus poderes e instituciones. La realización de este encuentro local destaca esa importancia y nuestra responsabilidad como ciudadanos en el proceso de redacción de una nueva constitución para Chile."
8276,3,respeto_por_la_constitución,A,"Derechos y libertades individuales, colectivas, políticas, sociales, económicas y medioambientales."
8279,3,respeto_por_la_constitución,A,"Exigencias en el cumplimiento y respeto de nuestros derechos, y la participación de todos en decisiones de país no tienen sentido si no respetamos la Constitución."
8284,3,respeto_por_la_constitución,P,"Se deben discutir más mecanismos de promoción de los contenidos e interpretación de la constitución, y métodos de verificación, dándole atribuciones correspondientes a los organismos del Estado."
8288,3,respeto_por_la_constitución,A,Para todos civiles y uniformados.
8289,3,respeto_por_la_constitución,A,"No se respeta, ya que, la acomodaron solo para algunos."
8290,3,respeto_por_la_constitución,P,"Se cuestiona la acción de respetar la Constitución actual, al ser considerada ilegítima por una porción importante del cabildo, por haber sido redactada y aprobada en Dictadura, en situación de violación de los DD.HH y con votaciones intervenidas."
8293,3,respeto_por_la_constitución,A,Todos deben respetar la nueva constitución elaborada en democracia.
8301,3,respeto_por_la_constitución,A,Mantener la supremacía de la constitución y garantizar con ello el respeto a todas las normas.
8308,3,respeto_por_la_constitución,A,Creemos que debe ser uno de los deberes a promover.
8312,3,respeto_por_la_constitución,A,Respetar lo que se dice y lo que se decide. Involucrase y valorar esta propuesta porque es buscar el bien común.
8314,3,respeto_por_la_constitución,A,"Este es un deber, respetar la carta fundamental que nos rige a todos. ademas consagra los derechos,deberes y responsabilidades  cada ciudadano."
8315,3,respeto_por_la_constitución,P,"Se  releva la necesidad de la sociedad en su conjunto acuerde mecanismos que garanticen respetar y resguardar la Constitución acordada democráticamente, sin que se generen espacios que la pongan en riesgo. se releva la necesidad de establecer mecanismos eficaces y eficientes de servicios comunitari"
8322,3,respeto_por_la_constitución,A,Porque es el fundamento de la sociedad que queremos construir
8325,3,respeto_por_la_constitución,A,"Que se respete la democracia, que nadie sea capaz de terminar un régimen democratico"
8327,3,respeto_por_la_constitución,A,"Sobre la base que la nueva constitución sea legítima, democrática, representativa de los interese del conjunto y heterogeneidad de la ciudadania que aspira a un bienestar."
8328,3,respeto_por_la_constitución,A,asamblea constituyente como mecanismo de formulación de la nueva constitucion
8330,3,respeto_por_la_constitución,A,"Si todos ayudamos a hacer la constitución, entonces hay que respetarla por respeto a los demás."
8331,3,respeto_por_la_constitución,A,TODA NORMA DEBE AJUSTARSE A LA CONSTITUCION
8339,3,respeto_por_la_constitución,A,"Respeto fundamental para cuidar el marco constitucional que se está llevando a cabo en forma legítima, por esta vez, en el país. Un deber primordial para todo ciudadano e instituciones públicas y privadas."
8346,3,respeto_por_la_constitución,A,o Porque es beneficio para todos
8348,3,respeto_por_la_constitución,P,Respetar primeramente el marco institucional acordado por la mayoría.
8351,3,respeto_por_la_constitución,A,Que se respete y asuma como carta fundamental.
8353,3,respeto_por_la_constitución,A,"consideramos esencial que la nueva constitución se deba respetar, ya que en ella se reflejara los principios fúndanles de la sociedad actual, por lo que es imprescindible que no se vulneren los principios prescritos en la carta fundamental por parte de la sociedad, autoridades o persona alguna."
8355,3,respeto_por_la_constitución,A,"Este debe interpretar los tiempos y derechos de las personas. Supremacia respecto de las demás normas, las que se ajustaron a ella."
8356,3,respeto_por_la_constitución,A,debe respetarse por todas las personas la  constitucion que hagamos ahora
8359,3,respeto_por_la_constitución,A,Se considera simplemente imprescindible.
8365,3,respeto_por_la_constitución,A,apegarse a las leyes  y reglamentos democraticamente establecidos y legitimados por la ciudania
8366,3,respeto_por_la_constitución,A,"Que toda ley tenga como base los derechos constitucionales, y que sea respetada por todos, cualquiera sea el gobierno de turno."
8370,3,respeto_por_la_constitución,A,Creada por consulta popular. Porque la construcción colectiva obliga a respetarla para una buena convivencia.
8388,3,respeto_por_la_constitución,A,El respeto a la Carta Fundamental.
8395,3,respeto_por_la_constitución,A,Fundamental
8401,3,respeto_por_la_constitución,P,"Es fundamental saber que todos respetamos lo que acordamos. Es el piso de donde se genera lo demás. La const. es el marco formal de toda convivencia social, por lo que para ser parte de la sociedad, se debe, al menos, respetar este marco. No es lógico que un documento garantice su propio respeto."
8404,3,respeto_por_la_constitución,A,es nuestra norma básica de convivencia
8409,3,respeto_por_la_constitución,A,Salvedad: constitución como ley fundamental.
8418,3,respeto_por_la_constitución,A,Respetar los puntos adscritos a la carta fundamental.
8425,3,respeto_por_la_constitución,A,La Constitución debe ser el marco jurídico  el cual  debe ser respetada por todos los ciudadanos del país.
8427,3,respeto_por_la_constitución,A,respetar carta magna para un desarrollo confiable del futuro del país
8433,3,respeto_por_la_constitución,A,"Debemos respetar la principal ley del país, en nuestro marco regulatorio que debe ser permanente"
8434,3,respeto_por_la_constitución,A,si es una constitución que nos representa debe velarse por su ejecución y aplicación
8438,3,respeto_por_la_constitución,A,"Para ser consecuentes con este proceso, y para mantener un orden, acceder a derechos y exigir deberes, es necesario afirmarse en el cumplimiento de una Constitución."
8439,3,respeto_por_la_constitución,A,Ayudar a modificar y cumplir la constitución.
8440,3,respeto_por_la_constitución,A,Si queremos formular una nueva constitución debemos conocerla y luego respetar lo que nos rige
8444,3,respeto_por_la_constitución,A,"Esta Constitución será formulada por todos y como será democrática la  debemos respetar irrestrictamente y debemos velar porque todos lo hagan, principalmente las autoridades de la República."
8448,3,respeto_por_la_constitución,P,Creemos que la constitución es la carta fundamental de entendimiento de un pueblo y gobierno moderno.
8454,3,respeto_por_la_constitución,A,Norma basica de convivencia y unidad.
8458,3,respeto_por_la_constitución,A,Entendiendo que estamos participando en su construcción debemos respetar la constitución politica.
8460,3,respeto_por_la_constitución,A,"Como es donde se contiene todo lo que se debe cumplir a nivel de país, se debe respetar para mantener una convivencia sana. Y el respeto debe ser igualitario desde todos los ciudadanos."
8469,3,respeto_por_la_constitución,A,Es el marco legal fundamental de la vida de un país y sus ciudadanos.
8471,3,respeto_por_la_constitución,A,"Se estima que el enunciado correcto es el RESPETO POR LA CONSTITUCIÓN Y LAS LEYES, incluyendo la vigilancia de su cumplimiento."
8477,3,respeto_por_la_constitución,A,"Todos los ciudadanos deben respetar la Constitución y las leyes, en la medida en que éstas hayan emanado desde la participación ciudadana."
8480,3,respeto_por_la_constitución,A,"Si  se  elabora  esta  carta  fundamental  de  forma  participativa  y  es  consensuada  por  todos  los  actores sociales, mínimo conocerla y respetarla"
8481,3,respeto_por_la_constitución,A,"Todos somos responsables de que la Constitución se haga sangre en nosotros, por lo que es necesario que cada quien la conozca y que este conocimiento lleve al respeto irrestricto de ésta"
8483,3,respeto_por_la_constitución,A,todo ciudadano debe respetar y cumplir la constitución ya que ella debe servir para el progreso y bienestar de los ciudadanos
8485,3,respeto_por_la_constitución,A,A
8488,3,respeto_por_la_constitución,A,Libre acceso y entendimiento en un lenguaje común.
8508,3,respeto_por_la_constitución,A,"el grupo sostiene que las leyes solo son respetadas por las familias con menores  recursos, los empresarios no tiene respeto por las leyes y buscan la forma de no cumplirlas."
8509,3,respeto_por_la_constitución,A,Respeto por la nueva constitución en la participación  ciudadana
8511,3,respeto_por_la_constitución,A,PARA REGIRSE Y VIVIR EN SOCIEDAD
8517,3,respeto_por_la_constitución,A,Para legitimar este instrumento
8518,3,respeto_por_la_constitución,A,Esto permite asegurar la supremacía de la Constitución frente a otras leyes y la dota de exigibilidad ante el Estado y ante terceros.
8519,3,respeto_por_la_constitución,A,"Es la ley más importante de nuestro país , es la carta fundamental, debe ser para todos los estratos sociales, donde no haya privilegios para los sectores mas adinerados del país, las FFAA y otras instituciones."
8523,3,respeto_por_la_constitución,A,Que se respete a la constitución (la nueva)
8524,3,respeto_por_la_constitución,A,Se explica por sí solo.
8527,3,respeto_por_la_constitución,A,el respeto a las reglas del juego más importante entre todos.
8537,3,respeto_por_la_constitución,A,"respeto por la carta fundamental que estructura, ordena y rige los destinos del país."
8540,3,respeto_por_la_constitución,A,Acuerdo democrático
8542,3,respeto_por_la_constitución,A,Para asegurar y garantizar los derechos y responsabilidades
8543,3,respeto_por_la_constitución,A,"Construida por todos, conocida por todos, en consecuencia, respetada por todos."
8544,3,respeto_por_la_constitución,A,ver archivo adjunto
8545,3,respeto_por_la_constitución,A,Como ciudadanos nos debemos a nuestra nación y su ordenamiento
8547,3,respeto_por_la_constitución,P,Debido a que nos ordena juridicamente como ciudadanos (debe incluir muchos aspectos) Nos representa a todos.
8549,3,respeto_por_la_constitución,A,"RESPETO A LA NUEVA CONSTITUCIÓN, ESTA PARTICIPANDO LA CIUDADANIA Y SON NUESTROS DERECHOS"
8555,3,respeto_por_la_constitución,A,Deber de todo ciudadano someterse a las normas establecidas.
8556,3,respeto_por_la_constitución,A,Porque es la ley fundamental del estado.
8557,3,respeto_por_la_constitución,A,"Toda persona debe tener la responsabilidad de  respetar la constitución, entendiendo que la soberanía debe radicar en el pueblo."
8562,3,respeto_por_la_constitución,P,sin fundamento
8566,3,respeto_por_la_constitución,A,Considerando una constitución legítima y construida democráticamente.
8570,3,respeto_por_la_constitución,A,Porque la constituciónes para la sociedad y para nuestro país la carta fundamental que todos debemos respetar y estar mas cercanos y conocerla.
8571,3,respeto_por_la_constitución,A,Una nueva constitución debe ser respetada por ser la ley fundante del Estado y por ser representativa de la soberanía popular. Un ejemplo de lo anterior es la participación en el presente proceso.
8572,3,respeto_por_la_constitución,A,CIUDADANOS DEBEN CUMPLIR CON LA CONSTITUCION QUE NOS RIGE
8573,3,respeto_por_la_constitución,A,"Concebimos a la Constitución como la ley fundamental del Estado, por ello debe cautelarse su supremacía respecto de cualquier otra regla jurídica. Al ser la expresión del consenso social fundamental, debe ser respetada por el Estado, sus agentes y los particulares."
8575,3,respeto_por_la_constitución,A,Respeto por la carta fundamental que representa los intereses de la ciudadanía
8577,3,respeto_por_la_constitución,A,Porque representa la carta fundamental que organiza nuestra sociedad.
