idEla,tema,concepto,acuerdo,fundamento
11104,4,tribunal_constitucional,A,"Para el control de la constitucionalidad de leyes, decretos, sentencias, etc. Que haga cumplir y defienda la constitución."
11198,4,tribunal_constitucional,D,"No debería existir, porque tenemos parlamento democrático que representa a la mayoría"
11269,4,tribunal_constitucional,A,Va relacionado con la formación de la constitución.
11284,4,tribunal_constitucional,A,Es el garante final de que tanto el Congreso Nacional como la Presidenta de la República respeten la  Constitución y los derechos de las personas.
11295,4,tribunal_constitucional,A,Institucion que debe velar por el respeto de los derechos constitucionales. Garantizar derechos y decisiones de las mayorías
11343,4,tribunal_constitucional,A,Conformación del tribunal constitucional con mayor pluralismo.  Quorum de aprobación o rechazo de las observaciones sean mayores a la simple mayoria.
11426,4,tribunal_constitucional,A,"Tiene un rol relevante, ya que debe velar por el respeto a la Constitución, tanto en las leyes que se dictan, como en las sentencias en que puedan afectarse derechos constitucionales de las personas. Debe ser independiente y técnico."
11516,4,tribunal_constitucional,A,"Organismo fiscalizador de la constitución y las leyes, con representación ciudadana vinculante"
11585,4,tribunal_constitucional,A,"Porque es importante que se vele por la constitucionalidad de las cosas, y este órgano es el adecuado."
11630,4,tribunal_constitucional,A,Tiene la responsabilidad de velar que el Congreso Nacional y la Presidencia de la Republica respeten la constitución y derechos humanos
11633,4,tribunal_constitucional,A,"Es necesario para garantizar el respeto a la Constitución y los derechos de las personas por parte del congreso, asi como también de la Presidencia de la Republica"
11674,4,tribunal_constitucional,A,Se  planteo que se desideologice los miembros. Se cuestionó su rol.
11853,4,tribunal_constitucional,A,Es importante esta institución pues se encarga de verificar que las leyes de fondo tengan una coherencia con la constitución de tal manera que no se contradigan.  Por unanimidad
12000,4,tribunal_constitucional,A,Vela porque el Congreso y el Presidente  respeten la Constitución y los derechos de las personas.
12077,4,tribunal_constitucional,A,Es el garante final de que tanto el Congreso Nacional como la Presidencia de la República respeten la  Constitución y los derechos de las personas.
12120,4,tribunal_constitucional,P,generar elección democrática por parte de los ciudadanos para esta institución
12239,4,tribunal_constitucional,A,Es necesario reevaluar sus funciones para que no se interponga en el proceso democrático. Esto implica eliminar el control preventivo de las leyes (orgánicas y simples).
12422,4,tribunal_constitucional,A,Es el garante final de que tanto el Congreso Nacional  como la Presidencia de la República respeten la  Constitución y los derechos de las personas.
12493,4,tribunal_constitucional,A,Desaparición del Tribunal constitucional.
12509,4,tribunal_constitucional,:Acuerdo,Es necesaria que una institución revise las leyes aprobadas de tal manera que sean rechazadas si no respetan la constitución.
12514,4,tribunal_constitucional,A,Como garante de la estabilidad política del país y la correcta interpretación de la Constitución. Debe sera autónomo e independiente de los otros poderes del Estado
12581,4,tribunal_constitucional,P,Acuerdo en que debe haber una institución independiente que vele porque las leyes estén alineadas con la constitución. Algunos participantes creen que esto debiera hacerlo el poder judicial. Se debe discutir estructura y funciones del TC.
12644,4,tribunal_constitucional,A,"Revisar las atribuciones y rol del TC ya que opera como un cuarto poder, revirtiendo decisiones tomadas por el poder legislativo"
12666,4,tribunal_constitucional,A,"Una alta corte independiente de la Corte Suprema de Justicia, en su totalidad institucional y decisoria. Su función será velar el cumplimiento y respeto de la Constitución de todo el sistema normativo en su conjunto. A ella podrán acceder tanto funcionarios públicos como la ... continua (ver acta)"
12719,4,tribunal_constitucional,A,"Hoy es un instrumento político que actúa como una cámara con súper poderes, que puede invalidar los acuerdos del congreso, según convenga o no a la composición política de sus componentes.  Al menos, debiera garantizarse la imparcialidad mediante la elección no partidaria de sus miembros."
12913,4,tribunal_constitucional,A,Resguardo de la Constitución.
12960,4,tribunal_constitucional,A,Es el garante final de que tanto el congreso nacional como la presidencia de la república respeten la constitución y los derechos de las peresonas
12970,4,tribunal_constitucional,D,Es ridículo e infame el uso que hoy se le da a esta institución. Es necesario una REMODELACIÓN de este en pos de que vuelva a funcionar. Sería bueno considerar como primera medida que el número de miembros sea IMPAR.
12988,4,tribunal_constitucional,A,"En mantener su función preventiva, mejorando el mecanismo de elección de sus miembros"
13014,4,tribunal_constitucional,A,Es el garante final de que tanto el Congreso Nacional como la Presidencia de la República respeten la  Constitución y los derechos de las personas.
13059,4,tribunal_constitucional,A,Se debe discutir sobre el rol y necesidad de su existencia.
13240,4,tribunal_constitucional,A,La acción del TC debe realizarse antes que salga publicada una ley que no haya llegado a acuerdo y que sea de relevancia para el país.
13298,4,tribunal_constitucional,A,Es el garante final de que tanto el Congreso Nacional  como la Presidencia de la República respeten la  Constitución y los derechos de las personas.
13379,4,tribunal_constitucional,A,Òrgano encargado de velar por el cumplimiento irrestricto a la Constituciòn actual
13404,4,tribunal_constitucional,A,ELIMINAR O CAMBIAR POR REFERENDUM REVOCATORIO
13419,4,tribunal_constitucional,A,"Es la institución que garantiza de que el congreso nacional, poder judicial, la Presidencia de la República respeten la constitución y los derechos de las personas . Sus integrantes deben ser elegidos por estamentos de la sociedad."
13433,4,tribunal_constitucional,A,Es el garante final de que tanto el Congreso Nacional  como la Presidencia de la República respeten la  Constitución y los derechos de las personas
13506,4,tribunal_constitucional,A,Es quien vela por el cumplimiento de la constitución
13561,4,tribunal_constitucional,D,Abolición del TC por falta de legitimidad democratica
13640,4,tribunal_constitucional,A,"Sus integrantes deben ser elegidos, de entre postulantes idóneos,  de manera democrática por la ciudadanía."
13753,4,tribunal_constitucional,A,"Institución fundamental que debiese permanecer, debido a su importancia, en forma autónoma e independiente."
13762,4,tribunal_constitucional,A,Es importante esta institución y que ejerza su labor de forma autónoma.
13763,4,tribunal_constitucional,A,"Que sea externo a los tres poderes del estado, sea elegido democráticamente y que tenga la facultad de cambiar la constitución  a través de mecanismos democráticos."
13800,4,tribunal_constitucional,A,Es el garante final de qu etanto al congreso nacional como la presidencia de la república respeten la constitución  y los derechos de las personas. Tendiendo la facultad de vetar leyes que no esten en la constitución
13844,4,tribunal_constitucional,A,Como órgano autónomo que vela por el cumplimiento de la Constitución y para que el resto del ordenamiento jurídico se condiga con ésta.
13903,4,tribunal_constitucional,A,"se propone que la institucionalidad que vigile la correcta interpretación de la constitución sea el tribunal constitucional, donde los jueces que son parte de ella no sean parte del cuoteo político, sino que sea un sistema similar a la alta dirección pública la que los escoja."
13928,4,tribunal_constitucional,A,Debe existir para velar que las conductas y formas de actuar de los poderes del estado no atentan contra la carta magna. Esto incluye la promulgacion de leyes y otras actividades o conductas desarolladas por organismos dependientes del estado.
14003,4,tribunal_constitucional,A,Debe velar por el fiel cumplimiento de la Constitución
14080,4,tribunal_constitucional,A,Es el garante final de que tanto el Congreso Nacional  como la Presidencia de la República respeten la  Constitución y los derechos de las personas
14086,4,tribunal_constitucional,A,debe existir para que las autoridades de turno respeten la constitucion
14099,4,tribunal_constitucional,A,Es el garante final de que tanto el Congreso Nacional  como la Presidencia de la República respeten la  Constitución y los derechos de las personas.
14132,4,tribunal_constitucional,P,Tribunal constitucional que no funcione como tercera camara legislativa ni sea electa por cuoteo politico.
14139,4,tribunal_constitucional,A,.
14268,4,tribunal_constitucional,A,"Referirse a acta escaneada. La completamos digitalmente durante el encuentro y luego todos la aprobaron firmando de manera física y a través de emails tras revisar versión final en detalle. En caso de requerir información adicional, escribir al organizador o moderador del encuentro."
14288,4,tribunal_constitucional,A,INSTITUCIÓN QUE DEBE FUNCIONAR EN FORMA INDEPENDIENTE Y AUTÓNOMA.
14387,4,tribunal_constitucional,A,Creemos importante que exista un Tribunal Constitucional que vele porque las leyes se dicten según la constitución y que sea autónomo.
14446,4,tribunal_constitucional,A,"Control preventivo de las leyes, control constitucional, inaplicabilidad de las leyes"
14546,4,tribunal_constitucional,A,Sirva de filtro para mantener equilibrio
14625,4,tribunal_constitucional,A,"Explicitar, definir su estructura y funciones de manera tal que mantenga autonomia, pluralismo e independencia de grupos de poder tanto economico, politicos, religiosos"
14666,4,tribunal_constitucional,A,"Tribunal constitucional como organo representativo y no de notables. Si se hace necesario que un organo supervise la constitucionalidad de leyes y actos administrativos, que sea un organo representativo de los grupos y opiniones que constituyen a la sociedad."
14700,4,tribunal_constitucional,A,Altamente Calificado.
14704,4,tribunal_constitucional,A,"QUE SE ELIMINE EL TRIBUNAL CONSTITUCIONAL POR QUE SE CONSTITUYE EN UNA TERCERA CAMARA QUE SOLO SE HA UTILIZADO POR LAS MINORIAS PARLAMENTARIAS, POR TANTO ES CONTRAMAYORITARIO."
14757,4,tribunal_constitucional,A,"organismo fiscalizador, de especial importancia para filtrara acuerdos politicos."
14764,4,tribunal_constitucional,A,Para mantener los valores consagrados en la Constitución.
14946,4,tribunal_constitucional,A,Eliminar el tribunal constitucional por ser un organismo intrinsicamente antidemocratico.
15021,4,tribunal_constitucional,A,Garante que se respeten las normas de la constitución por parte del Estado y autoridades.
15031,4,tribunal_constitucional,A,TRIBUNAL QUE DE GARANTIA DE LEGITIMIDAD E IGUALDAD ANTE LA LEY
15144,4,tribunal_constitucional,A,Eliminar o abolir el Tribunal Constitucional
15175,4,tribunal_constitucional,A,-
15255,4,tribunal_constitucional,A,"derogación de este organismo, coarta el estado de derecho."
15298,4,tribunal_constitucional,A,Parte muy importante para que el poder ejecutivo tenga límites!!
15346,4,tribunal_constitucional,A,Mantener su rango constitucional y autonomía.
15349,4,tribunal_constitucional,A,"Sin este ente, la supremacía constitucional no sería defendida como debe ser. Se debe entender tal como se entiende hoy."
15438,4,tribunal_constitucional,A,"Debe haber un órgano autónomo que vele por el pleno respeto de la Constitución, cuyo fin es proteger los derechos de las personas y la institucionalidad democrática."
15503,4,tribunal_constitucional,A,Que tanto el Congreso como la presidencia de la república respeten la constitución y los derechos de las personas
15512,4,tribunal_constitucional,A,SE CONSIDERA CLAVE PARA CUIDAR QUE LAS LEYES NO PASEN A LLEVAR LOS PRINCIPIOS ESTABLECIDOS EN LA CONSTITUCIÓN. PERO SI SE COMENTÓ QUE DEBERÍAN HABER CAMBIOS EN SU COMPOSICIÓN.
15516,4,tribunal_constitucional,A,Fundamental para el control del cumplimiento de la Constitución
15521,4,tribunal_constitucional,A,Es el garante final de que tanto el Congreso Nacional  como la Presidencia de la República respeten la  Constitución y los derechos de las personas.
15669,4,tribunal_constitucional,A,"Eliminar cuoteo, que se escojan por sus competencias profesionales y por acuerdo político."
15671,4,tribunal_constitucional,A,"Porque debe existir una institución que proteja la Constitución, cuyos integrantes sean elegidos democráticamente, con representantes regionales."
15737,4,tribunal_constitucional,P,"CONTROL PREVENTIVO DE CONSTITUCIONALIDAD RESTRINGIDO, BAJO PRINCIPIO DE DIFERENCIA RAZONADA, MINISTROS CON CURRICULUM ELEVADO Y EXPERIENCIA CALIFICADA."
15815,4,tribunal_constitucional,A,"control de constitucionalidad de leyes, que sus miembros no sean elegidos según criterios políticos."
15824,4,tribunal_constitucional,A,"El Tribunal Constitucional debe garantizar el respeto por la constitución y los derechos de las personas, sin coartar la libertad individual."
15843,4,tribunal_constitucional,A,Institución u organismo que resuelve controversias en cuanto a valores y principios de la constitución.
15850,4,tribunal_constitucional,A,Órgano controlador que revise siempre que las nuevas leyes se ajusten a la Constición.  Debe representar a las distintas visiones políticas del país
