idEla,tema,concepto,acuerdo,fundamento
85,4,tribunal_constitucional,A,Como contralor constitucional llamado a velar por que la producción normativa sea constitucional.
106,4,tribunal_constitucional,A,"Variar la composición del Tribunal Constitucional por un número impar, además se debe variar y democratizar su sistema de elección."
162,4,tribunal_constitucional,A,Definir de manera más sensata ( como en otros países) el rol que ejerce el tribunal en la constitución.
168,4,tribunal_constitucional,A,"Debe existir, con funcionarios elegidos por elección popular y limitar sus funciones y atribuciones."
178,4,tribunal_constitucional,A,"Debe terminar, es un resabio de la dictadura, se ha constituido en una especie de nuevo parlamento"
220,4,tribunal_constitucional,A,Debe ser independiente. Debe velar por el apego a la Constitución de las leyes y decretos.
246,4,tribunal_constitucional,A,Revisar atribuciones
283,4,tribunal_constitucional,P,Cambio de elección de los integrantes
297,4,tribunal_constitucional,A,"Garante del principio de primacia constitucional, del principio de legalidad y del libre y seguro ejercicio de los derechos y garantias constitucionales, debiendo protejer y sancionar a los tres poderes del Estado cuando corresponda."
423,4,tribunal_constitucional,A,Reformarse su organica y forma de elección. Respecto a sus funciones no debiera regular cuestiones de fondo. que no sea una tercera cámara del congreso.
426,4,tribunal_constitucional,A,"Importante que siga existiendo esta Institución porque permite que la deliberación legislativa se ajuste a la Constitución, reguardando la primacía de esta por sobre los órganos de Gobierno y las leyes asociadas a éstos."
479,4,tribunal_constitucional,D,.
520,4,tribunal_constitucional,A,Su actuar no debe ir en contra de la voluntad popular.
571,4,tribunal_constitucional,A,Es el garante final de que tanto el Congreso Nacional  como la Presidencia de la República respeten la  Constitución y los derechos de las personas.
671,4,tribunal_constitucional,A,Debe estar establecido en la constitución y podría participar en un proceso de un juicio político.
682,4,tribunal_constitucional,P,Evaluar existencia y autonomía de este organismo.
924,4,tribunal_constitucional,A,No puede haber un suprapoder  no elegido por  encima de los poderes electos. Debe terminarse el actual y no existir
1027,4,tribunal_constitucional,A,acuerdo completo
1108,4,tribunal_constitucional,A,Este tribunal es muy importante para que el Congreso y la Presidencia de la República respeten la Constitución
1133,4,tribunal_constitucional,A,Menos poder y compuesto por personas del mundo académico
1228,4,tribunal_constitucional,A,Eliminarlo. No debe constituir un nuevo poder del Estado.
1308,4,tribunal_constitucional,A,Eliminación
1327,4,tribunal_constitucional,A,Consideramos que debe residir y depender de la corte suprema.
1351,4,tribunal_constitucional,A,"Eliminarlo o por lo menos revisar y reformar su funcionamiento y atribuciones, algunas de ellas consideradas como antidemocráticas"
1520,4,tribunal_constitucional,A,• Eliminar Tribunal Constitucional  Ahorro de tiempo y dinero
1614,4,tribunal_constitucional,A,Eliminar el poder de veto de la soberanía popular.
1708,4,tribunal_constitucional,A,Con control constitucional preventivo de todas las leyes
1715,4,tribunal_constitucional,A,Es quien garantiza el cumplimiento de la Constitución por parte del Congreso Nacional y Presidente de la Republica
1716,4,tribunal_constitucional,A,Organismo autónomo independiente que vele por la constitucionalidad de las leyes.
1860,4,tribunal_constitucional,A,Esperamos que pudiese asegurarse su idoneidad para el cargo.
1880,4,tribunal_constitucional,A,Independiente del poder politico
2015,4,tribunal_constitucional,A,Debe existir como recurso último que se tiene para zanjar aspectos relacionado con la legitimidad de las leyes y su aplicación. No debe ser politizado y contar con atribuciones suficientes y determinantes para cumplir su labor.
2031,4,tribunal_constitucional,A,"Que se mantenga el control preventivo de las leyes desarrollado por éste. Que siga estando conformado por miembros de la Corte Suprema, acreditando una mayor independencia política."
2130,4,tribunal_constitucional,A,Es el garante final de que tanto el Congreso Nacional    como la Presidencia de la República respeten la    Constitución y los derechos de las personas.
2136,4,tribunal_constitucional,A,La constitucionalidad de las Leyes  y actos del Estado deben ser revisados  previa asu implementación  o a su aplicación
2149,4,tribunal_constitucional,A,Garantizar una integración democrática y mas representativa de la sociedad chilena en el Tribunal Constitucional
2171,4,tribunal_constitucional,A,FISCALIZADOR Y CONTROLADOR DE LAS LEYES. ES IMPORTANTE QUE LA COMPOSICIÓN SEA MÁS TÉCNICA Y NO POLÍTICA.
2310,4,tribunal_constitucional,A,Redefinir sus funciones para proteger esta Constitución y replantear su forma de elección.
2408,4,tribunal_constitucional,A,"Que este tenga mayor atribuciones para derogar leyes, que estén vinculadas a situaciones ilícitas en su formulación y ejecución."
2475,4,tribunal_constitucional,A,Con miembros elegidos por el pueblo.
2482,4,tribunal_constitucional,A,Demasiado poder de veto de los otros poderes.Debe fiscalizar al poder ejecutivo el uso de la fuerza Publica.
2521,4,tribunal_constitucional,D,Deben ser los tribunales de justicia quienes juzguen la justicia constitucional.
2572,4,tribunal_constitucional,A,Es el garante final que todos los organismos del Estado cumplan las leyes
2576,4,tribunal_constitucional,A,Debe existir un órgano que procure el respeto a la Constitución pero los miembros debieran ser elegidos más de acuerdo al mérito.
2579,4,tribunal_constitucional,P,"La existencia del tribunal es un peligro, es un ente para decidir si las leyes deben ser o no según lo que dice la constitución, en la actualidad ha paralizado procesos democraticos.  Debe cambiar su figura para no vetar decisiones democraticas"
2597,4,tribunal_constitucional,A,Ente de control para los actos de la administración pública y la constitucionalidad de las leyes.
2598,4,tribunal_constitucional,P,este rol también lo puede cumplir la corte suprema
2773,4,tribunal_constitucional,A,Es el garante final de que tanto el Congreso Nacional como la Presidencia de la República respeten la  Constitución
2834,4,tribunal_constitucional,A,"Eliminarlo, reemplazar por organismo autónomo de forma meramente técnica que revise a petición la constitucionalidad de las leyes, debe tener autoridades electas por alta dirección pública."
2969,4,tribunal_constitucional,A,Institución encargada que veía por que los 3 poderes se rigen bajo la
3164,4,tribunal_constitucional,A,Institución de relevancia que debe ejercer en forma independiente.
3416,4,tribunal_constitucional,A,Es el garante final de que tanto el Congreso Nacional como la Presidencia de la República respeten la  Constitución
3534,4,tribunal_constitucional,A,Garantiza que la Presidencia de la República y el Congreso respeten la Constitución. Debe ser autónomo.
3656,4,tribunal_constitucional,P,Se registran 2 votos en contra a registrar la figura del Tribunal Constitucional en una nueva Constituci
3693,4,tribunal_constitucional,A,"Un poder que está por sobre el legislativo, en donde los participantes no son votados democráticamente. Herramienta antidemocrática."
3711,4,tribunal_constitucional,A,Eliminar esta Institución que funciona ilegitimamente como un Poder Independiente del Estado
3717,4,tribunal_constitucional,A,Fundamental para que se cumpla al pie de la letra la Constitución.
3763,4,tribunal_constitucional,P,"Que ejerza un control preventivo y represivo. Institución de conocimiento técnico. Que se encargue de velar por la supremacía constitucional.  No hubo acuerdo total en el aspecto del mecanismo de elección, ya que unos quieren que se mantenga y otros uno distinto."
3780,4,tribunal_constitucional,A,Hace que se respete la Constitución y los derechos de las personas.
3873,4,tribunal_constitucional,A,Fortalecimiento de autonomía de Tribunal Constitucional y Contraloría de la República.
3878,4,tribunal_constitucional,A,El tribunal constitucional independiente es la instancia que protege a los ciudadanos de leyes incoherentes con la constitución y el derecho natural.
4026,4,tribunal_constitucional,A,Que vele por la correcta implementación de la Constitución.
4105,4,tribunal_constitucional,A,.
4111,4,tribunal_constitucional,A,como funciona actualmente
4251,4,tribunal_constitucional,A,Es el garante final de que tanto el Congreso Nacional como la Presidencia de la República respeten la  Constitución y los derechos de las personas
4298,4,tribunal_constitucional,A,Que solo exista con control ex-post. También es importante modificar el mecanismo de control y elección.
4335,4,tribunal_constitucional,A,Es el garante que tanto el Congreso como el gobierno respeten la Constitución y los derechos de las personas
4456,4,tribunal_constitucional,A,Se elimina la figura de tribunal constitucional y sera la Corte Suprema quien dirima temas de constitucionalidad de las leyes.
4463,4,tribunal_constitucional,A,Defensa de la constitucionalidad de la ley y respeto a la constitución
4473,4,tribunal_constitucional,A,No hubo fundamento.
4480,4,tribunal_constitucional,A,Tiene que ser el garante final que tanto el congreso nacional como la presidencia de la república respeten la constitucional. Control obligatorio preventivo de proyectos de ley.
4562,4,tribunal_constitucional,A,Fundamental para el correcto funcionamiento de la constitución. Debe ser autónomo y con los quórum actuales
4721,2,tribunal_constitucional,A,Este debe ser eliminado porque en este momento se convirtió en un cuarto poder del Estado.  Pasando por encima del Parlamento que fue elegido por la ciudadanía. En cambio el Tribunal Constitucional no es elegido por votación popular.  Esta facultad debe regresar a la Corte Suprema para validar la aplicabilidad de una ley en especial.
4733,4,tribunal_constitucional,A,"(10/10) INSTITUCION QUE VELE POR EL CUMPLIMIENTO DE TODO LO EXPRASADO EN LA CONSTITUCION, REGULARIZANDO EL CUMPLIMIENTO DE ESTOS TERMINOS."
4792,4,tribunal_constitucional,A,Transparencia en elección de los miembros del Tribunal Constitucional
4818,4,tribunal_constitucional,A,"TRIBUNAL CONSTITUCIONAL, Democratización y modernización de la institución"
4828,4,tribunal_constitucional,A,Es necesario que exista control preventivo de las leyes y de los actos administrativos del Estado. Control abstracto de constitucionalidad a posteriori por incentivo de la ciudadanía.
4904,4,tribunal_constitucional,A,Es el garante final de que tanto el Congreso Nacional  como la Presidencia de la República respeten la  Constitución y los derechos de las personas.
4946,4,tribunal_constitucional,A,Toda ley debe someterse a los valores establecidos en la constitución
4976,4,tribunal_constitucional,A,Esta figura debe ser eliminada. Se considera que no está acorde a la democracia.
5003,4,tribunal_constitucional,A,que vele por el cumplimiento de las leyes.
5040,4,tribunal_constitucional,A,Debe tener miembros impares en número.  Rol fundamental de control de constitucionalidad de las normas legales e inferiores.  Debe resguardarse su existencia e independencia.
5184,4,tribunal_constitucional,A,"Se destaca esta institución por ser la que resguarda que las autoridades políticas, como el Presidente y el Congreso Nacional, respeten la Constitución."
5199,4,tribunal_constitucional,A,elegido dramáticamente
5241,4,tribunal_constitucional,A,órgano encargado de velar por el respeto constitución
5281,4,tribunal_constitucional,A,"Miembros deben ser electos democráticamente, no asignados, sin poder de veto, y debe tener un carácter consultivo."
5304,4,tribunal_constitucional,A,"Es necesario , pero debe tener un rol consultivo, diferente al rol actual"
5358,4,tribunal_constitucional,A,Institución que debe funcionar en forma autónoma e independiente.
5539,4,tribunal_constitucional,A,"Reformar para que sea una institución independiente de los poderes fácticos, económicos y políticos."
5683,4,tribunal_constitucional,A,El Tribunal Constitucional NO debe estar por sobre ningún otro poder del estado
5763,4,tribunal_constitucional,A,"ESTE DEBE ESTAR BASADO EN LOS DD.HH. Y VELAR POR LA DEMOCRACIA, Y SIN PERDER EL SENTIDO DE LOS DERECHOS CIUDADANOS BÁSICOS."
5777,4,tribunal_constitucional,A,Autónomo representativo. Elección transparente y despolitizada. Idóneos para el cargo.
5805,4,tribunal_constitucional,A,"CAMBIO DEL MODO DE DESIGNAR A SUS MIEMBROS, PARA QUE TODOS SEAN ELEGIDOS POR LA CORTE SUPREMA Y SEAN PARTE DEL PODER JUDICIAL."
5878,4,tribunal_constitucional,A,Entidad importante en el control preventivo de la constitucionalidad de las leyes que vayan a dictarse.
6053,4,tribunal_constitucional,A,"En el entendido de existir un sistema Unicameral, en que no existe doble revision y por cuanto asegura la sujecion de las leyes al imperio de la Constitucion"
6077,4,tribunal_constitucional,A,"Restringir y regular sus atribuciones, evitando que opere como instancia de decisión política."
6140,4,tribunal_constitucional,A,Una institución fundamental para velar por el cuidado de la constitución. Debe mantener su independencia y siempre actuar con la mirada de largo plazo.
6166,4,tribunal_constitucional,A,"Que se revise la forma de elección de los miembros del Tribual Constitucional, que se impida que exista injerencia de los partidos políticos en su nombramiento.  Que se redefinan sus atribuciones, que no opere como una tercera cámara, y que se limite los alcances de sus fallos."
6197,4,tribunal_constitucional,P,"se debe modificar la manera en que se elige  tribunal constitucional, debe funcionar más como un fiscalizador que cómo un órgano que dictamine de manera tan rígida. Hay desacuerdo en si se debe eliminar o reformar"
6234,4,tribunal_constitucional,A,Este organo custodio del cumplimiento de la constitucion  debe existir y ojala tener mas poder
6256,4,tribunal_constitucional,A,"Tribunal legal, sin sesgo político, sin reemplazantes. Integrantes apolíticos / técnicos."
6277,4,tribunal_constitucional,A,Es el garante final de que tanto el Congreso Nacional como la Presidencia de la República respeten la  Constitución
6328,4,tribunal_constitucional,A,Institución de la República que vela y cautela el respeto y el cumplimiento de la constitución.
6571,4,tribunal_constitucional,A,"Que siga existiendo un mecanismo de control constitucional, independiente del parlamento."
6603,4,tribunal_constitucional,A,Fundamental
6641,4,tribunal_constitucional,A,Es el garante final de que tanto el Congreso Nacional como la Presidencia de la República respeten la  Constitución y los derechos de las personas.
6829,4,tribunal_constitucional,A,"El tribunal constitucional tiene que ser el garante final de que, tanto el congreso nacional como la presidencia de la república, respeten la constitución. Sólo así se protegen los derechos de las personas."
6862,4,tribunal_constitucional,A,Haga respetar la constitución y que las leyes no perjudiquen a las minorías y las determinaciones de las minorías.
6996,4,tribunal_constitucional,A,Eliminar control expost de aprobación de leyes en el Congreso. Propuesta creación de sala constitucional en la Corte Suprema para control inaplicabilidad por inconstitucionalidad de normas.
7023,4,tribunal_constitucional,A,Es el garante final de que tanto el Congreso Nacional como la Presidencia de la República respeten la  Constitución y los derechos de las personas.
7037,4,tribunal_constitucional,A,Es el garante final de que tanto el Congreso Nacional  como la Presidencia de la República respeten la  Constitución y los derechos de las personas.
7149,4,tribunal_constitucional,A,"DeMantenerseEstaInstitución,DeberáSerModificadaEnCuantoSusFunciones y atribuciones,DeManeraTalQueSea unÓrganoTécnico yMeramenteConsultivoPeroDebeDejarDeSer unÓrganoContraMayoritario yAntidemocráticoComo lo esActualmente.Debe serConsultivoPeroNO vinculante,lasDecisionesLasDebenTomarLosColegisladores"
7171,4,tribunal_constitucional,A,Organismo que vela para que las leyes no vayan en contra de la constitución.
7173,4,tribunal_constitucional,A,"Autónomo, ser un ente fiscalizador, con rango constitucional, ejercer control a la administración pública y ser un ente fiscalizador superior en nuestro país."
7176,4,tribunal_constitucional,A,-debe ser elegido democráticamente.   -no debe tener capacidad de influenciar las leyes emitidas del parlamento.
7300,4,tribunal_constitucional,P,"Necesario discutir esta institución, al menos en sus atribuciones, considerando que actualmente tiene mucho poder y sus miembros no son elegidos democráticamente, lo que produce un desequilibrio con los otros poderes del Estado."
7363,4,tribunal_constitucional,P,"Acuerdo en que debiera haber una justicia constitucional o alguna forma de analizar eventos y leyes que no sean compatibles con estas, pero no hay acuerdo en si debe ser un tribunal, un comité judicial o parlamentario, o algún otro mecanismo."
7367,4,tribunal_constitucional,A,"El tribunal constitucional debe proteger los derechos de las personas y la institucionalidad democrática. Debe ser apolítico. Además, es necesario priorizar los derechos, protegiendo por sobre todo la educación, salud y medio ambiente."
7396,4,tribunal_constitucional,A,Es el garante final de que tanto el Congreso Nacional como la Presidencia de la República respeten la  Constitución y los derechos de las personas
7480,4,tribunal_constitucional,A,Es el garante final de que tanto el Congreso Nacional como la Presidencia de la República respeten la  Constitución y los derechos de las personas
7658,4,tribunal_constitucional,A,Organismo autónomo que refuerza el juicio y acción constitucional.
7689,4,tribunal_constitucional,A,Con su independencia y actuales atribuciones.
7755,4,tribunal_constitucional,D,"proponemos su eliminación hay acuerdo en NO mantener esta institución. Toda vez que las leyes se debaten en el Congreso Nacional, no en una ""tercera cámara"""
7796,4,tribunal_constitucional,A,Es necesario discutir sus atribuciones características. Por la interpretación de las leyes y poder cuestionar la ley.
7813,4,tribunal_constitucional,A,Es muy importante ya que será quien vela para que la constitución se cumpla y prime respecto a todas las otras Leyes
7848,4,tribunal_constitucional,A,"Vela por el cumplimiento de la constitución, conformado por expertos en derecho constitucional."
7891,4,tribunal_constitucional,A,Es el garante final de que tanto el Congreso Nacional  como la Presidencia de la República respeten la  Constitución y los derechos de las personas.
8003,4,tribunal_constitucional,A,Organismo encargado de velar por la constitucionalidad y ejercer justicia constitucional.
8223,4,tribunal_constitucional,A,Es el garante final de que tanto el Congreso Nacional como la Presidencia de la República respeten la  Constitución y los derechos de las personas
8238,4,tribunal_constitucional,A,Es el garante final de que tanto el Congreso Nacional como la Presidencia de la República respeten la  Constitución y los derechos de las personas.
8420,4,tribunal_constitucional,A,Derogación del TC. Las funciones de este organismo deben ser distribuidas en las diferentes Instituciones del Estado.
8545,4,tribunal_constitucional,A,Fundamental para velar que todas las leyes que se promulguen y apliquen no vayan en contra de la Constitución.
8594,4,tribunal_constitucional,A,alguien debe velar por respetar la constitución
8715,4,tribunal_constitucional,A,Asegurar que leyes aprobadas no pasen por encima de la constitución
8750,4,tribunal_constitucional,P,"Órgano que tiene como función principal interpretar en última instancia las normas y si estas se ajustan a la constitución. Sus miembros deben ser elegidos en base a concurso por competencia y haberse destacado en materia profesional, constitucional y que su funcionamiento sea regulado por una LOC."
8752,4,tribunal_constitucional,A,Este debe dejar de existir debido a su autoritarismo y falta de representatividad.
8834,4,tribunal_constitucional,D,Debe ser abolido por poco democrático.
8848,4,tribunal_constitucional,A,Deberia cesar en sus funciones actuales. Eliminar por carecer de legitimidad
8877,4,tribunal_constitucional,A,Garantiza que la Presidencia y en Congreso respeten la Constitución
8880,4,tribunal_constitucional,A,Sus integrantes deben ser elegidos mediante concursos públicos.
8944,4,tribunal_constitucional,A,Nos garantiza que tanto el gobierno de turno como los parlamentarios respeten las leyes y personas
9004,4,tribunal_constitucional,A,"Este debe ser un ente consultivo y no decisivo, pues no ha sido electo demócratamente, si no en forma arbitraria por quienes tienen el poder, arrebatando de esta forma la posibilidad de elegir al pueblo."
9012,4,tribunal_constitucional,A,"Debe garantizar que tanto el poder ejecutivo, poder legislativo y poder judicial respeten la constitución y derecho de las personas"
9092,4,tribunal_constitucional,D,En su rol de defensor y garante de la Constitución.
9129,4,tribunal_constitucional,A,Es el garante final de que tanto el Congreso Nacional  como la Presidencia de la República respeten la  Constitución y los derechos de las personas.
9150,4,tribunal_constitucional,A,"Debe mantenerse, tener una mirada de largo plazo y estar conformado por juristas de probado prestigio, no vinculados a partidos políticos."
9171,4,tribunal_constitucional,A,Para resguardar la constitución
9215,4,tribunal_constitucional,A,"Debe estar representado por gente idónea, imparcial e intachable para que la constitución sea cumplida al pie de la letra"
9423,4,tribunal_constitucional,A,"Es relevante discutir si debe haber un órgano que vele por el cumplimiento de la constitución, pero es necesario redefinir quienes lo componen y sus atribuciones, estas no pueden pasar por sobre la decisiones tomadas en el parlamento en su mayoría."
9487,4,tribunal_constitucional,A,Tribunal Constitucional
9538,4,tribunal_constitucional,A,Garante de que mayorías circunstanciales no vulneren garantías constitucionales.
9665,4,tribunal_constitucional,A,Con atribuciones correctivas. Sus miembros deben representar la voluntad popular.  Que no sea constitutivo de una tercera cámara. Limitar su uso y abuso.
9706,4,tribunal_constitucional,A,"Terminar con la figura que hoy tiene este tribunal y su composición. Entregar esta labor al Defensor del Pueblo quien tiene en otros países como función que los actos de los poderes del estado se adecuen a la Constitución Política, profundizando la democracia."
9719,4,tribunal_constitucional,A,cuidar respeto a la constitución
9728,4,tribunal_constitucional,A,Se necesita un organismo que se asegure que se respete la constitución.  -Tendrá que tener un número impar  -Acortar los plazos de revisión   -No más derecho a veto  -modificar los requisitos de elección y designación  -No subcontratar para sus funciones
9858,4,tribunal_constitucional,A,"Esta garantiza que el Congreso Nacional, Poder Judicial, Presidencia de la República respeten la constitución y sus derechos de cada ciudadano. Sus integrantes deben ser elegidos por estamentos de la sociedad."
10063,4,tribunal_constitucional,A,Nos protege a todos.
10114,4,tribunal_constitucional,A,CUMPLE UNA IMPORTANTE FUNCION VIGILANDO QUE LAS LEYES QUE SE ESTAN ESTUDIANDO EN EL PARLAMENTO NO VAYAN EN CONTRA DE LA CONSTITUCION
10149,4,tribunal_constitucional,A,Porque debe velar por el cumplimiento de la constitución.
10176,4,tribunal_constitucional,A,No hay fundamento anotado.
10208,4,tribunal_constitucional,A,TC garante de que autoridades respeten la Constitución.
10230,4,tribunal_constitucional,A,"Debe existir, integrado de un modo distinto.  Generado por competencias."
10239,4,tribunal_constitucional,A,unanimidad.  organismo autonomo
10257,4,tribunal_constitucional,A,como existe actualmente.
10404,4,tribunal_constitucional,A,Es el garante final de que tanto el Congreso Nacional como la Presidencia de la República respeten la  Constitución y los derechos de las personas.
10443,4,tribunal_constitucional,A,Es un lugar que va relacionado con la formación de una constitución.
10446,4,tribunal_constitucional,A,Es el garante final de que tanto el Congreso Nacional como la Presidencia de la República respeten la  Constitución y los derechos de las personas.
10643,4,tribunal_constitucional,A,Garantizar su existencia y atribuciones
10656,4,tribunal_constitucional,A,Debemos mejor lo que tenemos como base definitiva a que nos regulen en forma justa para todos.
10713,4,tribunal_constitucional,A,"Poseer el deber de someter a los tres poderes del Estado a la Constitución y a las leyes como asi mismo, al derecho de las personas. Los integrantes de este cuerpo deberían ser elegidos en forma unanime por los distintos  estamentos de la sociedad."
10807,4,tribunal_constitucional,A,"Creemos que debiese convertirse en un organismo asesor sin capacidad resolutiva, asimismo habria que revisar su composición."
10824,4,tribunal_constitucional,A,Es el garante final de que tanto el Congreso Nacional como la Presidencia de la República respeten la  Constitución y los derechos de las personas.
10934,4,tribunal_constitucional,A,Que se mantenga como lo que hay.
10941,4,tribunal_constitucional,D,"La mayoría considerar que este Tribunal Constitucional, se debe derogar por ser una institución que opera como sensor sobre las políticas que genera el parlamento y el poder ejecutivo, que tiene un componente político conservador por tanto debe ser derogado. Uno de los miembros en cambio consideró que este cumple una labor importante en el control de las políticas públicas, el instrumento es bueno, y perfectible."
